start,end,script
01:34:09.436,01:34:11.354,I told you.
01:34:11.354,01:34:13.398,I know a guy.
01:34:14.483,01:34:17.402,"Now, who wants to see $43 million?"
01:34:20.238,01:34:22.991,"For a minute there, I thought you had me chasing my tail."
01:34:24.493,01:34:26.119,You want to count it?
01:34:26.119,01:34:28.662,"If you're shorting me, I know where to find you."
01:34:28.662,01:34:30.123,So we're good?
01:34:30.123,01:34:32.292,Did I not give you my word?
01:34:32.292,01:34:34.336,Then don't treat me like an asshole.
01:34:34.336,01:34:35.753,I'll try my best.
01:34:38.756,01:34:41.635,You and Mr. Stigman are free to go.
01:34:41.635,01:34:43.219,"BOBBY: Yes, sir."
01:34:43.219,01:34:45.096,EARL: I trust you can find your way home.
01:34:45.096,01:34:46.889,That's right. Let's go.
01:34:46.889,01:34:48.682,STIG: I'm not gonna let him get away with the money.
01:34:48.682,01:34:50.602,I hate these teeth.
01:34:50.602,01:34:51.978,I got a plan.
01:34:51.978,01:34:55.482,"I got my grenade launcher, I got my M-4."
01:34:55.482,01:34:57.609,I'm capable of coming up with a plan.
01:34:57.609,01:34:58.985,It better be a goddamn good one.
01:34:58.985,01:35:01.530,It's a good plan.
01:35:33.645,01:35:35.647,That was your plan?
01:35:35.647,01:35:37.315,"Yeah, that's why it's a brilliant plan."
01:35:37.315,01:35:38.858,Nobody expected it.
01:35:40.485,01:35:41.986,Go.
01:36:13.351,01:36:15.019,"QUINCE: Come on, move it!"
01:36:16.896,01:36:19.107,"Move, you dumb assholes!"
01:36:32.287,01:36:33.622,You coming?
01:36:41.129,01:36:42.838,"Go ahead, I'll be right behind you."
01:36:42.838,01:36:45.508,Don't miss.
01:36:50.846,01:36:53.057,Told you.
01:37:22.211,01:37:24.005,BOBBY: Stig.
01:37:24.005,01:37:26.090,Stig!
01:37:30.762,01:37:33.682,Don't do it. Don't do it.
01:37:35.016,01:37:37.018,No more fucking around.
01:37:37.018,01:37:40.146,"Now, drop your weapon."
01:37:40.146,01:37:42.148,Tell Mr. Stigman to do the same.
01:37:42.148,01:37:44.734,BOBBY: You tell him.
01:37:44.734,01:37:46.820,EARL: It's real simple.
01:37:46.820,01:37:49.531,We can all make a deal or we can all die.
01:37:49.531,01:37:50.990,I'm not making any deals.
01:37:50.990,01:37:52.908,"EARL: Talk to your man, Bobby."
01:37:52.908,01:37:54.494,Be the smart one.
01:37:54.494,01:37:57.121,You think Tres Cruces is the only stash we got?
01:37:57.121,01:38:00.750,We got 20 more.
01:38:00.750,01:38:02.627,You're not gonna change a damn thing.
01:38:02.627,01:38:05.547,Stig?
01:38:05.547,01:38:07.881,"You're my people, right?"
01:38:09.883,01:38:11.594,That's correct.
01:38:11.594,01:38:13.638,Unh! Aah!
01:38:24.315,01:38:25.567,You good?
01:38:25.567,01:38:28.110,Never better.
01:38:28.110,01:38:29.821,"We're not people, though."
01:38:29.821,01:38:31.280,This makes us family.
01:38:31.280,01:38:33.700,"All right, brother."
01:38:33.700,01:38:37.953,"STIG: Hey, Señor Einstein, you're looking kind of fucked up sitting there, man."
01:38:37.953,01:38:39.664,You all right?
01:38:42.542,01:38:45.169,Mow my lawn.
01:38:56.848,01:38:58.474,"STIG: Well, you know what was so cool?"
01:38:58.474,01:39:00.351,You rolling in on that '64 Impala.
01:39:00.351,01:39:01.728,"I mean, you looked badass, man."
01:39:01.728,01:39:03.354,"BOBBY: Oh, yeah, that's right."
01:39:03.354,01:39:05.273,"Oh, listen, one more thing, one more thing."
01:39:05.273,01:39:06.649,STIG: What?
01:39:06.649,01:39:08.526,BOBBY: Give me your gun.
01:39:08.526,01:39:09.778,Give me your gun.
01:39:09.778,01:39:11.112,"STIG: Oh, you're not serious."
01:39:11.112,01:39:12.572,"BOBBY: Yes, I am."
01:39:12.572,01:39:14.156,Thank you.
01:39:12.572,01:39:15.825,You're doing this after everything we've been through?
01:39:15.825,01:39:17.619,Arm or leg?
01:39:17.619,01:39:19.495,This is not gonna make you feel better.
01:39:19.495,01:39:22.081,"Leg, there's more flesh, there's not as much bone."
01:39:22.081,01:39:25.126,The arm will-- Know what you are?
01:39:23.291,01:39:27.712,"You're a petty-- Oh, fucking son of a bitch!"
01:39:27.712,01:39:29.631,"Hurts, doesn't it?"
01:39:29.631,01:39:34.051,"Three more inches to the left, you wouldn't be winking at waitresses."
01:39:34.051,01:39:36.387,"I'd still wink, I just wouldn't be able to do anything."
01:39:36.387,01:39:38.556,I don't miss.
01:39:38.556,01:39:40.057,When's the last time you saw me miss?
01:39:40.057,01:39:42.685,You gonna carry my ass all the way the fuck home.
01:39:42.685,01:39:44.270,"Oh, shit, man. This burns."
01:39:44.270,01:39:46.856,BOBBY: Ha-ha-ha. That's correct.
01:39:46.856,01:39:50.318,"You know, I shot you when I didn't know who you were."
01:39:50.318,01:39:52.236,Before we were family.
01:39:52.236,01:39:53.571,BOBBY: We're family now.
01:39:53.571,01:39:55.030,I shot you because I know who you are.
01:39:55.030,01:39:57.158,STIG: That ain't right.
01:40:14.550,01:40:16.427,They definitely got the look.
01:40:16.427,01:40:20.849,"Assholes in windshield sunglasses, practically CIA uniform."
01:40:20.849,01:40:22.517,Can I get you boys anything else?
01:40:23.559,01:40:25.603,Are your doughnuts any good?
01:40:25.603,01:40:28.147,"Tell you the truth, they're pretty lousy."
01:40:28.147,01:40:30.608,Can't tell you how happy we are to hear that.
01:40:32.485,01:40:34.946,You take care.
01:40:34.946,01:40:36.531,Saw what?
01:40:36.531,01:40:38.282,That's a twitch.
01:40:43.287,01:40:47.166,"For a guy who just blew up $43 million, all of a sudden you're a generous tipper."
01:40:47.166,01:40:49.794,Who said I blew up $43 million?
01:40:51.546,01:40:53.673,What are you saying?
01:40:53.673,01:40:55.842,I'm hearing something.
01:40:55.842,01:40:59.428,"If you're hearing it, it's because you're hearing it, not because I'm saying it."
01:41:00.429,01:41:02.807,How much did you keep?
01:41:02.807,01:41:05.018,Two million?
01:41:05.018,01:41:06.853,That's like one each.
01:41:06.853,01:41:08.103,"Oh, so now you get half?"
01:41:08.103,01:41:10.398,"Well, I shot half the guys."
01:41:11.482,01:41:12.901,Two million?
01:42:23.220,01:44:03.029,"Na, na, na, na, na Na, na, na, na, na Na, na, na, na, na Na, na, na, na, na Na, na, na, na, na."
