start,end,script
00:02:39.451,00:02:41.787,Mrs. Peterson!
00:02:41.787,00:02:44.372,"Ramon, hey!"
00:02:44.372,00:02:46.583,How you doin'?
00:02:46.583,00:02:48.752,"There it is, right there on the desk."
00:02:48.752,00:02:50.295,Where's she headed?
00:02:50.295,00:02:52.006,"She's snowbound, Ramon."
00:02:55.968,00:02:57.385,See you went with the pink.
00:02:57.385,00:02:58.929,"Yeah, yeah."
00:02:58.929,00:03:01.306,It's kind of a pink day today.
00:03:01.306,00:03:04.267,I'm gonna have another pickup for you on Thursday.
00:03:04.267,00:03:05.560,All right.
00:03:05.560,00:03:07.021,"All right. Thanks, Ramon."
00:03:43.015,00:03:44.432,Peterson!
00:03:45.559,00:03:47.811,Peterson.
00:03:50.313,00:03:53.067,"Mr. Cowboy, da?"
00:03:57.529,00:04:00.532,"Mmm, it's pretty."
00:04:00.532,00:04:03.785,Mmm.
00:05:10.351,00:05:12.479,MAN: Time...
00:05:12.479,00:05:22.447,"rules over us without mercy, not caring if we're healthy or ill, hungry or drunk, Russian, American, beings from Mars."
00:05:22.447,00:05:23.782,It's like a fire.
00:05:23.782,00:05:25.533,It could either destroy us or keep us warm.
00:05:25.533,00:05:28.036,That's why every FedEx office has a clock.
00:05:28.036,00:05:30.914,Because we live or we die by the clock.
00:05:30.914,00:05:32.958,We never turn our back on it.
00:05:32.958,00:05:38.630,"And we never, ever allow ourselves the sin of losing track of time!"
00:05:38.630,00:05:40.590,"Locally, it's 1:56."
00:05:40.590,00:05:46.596,That means we've got three hours and four minutes before the end-of-the-day's package sort.
00:05:46.596,00:05:48.932,That's how long we have.
00:05:50.976,00:05:56.606,"before this pulsating, accursed, relentless taskmaster tries to put us out of business."
00:05:56.606,00:05:59.776,"Hey, Nicolai."
00:05:59.776,00:06:01.778,"How are you, kid?"
00:06:01.778,00:06:04.072,You just delivered your very first FedEx package.
00:06:04.072,00:06:07.742,"That deserves something special, like a Snickers bar..."
00:06:07.742,00:06:10.662,and a C.D. player.
00:06:10.662,00:06:12.747,And something to listen to-- a C.D. There.
00:06:12.747,00:06:13.957,Elvis Presley.
00:06:13.957,00:06:15.667,Fifty million fans can't be wrong.
00:06:15.667,00:06:17.711,"You all recognize this, don't you?"
00:06:17.711,00:06:20.421,I took the liberty of sending this to myself.
00:06:20.421,00:06:25.468,I FedEx'd it before I left Memphis.
00:06:25.468,00:06:27.721,You're probably wondering what could be in here.
00:06:27.721,00:06:30.057,What could it possibly be?
00:06:30.057,00:06:31.975,Maybe technical drawings?
00:06:31.975,00:06:34.895,Is this the new wallpaper for the-- for the bathroom?
00:06:36.855,00:06:46.740,"It is...a clock, which I started at absolute zero and is now at 87 hours, 22 minutes and 17 seconds."
00:06:46.740,00:06:51.661,"From Memphis, America to Nicolai in Russia, 87 hours."
00:06:51.661,00:06:55.082,Eighty-seven hours is a shameful outrage.
00:06:55.082,00:06:58.168,This is just an egg timer!
00:06:58.168,00:06:59.586,What if it had been something else?
00:06:59.586,00:07:01.129,Like your paycheck?
00:07:01.129,00:07:04.299,Or fresh boysenberries?
00:07:04.299,00:07:06.509,Eighty-seven hours is an eternity.
00:07:06.509,00:07:08.511,The cosmos was created in less time!
00:07:08.511,00:07:11.431,Wars have been fought and nations toppled in 87 hours!
00:07:11.431,00:07:13.433,Fortunes made and squandered.
00:07:17.562,00:07:19.480,What?
00:07:19.480,00:07:21.566,What are you saying about me?
00:07:21.566,00:07:23.526,"I tell them, what do they expect?"
00:07:23.526,00:07:27.239,"This man, when his truck broke down, he stole a boy's bicycle to do his delivery."
00:07:27.239,00:07:30.075,I borrowed it!
00:07:30.075,00:07:33.954,"And I got my packages delivered, and that is what you people are gonna have to start doing."
00:07:33.954,00:07:42.087,"You have to start doing whatever it takes, because in three hours and two minutes, every one of these packages has to be on the big truck and on its way to the airport."
00:07:42.087,00:07:44.839,Fifteen minutes!
00:07:44.839,00:07:46.507,Crunch time! Crunch time!
00:07:46.507,00:07:48.093,Crunch time!
00:07:48.093,00:07:51.471,Let's go! Every package on the airport truck.
00:07:51.471,00:07:53.681,Go!
00:07:53.681,00:07:55.683,We have a big problem.
00:07:55.683,00:07:57.018,The truck in Red Square is stuck.
00:07:57.018,00:07:59.479,What do you mean?
00:07:59.479,00:08:01.189,Stuck how?
00:08:01.189,00:08:03.108,It's stuck!
00:08:01.189,00:08:04.859,The most important truck-- the Kremlin truck!
00:08:14.828,00:08:17.331,"All right, all right, all right."
00:08:17.331,00:08:19.082,We'll just do the sort.
00:08:19.082,00:08:22.336,"Ah, yeah, a clamp."
00:08:22.336,00:08:24.921,Let's go. Unload-- Get him out of there.
00:08:24.921,00:08:27.799,Right here.
00:08:27.799,00:08:30.093,"One to the airport truck, one to the Moscow truck."
00:08:30.093,00:08:32.346,Got it?
00:08:32.346,00:08:34.555,"C.D.G., F.E., M.E, Memphis on the airport truck."
00:08:34.555,00:08:36.141,Everything else right there.
00:08:36.141,00:08:38.643,"Nicolai! Tick-tock, tick-tock."
00:08:40.895,00:08:43.898,"Hi, this is Kelly. If you're calling for Chuck, press one."
00:08:43.898,00:08:45.942,Otherwise leave a message after the tone. Thanks.
00:08:47.277,00:08:49.279,"CHUCK: Hello, Kelly."
00:08:49.279,00:08:51.365,"Pick up, pick up, pick up, pick up. You're not there."
00:08:51.365,00:08:53.325,You're not gonna believe this.
00:08:51.365,00:08:55.952,I'm doin' the sorts in the middle of Red Square in the shadow of Lenin's tomb.
00:08:59.706,00:09:05.545,"I'm outta here in two minutes and I'm pickin' up the sweep through Paris, so I should be back in Memphis about 18 hours or so."
00:09:05.545,00:09:07.797,That's the good news.
00:09:07.797,00:09:09.799,I gotta go to the dentist this week.
00:09:09.799,00:09:11.801,I got something in there that's hurtin'.
00:09:11.801,00:09:14.846,"I love you and I'm gonna see you soon, and you know what that means."
00:09:14.846,00:09:16.264,Bye-bye.
00:09:16.264,00:09:18.308,"Tick-tock, tick-tock, tick-tock, tick-tock!"
00:09:36.076,00:09:38.870,"I absolutely, positively have to get to Memphis tonight."
00:09:38.870,00:09:41.081,Can't help you.
00:09:41.081,00:09:44.418,"With this extra head wind, are we gonna be able to push it and make the sort?"
00:09:44.418,00:09:46.253,We'll do our best.
00:09:46.253,00:09:50.673,"Gwen, is there something wrong with our doctors that Jack keeps getting certified to fly?"
00:09:50.673,00:09:52.967,Aren't you concerned?
00:09:52.967,00:09:55.011,But a girl's gotta do what a girl's gotta do.
00:09:55.011,00:09:57.972,That's the spirit. Relentless is our goal. Relentless!
00:09:57.972,00:10:03.811,What do you expect from the guy who stole a crippled kid's bicycle when his truck broke down?
00:10:03.811,00:10:05.939,But I love that the kid's now crippled.
00:10:05.939,00:10:08.525,So you missed the last truck by two minutes?
00:10:08.525,00:10:11.486,Two minutes.
00:10:11.486,00:10:14.489,The plane wasn't that heavy.
00:10:11.486,00:10:16.575,"You could've added some fuel, picked up the speed and made up the time."
00:10:16.575,00:10:17.784,It's about the trucks.
00:10:17.784,00:10:19.619,Today's truck was two minutes late.
00:10:19.619,00:10:23.331,"Tomorrow's will be four minutes late, and then six minutes and eight minutes late."
00:10:23.331,00:10:24.832,"Next thing you know, we're the U.S. Mail."
00:10:24.832,00:10:32.257,"Yeah, well-- Alls I'm sayin' is, if you'd gotten all those trucks on the plane, those Russkies would be walking on water right now."
00:10:32.257,00:10:34.926,"Hey, don't-- Don't gimme that look."
00:10:34.926,00:10:36.428,It's just grape juice.
00:10:36.428,00:10:37.804,Yeah.
00:10:37.804,00:10:40.599,It's like a 1992 full-bodied grape juice.
00:10:40.599,00:10:42.976,"I see no evil, hear no evil, speak no evil."
00:10:42.976,00:10:46.313,"We'd offer you some but, you know, somebody's got to fly the plane."
00:10:46.313,00:10:49.899,"Yeah, well, I just say no, right?"
00:10:49.899,00:10:52.860,"Listen, Stan, I've been meaning to ask you."
00:10:52.860,00:10:54.988,How's Mary?
00:10:54.988,00:10:59.867,"Oh. Uh, well, we really don't know anything yet."
00:10:59.867,00:11:01.495,Mm-hmm.
00:11:01.495,00:11:10.337,"Uh, she went to the doctor yesterday, and, uh, it hasn't meta-- metastasized..."
00:11:10.337,00:11:13.340,as far as they can tell right now.
00:11:13.340,00:11:16.426,It's just kind of wait and see.
00:11:16.426,00:11:18.719,I'm so sorry.
00:11:18.719,00:11:21.973,Tell her I'm gonna come by and see her on my next layover.
00:11:21.973,00:11:25.352,"I want you to know, Stan, we are all thinking about her and you."
00:11:25.352,00:11:27.854,And just blessings.
00:11:27.854,00:11:30.898,"Hi, this is Kelly. If you're calling for Chuck, press one."
00:11:30.898,00:11:33.985,"Otherwise, leave a message after the tone. Thanks."
00:11:38.198,00:11:41.117,Stan.
00:11:41.117,00:11:43.537,Listen.
00:11:41.117,00:11:48.458,"Uh, I heard about this-- I heard about this doctor down in Emory, in Atlanta."
00:11:48.458,00:11:50.502,"Uh, he's supposed to be the absolute best."
00:11:50.502,00:11:52.671,He worked on Frank Toretta's wife.
00:11:52.671,00:11:54.713,Frank Toretta is a systems analyst.
00:11:54.713,00:11:57.175,He played center field for us.
00:11:57.175,00:12:00.136,In the softball tournament last Labor Day.
00:12:00.136,00:12:02.055,"Anyway, beside the point."
00:12:02.055,00:12:15.943,"Uh, what I was thinking is, is that I could get his number-- the doctor-- and, uh, you know, put you all together and-- You know, you could get this thing fixed."
00:12:15.943,00:12:17.904,You could beat it.
00:12:19.197,00:12:20.574,"Thanks, Chuck."
00:12:20.574,00:12:23.660,"So, I'll get his number."
00:12:46.099,00:12:47.684,Is Kelly Frears around?
00:12:47.684,00:12:49.352,She's copying her dissertation.
00:13:21.384,00:13:23.970,You're home.
00:13:23.970,00:13:25.972,I love that you're home.
00:13:45.158,00:13:51.998,"Just days before Santa departs on his annual gift-giving venture, he's been declared physically fit to fly."
00:13:51.998,00:13:55.960,"Santa got checked out by doctors at the V.A. Hospital in Augusta, Georgia."
00:13:55.960,00:14:02.467,"After they declared the jolly old elf in tiptop shape, Santa Claus took off into the wild blue yonder for an early start."
00:14:02.467,00:14:10.183,"In Sarajevo, he spent the day with children, handing out presents and even helping them decorate the special Christmas tree."
00:14:14.145,00:14:16.439,Santa and a sea of elves took over the floor...
00:14:16.439,00:14:18.483,at the Hong Kong Futures Exchange.
00:14:18.483,00:14:45.593,"Market traders bought Santa hats, donating-- The turkey's a little dry, isn't it?"
00:14:45.593,00:14:48.304,ALL: No.
00:14:51.932,00:14:53.267,How many did you do last night?
00:14:53.267,00:14:55.353,Last night? 2.9 million.
00:14:55.353,00:14:59.023,Now you've got to be in the market for more of these candied yams.
00:14:59.023,00:15:00.358,Here you go.
00:15:00.358,00:15:02.569,2.9 has got to be the record.
00:15:02.569,00:15:04.529,Look at those marshmallows.
00:15:04.529,00:15:06.364,"When I was there, we did two million."
00:15:06.364,00:15:07.657,We thought that was a big deal.
00:15:07.657,00:15:08.867,The glory days.
00:15:08.867,00:15:10.577,What'd they do the first night?
00:15:10.577,00:15:11.952,The very first night?
00:15:11.952,00:15:13.830,MAN 1: Twelve.
00:15:13.830,00:15:16.499,"Hell, no. Twelve."
00:15:16.499,00:15:19.377,And they did the sort right there on a card table.
00:15:19.377,00:15:22.338,And Fred Smith had that card table bronzed.
00:15:22.338,00:15:25.132,I've been hearing that for five years.
00:15:25.132,00:15:26.634,It's in his office today.
00:15:26.634,00:15:29.387,They go from that to the new hub up in Anchorage.
00:15:29.387,00:15:33.892,It's state of the art-- a perfect marriage between technology and systems management.
00:15:33.892,00:15:37.478,"Speaking of marriage, Chuck, when are you gonna make an honest woman out of Kelly?"
00:15:39.063,00:15:41.900,How long?
00:15:41.900,00:15:45.319,You won. I owe you $5.
00:15:45.319,00:15:47.405,Way before the pie.
00:15:47.405,00:15:54.036,"Right about the time the pie came out, the marriage-- Kelly is still recovering from her failed relationship with that parolee."
00:15:54.036,00:15:55.914,He was a lawyer.
00:15:55.914,00:16:00.334,I knew it had something to do with raising your right hand and swearing to tell the truth.
00:16:00.334,00:16:03.922,Remember when he fell on the sidewalk and broke his shoulder at the wedding reception?
00:16:03.922,00:16:06.466,He tripped on a curb holding a door open for me.
00:16:06.466,00:16:07.842,Aunt Kelly was married before?
00:16:07.842,00:16:09.677,KELLY: It's not even worth remembering.
00:16:09.677,00:16:14.432,"So since her failed marriage to the parolee-- Oh, my God."
00:16:14.432,00:16:17.769,Kelly can't see being with a man who wears a pager to bed.
00:16:17.769,00:16:19.813,"What're you gonna attach it to, Hoss?"
00:16:19.813,00:16:24.609,"When you wear it to bed, I hope you got one of those things that go vibratin'."
00:16:24.609,00:16:27.236,Watch it.
00:16:27.236,00:16:30.740,"Oh, did you hit an olive pit?"
00:16:30.740,00:16:32.158,I thought I took all of them out.
00:16:32.158,00:16:35.035,"No, no, it's not that."
00:17:01.479,00:17:03.648,"Okay, I'll cancel Saturday."
00:17:03.648,00:17:05.566,"If I'm not here, I'm not."
00:17:03.648,00:17:07.610,"But if I am, well, then I am."
00:17:07.610,00:17:09.612,But you gotta be here New Year's Eve.
00:17:09.612,00:17:12.239,Malaysia can't be that bad.
00:17:12.239,00:17:13.950,When are you defending your dissertation?
00:17:13.950,00:17:15.910,January 12.
00:17:15.910,00:17:19.288,I'm gonna have to switch over the South America thing.
00:17:19.288,00:17:23.584,"If I do that on the third or fourth, I'm gonna have to head back out on the 13th."
00:17:23.584,00:17:25.962,So long as you're here New Year's Eve.
00:17:25.962,00:17:29.048,I will be here New Year's Eve.
00:17:32.385,00:17:33.970,What?
00:17:33.970,00:17:36.389,What about our Christmas?
00:17:39.392,00:17:41.394,We have to do it in the car.
00:17:46.983,00:17:49.276,"CHUCK: I'd just like a minute over here, all right?"
00:17:49.276,00:17:52.405,Thanks.
00:17:56.701,00:17:59.245,"CHUCK: Two minutes, okay?"
00:17:59.245,00:18:01.497,Two more minutes.
00:18:01.497,00:18:02.707,Merry Christmas.
00:18:02.707,00:18:04.709,I thought you were gonna stiff me.
00:18:04.709,00:18:06.586,What is the ribbon?
00:18:04.709,00:18:09.005,Is it a thousand-pound test fishing line or something?
00:18:09.005,00:18:10.757,Here's your fancy thing.
00:18:10.757,00:18:13.676,Thanks.
00:18:15.929,00:18:18.056,I love the wrapping.
00:18:19.599,00:18:21.726,And I love the box.
00:18:24.311,00:18:28.441,"Oh. Oh, my."
00:18:29.567,00:18:31.611,"Oh, that is terrific."
00:18:31.611,00:18:34.072,My grandaddy used it on the Southern Pacific.
00:18:36.699,00:18:40.453,"Hey, I took this. This is my favorite picture of you."
00:18:42.204,00:18:46.166,You know what I'm gonna do?
00:18:46.166,00:18:48.086,on Memphis time.
00:18:51.756,00:18:53.007,Kelly time.
00:18:53.007,00:18:54.592,Hmm.
00:18:54.592,00:18:56.719,You haven't said anything about your presents.
00:18:56.719,00:18:57.887,Is there a problem?
00:18:57.887,00:18:59.097,"I'm sorry, no!"
00:18:59.097,00:19:01.682,Look at my journal.
00:19:01.682,00:19:03.059,What about the pager?
00:19:03.059,00:19:05.311,Real leather.
00:19:05.311,00:19:07.521,Did you like the pager or not?
00:19:07.521,00:19:11.358,I love it. Look at him in his little blue Russian house.
00:19:11.358,00:19:14.278,It's from Russia.
00:19:14.278,00:19:15.696,It's not one of those loud ones?
00:19:15.696,00:19:20.534,No. You can program it so it vibrates and lights up and see it in the dark.
00:19:20.534,00:19:24.789,It seems like a real nice pager.
00:19:24.789,00:19:26.290,Sorry about the hand towels.
00:19:26.290,00:19:28.417,"No, no. I love 'em."
00:19:28.417,00:19:31.045,"Every time I wash my hands, I will think of you."
00:19:31.045,00:19:32.630,"All right, I gotta go."
00:19:32.630,00:19:35.382,Merry Christmas.
00:19:35.382,00:19:36.634,Merry Christmas.
00:19:36.634,00:19:38.636,I love you.
00:19:46.144,00:19:49.063,Chuck! Keys!
00:19:58.906,00:20:00.407,Thank you.
00:20:00.407,00:20:02.076,That reminds me.
00:20:02.076,00:20:05.454,I have one more present for you.
00:20:05.454,00:20:10.835,Only this isn't an open in the car kind of present...
00:20:10.835,00:20:12.753,"like, say, hand towels."
00:20:12.753,00:20:15.255,"Which were a joke, by the way."
00:20:19.385,00:20:22.013,I'm terrified.
00:20:22.013,00:20:28.019,"Just take it and hold onto it, and you can open it on New Year's Eve."
00:20:28.019,00:20:30.021,And I love you.
00:20:33.733,00:20:36.485,I'll be right back.
00:21:20.404,00:21:23.116,"Hey, Al, where are we?"
00:21:23.116,00:21:25.159,Somewhere over the Pacific Ocean.
00:21:25.159,00:21:27.703,"Ha, ha, ha!"
00:21:27.703,00:21:30.164,"Tahiti Control, FedEx 88."
00:21:30.164,00:21:36.170,Position Jenna at 1526-- Is all this turbulence from Santa and those eight tiny reindeer?
00:21:36.170,00:21:38.714,Tamara at 1620.
00:21:38.714,00:21:40.967,Erick is next.
00:21:40.967,00:21:42.635,Fuel: niner-five-decimal-five.
00:21:44.262,00:21:46.346,"Blaine, tell them we're deviating south for weather."
00:21:46.346,00:21:48.432,Make another position plot on your deviation left.
00:21:48.432,00:21:51.227,"BLAINE: Tahiti Control, FedEx 88."
00:21:51.227,00:21:53.854,Position Jenna at 1526.
00:21:53.854,00:21:56.274,Flight level 350.
00:21:56.274,00:21:59.152,We're 200 miles south of our original course.
00:21:59.152,00:22:02.280,"KEVIN: Continue plotting, and check contingency procedures."
00:22:02.280,00:22:04.198,"Tahiti Control, FedEx 88."
00:22:04.198,00:22:06.284,Broadcasting in the blind.
00:22:07.827,00:22:09.703,BLAINE: I've never been out of comm this long.
00:22:09.703,00:22:12.248,Did you try the higher H.F. frequency?
00:22:12.248,00:22:14.792,"BLAINE: Tahiti Control, FedEx 88."
00:22:14.792,00:22:17.837,"AL: Better buckle up, Chuck."
00:22:17.837,00:22:20.798,"BLAINE: Tahiti Control, FedEx 88."
00:22:20.798,00:22:23.009,Do you read?
00:22:31.309,00:22:33.477,"Tahiti Control, FedEx 88."
00:22:33.477,00:22:36.522,Position Jenna at 1526.
00:22:36.522,00:22:38.649,Flight level 350.
00:22:38.649,00:22:40.609,Expecting Tamara at 1...
00:23:21.817,00:23:25.029,Fire! Explosion!
00:23:25.029,00:23:26.989,Let's get a hose!
00:23:28.908,00:23:32.912,Hold on to it!
00:23:35.164,00:23:37.333,Seat belt!
00:23:43.421,00:23:46.466,We may have to ditch!
00:23:55.851,00:23:57.895,Okay?
00:23:58.604,00:24:00.398,Fire in the hold!
00:24:00.398,00:24:02.482,We're goin' down!
00:24:02.482,00:24:04.985,Mayday! Mayday!
00:24:15.453,00:24:17.831,Bringing it down and out!
00:24:17.831,00:24:21.001,Ten thousand feet!
00:24:21.001,00:24:23.421,Masks off!
00:24:25.339,00:24:28.592,AL: Chuck! Life vest!
00:25:00.416,00:25:03.501,Chuck!
00:25:03.501,00:25:06.546,Where's your life vest?
00:25:30.196,00:25:32.156,Ditching switch on!
00:25:46.170,00:25:48.922,I've got visual!
00:25:53.010,00:25:55.595,Brace for impact!
00:34:47.252,00:34:49.629,Hello!
00:36:31.148,00:36:33.608,Hello!
00:36:33.608,00:36:35.568,Anybody!
00:36:47.246,00:36:49.374,Anybody!
00:36:53.670,00:36:56.506,Help!
00:36:56.506,00:36:58.508,Help!
00:39:05.927,00:39:07.887,What is that?
00:39:11.183,00:39:13.685,Hey!
00:39:25.113,00:39:27.157,Hey!
00:39:27.157,00:39:29.909,Anybody?
00:43:40.368,00:43:42.579,Hello?
00:47:36.187,00:47:39.691,"Get! Go, go."
00:48:37.582,00:48:40.626,Albert R. Miller.
00:48:40.626,00:48:43.962,Not Alan. Albert.
00:50:04.376,00:50:06.796,"So, that's it."
00:53:02.888,00:53:05.016,Hey! A ship!
00:53:05.016,00:53:07.434,Hey! Hey!
00:53:07.434,00:53:09.478,Hey! Hey!
00:53:09.478,00:53:11.772,A ship! Over here!
00:53:11.772,00:53:14.859,Hey! Hey!
00:53:14.859,00:53:18.029,Over here! Over here!
00:53:23.492,00:53:25.410,Over here!
00:53:25.410,00:53:29.165,Over here!
00:53:29.165,00:53:31.750,Help me! Help!
00:53:31.750,00:53:33.752,Help! Look here!
00:53:33.752,00:53:38.841,S...O...S!
00:53:38.841,00:53:41.802,Help! Come on!
00:53:41.802,00:53:43.595,Help!
01:02:44.844,01:02:46.804,Happy birthday.
01:02:48.724,01:02:53.520,"The most beautiful thing in the world is, of course, the world itself."
01:02:53.520,01:02:55.855,"Johnny, have the happiest birthday ever. Score."
01:02:55.855,01:02:57.357,Your Grandpa.
01:04:54.683,01:04:56.685,Ew.
01:06:05.754,01:06:07.839,Come on.
01:06:07.839,01:06:10.550,Come on. Come on.
01:06:10.550,01:06:14.429,Come on. Come on.
01:10:44.866,01:10:48.119,You wouldn't have a match...
01:10:52.373,01:10:54.458,"Oh, oh, oh!"
01:11:10.600,01:11:12.268,The air got to it.
01:11:12.268,01:11:14.270,The air got to it!
01:11:56.813,01:12:00.441,"Come on, come on."
01:12:05.446,01:12:07.615,I did it. I did it.
01:12:11.286,01:12:13.412,Fire!
01:12:13.412,01:12:15.414,There you go!
01:12:15.414,01:12:17.458,Light it up!
01:12:20.336,01:12:22.588,"Ouch! Ha, ha, ha!"
01:12:22.588,01:12:24.841,Ouch!
01:12:39.230,01:12:42.317,Here you go! Here you go!
01:12:42.317,01:12:44.568,It's a signal fire!
01:12:45.653,01:12:49.115,And it spells out S.O.S!
01:12:49.115,01:12:51.117,Whoa!
01:12:52.285,01:12:54.453,It's a meteor shower!
01:12:54.453,01:12:56.539,Fireflies!
01:12:56.539,01:13:00.710,You're free! You're free!
01:13:00.710,01:13:01.961,Yeah!
01:13:01.961,01:13:03.963,Yes!
01:13:03.963,01:13:06.549,Look what I have created!
01:13:06.549,01:13:08.676,I have made fire!
01:13:08.676,01:13:12.180,I...have made fire!
01:13:24.067,01:13:26.069,Mmm!
01:13:32.950,01:13:34.911,You gotta love crab.
01:13:37.121,01:13:39.082,In the nick of time too.
01:13:41.000,01:13:44.045,I couldn't take much more of those coconuts.
01:13:44.045,01:13:46.297,Coconut milk's a natural laxative.
01:13:48.258,01:13:51.344,Things that Gilligan never told us.
01:13:51.344,01:13:53.346,Oh.
01:14:05.191,01:14:07.651,"Pretty well-made fire, huh, Wilson?"
01:14:15.576,01:14:18.871,So...Wilson.
01:14:18.871,01:14:21.165,We were en route...
01:14:21.165,01:14:25.461,from Memphis for 11 and a half hours.
01:14:25.461,01:14:29.424,About 475 miles an hour.
01:14:29.424,01:14:33.552,So they think that we are right here.
01:14:33.552,01:14:35.471,But...
01:14:35.471,01:14:38.557,we went out of radio contact...
01:14:38.557,01:14:43.020,and flew around that storm for about an hour.
01:14:43.020,01:14:45.982,"So that's a distance of what, 400 miles?"
01:14:47.566,01:14:49.568,Four hundred miles squared.
01:14:49.568,01:14:53.697,"That's 160,000..."
01:14:53.697,01:14:57.576,times pi-- 3.14.
01:15:00.288,01:15:08.838,"Five hundred and two thousand, four-- That's a search area of 500,000 square miles."
01:15:11.382,01:15:13.676,That's twice the size of Texas.
01:15:16.012,01:15:17.930,They may never find us.
01:15:42.997,01:15:45.749,This tooth is just killing me.
01:15:45.749,01:15:52.215,"It started out just hurting when I bit down, but now it just hurts all the time."
01:15:52.215,01:15:54.884,All the time.
01:15:54.884,01:15:59.889,"It's-- It's a good thing there's not much to eat around here, because I don't think I could chew it."
01:16:01.598,01:16:05.395,Just keep sucking on all that coconut and all that crab.
01:16:07.688,01:16:15.530,"And just think, I used to avoid going to the dentist like the plague."
01:16:15.530,01:16:23.204,"I put it off every single chance I got. But now, oh, what I wouldn't give..."
01:16:23.204,01:16:26.499,to have a-- a dentist right here in this cave.
01:16:31.795,01:16:34.006,"In fact, I wish you were a dentist."
01:16:39.678,01:16:41.638,Yeah.
01:16:41.638,01:16:43.724,Dr. Wilson.
01:16:54.026,01:16:56.028,You wanna hear something funny?
01:16:57.654,01:17:04.745,"Back home in Memphis, my dentist's name is Dr. James Spaulding."
01:17:24.765,01:17:27.518,She's much prettier in real life.
01:21:45.693,01:21:47.695,Shut up!
01:22:52.593,01:22:54.595,Bakersfield?
01:22:58.724,01:23:01.602,Bakersfield!
01:23:58.200,01:24:00.160,This could work.
01:24:02.371,01:24:04.414,This could work.
01:24:37.364,01:24:41.201,Twenty-two-- Forty-four lashings.
01:24:43.119,01:24:45.163,Forty-four lashings.
01:24:43.119,01:24:49.418,So-- We have to make rope again.
01:24:53.505,01:24:55.883,"Wilson, we're gonna have to make a hell of a lot of rope."
01:25:02.222,01:25:05.017,Eight lashings of these structurals.
01:25:05.017,01:25:07.978,That's 24 apiece.
01:25:07.978,01:25:11.398,That'll be 100-- 160.
01:25:11.398,01:25:13.817,Here we are today.
01:25:13.817,01:25:21.992,"That gives us another month and a half until we're into March and April, which is our best chances for the high tides and the offshore breezes."
01:25:23.493,01:25:28.874,We need-- We need 424 feet...
01:25:28.874,01:25:32.461,"of good rope, plus another 50 feet, say, for miscellaneous."
01:25:32.461,01:25:37.049,Round that off to 475 feet of good rope.
01:25:37.049,01:25:49.561,"Now, if we average 15 feet a day-- Plus, we have to build it, we have to stock it, we have to launch it."
01:25:51.897,01:25:54.357,That's gonna be tight.
01:25:54.357,01:25:56.359,That is not much time.
01:25:57.569,01:26:02.407,"But we-- We live and we die by time, don't we?"
01:26:04.576,01:26:08.538,"Now, let's not commit the sin of turning our back on time."
01:26:13.627,01:26:15.963,I know.
01:26:15.963,01:26:19.008,I know.
01:26:38.234,01:26:40.362,This is it.
01:26:42.698,01:26:45.742,That's all that's left.
01:26:45.742,01:26:49.038,"I checked over the whole island, and that is all that's left."
01:26:49.038,01:26:50.998,So we're gonna be short.
01:26:54.292,01:26:56.294,Short.
01:27:03.177,01:27:05.428,We'll just have to make some more out of the videotape.
01:27:07.056,01:27:09.349,Yes.
01:27:09.349,01:27:11.226,We do. We have time.
