start,end,script
00:02:11.966,00:02:16.720,"welcome to the Daytona 500, the Super Bowl of motor racing events."
00:02:16.762,00:02:21.266,Walking onto the grid is the two-time Daytona 500 and defending champion Rowdy Burns.
00:02:23.435,00:02:26.772,"And perennial contender from Reading, Pennsylvania, Aldo Bennedetti."
00:02:45.833,00:02:48.085,"ANNOUNCER: Gentlemen, start your engines."
00:03:31.670,00:03:34.255,"Big turn back for number 43, Richard Petty."
00:03:34.297,00:03:36.591,Petty spins to the inside of the track.
00:03:36.633,00:03:37.676,A tough break for Richard Petty.
00:03:39.178,00:03:41.930,Richard Petty is out of the Daytona 500.
00:03:41.972,00:03:52.399,"Speaking of people who are out of the race, perhaps it's time to remember the legendary crew chief, Harry Hogge, whose great driver, Buddy Bretherton, died here last year in a fiery crash, hitting the wall at over 195 miles an hour."
00:03:56.319,00:03:57.487,"So you're enjoying the good life, Harry?"
00:03:57.529,00:03:59.531,Yeah.
00:03:59.573,00:04:02.201,I never minded spreading a little fertilizer around now and then.
00:04:02.242,00:04:03.869,There's worse things.
00:04:03.911,00:04:05.162,How's the truck running?
00:04:05.204,00:04:06.413,Runs good.
00:04:08.415,00:04:11.376,I want you to build me a car.
00:04:17.340,00:04:22.512,"Now, Tim, everybody knows some downtown car dealer can't afford a race team."
00:04:22.554,00:04:25.807,No driver worth a damn is gonna sign with you.
00:04:25.849,00:04:30.104,"'Cause they wreck one car, you can't afford to build them another and they're out of the deal, you know."
00:04:30.145,00:04:32.564,And no car's gonna win without a driver.
00:04:32.606,00:04:34.441,Not even mine.
00:04:34.482,00:04:37.236,"If you built the car, I'd get a damn driver."
00:04:41.698,00:04:45.786,What kind of driver are you going to find after the season's started?
00:04:45.827,00:04:48.288,Some old boy who's washed up and wasn't worth a shit to begin with.
00:04:49.664,00:04:51.583,You can work with him.
00:04:51.625,00:04:53.919,"You can build a driver like you build a car, Harry."
00:04:53.961,00:04:56.088,"Tim, take a look at that hound."
00:04:56.130,00:04:58.381,That's the best coon dog I've ever seen or heard about.
00:04:58.423,00:04:59.466,And I didn't teach him a damn thing.
00:05:00.842,00:05:02.136,"Well, I got somebody."
00:05:03.053,00:05:03.887,Take a look at him.
00:05:05.555,00:05:07.307,"Anybody I gotta take a look at, ain't somebody."
00:05:07.348,00:05:08.349,Then take a look at nobody.
00:05:11.770,00:05:14.189,"Look, Tim, I gave up racing."
00:05:14.231,00:05:15.857,You gotta know that.
00:05:15.899,00:05:18.443,"You didn't give up racing, Harry."
00:05:18.485,00:05:21.696,You quit to avoid an investigation into Buddy's crash at Daytona.
00:05:21.738,00:05:24.324,"Hey, I didn't avoid any goddamn investigation."
00:05:26.493,00:05:31.665,"Anyway, I talked to NASCAR and if you come back in there won't be any investigation."
00:05:31.706,00:05:32.499,How the hell did you sell them on that deal?
00:05:33.708,00:05:34.960,I'm a hell of a salesman.
00:05:40.548,00:05:41.758,"Now, that's a racecar driver."
00:05:45.386,00:05:47.014,When's your driver due?
00:05:51.768,00:05:54.062,Harry tells me your guy runs those Indy type deals.
00:05:54.104,00:05:56.064,Yeah.
00:05:56.106,00:06:01.862,"Two World of Outlaw championships, three all-star wins, seven straight feature wins and he's been driving ASA."
00:06:01.903,00:06:02.821,Hey.
00:06:04.698,00:06:06.325,Got yourself a real statistician there.
00:06:06.365,00:06:07.159,Does he know anything about drivers?
00:06:07.201,00:06:08.367,We'll see.
00:06:15.292,00:06:18.003,"Harry, where'd you say your driver's from?"
00:06:18.045,00:06:19.296,Eagle Rock.
00:06:20.630,00:06:23.382,"It's up around Wilkesboro, isn't it?"
00:06:23.424,00:06:25.260,"No. Glendale, California."
00:06:25.302,00:06:27.262,He's a Yankee?
00:06:27.304,00:06:30.473,Not exactly.
00:06:30.515,00:06:31.683,You're not really anything.
00:06:33.018,00:06:34.228,You said it.
00:06:50.785,00:06:52.537,"The shocks are right, we're dialed in, buddy."
00:06:52.579,00:06:54.081,Don't change a thing.
00:06:57.416,00:07:00.128,"Hey, you ain't buried in horse manure after all."
00:07:00.170,00:07:01.796,Looking pretty good.
00:07:01.838,00:07:03.798,You're the one who's looking good.
00:07:03.840,00:07:09.096,"It hadn't been easy, Harry, I'll guran-damn-tee you, but this bitch is ready to run."
00:07:09.137,00:07:11.932,"I can't tell you how much we all appreciate you letting us use the car, Rowdy."
00:07:15.310,00:07:16.270,"I told you about this, Rowdy."
00:07:17.187,00:07:20.399,Harry's got some new driver and he needs a car just to turn a couple of laps.
00:07:20.440,00:07:23.693,"I told you it was Harry Hogge who'd asked us personally, as a favor."
00:07:29.199,00:07:29.991,Who is this driver?
00:08:03.108,00:08:05.360,Tim tells me you've been running open-wheels.
00:08:06.403,00:08:07.904,That's right.
00:08:07.946,00:08:10.324,And now you just want to up and drive NASCAR?
00:08:11.283,00:08:12.951,That's right.
00:08:12.993,00:08:14.995,What do you know about stock car racing?
00:08:15.036,00:08:17.705,"Well, I've watched it on television, of course."
00:08:18.915,00:08:21.084,You've seen it on television?
00:08:21.126,00:08:23.211,"ESPN, the coverage is excellent."
00:08:23.253,00:08:24.921,You'd be surprised at how much you can pick up.
00:08:24.963,00:08:27.424,I'm sure I would.
00:08:27.466,00:08:29.634,"Look, this may not be the best time for you to run this car."
00:08:31.178,00:08:31.928,Was there some problem?
00:08:34.681,00:08:36.808,"No, sir."
00:08:36.850,00:08:39.478,"But you bend this bitch the least little bit, I'm gonna tear your balls off."
00:08:50.030,00:08:53.074,Okay.
00:08:54.909,00:08:56.995,Didn't he hear what that man said?
00:09:01.041,00:09:04.002,Hold on a minute.
00:09:04.044,00:09:06.254,What? About how I'm gonna run? Sure.
00:09:07.755,00:09:09.716,About how you've managed to live as long as you have.
00:09:09.757,00:09:10.842,"Look, I ain't gonna let you race this car."
00:09:10.884,00:09:12.093,Mmm-mmm.
00:09:21.019,00:09:21.895,What's going on?
00:09:22.687,00:09:24.647,He's had second thoughts.
00:09:24.689,00:09:25.773,You said you'd look at him.
00:09:25.815,00:09:27.567,I've looked at him.
00:09:27.608,00:09:30.529,"I paid $2,500 to use this track today, Harry."
00:09:30.570,00:09:33.656,Forget it.
00:09:33.698,00:09:36.159,"Well, I know a damn race driver when I see one."
00:09:38.745,00:09:41.706,"MAN: What's going on, Harry?"
00:09:41.748,00:09:43.583,"Do us all a favor, Harry."
00:09:51.550,00:09:53.510,Let me drive.
00:10:03.061,00:10:05.313,That tunnel turn's real tricky.
00:10:05.355,00:10:07.607,"Now, whether it's hot or cold, it gets as slick as a butt."
00:10:07.648,00:10:10.902,Then you'll slip and slide and slam yourself into the wall before you know it.
00:10:10.944,00:10:12.446,So just take it easy.
00:10:23.664,00:10:25.041,I'm dropping the hammer.
00:10:25.083,00:10:26.167,"No, you're not."
00:11:00.868,00:11:03.079,It's under Rowdy's time.
00:11:03.121,00:11:05.039,"Well, it might have been better if he cracked up the car."
00:11:20.888,00:11:22.474,That was fast.
00:11:22.807,00:11:24.351,Yeah?
00:11:24.392,00:11:26.186,Thirty-one flat.
00:11:26.227,00:11:29.063,That's good enough to take the pole in the last race here.
00:11:33.067,00:11:35.028,"Hell, I thought this was gonna be a joke."
00:11:35.069,00:11:36.488,You never drove a stock car before?
00:11:36.530,00:11:38.281,"No, sprints mainly."
00:11:38.323,00:11:40.575,What's your name?
00:11:40.617,00:11:42.827,Cole Trickle.
00:11:42.869,00:11:43.828,"Damn nice to meet you, too, Cole."
00:11:45.330,00:11:47.123,You were one lucky son of a bitch in that tunnel turn.
00:11:47.165,00:11:49.209,That car was way out of shape.
00:11:49.250,00:11:51.670,"Well, if you think it was luck, let's do it again."
00:11:52.504,00:11:53.712,You run good.
00:11:53.754,00:11:55.714,Thank you.
00:11:55.756,00:11:57.467,"Now, go get your own car and we'll see how you do in a crowd."
00:12:01.846,00:12:04.641,"So, how come you don't stick to open wheels?"
00:12:04.683,00:12:07.185,I lost my ride.
00:12:07.227,00:12:10.938,"After two championships and seven straight wins, you were fired?"
00:12:10.980,00:12:12.315,I lost my ride.
00:12:13.650,00:12:15.151,Doesn't matter.
00:12:15.193,00:12:16.777,Why's that?
00:12:16.819,00:12:17.987,I wasn't going anywhere.
00:12:18.029,00:12:18.779,Where do you want to go?
00:12:19.698,00:12:20.948,Indianapolis.
00:12:22.450,00:12:24.160,But you can't win in Indy without a great car.
00:12:24.202,00:12:25.995,And my name's not Andretti or Unser.
00:12:26.037,00:12:28.164,"On the other hand, stock cars are stock cars."
00:12:28.206,00:12:30.458,"Hey, there's nothing stock about a stock car."
00:12:31.918,00:12:34.379,"Look, I'm not trying to insult you."
00:12:34.421,00:12:36.381,"All I'm saying is, stock cars are built to run equal."
00:12:36.423,00:12:37.674,Isn't that right?
00:12:37.716,00:12:39.384,So the rule books say.
00:12:39.426,00:12:41.511,So I don't have to worry about getting beat by another car.
00:12:41.553,00:12:43.722,"In other words, all you have to worry about is getting beat by other drivers."
00:12:43.762,00:12:46.307,Yeah.
00:12:46.349,00:12:47.684,"You build me a car, and I'll win Daytona next year."
00:12:54.941,00:12:58.027,I'm gonna give you an engine low to the ground.
00:13:00.029,00:13:02.865,Extra-big oil pan that'll cut the wind from underneath you.
00:13:04.242,00:13:07.328,That'll give you 30 to 40 more horsepower.
00:13:10.998,00:13:15.420,I'm gonna give you a fuel line that'll hold an extra gallon of gas.
00:13:15.462,00:13:19.257,I'm gonna shave half an inch off you and shape you like a bullet.
00:13:19.299,00:13:25.472,"And when we get you primed, painted and weighed, you're going to be ready to go out on that racetrack."
00:13:25.513,00:13:27.014,You hear me?
00:13:30.518,00:13:31.394,You're gonna be perfect.
00:14:45.426,00:14:46.594,Okay.
00:14:53.351,00:14:55.562,"Cole, you're wandering all over the track."
00:14:55.603,00:14:58.398,Yeah.
00:14:58.439,00:15:01.067,"No, he didn't slam into you, he didn't bump you, he didn't nudge you."
00:15:01.108,00:15:03.277,"He rubbed you, and rubbing, son, is racing."
00:15:12.912,00:15:13.663,There goes the fender.
00:15:18.042,00:15:18.918,There goes the quarter panel.
00:15:41.232,00:15:42.776,COLE: All right. Get back!
00:15:49.031,00:15:54.995,"All right, while we're still under a caution, I want you to go back out on that track and hit the pace car."
00:15:55.037,00:15:57.540,Hit the pace car?
00:15:57.582,00:15:59.459,What for?
00:15:59.500,00:16:01.795,Because you hit every other goddamn thing out there.
00:16:01.836,00:16:04.505,I want you to be perfect.
00:16:21.063,00:16:22.690,You're going too high.
00:16:44.712,00:16:47.632,How about that?
00:16:51.845,00:16:53.012,"I don't want you spoiled, Buck."
00:17:10.488,00:17:11.405,This is gonna hurt.
00:17:12.573,00:17:14.325,Move! Move! Move!
00:17:17.954,00:17:19.455,Did you see that guy?
00:17:19.497,00:17:20.331,What?
00:17:32.886,00:17:34.428,I've got to pit.
00:17:34.470,00:17:36.180,I don't think so.
00:17:36.222,00:17:37.015,You're what?
00:17:38.599,00:17:39.726,We're eating ice cream.
00:17:40.518,00:17:41.352,Ice cream?
00:17:53.280,00:17:58.536,"Now, you're welcome to come on and get one, but I don't believe NASCAR would think much of you trying to eat an ice cream cone out there."
00:17:58.578,00:17:59.871,You have enough trouble riding around the track as it is.
00:18:16.679,00:18:18.138,CREW MAN: Take it easy.
00:18:19.432,00:18:20.892,"MAN: Come on now, Cole!"
00:18:21.559,00:18:23.227,Cole! Cole!
00:18:30.693,00:18:32.570,We messed up big-time on Sunday.
00:18:33.988,00:18:41.746,I had sponsors in the stands and I'm hugging and holding hands and kissing them in the ear and praying for a good showing.
00:18:42.496,00:18:44.958,And what do we do?
00:18:44.999,00:18:46.960,We end up looking like a monkey fucking a football out there.
00:18:49.670,00:18:51.422,"Everybody out, please."
00:18:53.091,00:18:54.467,Except you two.
00:19:02.934,00:19:05.770,I've got a question.
00:19:05.812,00:19:09.315,What is the one thing you absolutely need to do to win a race?
00:19:09.356,00:19:11.776,It's pretty damn obvious...
00:19:11.818,00:19:13.152,You need to finish the race.
00:19:14.361,00:19:17.448,"Tim, I realize Harry's been around a long time."
00:19:19.158,00:19:23.287,I'm not saying that his ways are antiquated but it'd help to have a car that handled properly and didn't blow engines.
00:19:23.329,00:19:27.750,"Well, if he wouldn't get excited and over rev the son of a bitch, the engine wouldn't blow."
00:19:27.792,00:19:36.801,"Now, Cole, when you shift the gear, and that little needle on the tach goes into the red and reads 9,000 rpm, that's bad."
00:19:39.971,00:19:42.640,"It's also my fault if the tires blow, if you ask this old fart."
00:19:42.682,00:19:43.933,"Well, hell yes, it's your fault."
00:19:43.975,00:19:47.979,There's 40 other vultures out there who managed to finish the race on their tires.
00:19:48.021,00:19:50.773,You see Darrell Waltrip using up his tires?
00:19:50.815,00:19:52.650,There's nothing I can't do with a racecar.
00:19:52.692,00:19:54.068,"Well, that's the difference between you and me."
00:19:54.110,00:19:56.529,There's only so much I can do!
00:19:56.570,00:19:59.406,"Harry, he doesn't need to appreciate your job to do his."
00:19:59.448,00:20:01.575,"Well, he sure as hell does."
00:19:59.448,00:20:04.162,How can he expect to race if he don't know what a racecar can and can't do?
00:20:04.203,00:20:05.663,"What is this shit, huh?"
00:20:05.705,00:20:08.124,You want me to work the pit and you drive?
00:20:08.166,00:20:09.667,Fine. We'll try that.
00:20:11.002,00:20:13.046,I can't talk to this son of a bitch.
00:20:16.465,00:20:19.677,I can't talk to that son of a bitch.
00:20:25.099,00:20:26.184,You think he can drive?
00:20:26.767,00:20:28.435,He can drive.
00:20:28.477,00:20:32.398,"He can drive beyond the limits of the tires, the engine, the car, anything else."
00:20:32.439,00:20:34.608,"If the son of a bitch listened to me, we wouldn't hardly ever lose a race."
00:20:38.029,00:20:42.449,"If we don't get us a sponsor in the next couple of races, my ass is fried."
00:20:46.328,00:20:48.288,I'm liable to be out of the car business altogether.
00:20:50.041,00:20:53.335,"And, Harry, I know you're great."
00:20:54.879,00:20:57.840,"But if the guy in the car doesn't trust you, we're never going to win a damn race."
00:21:12.105,00:21:13.397,"Hey, Harry."
00:21:19.486,00:21:21.321,"We've gotta talk, all right?"
00:21:23.282,00:21:25.284,"All right, Harry. Talk."
00:21:25.325,00:21:28.121,No. On the radio during the race.
00:21:28.162,00:21:33.709,"Now, you wanna run right on the ragged edge all the damn time, you've got to tell us what's going on with the car."
00:21:33.751,00:21:35.128,Or you just want to change the way I drive it.
00:21:35.169,00:21:36.879,Maybe.
00:21:36.921,00:21:39.840,"Well, maybe you can set up the car so I don't have to change."
00:21:39.882,00:21:41.175,I'd be happy to.
00:21:41.217,00:21:42.635,You just tell me how.
00:21:42.676,00:21:44.053,What do you want to know?
00:21:44.095,00:21:46.097,"Well, hell, Cole, you are the driver."
00:21:46.139,00:21:47.598,You think she's running loose or tight? Tell us.
00:21:47.640,00:21:52.270,"We give a turn here, take some wedge out there, we'll win some races."
00:21:52.311,00:21:55.731,I can't do that.
00:21:55.773,00:21:58.609,Because I don't know what the hell you're talking about.
00:21:58.651,00:21:59.485,How do you mean that?
00:22:09.411,00:22:12.248,"Because I don't know much about cars, okay?"
00:22:12.290,00:22:15.876,"Well, hey, Cole, that don't make you a damn bit different from any driver I ever met."
00:22:15.918,00:22:17.670,"No, I mean, I really don't know."
00:22:17.711,00:22:20.256,I don't know what you just said about a turn here and a wedge there.
00:22:20.298,00:22:22.258,I don't know.
00:22:22.300,00:22:23.801,How can that be?
00:22:23.843,00:22:25.552,What's the difference?
00:22:25.594,00:22:27.763,They told me to get in a car and drive.
00:22:29.598,00:22:32.101,"The point is, I'd like to help out but I can't."
00:22:32.143,00:22:34.436,I'm an idiot.
00:22:40.026,00:22:41.194,Well...
00:22:42.528,00:22:46.532,"We're just gonna have to figure one out, aren't we?"
00:22:50.077,00:22:51.620,Don't worry about it.
00:22:53.539,00:22:55.041,All right?
00:22:56.292,00:22:57.043,How does she feel?
00:23:00.462,00:23:01.839,Whoa!
00:23:04.800,00:23:07.803,"Well, the rear end's loose."
00:23:07.845,00:23:10.639,"Loose is fast, and on the edge, you're out of control."
00:23:14.560,00:23:16.979,"Now, Cole, there is something else."
00:23:19.690,00:23:22.151,Tires is what wins a race.
00:23:24.070,00:23:24.945,Yeah.
00:23:26.239,00:23:31.244,"If we can't figure you a way to run so you don't melt the damn tires, we can't finish a race."
00:23:31.285,00:23:32.870,"So, what do you want?"
00:23:32.912,00:23:38.918,"I'll tell you what, you run 50 laps any way you like, then 50 laps like I want you to."
00:23:38.959,00:23:40.502,Give me an honest run.
00:23:40.544,00:23:41.837,"If you do, I'm gonna beat you."
00:23:58.562,00:24:02.608,All right.
00:24:02.649,00:24:09.323,"Now, when you were racing Indy cars out west, the tires were twice as wide and the car weighed half as much."
00:24:09.365,00:24:15.204,"Now your car weighs twice as much and the tires are half as wide and you're burning them up, all right."
00:24:15.246,00:24:17.373,"Now, if you do..."
00:24:15.246,00:24:20.000,"When you burn them up, they melt, when they melt, they get greasy and you slip and slide."
00:24:20.042,00:24:22.878,And you're out of control. All right?
00:24:39.312,00:24:41.272,"His way, my way."
00:24:42.148,00:24:44.358,I was six seconds faster.
00:24:44.400,00:24:47.069,"You can buy me some lunch at the highway joint, Tim."
00:25:02.251,00:25:04.544,What's wrong?
00:25:04.586,00:25:05.838,We're trying to figure out what to do.
00:25:07.505,00:25:09.091,About what?
00:25:09.133,00:25:11.010,We're in trouble.
00:25:11.051,00:25:13.804,Rowdy took the pole in 30.25.
00:25:13.846,00:25:16.807,We run 31.10.
00:25:16.849,00:25:19.059,We're looking for some speed out of this.
00:25:21.728,00:25:22.562,"The car's perfect, Harry."
00:25:35.159,00:25:38.912,ANNOUNCER: It's the first race of the season here at the legendary Darlington International Speedway.
00:25:38.954,00:25:41.123,And the most treacherous turn is number four.
00:25:41.165,00:25:43.209,30:90. Leader's 30:80.
00:25:43.250,00:25:45.294,You're running 12th.
00:25:45.336,00:25:46.170,"Thanks, Harry."
00:25:59.308,00:26:01.810,"You're gonna burn the damn tires, Cole."
00:26:01.852,00:26:04.438,"Harry, I'm not going faster."
00:26:05.814,00:26:07.858,"He's right, Harry."
00:26:07.900,00:26:09.527,We just haven't fallen off as much as everybody else.
00:26:11.237,00:26:12.821,That's right.
00:26:12.863,00:26:16.658,HARRY: You're running fifth and you're gaining half a second a lap on the leader.
00:26:20.287,00:26:21.121,Fifteen to go.
00:26:25.418,00:26:27.627,Don't pass on the outside of turn four.
00:26:30.588,00:26:33.551,That's right.
00:26:38.055,00:26:41.141,"ANNOUNCER: And Trickle has moved into the number two spot, right behind Rowdy Burns."
00:26:41.183,00:26:42.726,I'm right behind the leader.
00:26:42.768,00:26:43.977,HARRY: Five laps to go.
00:26:48.274,00:26:49.275,Remember me?
00:26:50.984,00:26:52.570,What in the hell's going on?
00:26:52.610,00:26:55.197,"Just a little rubbing, Harry."
00:27:02.079,00:27:03.330,I'm going to take this rookie once and for all.
00:27:09.711,00:27:11.297,"All right, God damn it."
00:27:11.338,00:27:13.090,You can't play with Rowdy like this.
00:27:13.132,00:27:14.467,He's gonna give you a real ass ripping.
00:27:14.508,00:27:15.468,"Just relax, Harry."
00:27:19.679,00:27:21.474,ANNOUNCER: Somebody's got to give.
00:27:21.515,00:27:23.934,And it's Rowdy Burns who's out!
00:27:23.976,00:27:26.520,No! An incredible recovery by Rowdy.
00:27:26.562,00:27:28.897,He retains his position on the lead lap.
00:27:28.939,00:27:30.983,And we have a new leader.
00:27:31.024,00:27:32.859,Cole Trickle in the number 46 City Chevrolet car.
00:27:34.320,00:27:37.114,We're under caution with three laps to go.
00:27:37.156,00:27:38.532,Caution's out.
00:27:38.574,00:27:40.658,What for?
00:27:40.700,00:27:42.536,You've been on the green for 68 laps.
00:27:42.578,00:27:43.621,"Everybody's got to pit, Cole."
00:27:54.798,00:27:56.258,"Go, go! Go, go!"
00:27:58.260,00:28:00.304,"The air gun's jammed, give me another one."
00:28:00.346,00:28:02.222,Give me a gun.
00:28:02.264,00:28:03.641,MAN: It's jammed.
00:28:04.933,00:28:06.143,Let's go!
00:28:12.525,00:28:14.360,Damn it! Go! Go! Go!
00:28:14.401,00:28:15.902,Go. Get them on quick!
00:28:26.079,00:28:27.789,God damn it!
00:28:28.790,00:28:30.083,"Now, Cole..."
00:28:36.632,00:28:37.924,COLE: Son of a bitch!
00:28:37.966,00:28:39.301,"Cole, we're on the air, all right?"
00:28:39.343,00:28:41.428,"I come into the pit, I'm in first place."
00:28:41.470,00:28:43.805,"I go out, I'm in third with two laps to go."
00:28:43.847,00:28:46.058,"All right. First of all, don't get excited, all right."
00:28:46.099,00:28:48.143,You're in third place.
00:28:48.185,00:28:49.478,"Now, what you do is this."
00:28:49.520,00:28:55.192,"When they slow down into turn four, you just keep your foot on the gas and drive right by them on the outside."
00:28:55.234,00:28:59.238,"Harry, you told me, nobody goes to the outside on turn four."
00:28:59.279,00:29:00.822,"Well, now I'm telling you different."
00:29:00.864,00:29:03.783,"If you go to the outside, you can hold it."
00:29:03.825,00:29:05.494,He's going to end up in the wall.
00:29:05.536,00:29:08.163,All right.
00:29:08.205,00:29:09.373,We don't have a whole lot of time to talk about this.
00:29:09.415,00:29:11.166,"Well, tell me how."
00:29:11.208,00:29:13.168,It's 'cause we've got a real good set of match tires on.
00:29:13.210,00:29:15.421,What?
00:29:15.462,00:29:17.881,Those tires are matched perfect and staggered special.
00:29:17.923,00:29:19.717,You're gonna get him killed.
00:29:19.758,00:29:22.052,Pace car's about ready duck on off.
00:29:22.094,00:29:25.305,"If you go to the outside, you can hold it."
00:29:25.347,00:29:26.890,"All right, Harry."
00:29:35.482,00:29:37.526,ANNOUNCER: The white flag is out.
00:29:56.086,00:29:57.546,The boy don't have the balls to pass me on the outside.
00:30:00.924,00:30:03.343,ANNOUNCER: And they're heading into treacherous turn four.
00:30:28.452,00:30:30.412,Yes!
00:30:30.454,00:30:34.040,ANNOUNCER: And Cole Trickle wins his first ever NASCAR victory.
00:30:34.082,00:30:36.251,Second place goes to Rowdy Burns.
00:30:46.011,00:30:47.805,Cole Trickle...
00:30:47.846,00:30:52.351,"Cole, did you have any idea you could run the car wide open into that last turn and make it stick like that?"
00:30:52.392,00:30:53.435,I knew it all along.
00:30:53.477,00:30:55.270,How's that?
00:30:55.312,00:30:58.524,"Well, in our last stop, when I came in, Harry put on special tires."
00:30:58.565,00:31:00.609,"Special tires? Harry Hogge, what's special about them?"
00:31:00.651,00:31:02.319,"Well, nothing in particular."
00:31:04.070,00:31:05.614,REPORTER: Looks like Harry Hogge has a little explaining to do.
00:31:05.656,00:31:07.825,You told me...
00:31:07.866,00:31:09.743,I lied. I had to tell you something to calm you down.
00:31:09.785,00:31:11.370,You were acting like such a candy-ass.
00:31:11.411,00:31:14.540,"After the air gun stuck, I figured you'd never get back on the racetrack."
00:31:14.581,00:31:16.583,You son of a bitch!
00:31:19.712,00:31:23.841,Try this on for size.
00:31:28.804,00:31:33.809,"Promise me one thing, boys, whatever else we do from here, we win Daytona."
00:31:34.852,00:31:36.936,That's a promise.
00:31:44.277,00:31:50.617,HARRY: Selling thousands of dollars worth of useless mining stock and they call that a dog and pony show.
00:31:50.659,00:31:54.162,"It may be funny, but it's not that funny when it happens to you, son."
00:31:56.540,00:31:58.166,It happened to me.
00:31:59.418,00:32:01.545,What? You bought worthless mining stock?
00:32:02.421,00:32:03.380,I told you I lost my ride.
00:32:05.215,00:32:07.259,That's how I lost it.
00:32:07.300,00:32:10.345,Team owner was a conman.
00:32:11.722,00:32:13.515,But mainly he sold stolen yachts.
00:32:15.642,00:32:19.229,"When I won enough races, he even used my name to promote the sales."
00:32:19.271,00:32:20.939,He went to jail and I lost my ride.
00:32:25.985,00:32:28.029,"It was pretty humiliating, actually."
00:32:28.071,00:32:33.869,"Hell, Cole, there's no need to be embarrassed by some lowlife, piece of trash who put you in that kind of position."
00:32:35.662,00:32:36.538,"Well, Harry, that depends."
00:32:37.038,00:32:39.124,On what?
00:32:39.165,00:32:42.711,"On whether or not you're related to that lowlife, piece of trash."
00:32:44.296,00:32:45.171,He was my father.
00:32:48.383,00:32:50.761,I've never really stuck with anything since.
00:32:53.221,00:32:56.349,"They don't trust me, I don't trust them."
00:32:57.434,00:32:58.393,You know how that goes.
00:32:59.478,00:33:04.942,"Like for instance, you lied to me today."
00:33:04.983,00:33:06.318,It was dumb luck I didn't end up crashed or dead.
00:33:07.653,00:33:08.403,I ought to punch you out.
00:33:09.529,00:33:11.406,Yeah? Give it a try.
00:33:15.828,00:33:16.745,No.
00:33:19.331,00:33:22.459,Don't wanna get my ass kicked by a 60-year-old man.
00:33:24.127,00:33:25.587,Fifty-nine.
00:33:25.629,00:33:26.463,"BUCK: Whoop his ass, Harry."
00:33:26.505,00:33:28.298,"Come on, Cole."
