start,end,script
00:02:24.811,00:02:25.937,Not that one.
00:02:27.564,00:02:28.565,The next.
00:03:10.481,00:03:12.567,How am I to bear it when you are gone?
00:03:13.192,00:03:15.278,"I am going only half a mile, Emma."
00:03:15.361,00:03:20.158,But great is the difference between a Mrs. Weston half a mile away and a Miss Taylor in the house.
00:03:27.415,00:03:29.042,Dear Emma.
00:03:30.877,00:03:36.382,You have been a friend and companion such as few possess.
00:03:37.217,00:03:38.885,"A governess in office, but..."
00:03:40.553,00:03:42.847,...little short of a mother in affection.
00:03:43.556,00:03:46.309,I wish you every happiness on your wedding day.
00:03:57.528,00:04:00.073,It's a pity Mr. Weston ever thought of her.
00:04:02.492,00:04:06.913,"Papa, Mr. Weston is such a good-humored, pleasant, excellent man."
00:04:06.996,00:04:08.373,He thoroughly deserves a good wife.
00:04:09.123,00:04:12.835,And you would not have had Miss Taylor live with us forever when she might have had a house of her own.
00:04:12.919,00:04:15.129,A house of her own. Where is the advantage of a house of her own?
00:04:16.631,00:04:18.299,...three times as large.
00:04:20.260,00:04:23.263,"It's entirely unnecessary. Poor Miss Terry, poor Isabella!"
00:04:23.346,00:04:25.265,"My sister married seven years ago, Papa."
00:04:25.348,00:04:27.058,You must be reconciled to it by now.
00:04:27.141,00:04:28.601,That was a terrible day.
00:04:39.112,00:04:43.157,It shall always be a matter of great joy to me that I made the match myself.
00:04:43.241,00:04:47.203,"Everyone said Mr. Weston would never marry again, but I did not believe it."
00:04:47.287,00:04:49.831,"Emma, you should not make matches or foretell things."
00:04:53.293,00:04:54.627,You must not make any more.
00:04:54.711,00:04:57.505,"I promise to make none for myself, Papa."
00:04:58.339,00:05:00.091,But I must indeed for other people.
00:05:00.591,00:05:02.468,It is the greatest amusement in the world.
00:05:03.219,00:05:05.346,"And after such success, you know."
00:05:18.234,00:05:20.403,Miss Bates. Mrs. Bates.
00:05:22.697,00:05:24.198,"Mr. Woodhouse, sir. Miss Woodhouse."
00:05:25.408,00:05:28.077,"-Mr. Cole, Mrs. Cole. -Good morning."
00:05:38.504,00:05:39.464,Miss Woodhouse!
00:05:41.174,00:05:42.050,Morning.
00:05:42.133,00:05:44.093,Is this not the most happy...
00:05:44.177,00:05:46.554,"happy, the most fortunate?"
00:05:46.637,00:05:49.724,"This morning, I could not get my bonnet on for trembling."
00:05:50.433,00:05:51.601,Hmm.
00:05:51.684,00:05:53.811,Surrounded by blessings.
00:05:54.562,00:05:56.397,Wanting for nothing.
00:05:57.356,00:05:58.983,I am trembling again.
00:06:07.116,00:06:09.619,I have a fancy that Mr. Weston's son may surprise us.
00:06:09.702,00:06:10.953,Frank Weston?
00:06:11.037,00:06:12.830,"He's Frank Churchill now, Papa."
00:06:13.456,00:06:14.916,He's his uncle's heir.
00:06:14.999,00:06:16.834,"When he came of age, he took his uncle's name."
00:06:17.543,00:06:19.170,I so long to meet him.
00:06:19.253,00:06:20.963,But how do you know he might surprise us?
00:06:21.839,00:06:23.424,It is his father's wedding day.
00:06:24.217,00:06:26.427,Mr. Weston speaks of him so highly.
00:06:26.511,00:06:28.513,I cannot doubt that he will come.
00:06:48.991,00:06:50.701,Poor Miss Taylor.
00:06:59.418,00:07:08.928,"Dearly beloved friends, we gather here in the sight of God to join together this man and this woman..."
00:07:11.347,00:07:18.813,an honorable estate instituted by God in this time of... of man's great innocence.
00:07:19.689,00:07:20.982,In no sense?
00:07:21.858,00:07:23.192,Innocence.
00:07:23.860,00:07:24.902,No?
00:07:25.403,00:07:26.404,Well...
00:07:30.908,00:07:31.868,Mmm.
00:07:40.042,00:07:42.837,"Mother, you must eat. It is impolite not to eat."
00:07:47.675,00:07:48.509,I was just telling...
00:08:58.412,00:08:59.830,"You know what I'm about to say, sir."
00:08:59.914,00:09:02.083,Why do you keep a carriage if you never put it out?
00:09:02.166,00:09:05.211,It's just such a shame to see it standing by.
00:09:05.294,00:09:08.798,A gentleman on foot-- -it's unusual. -Unusual.
00:09:08.881,00:09:10.591,"Good evening, Mrs. Reynolds."
00:09:49.338,00:09:52.049,At last. Mr. Knightley.
00:09:55.219,00:09:57.054,You must have had a shocking walk.
00:09:57.138,00:09:59.515,"Not at all, sir. It's a beautiful evening."
00:09:59.599,00:10:01.851,You must have found it very damp and dirty.
00:10:03.686,00:10:05.271,Look at my shoes.
00:10:05.354,00:10:06.606,Not a speck on them.
00:10:10.526,00:10:11.736,Joy?
00:10:12.361,00:10:13.321,"Oh, the wedding."
00:10:13.404,00:10:15.114,What a terrible day.
00:10:17.491,00:10:19.869,"So, how did you all behave? Who cried the most?"
00:10:19.952,00:10:22.288,We all behaved charmingly.
00:10:22.872,00:10:24.665,Everybody was in their best looks.
00:10:24.749,00:10:27.710,"Not a tear, and hardly a long face to be seen."
00:10:27.793,00:10:29.503,Bring the screen a little closer.
00:10:29.587,00:10:30.921,Mr. Knightley feels a chill.
00:10:32.632,00:10:34.383,And what of Mr. Frank Churchill?
00:10:34.467,00:10:36.927,Is he every bit as handsome as his father promised he would be?
00:10:38.763,00:10:39.847,He did not come?
00:10:48.606,00:10:51.984,"You see, he wished exceedingly to come, but his aunt and uncle could not spare him."
00:10:52.068,00:10:54.570,"Well, I dare say he might have come if he could."
00:10:54.654,00:10:56.781,I do not know why you should say so.
00:10:56.864,00:11:01.285,"If Frank Churchill had wanted to attend his father's wedding, he would have contrived it."
00:11:01.369,00:11:03.162,He... he chose not to come.
00:11:03.245,00:11:05.414,You've never met Mr. Frank Churchill.
00:11:05.498,00:11:07.708,We do not know what he is able or unable to do.
00:11:07.792,00:11:13.130,"There is one thing, Emma, which a man can always do if he chooses, and that is his duty."
00:11:13.214,00:11:16.675,It is Frank Churchill's duty to pay this attention to his father.
00:11:16.759,00:11:19.261,"He also has a duty to his aunt, who is unwell."
00:11:21.847,00:11:23.349,for as long as she could say so.
00:11:24.016,00:11:25.434,Her nephew is not a doctor.
00:11:30.439,00:11:34.026,"...that he must attend his father's wedding, there would have been no opposition to his going."
00:11:34.110,00:11:38.197,"You are the worst judge in the world, Mr. Knightley, of the difficulties of dependence."
00:11:38.280,00:11:39.740,You've always been your own master.
00:11:40.241,00:11:42.618,You've no idea what it is to have tempers to manage.
00:11:42.701,00:11:45.454,I shall remember that next time you quarrel with me.
00:12:26.537,00:12:30.207,"There is a new parlor boarder, Papa, at Mrs. Goddard's school."
00:12:30.291,00:12:31.417,-Miss Smith. -There.
00:12:31.500,00:12:32.668,Distinctly.
00:12:33.669,00:12:35.129,Do you feel it? A chill draft.
00:12:35.212,00:12:36.630,A chill and sickly draft.
00:12:36.714,00:12:38.007,She's a natural child.
00:12:38.507,00:12:41.302,"Nobody knows her parentage, not even Miss Smith herself."
00:12:41.385,00:12:43.095,Is that not mysterious?
00:12:47.433,00:12:48.976,Miss Taylor would have felt it.
00:13:23.219,00:13:29.850,"The misfortune of your birth, Harriet, ought to make you particularly careful as to your associates."
00:13:29.934,00:13:32.394,There can be no doubt of your being a gentleman's daughter.
00:13:33.479,00:13:36.398,You must support your claim to that station by everything within your power.
00:13:38.484,00:13:42.238,"Know you the Martins, Miss Woodhouse, of Abbey Mill Farm?"
00:13:42.947,00:13:44.490,I know that they are tenant farmers.
00:13:44.990,00:13:46.534,They rent their farm from Mr. Knightley.
00:13:48.410,00:13:50.538,They were ever so kind to me this summer.
00:13:50.621,00:13:51.580,Thank you.
00:13:53.082,00:13:59.004,"When I went away, Mrs. Martin was so very kind as to send Mrs. Goddard a beautiful goose."
00:14:00.965,00:14:04.301,"The finest goose Mrs. Goddard had ever seen, she said."
00:14:08.055,00:14:13.060,The Martins are of precisely the order of people with whom I feel I can have nothing to do.
00:14:14.103,00:14:16.480,A degree or two lower might interest me.
00:14:16.564,00:14:20.317,"If they were very poor, I might hope to be useful to them in some way, but..."
00:14:20.818,00:14:26.198,a farmer can need none of my help and is therefore as much above my notice as he is below it.
00:14:27.825,00:14:33.706,Mr. Robert Martin went three miles one day to bring me walnuts because he knew how fond I was of them.
00:14:33.789,00:14:35.291,I believe he's very clever.
00:14:35.374,00:14:36.458,He understands everything.
00:14:36.542,00:14:37.459,Come.
00:14:38.961,00:14:41.338,"After tea, we shall call on my dear Mrs. Weston."
00:14:41.422,00:14:43.883,We promised we should be seeing one another every day.
00:15:00.316,00:15:02.651,"It was a beautiful service, Mr. Elton."
00:15:02.735,00:15:05.237,Oh. I'm not the first to visit you this morning.
00:15:05.321,00:15:08.115,You are no less welcome for being the second.
00:15:08.198,00:15:11.201,"Mr. Elton, Miss Harriet Smith."
00:15:13.579,00:15:15.247,It is my great honor.
00:15:18.876,00:15:23.255,"Harriet, you must sit over there so that you may admire the view of Enscombe."
00:15:24.048,00:15:25.716,Mr. Frank Churchill is the artist.
00:15:25.799,00:15:29.219,I have heard it described as one of the finest houses in Yorkshire.
00:15:29.303,00:15:30.429,I have heard the same.
00:15:30.512,00:15:33.933,And Mr. Churchill is to inherit the entire estate.
00:15:34.016,00:15:35.684,He is very fortunate.
00:15:35.768,00:15:38.896,There is such symmetry between us.
00:15:38.979,00:15:41.398,We both lost our mothers when we were very young.
00:15:41.482,00:15:44.026,"And he has his aunt to care for, as I have Papa."
00:15:45.319,00:15:50.324,But how can we admire a painted beauty with such...
00:15:51.408,00:15:54.203,loveliness before us in the flesh?
00:15:59.917,00:16:02.127,Mr. Elton is such a good-humored man.
00:16:03.045,00:16:04.922,So cheerful and obliging.
00:16:05.005,00:16:06.298,And gentle.
00:16:07.341,00:16:09.551,I think very well of Mr. Elton.
00:16:12.262,00:16:17.142,"I do so wonder, Miss Woodhouse, that you should not be going to be married."
00:16:25.150,00:16:26.568,Employment I do not want.
00:16:26.652,00:16:28.570,Consequence I do not want.
00:16:29.530,00:16:34.535,I believe few married women are half as much mistress of their husband's house as I am of Hartfield.
00:16:37.329,00:16:38.789,You must come again tomorrow.
00:16:40.916,00:16:42.459,"Thank you, Miss Woodhouse."
00:16:43.168,00:16:44.044,Thank you.
00:17:10.696,00:17:12.489,"Miss Woodhouse, which do you prefer?"
00:17:12.573,00:17:14.199,They are practically identical.
00:17:18.954,00:17:20.831,"-But the light... -The dark, then."
00:17:21.331,00:17:23.625,The light is a good deal prettier.
00:17:27.546,00:17:29.381,"Miss Woodhouse, what's the matter?"
00:17:31.925,00:17:33.719,Miss Woodhouse.
00:17:33.802,00:17:35.179,How do you do?
00:17:35.262,00:17:36.388,"And you, Miss Smith."
00:17:37.556,00:17:38.849,I saw you through the window.
00:17:39.516,00:17:40.809,I saw you through the window.
00:17:40.893,00:17:42.644,"Miss Woodhouse, I bring happy news."
00:17:42.728,00:17:47.107,"We have had a letter this very morning from my niece, Jane Fairfax."
00:17:47.191,00:17:48.609,I hope that she is well.
00:17:48.692,00:17:51.528,"In normal course, she writes on a Tuesday, but today was..."
00:17:51.612,00:17:52.946,"Oh, her health."
00:17:53.030,00:17:57.076,"Oh, Miss Woodhouse, you are so very kind to inquire."
00:17:57.159,00:17:58.077,Poor Jane.
00:17:58.160,00:18:01.538,"She was at Weymouth with Colonel Campbell and, uh..."
00:18:01.622,00:18:02.956,"Oh, where is the letter?"
00:18:03.040,00:18:05.459,"Oh. Oh, it must not be far off."
00:18:06.168,00:18:07.753,"Oh, such an unexpected..."
00:18:07.836,00:18:09.713,"Oh, it's on the glove stand."
00:18:09.797,00:18:12.674,It was with the gloves. It was with the gloves.
00:18:12.758,00:18:19.848,"Yes, at Weymouth with Colonel Campbell and his wife and Jane's dear friend, Miss Campbell, who is recently married."
00:18:19.932,00:18:20.808,She's Mrs. Dixon now.
00:18:20.891,00:18:28.524,"And, oh, dear, Mr. Dixon, who is the most charming young man, rendered to Jane a great service in recent days."
00:18:28.607,00:18:31.568,"They were... Oh, too pretty. That is..."
00:18:31.652,00:18:44.289,"Yes, they were out in a part... oh, in a party on the water, and Jane, by the sudden whirling around of something or other in the sails, would have been dashed to the sea at once..."
00:18:48.710,00:18:57.094,"But Mr. Dixon, with the greatest presence of mind, caught hold of her habit and saved her life."
00:18:57.970,00:19:00.055,"Oh, to think that poor Jane may have perished."
00:19:01.223,00:19:04.560,"I cannot think of it without shaking, she an orphan."
00:19:05.102,00:19:07.980,I am very pleased that Miss Fairfax was not harmed.
00:19:08.063,00:19:13.318,"How gratified Jane will be to know that she has such dear, devoted friends."
00:19:13.402,00:19:19.950,Heaven forbid that I should ever bore anybody half as much about all the Knightleys together as Miss Bates does about Jane Fairfax.
00:19:20.909,00:19:25.414,One is sick of the very name Jane Fairfax.
00:19:25.497,00:19:27.833,Every letter from her is read 40 times over.
00:19:27.916,00:19:31.962,"And if she does but knit a pair of garters, one hears of nothing else for a whole month."
00:19:35.757,00:19:37.217,It is Robert Martin.
00:19:48.520,00:19:50.480,-Miss Smith. -Mr. Martin.
00:19:59.573,00:20:01.700,"-Lovely to see you, Miss Smith. -Goodbye."
00:20:07.164,00:20:09.750,Only think of our happening to meet him.
00:20:10.626,00:20:12.085,"Well, Miss Woodhouse?"
00:20:12.586,00:20:14.296,Is he like what you expected?
00:20:17.758,00:20:28.185,"I had no right to expect much, and indeed, I did not expect much, but I had imagined him, I confess, a degree or two nearer..."
00:20:29.311,00:20:30.896,gentility.
00:20:32.147,00:20:33.607,To be sure...
00:20:34.441,00:20:38.487,he's not so genteel as to a real gentleman.
00:20:52.668,00:20:55.128,I do hope Mr. Woodhouse is not ill.
00:20:55.212,00:20:56.421,"Oh, no."
00:20:57.631,00:21:00.050,"Oh, Papa sees Mr. Perry every day."
00:21:00.759,00:21:02.594,I know I disappoint him awfully.
00:21:02.678,00:21:04.471,I'm so seldom indisposed.
00:21:04.972,00:21:07.808,"If he does not invent an illness for me, I hardly figure in his letters."
00:21:09.226,00:21:10.519,Truly...
00:21:12.104,00:21:15.649,"you are the very picture of good health, Miss Woodhouse."
00:21:16.650,00:21:19.695,Mrs. Martin thinks you the most handsome woman in all of Highbury.
00:21:24.866,00:21:28.036,"You must never flatter me in front of Mr. Knightley, Harriet."
00:21:28.120,00:21:29.621,He thinks me vain enough already.
00:21:30.706,00:21:32.916,I do not think you personally vain.
00:21:33.000,00:21:36.003,"Considering how very handsome you are, you seem little occupied with it."
00:21:37.963,00:21:39.715,Your vanity lies a different way.
00:21:48.390,00:21:51.268,Did I tell you what Mr. Elton said of you the other day?
00:21:54.396,00:21:56.231,He called you...
00:21:58.775,00:22:00.569,loveliness itself.
00:22:03.822,00:22:13.206,"It, it seems to me his manners are rather softer than they used to be, and I rather wonder whether he means to ingratiate himself with you."
00:22:19.671,00:22:20.630,"Morning, Mrs. Goddard."
00:22:20.714,00:22:22.632,"-Good morning, Mr. Elton. -Girls."
00:22:49.201,00:22:51.203,"These are exquisitely done, Miss Woodhouse."
00:22:51.286,00:22:52.913,You have a charming talent.
00:22:53.997,00:22:57.876,"I dare say there is merit in them, in the least finished perhaps the most."
00:22:57.959,00:23:01.671,"So Mr. Knightley tells me, and he finds fault in everything I do."
00:23:04.424,00:23:06.343,"Did you ever have your likeness taken, Harriet?"
00:23:06.426,00:23:08.428,Oh... no.
00:23:09.137,00:23:12.766,What an exquisite possession a good picture of her would be.
00:23:13.266,00:23:14.518,It would indeed.
00:23:15.477,00:23:16.728,It would indeed.
00:23:17.312,00:23:18.855,"Let me entreat you, Miss Woodhouse."
00:23:47.926,00:23:50.804,You have given Miss Smith...
00:23:52.055,00:23:53.682,all that she requires.
00:23:54.808,00:24:02.315,"She was a beautiful creature when she came to you, but the attractions you have added are infinitely superior to what she received from..."
00:24:03.650,00:24:04.651,nature.
00:24:04.734,00:24:06.778,"It's depressing for me to have to take care of it, you know?"
00:24:06.862,00:24:07.821,"-No. Well, quite. -Take over."
00:24:07.904,00:24:11.074,"Mr. Woodhouse, your daughter's gifts are without compare."
00:24:12.242,00:24:13.618,Bear witness.
00:24:16.997,00:24:19.082,"Mm. You've made her too tall, Emma."
00:24:20.208,00:24:21.918,"Uh, no."
00:24:22.502,00:24:24.087,"No, certainly not too tall."
00:24:24.963,00:24:26.381,Not in the least too tall.
00:24:30.552,00:24:32.345,"When it is finished, you must have it framed."
00:24:33.972,00:24:34.931,Allow me.
00:24:36.057,00:24:42.022,"Trust me with this commission, Miss Woodhouse, and I will ride to London the moment I am asked."
00:24:42.898,00:24:44.441,It would be my great honor.
00:24:47.110,00:24:49.029,I cannot have a moment's doubt.
00:24:50.113,00:24:51.907,It is exactly as I planned.
00:24:53.867,00:24:55.702,He's in love with you.
00:25:00.040,00:25:03.752,"I do not know what your opinion may be, Mrs. Weston, of this great..."
00:25:04.794,00:25:08.840,"intimacy between Emma and Harriet Smith, but I think it a bad thing."
00:25:08.924,00:25:10.842,How differently we feel.
00:25:10.926,00:25:15.972,Miss Smith knows nothing about herself and looks upon Emma as knowing everything.
00:25:17.265,00:25:19.643,Her ignorance is hourly flattery.
00:25:19.726,00:25:23.772,But educating Harriet will be an inducement for Emma to educate herself.
00:25:23.855,00:25:24.981,They will read together.
00:25:25.065,00:25:28.360,Emma has been meaning to read more ever since she was 12 years old.
00:25:28.443,00:25:32.447,She never would submit to anything requiring industry and patience.
00:25:32.530,00:25:35.200,"I cannot allow you to be a judge in this matter, Mr. Knightley."
00:25:35.283,00:25:39.246,"You are so used to live alone, you do not know the value of a companion."
00:25:40.830,00:25:45.168,"Well, she always declares that she will never marry, which, of course, means just nothing at all."
00:25:46.419,00:25:50.715,I should like to see Emma in love and in some doubt of a return.
00:25:51.758,00:25:52.968,It would do her good.
00:26:06.231,00:26:08.525,"The day is wasting, Mr. Martin. Come along."
00:26:20.495,00:26:21.997,"I'm really most obliged to you, sir."
00:26:22.080,00:26:23.623,I'd expected to wait until the spring.
00:26:25.834,00:26:28.795,"Always buy out of season, Mr. Martin, whenever you can."
00:26:31.840,00:26:37.804,"Mr. Knightley, sir, forgive my liberty, but may I be so bold as to seek your advice?"
00:26:39.639,00:26:40.557,Of course.
00:26:43.768,00:26:44.811,Miss Woodhouse!
00:26:45.937,00:26:47.439,You will never guess what has happened.
00:26:47.522,00:26:49.607,Robert Martin has offered me his hand.
00:26:51.401,00:26:53.820,He writes as if he really loves me very much.
00:27:02.245,00:27:03.413,Is it a good letter?
00:27:04.706,00:27:05.957,Or too short?
00:27:07.292,00:27:08.501,It is a very good letter.
00:27:08.585,00:27:10.795,So good I think one of his sisters must have helped him.
00:27:11.880,00:27:13.256,But what shall I say?
00:27:13.840,00:27:16.259,"Dear Miss Woodhouse, do advise me."
00:27:16.843,00:27:18.053,"Oh, no, no, no."
00:27:18.136,00:27:19.596,The words must be your own.
00:27:36.279,00:27:38.239,You think I ought to refuse him.
00:27:40.116,00:27:48.166,"I lay it down as a general rule, Harriet, that if a woman doubts whether she should accept a man or not, she certainly ought to refuse him."
00:27:51.836,00:27:55.340,Perhaps... it is safer.
00:27:57.217,00:27:58.718,Do you think I had better say no?
00:27:58.802,00:28:01.096,Not for the world would I advise you either way.
00:28:01.971,00:28:04.557,You must be the best judge of your own happiness.
00:28:16.653,00:28:17.987,I have now...
00:28:19.864,00:28:21.491,quite determined...
00:28:23.535,00:28:26.329,and really almost made up my mind...
00:28:29.249,00:28:30.375,to...
00:28:32.001,00:28:34.337,refuse Mr. Martin.
00:28:41.010,00:28:43.763,Then she is a greater simpleton than I ever believed her.
00:28:43.847,00:28:48.059,Harriet Smith refuse Robert Martin? I...
00:28:51.187,00:28:52.105,I saw her answer.
00:28:52.188,00:28:53.398,Nothing could be clearer.
00:28:53.481,00:28:54.607,You saw her answer?
00:28:54.691,00:28:56.943,You wrote her answer. This is your doing.
00:28:57.026,00:28:59.237,"Emma, you persuaded her to refuse him."
00:28:59.320,00:29:02.449,"Well, if I did, I should not feel that I had done wrong."
00:29:02.532,00:29:06.453,"Mr. Martin's a respectable young man, but I cannot admit him to be Harriet's equal."
00:29:06.536,00:29:09.914,"No, indeed, he is her superior in both sense and situation."
00:29:09.998,00:29:13.042,"Emma, your infatuation about that girl blinds you."
00:29:13.126,00:29:19.132,"What are Harriet Smith's claims, either of birth, nature or education, to any connection higher than Robert Martin?"
00:29:19.215,00:29:20.967,She is the natural daughter of nobody knows whom.
00:29:21.050,00:29:23.052,"-There can scarcely be a doubt -Probably no settled provision at all, that her father is a gentleman, and a gentleman of fortune!"
00:29:23.136,00:29:24.220,and certainly no respectable relations!
00:29:24.304,00:29:25.221,Her allowance is very liberal.
00:29:25.305,00:29:27.557,Nothing has been grudged for her improvement.
00:29:27.640,00:29:30.393,She is known only as a parlor boarder at a common school.
00:29:30.477,00:29:32.979,"She is pretty, and she is good-tempered, and that is all."
00:29:33.062,00:29:34.397,That is all?
00:29:34.481,00:29:37.442,"These are not trivial recommendations, Mr. Knightley."
00:29:37.525,00:29:46.201,"Till men do fall in love with well-informed minds instead of handsome faces, a girl with such loveliness as Harriet has a certainty of being admired and sought after wherever she goes."
00:29:46.701,00:29:51.706,"I am very much mistaken if your sex, in general, would not find these qualities the highest claims a woman could possess."
00:29:51.790,00:29:58.338,"Upon my word, Emma, to hear you abusing the reason you have is almost enough to make me think so, too."
00:29:58.421,00:30:02.050,Better to be without sense altogether than to misapply it as you do.
00:30:08.598,00:30:11.601,Men of sense do not want silly wives.
00:30:11.684,00:30:19.275,And more prudent men would be afraid of the inconvenience and disgrace that they might be involved in when the mystery of her parentage came to be revealed.
00:30:20.360,00:30:25.031,"Let her marry Robert Martin, and she is safe and respectable forever."
00:30:25.114,00:30:29.702,"But if you teach her to expect to marry greatly, nobody within her reach will ever be good enough for her."
00:30:29.786,00:30:33.373,Your plans for Harriet are best known only to yourself.
00:30:34.165,00:30:39.921,"But as you make no secret of your love of matchmaking, it is fair to suppose the plans you have."
00:30:40.004,00:30:41.464,And as a friend...
00:30:42.799,00:30:48.388,"-Oh! -I shall just hint to you that if Elton is the man that I think, it will be your labor in vain."
00:30:48.471,00:31:00.316,"He knows that he is a very handsome young man and, and a great favorite wherever he goes, but from his general way of talking when there are only men present, I'm convinced that he does not mean to throw himself away."
00:31:00.400,00:31:06.322,"I'm very much obliged to you for opening my eyes, Mr. Knightley, but know that I am done with matchmaking for the present."
00:31:08.533,00:31:10.451,I only want to keep Harriet for myself.
00:31:57.582,00:31:58.875,It's so beautiful!
00:31:59.500,00:32:02.003,You certainly spared no expense.
00:32:17.185,00:32:21.356,and your responsibility to teach the baby to drink milk without spilling it all over my favorite trousers.
00:32:24.233,00:32:26.319,"Emma, they're here."
00:32:32.909,00:32:34.661,"Husband, comport yourself."
00:32:35.703,00:32:38.039,-Papa. -Isabella.
00:32:38.706,00:32:39.958,Emma.
00:32:42.502,00:32:44.837,"-instead of coming here. -But why should you be sorry, sir?"
00:32:44.921,00:32:46.089,It did us a great deal of good.
00:32:46.172,00:32:48.508,"On the contrary, Mr. John Knightley looks far from well."
00:32:48.591,00:32:51.052,"Southend was strenuously recommended by our physician, sir."
00:32:51.135,00:32:52.720,Sea air and sea bathing.
00:32:52.804,00:32:54.430,The sea is rarely of use to anybody.
00:32:54.514,00:32:55.515,It nearly killed me once.
00:32:55.598,00:32:56.516,Come.
00:32:57.141,00:32:59.060,I must beg you not to speak of the sea.
00:32:59.560,00:33:00.853,Makes me miserable.
00:33:00.937,00:33:03.106,And envious. I who have never seen it.
00:33:03.189,00:33:06.109,Mr. Wingfield specified that Southend was the best place to go for the family.
00:33:12.073,00:33:14.033,-but Southend? -Let us be friends.
00:33:22.959,00:33:23.835,Aw.
00:33:26.170,00:33:32.593,"Tell your aunt, little Emma, that she was very wrong and she ought to set you a better example."
00:33:36.889,00:33:38.641,-What is the matter? Is there fever? -Uh...
00:33:39.642,00:33:41.769,Where is the nurse? Give her to me.
00:33:41.853,00:33:43.062,-Is she feverish? -I do not know.
00:33:44.856,00:33:47.108,-Send for Perry. -Do not send for Perry.
00:33:47.191,00:33:48.568,Send for Perry!
00:33:50.987,00:33:53.072,As death follows life...
00:34:06.335,00:34:07.336,Hmm.
00:34:10.715,00:34:11.799,Yes.
