start,end,script
00:06:29.931,00:06:33.143,I DON'T FEEL AS THOUGH I'M STANDING BESIDE YOU.
00:06:38.065,00:06:41.276,"OTHER PEOPLE KNOW, CLAIRE."
00:06:46.405,00:06:48.533,- AND THAT'S SOMETHING YOU DO NOT RECOVER FROM. - WHO?
00:06:48.616,00:06:50.451,- THAT'S SOMETHING THAT FOLLOWS YOU FOR LIFE. - WHO KNOWS?
00:06:51.995,00:06:53.330,ZOE.
00:06:55.290,00:06:58.417,I THOUGHT YOU SAID SHE COULD BE TRUSTED.
00:07:02.130,00:07:04.465,SHE WOULDN'T HAVE BEEN A PROBLEM IF YOU HADN'T LIED.
00:07:04.549,00:07:06.676,"NO, SHE WOULDN'T HAVE BEEN A PROBLEM IF YOU HADN'T DROPPED YOUR PANTS."
00:07:06.760,00:07:11.932,"AND YOU COME IN HERE, TO MY OFFICE, AND BERATE ME WHEN YOU'RE THE ONE WHO'S EXPOSED US?"
00:07:12.015,00:07:13.600,DON'T YOU TRY TO TURN THIS AROUND ON ME.
00:07:16.519,00:07:18.397,I HAVE TURNED DOWN DONATIONS FOR US.
00:07:18.521,00:07:20.107,I DRAFTED PETER'S BILL FOR US.
00:07:20.190,00:07:23.526,I DIVERTED TIME AND ENERGY AWAY FROM MY GOALS FOR US.
00:07:23.610,00:07:27.530,"OKAY, I DON'T WANNA HAVE TO SAY THIS, BUT MAYBE YOU NEED TO HEAR IT."
00:07:27.614,00:07:36.790,"C.W.I. IS IMPORTANT, YES, BUT IT DOESN'T COME CLOSE TO WHAT WE ARE TRYING TO ACCOMPLISH."
00:07:36.873,00:07:38.499,YOU MUST SEE THAT!
00:07:41.586,00:07:45.173,I'M JUST BEING HONEST.
00:07:45.257,00:07:48.843,THEN BE HONEST ABOUT HOW YOU'VE BEEN USING ME JUST LIKE YOU USE EVERYBODY ELSE.
00:07:48.927,00:07:51.305,THAT WAS NEVER PART OF THE BARGAIN.
00:07:59.187,00:08:01.022,IS IT THE HOT FLASHES?
00:08:11.450,00:08:13.285,GET OUT.
00:08:20.125,00:08:22.127,I'LL SEE YOU BACK AT THE HOUSE.
00:08:32.679,00:08:34.639,I'M ON MY WAY TO THE OFFICE.
00:08:34.722,00:08:37.267,"- LET ME CALL YOU WHEN I GET THERE. - NO, NO. WE NEED TO TALK NOW."
00:08:37.351,00:08:39.478,"I KNOW YOU'RE UPSET, PETER, BUT THAT'S NOT GOING TO ACHIEVE ANYTHING."
00:08:39.560,00:08:41.562,"I AM MORE THAN UPSET, FRANK."
00:08:41.646,00:08:44.774,CHANGE YOUR TONE. I'M IN NO MOOD.
00:08:47.027,00:08:50.822,"YOU HANG UP ON ME NOW, YOU'RE NOT GONNA APPRECIATE WHO I CALL NEXT."
00:08:50.905,00:08:53.616,- EXCUSE ME? - I PROMISED MY PEOPLE JOBS.
00:08:53.700,00:08:56.453,YOU PROMISED ME YOU COULD GET THIS BILL PASSED.
00:08:56.536,00:08:59.122,YOU FAILED ON YOUR PROMISE. I'M NOT GONNA FAIL ON MINE.
00:08:59.206,00:09:02.250,"SO HOWEVER YOU NEED TO FIX IT, YOU FIGURE IT OUT."
00:09:12.969,00:09:15.596,"YOU DON'T UNDERSTAND. I'M NOT AFRAID OF YOU ANYMORE, FRANK."
00:09:15.680,00:09:18.350,- THEN YOU'RE MISGUIDED. - MY PAST IS OUT IN THE OPEN.
00:09:18.433,00:09:20.268,YOU DON'T HOLD THAT OVER MY HEAD ANYMORE.
00:09:20.352,00:09:21.895,"THEY DON'T KNOW EVERYTHING, PETER."
00:09:21.978,00:09:25.148,"YOU DESTROY ME, YOU DESTROY YOURSELF."
00:09:29.819,00:09:33.031,- WHAT DO YOU WANT ME TO DO? - WE HAVE TO ACCELERATE THINGS.
00:09:33.114,00:09:36.659,ISN'T IT TOO EARLY? IT'S ALMOST TWO FULL MONTHS INTO THE ELECTION.
00:09:36.743,00:09:39.329,- THAT GIVES THE WHITE HOUSE TOO MUCH TIME TO VET SOMEBODY. - PETER'S CROSSED THE LINE.
00:09:39.413,00:09:41.706,"WE BUILT UP HIS CONFIDENCE, AND NOW WE'RE LOSING CONTROL OF HIM."
00:09:41.789,00:09:43.500,MAYBE HE WAS JUST BLOWING OFF STEAM.
00:09:43.583,00:09:45.752,NO. HE'S DETERMINED. WE HAVE TO ACT NOW.
00:09:45.835,00:09:47.504,YOU HAVE EVERYTHING YOU NEED ON YOUR END?
00:09:49.172,00:09:50.673,SOME SORT OF SOCIAL SETTING'S PREFERABLE.
00:09:50.757,00:09:52.884,- ANYTHING ELSE? - I'LL NEED CASH.
00:09:52.967,00:09:54.553,ABOUT THREE GRAND.
00:09:54.635,00:09:56.596,IT'LL BE IN YOUR TOP DRAWER BY TOMORROW MORNING.
00:09:56.679,00:09:58.348,SIR...
00:09:59.891,00:10:02.018,"ONCE WE DO THIS, WE'RE COMMITTED."
00:10:02.102,00:10:04.812,- UNDERSTOOD. - I CAN'T PREDICT HOW HE'S GONNA REACT.
00:10:04.896,00:10:06.565,"WELL, I WON'T BE BLACKMAILED."
00:10:18.701,00:10:20.620,HELLO?
00:10:25.833,00:10:28.002,YEAH. WHO IS IT?
00:10:28.086,00:10:30.464,CLAIRE UNDERWOOD.
00:10:34.301,00:10:36.136,ZOE?
00:10:41.516,00:10:43.602,I APOLOGIZE FOR NOT BUZZING.
00:10:43.684,00:11:03.163,"SOMEBODY WAS COMING IN THE BUILDING WHEN I WAS DOWNSTAIRS, THIS IS NICE-- FIRE ESCAPE."
00:11:08.835,00:11:10.753,"HEY, COULD YOU PLEASE NOT GO THROUGH MY THINGS?"
00:11:10.837,00:11:12.380,"OH, I'M SORRY. AM I INTRUDING?"
00:11:14.882,00:11:18.803,"WELL, THAT MAKES IT A TWO-WAY STREET, I SUPPOSE."
00:11:21.598,00:11:25.352,"OKAY, IF YOU-- IF YOU CAME HERE TO PUNISH ME..."
00:11:25.435,00:11:27.145,FINE. I GET IT.
00:11:32.484,00:11:37.238,"SUCH A SHAME, HOW NAIVE YOU ARE."
00:11:39.115,00:11:41.784,- I'M NOT NAIVE. - NO?
00:11:43.702,00:11:46.164,"I'VE KNOWN EVERYTHING FROM THE BEGINNING, ZOE."
00:11:46.247,00:11:48.667,MY HUSBAND AND I TELL EACH OTHER EVERYTHING.
00:11:56.299,00:11:58.968,DON'T YOU BELIEVE ME?
00:12:02.972,00:12:05.475,IS THERE A SPIDER I CAN TRAP?
00:12:09.812,00:12:13.525,"I'M NOT HERE TO PUNISH YOU, OR TO TELL YOU TO STOP."
00:12:13.608,00:12:17.278,I JUST THOUGHT I SHOULD OPEN THOSE BIG BRIGHT EYES.
00:12:26.538,00:12:28.623,I THINK I SHOULD TOO.
00:12:35.589,00:12:37.507,MAYBE YOU'RE NOT THAT NAIVE.
00:12:37.591,00:12:40.093,A LESSER WOMAN WOULDN'T HAVE OPENED THE DOOR.
00:13:13.460,00:13:15.587,"UNION STATION, PLEASE."
00:13:28.767,00:13:34.731,"THIS IS CLAIRE. I'M UNAVAILABLE TO ANSWER THE PHONE, BUT IF YOU LEAVE A MESSAGE, I'LL BE SURE AND GET BACK TO YOU SHORTLY."
00:13:54.125,00:13:56.503,YOU DON'T HAVE TO TIPTOE.
00:13:56.586,00:13:58.505,I THOUGHT YOU FELL ASLEEP.
00:13:58.588,00:14:01.800,NO. JUST THINKING ABOUT WORK.
00:14:01.882,00:14:04.678,I DON'T HAVE ANYTHING FOR YOU YET. I WILL SOON.
00:14:04.761,00:14:06.638,I KNOW YOU WILL.
00:14:10.475,00:14:12.686,YOU CAN SPEND THE NIGHT IF YOU WANT.
00:14:12.769,00:14:14.688,EARLY MEETINGS.
00:14:14.771,00:14:16.981,WOULDN'T HAVE TIME TO GET HOME AND CHANGE.
00:14:17.064,00:14:19.942,- YOU SEEM DISTRACTED. - I HAVE A LOT ON MY MIND.
00:14:21.986,00:14:25.156,"- WORK, JUST LIKE YOU. - NO CLAIRE?"
00:14:27.367,00:14:29.243,OR MAYBE SHE QUALIFIES AS WORK.
00:14:31.078,00:14:33.206,SHE DIDN'T MENTION ANYTHING?
00:14:36.417,00:14:38.169,ABOUT...
00:14:38.252,00:14:40.505,I THOUGHT YOU DIDN'T KEEP THINGS FROM EACH OTHER.
00:14:40.588,00:14:43.257,"LOOK, JUST SAY WHAT YOU WANT TO SAY."
00:14:44.551,00:14:47.011,SHE CAME BY HERE A FEW HOURS AGO.
00:14:47.094,00:14:49.597,WE HAD A NICE LITTLE TALK.
00:14:53.934,00:14:56.062,"YOU SHOULD GO HOME, GET SOME REST."
00:15:07.114,00:15:08.949,HEY!
00:15:16.957,00:15:27.218,THIS IS CLAIRE. I'M UNAVAILABLE TO ANSWER-- THE LIGHTS IN THE WHARTONS' HOUSE WILL GO ON IN A FEW MOMENTS.
00:15:27.301,00:15:38.020,"THEY ALWAYS GET UP PRECISELY AT QUARTER TO 7:00, WHICH IS JUST THE TIME THAT CLAIRE WOULD BE GOING FOR HER RUN, IF SHE WERE HERE."
00:15:41.982,00:15:48.364,"REBELLION ON ALL FRONTS-- CLAIRE, ZOE, RUSSO."
00:15:48.448,00:15:50.909,I MUST NOT LOSE MY RESOLVE.
00:15:50.991,00:15:55.246,"I WILL MARCH FORWARD, EVEN IF I HAVE TO DO SO..."
00:15:55.329,00:15:57.665,ALONE.
00:15:57.749,00:16:00.251,SEE? TOLD YA.
00:16:00.334,00:16:03.588,- GOOD MORNING. - OHH!
00:16:03.671,00:16:05.590,"HI, FRANK."
00:16:05.673,00:16:07.592,- HOW ARE YOU? - I'M GOOD.
00:16:11.095,00:16:14.223,- HOW'S SHE FEELING? - A LOT BETTER.
00:16:14.307,00:16:16.684,GOOD. SHE SAID SHE'D BE GONE FOR THE REST OF THE WEEK.
00:16:16.768,00:16:18.686,- IS IT THE FLU OR SOMETHING? - SOMETHING LIKE THAT.
00:16:18.770,00:16:21.355,I JUST CAME OVER TO PICK UP A FEW THINGS FROM HER OFFICE.
00:16:21.439,00:16:23.858,"- I COULD'VE SENT SOMEBODY OVER. - OH, NO. IT'S NO BIG DEAL."
00:16:23.942,00:16:26.152,"IN FACT, I ALSO CAME HERE TO ASK YOU A FAVOR."
00:16:26.235,00:16:28.905,"YOU WENT TO STANFORD, CORRECT?"
00:16:28.988,00:16:31.198,- VALEDICTORIAN? - YEAH.
00:16:31.282,00:16:34.535,- DO YOU KNOW THE PROVOST? - WARREN TYNSDALE.
00:16:34.619,00:16:37.413,HE FLIES ME OUT TO DO FUNDRAISING EVENTS.
00:16:37.497,00:16:39.999,SUPPOSEDLY I'M THE POSTER CHILD FOR ALUMNI.
00:16:40.082,00:16:41.835,MAKING THE WORLD A BETTER PLACE.
00:16:44.337,00:16:48.466,"LINDA VASQUEZ, THE PRESIDENT'S CHIEF OF STAFF-- HER SON, RUBEN, APPLIED."
00:16:48.549,00:16:53.387,I'D LOVE FOR YOU TO GET ON THE PHONE WITH TYNSDALE AND TELL HIM THAT THEY SHOULD ACCEPT HIM.
00:16:53.471,00:16:56.557,I DON'T KNOW. I-- I'VE NEVER RECOMMENDED ANYONE.
00:16:56.641,00:16:58.935,ALL THE BETTER. IT'LL CARRY MORE WEIGHT.
00:16:59.018,00:17:02.021,CAN I MEET RUBEN FIRST?
00:17:05.191,00:17:10.154,"IN FACT, IT WOULD BE BETTER IF BOTH SHE AND RUBEN BELIEVED HE GOT IN ON MERIT ALONE."
00:17:10.237,00:17:13.324,WILL YOU PLEASE DO THIS FAVOR FOR CLAIRE AND ME?
00:17:17.871,00:17:20.206,THANK YOU.
00:17:23.584,00:17:25.753,MORE CONTRAST.
00:17:25.837,00:17:29.048,WE NEED TO CATCH THE EDGE OF HIS FACE.
00:17:29.131,00:17:31.968,LET'S RE-CROP IT. BRING IT IN A QUARTER OF AN INCH ON THE LEFT.
00:17:33.594,00:17:35.054,WOULD YOU...
00:17:46.190,00:17:48.026,SOMEBODY NAMED CLAIRE?
00:17:56.617,00:17:59.037,REMY.
00:17:59.119,00:18:01.581,YOU HUNGRY?
00:18:01.664,00:18:03.583,I DON'T EAT PORK.
00:18:03.666,00:18:05.752,WHEN DID THAT HAPPEN?
00:18:05.835,00:18:08.379,WHEN WE STARTED LOBBYING FOR THE MEATPACKING INDUSTRY.
00:18:13.801,00:18:15.428,I'M GOOD. I ALREADY ATE LUNCH.
00:18:15.511,00:18:17.430,HALF A RACK COMING UP.
00:18:17.513,00:18:19.306,I DON'T USUALLY DO BUSINESS HERE.
00:18:19.390,00:18:20.975,THIS IS MY LITTLE SECRET.
00:18:21.059,00:18:23.394,I'D LOVE IT IF WE COULD KEEP IT THAT WAY.
00:18:23.477,00:18:26.439,I DON'T THINK YOU HAVE TO WORRY ABOUT ME BRINGING CLIENTS BY.
00:18:29.692,00:18:31.861,"YOU SEEM TENSE, REMY."
00:18:31.945,00:18:34.280,I ASSUME YOU'RE UPSET ABOUT THE WATERSHED BILL.
00:18:34.363,00:18:36.282,NOT WITH YOU. YOU WERE JUST DOING YOUR JOB.
00:18:36.365,00:18:38.492,BUT NOW I HAVE TO DO MINE.
00:18:38.576,00:18:41.161,I'D LIKE TO PROPOSE A PARTNERSHIP.
00:18:41.245,00:18:44.123,"I'M ALWAYS OPEN TO PARTNERSHIPS, FRANK."
00:18:44.206,00:18:50.463,"IF PETER RUSSO WERE A PRO-NATURAL GAS CANDIDATE, HOW VALUABLE WOULD THAT BE TO SANCORP?"
00:18:50.546,00:18:52.465,THE WATERSHED BILL WAS ANTI-DRILLING.
00:18:52.548,00:18:54.717,"PETER'S PRO-EMPLOYMENT, NOT ANTI-DRILLING."
00:18:54.801,00:18:59.680,"HE JUST WANTS TO BRING EMPLOYMENT TO HIS PEOPLE, AND SANCORP IS BUILDING REFINERIES."
00:18:59.764,00:19:01.724,MOSTLY ON SITE.
00:19:01.808,00:19:06.186,DO YOU THINK THEY WOULD BE OPEN TO CONSIDERING PHILADELPHIA?
00:19:08.439,00:19:11.484,"I CAN TALK WITH THEM, BUT I CAN'T MAKE ANY PROMISES."
00:19:11.567,00:19:13.820,"OH, I DON'T WANT ANY PROMISES. JUST ENGAGE WITH RUSSO."
00:19:13.903,00:19:16.030,"YOU KNOW, GIVE HIM A GLIMMER OF GOOD FORTUNE."
00:19:16.114,00:19:19.450,"AW, FRANK, HERE YOU GO."
00:19:20.618,00:19:22.620,COME ON. SMELL THAT.
00:19:22.703,00:19:26.124,YOU SURE YOU DON'T WANT TO RECONSIDER YOUR STANCE ON PORK?
00:19:47.854,00:19:50.148,YOU CAN AFFORD THAT?
00:19:55.194,00:19:57.571,SO IS THE SECURITY DEPOSIT.
00:19:57.655,00:20:00.282,THAT'S TO BUY SOME FURNITURE.
00:20:07.456,00:20:09.375,I'LL PAY YOU BACK. I PROMISE.
00:20:09.458,00:20:11.794,IT'S NOT NECESSARY.
00:20:16.757,00:20:19.385,BUT I DO NEED YOU TO DO ONE THING FOR ME.
00:20:24.140,00:20:25.975,DO YOU REALLY CARE HOW YOU DELIVER THEM?
00:20:26.059,00:20:30.521,"FIRST, I ADVOCATE FOR MORE REGULATION FOR THE WATERSHED, THEN I COZY UP TO THE DRILLING INTERESTS?"
00:20:30.604,00:20:32.523,"YEAH, BUT NATURAL GAS IS THE FUTURE, PETER."
00:20:32.606,00:20:37.111,"THIS IS AN INDUSTRY THAT COULD BRING 100,000 JOBS INTO YOUR STATE OVER THE NEXT DECADE."
00:20:37.195,00:20:40.280,I AGREE WITH PETER. IT SEEMS LIKE FLIP-FLOPPING.
00:20:40.364,00:20:44.326,SANCORP'S LOBBYING EFFORTS IS WHY WE LOST THE WATERSHED BILL.
00:20:44.410,00:20:48.372,BUT THEY CAN ALSO BE A VERY POWERFUL ALLY.
00:20:50.875,00:20:52.793,THIS MAKES YOU LOOK LIKE BUSINESS AS USUAL.
00:20:52.877,00:20:54.378,THIS IS POLITICS.
00:20:54.461,00:20:57.798,THERE ARE SEIZED OPPORTUNITIES AND MISSED OPPORTUNITIES.
00:20:57.882,00:21:00.342,"SEIZE THIS ONE, PETER."
00:21:02.261,00:21:05.932,SANCORP CAN COMMIT TO BUILDING NEW REFINERIES IN PHILLY?
00:21:06.015,00:21:08.809,SANCORP WILL COMMIT TO DISCUSSING IT WITH YOU.
00:21:08.893,00:21:11.270,"- I NEED MORE THAN THAT. - LOOK, YOU ASKED ME TO FIX A PROBLEM."
00:21:11.353,00:21:14.232,I'VE COME TO YOU IN LESS THAN 24 HOURS WITH A SOLUTION.
00:21:14.314,00:21:16.650,CAN YOU MEET ME HALFWAY?
00:21:17.860,00:21:19.862,WHAT WOULD BE THE FIRST STEP?
00:21:19.946,00:21:22.531,ALL RIGHT. YOU REMEMBER REMY DANTON?
00:21:22.615,00:21:25.701,"- OH, COME ON. HE LED THE CHARGE AGAINST THE WATERSHED BILL. - I KNOW. THAT'S NOT THE POINT."
00:21:25.785,00:21:29.789,ONE OF HIS OTHER BIG CLIENTS IS THE McNEALLY CANCER INSTITUTE.
00:21:33.126,00:21:34.668,REMY WILL BE THERE.
00:21:34.752,00:21:37.964,"WE HAVE EVENTS IN HAVERFORD AND GLADWYNE-- YEAH, WELL, THIS IS MORE IMPORTANT."
00:21:38.047,00:21:41.341,YOU ALSO HAVE A RADIO INTERVIEW TOMORROW MORNING WITH A LOCAL PITTSBURGH STATION?
00:21:41.425,00:21:43.385,- YES. - ALL RIGHT.
00:21:43.469,00:21:45.721,MEET WITH REMY TONIGHT.
00:21:45.805,00:21:51.978,"AND IF IT GOES WELL AND IF YOU'RE COMFORTABLE, TOMORROW MORNING ON THE RADIO, YOU SUPPORT THEIR DRILLING EFFORTS."
00:21:52.061,00:21:57.399,"AND REMY HAS ASSURED ME IF YOU DO THAT, HE CAN PUSH SANCORP IN THE RIGHT DIRECTION."
00:22:02.029,00:22:03.948,CANCEL THE EVENTS TOMORROW.
00:22:04.031,00:22:05.950,"HEAD BACK TO PHILLY, DO SOME DAMAGE CONTROL."
00:22:06.033,00:22:09.703,- I'LL SEE YOU TOMORROW AFTERNOON. - PETER-- PLEASE.
00:22:11.497,00:22:13.040,OKAY.
00:22:13.124,00:22:15.084,I'M GONNA GO MAKE SOME CALLS.
00:22:23.176,00:22:27.263,"PETER, HAVE YOU MENTIONED ANYTHING TO HER ABOUT KAPENIAK OR..."
00:22:30.808,00:22:33.019,NO. I HAVEN'T MENTIONED IT TO ANYBODY.
00:22:36.189,00:22:41.319,ALL RIGHT. STAMPER WILL COME BY IN THE MORNING AND BRIEF YOU ON THE TALKING POINTS.
00:22:52.038,00:22:54.623,THE SUN HAD JUST COME UP.
00:22:55.457,00:22:58.627,YOU WERE ASLEEP... RIGHT HERE.
00:23:00.420,00:23:02.256,THE LIGHT WAS PERFECT.
00:23:03.423,00:23:05.718,I HAD NO CHOICE.
00:23:05.801,00:23:10.223,I ALWAYS SLEPT SO WELL IN THIS APARTMENT.
00:23:13.433,00:23:14.977,I DON'T KNOW.
00:23:15.061,00:23:16.937,I HAVEN'T DECIDED.
00:23:18.105,00:23:20.024,YOU HAVE NO LUGGAGE.
00:23:23.443,00:23:25.487,IT SMELLS THE SAME.
00:23:31.451,00:23:33.495,FEELS THE SAME.
00:24:19.333,00:24:21.835,NOT HAVING A SIGNIFICANT PRESENCE IN PHILADELPHIA.
00:24:21.919,00:24:24.630,THERE ARE ADVANTAGES TO CENTRALIZING IN A MAJOR URBAN CENTER.
00:24:32.346,00:24:34.807,- SIGNIFICANTLY. - HOW CAN I HELP WITH THAT?
00:24:34.890,00:24:38.185,STATEWIDE PERMITTED-USE ZONING. NO MORE CONDITIONAL ZONING.
00:24:38.269,00:24:40.229,THE MUNICIPALITIES ARE SLOWING DOWN DEVELOPMENT.
00:24:40.313,00:24:42.022,THAT'S THE STATE LEGISLATURE.
00:24:42.106,00:24:45.859,"YOU COME OUT IN SUPPORT OF PERMITTED USE, AND YOU GET ELECTED GOVERNOR."
00:24:45.943,00:24:48.195,THAT'LL PUT PRESSURE ON THE LEGISLATURE.
00:24:48.279,00:24:50.906,SANCORP IS VERY INTERESTED IN HAVING A POWERFUL FRIEND IN HARRISBURG.
00:24:50.990,00:24:52.699,MY OPPONENT'S PRO-DRILLING.
00:24:52.783,00:24:55.202,YOUR OPPONENT ISN'T ASKING FOR REFINERIES IN PHILADELPHIA.
00:24:56.954,00:24:58.998,WE PREFER FRIENDS WE CAN COUNT ON.
00:25:06.005,00:25:09.383,HAVE YOUR CLIENTS LISTEN TO WZPZ TOMORROW AT A QUARTER TO 8:00.
00:25:09.467,00:25:11.302,IT'S A PITTSBURGH STATION.
00:25:13.095,00:25:16.098,"IT'S BEEN A PLEASURE, CONGRESSMAN."
00:25:16.182,00:25:18.976,I LOOK FORWARD TO TALKING AGAIN SOON.
00:25:37.744,00:25:40.164,YOU GOT A LIGHT?
00:25:40.247,00:25:42.624,THIS IS A CANCER RESEARCH EVENT.
00:25:42.708,00:25:44.626,I KNOW. I HELPED ORGANIZE IT.
00:25:44.710,00:25:46.920,- YOU WORK FOR THE INSTITUTE? - NO. THE HOTEL.
00:25:51.300,00:25:53.969,NO. THE MANAGER WOULD KILL ME.
00:25:54.053,00:25:56.138,"WELL, AT LEAST I GOT YOU TALKING."
00:25:58.849,00:26:01.519,ARE YOU HAVING A GOOD NIGHT? YOU LOOK HAPPY.
00:26:01.601,00:26:04.146,"UH, I AM. I AM. I'M HAVING A GREAT NIGHT."
00:26:04.230,00:26:06.982,- WHY? - I JUST GOT SOME VERY GOOD NEWS.
00:26:07.066,00:26:09.485,WE SHOULD CELEBRATE. WHAT ARE YOU DRINKING?
00:26:09.567,00:26:11.153,"YOU KNOW, I WAS JUST LEAVING, ACTUALLY."
00:26:11.237,00:26:13.322,YOU HAVEN'T EVEN ASKED MY NAME YET.
00:26:13.406,00:26:15.573,"- I APOLOGIZE, BUT I HAVE TO GO. - IT'S RACHEL."
00:26:15.657,00:26:18.285,"I'M NOT TRYING TO BE RUDE, BUT I GOT A BIG MEETING TOMORROW."
00:26:18.369,00:26:22.540,THEN DON'T BE RUDE. JUST STAY A FEW MORE MINUTES AND KEEP ME FROM HAVING TO MINGLE.
00:26:22.622,00:26:26.752,"MY DATE DITCHED ME. SO IF YOU ABANDON ME NOW, THAT WOULD BE VERY RUDE."
00:26:28.045,00:26:30.464,THESE HEELS ARE KILLING ME.
00:26:32.925,00:26:36.594,"- FEEL THAT. FEEL THAT BLISTER. - HEY, I..."
00:26:36.678,00:26:38.805,I HAVE A GIRLFRIEND.
00:26:38.889,00:26:40.849,I'D BE SURPRISED IF YOU DIDN'T.
00:26:44.686,00:26:47.814,- WHY'D YOUR DATE DITCH YOU? - MMM. VERY SCANDALOUS.
00:26:47.898,00:26:49.733,"MMM, WHAT HAPPENED?"
00:26:52.236,00:26:54.488,CLINK GLASSES WITH ME.
00:27:02.580,00:27:04.498,WOW.
00:27:07.625,00:27:09.545,"I'M PETITE, BUT I CAN HOLD MY LIQUOR."
00:27:09.627,00:27:11.547,OBVIOUSLY.
00:27:14.800,00:27:16.552,WHAT THEN?
00:27:19.388,00:27:21.223,I GET UNDRESSED.
00:27:23.559,00:27:25.643,WHAT ABOUT YOU?
00:27:25.727,00:27:28.522,WHAT ARE YOU LIKE WHEN YOU GET DRUNK?
00:27:30.441,00:27:33.277,- IT'S NOT PRETTY. - PRETTY'S OVERRATED.
00:27:33.360,00:27:35.946,I LIKE IT WHEN THINGS GET A LITTLE BIT UGLY.
00:27:37.864,00:27:42.536,"WHEN I WORK LATE NIGHTS, THEY LET ME STAY AT THE HOTEL SO I DON'T HAVE TO DRIVE HOME."
00:27:43.703,00:27:46.039,UM...
00:27:46.123,00:27:48.626,THIS ONE IS YOURS.
00:27:59.677,00:28:01.138,ROOM 1121.
00:28:22.826,00:28:24.662,IN HERE.
00:28:29.333,00:28:32.461,I NEED YOU TO LOCATE SOMEBODY.
00:28:32.545,00:28:34.921,WHO?
00:28:35.005,00:28:36.923,MY WIFE.
00:28:40.636,00:28:43.263,DO YOU HAVE A WAY OF DOING THAT?
00:28:43.347,00:28:45.516,"I DO, SIR."
00:28:45.599,00:28:50.354,I KNOW A GUY IN MISSING PERSONS-- SHE'S NOT MISSING. I JUST...
00:28:50.437,00:28:53.023,DON'T KNOW WHERE SHE IS AT THE MOMENT.
00:28:54.233,00:28:56.151,I TRUST HIM.
00:28:56.235,00:28:58.070,WE CAN DO THIS OFF THE BOOKS.
00:28:59.488,00:29:00.906,GOOD.
00:29:00.989,00:29:03.075,I'LL GET ON IT RIGHT AWAY.
00:29:15.837,00:29:19.925,NO. I'LL TELL YOU WHY. BECAUSE MY MOTHER ALWAYS USED TO TELL ME TO SMILE MORE.
00:29:20.008,00:29:23.679,"ALWAYS DROVE ME CRAZY. SHE'D SAY, CLAIRE, WHY HAVE YOU THAT SCOWL ALL THE TIME?"
00:29:23.762,00:29:26.098,YOU LOOK SO MUCH MORE BEAUTIFUL WHEN YOU SMILE.
00:29:28.350,00:29:31.311,"THERE WAS NEVER, OH, WHAT DO YOU FEEL? OR WHAT ARE YOU THINKING?"
00:29:31.395,00:29:33.439,JUST SO LONG AS I LOOKED BEAUTIFUL AND HAPPY.
00:29:33.522,00:29:36.024,THAT'S ALL SHE CARED ABOUT.
00:29:36.108,00:29:41.655,SO YOU WANT ME TO ASK YOU WHAT YOU'RE THINKING AND FEELING?
00:29:41.739,00:29:43.616,ALL THE TIME.
00:29:46.076,00:29:48.370,I ACTUALLY DO WANNA KNOW WHAT YOU'RE THINKING AND FEELING.
00:29:51.540,00:29:54.418,- WHAT? - TELL ME FIRST.
00:30:01.592,00:30:04.261,- I THINK I'D BETTER GET DRESSED. - WHAT? WHY?
00:30:04.344,00:30:07.055,"UH, BECAUSE..."
00:30:07.139,00:30:12.894,"I'VE GOT FRIENDS COMING OVER, AND AS A HOST, I SHOULD PROBABLY WEAR CLOTHES."
00:30:12.978,00:30:14.313,- REALLY? - YEAH.
00:30:14.396,00:30:17.566,"- WHY DO YOU DO THAT? - WELL, YOU KNOW."
00:30:17.650,00:30:20.402,- IT'S PROPER? - KIND OF.
00:30:53.811,00:30:56.188,"OH, FUCK."
00:32:16.935,00:32:18.812,THOUGHT YOU MIGHT HAVE BAILED.
00:32:23.191,00:32:25.026,SIT DOWN.
00:32:32.242,00:32:34.160,VODKA OR WHISKEY?
00:32:36.246,00:32:39.499,"COME ON. YOU CAN BE A GOOD BOY DOWNSTAIRS, NOT UP HERE."
00:32:39.583,00:32:41.501,"SERIOUSLY, I'M GOOD."
00:32:41.585,00:32:43.503,"WHISKEY, I THINK."
00:32:49.593,00:32:52.011,SO WHAT'S YOUR GOOD NEWS?
00:32:52.095,00:32:55.265,I WANNA KNOW WHAT WE'RE CELEBRATING.
00:32:55.348,00:32:58.852,"WHY DID YOUR, UH-- WHY DID YOUR DATE DITCH YOU?"
00:32:58.936,00:33:01.020,"- I ASKED YOU FIRST. - I DID, DOWNSTAIRS."
00:33:03.732,00:33:05.651,HE WORKS ON THE HILL.
00:33:05.734,00:33:07.653,SOME STAFFER OR SOMETHING.
00:33:07.736,00:33:10.280,I DON'T KNOW. I THINK HE'S A GLORIFIED GOFER.
00:33:10.363,00:33:12.031,A FRIEND SET ME UP WITH HIM.
00:33:12.115,00:33:14.785,"SO I SAID HE SHOULD COME TONIGHT, KEEP ME COMPANY."
00:33:14.868,00:33:16.829,BUT ALL HE WANTED TO DO WAS SCHMOOZE.
00:33:16.912,00:33:21.374,"SO I BROUGHT HIM INTO THE WOMEN'S BATHROOM, TOLD HIM HE WAS BEING AN ASSHOLE."
00:33:21.458,00:33:24.002,HE TOLD ME I WAS BEING CHILDISH.
00:33:24.085,00:33:26.421,SO I SLAPPED HIM.
00:33:28.381,00:33:31.217,YEAH. BIG RED HAND MARK RIGHT ACROSS HIS FACE.
00:33:31.301,00:33:33.804,I THINK HE WAS EMBARRASSED TO BE SEEN BY THE SCHMOOZERATI.
00:33:33.887,00:33:35.430,SO HE LEFT.
00:33:35.514,00:33:40.185,AND THAT IS THE LAST TIME I GO ON A DATE WITH A GUY WHO WEARS A FLAG PIN TO WORK.
00:33:40.268,00:33:44.105,I'M ONE OF THOSE GUYS WHO WEARS A FLAG PIN TO WORK.
00:33:46.817,00:33:48.694,"THIS ISN'T REALLY A DATE, IS IT?"
00:33:50.069,00:33:52.405,I REALLY SHOULDN'T BE HERE.
00:33:52.489,00:33:54.616,THAT'S WHAT MAKES IT FUN.
00:33:57.243,00:34:00.121,TELL ME YOUR GOOD NEWS. I WANNA KNOW WHAT WE'RE TOASTING TO.
00:34:02.541,00:34:04.376,LET'S TOAST TO YOU.
00:34:22.978,00:34:24.646,OH.
00:34:36.950,00:34:39.285,HEY.
00:34:39.369,00:34:41.788,WHAT ARE YOU...
00:34:41.872,00:34:43.790,I DIDN'T WANNA WAIT AT THE HERALD.
00:34:43.874,00:34:46.043,"I WAS GONNA CALL YOU, BUT..."
00:34:49.212,00:34:51.798,CAN I STAY AT YOUR PLACE TONIGHT?
00:34:51.882,00:34:54.259,"UH, STAY WITH ME?"
00:34:54.342,00:34:58.931,"WELL, JUST ON YOUR COUCH FOR A NIGHT OR TWO."
00:34:59.014,00:35:00.933,"UH, WHY?"
00:35:01.016,00:35:03.309,I CAN'T BE IN MY APARTMENT.
00:35:03.393,00:35:06.145,- DID SOMETHING HAPPEN? - NO. I...
00:35:08.690,00:35:10.483,I'M SORRY.
00:35:16.740,00:35:18.199,COME ON.
00:35:21.995,00:35:23.997,QUARTER TO 8:00. I'LL BE WITH HIM.
00:35:25.498,00:35:27.459,AND WHERE'S PETER NOW?
00:35:27.542,00:35:29.377,ARE YOU SURE YOU WANT THE DETAILS?
00:35:29.461,00:35:30.712,MM.
00:35:32.923,00:35:35.008,"JUST TELL ME, IS IT GOING WELL?"
00:35:35.092,00:35:37.010,HASN'T BEEN ANY UPDATES.
00:35:37.094,00:35:39.012,"BUT IF IT DOES GO WELL, YOU'LL BE READY?"
00:35:39.096,00:35:41.807,I'M READY. I'VE BEEN READY. I'M READY.
00:35:41.890,00:35:44.059,"- ANYTHING ELSE? - WE NEVER PLAYED CHESS BEFORE, HAVE WE?"
00:35:45.226,00:35:47.020,I DON'T KNOW HOW.
00:35:47.104,00:35:49.188,YOU WANT ME TO TEACH YOU?
00:35:51.108,00:35:53.026,I SHOULD REALLY GET SOME REST.
00:35:53.110,00:35:55.361,BE FRESH FOR THE MORNING.
00:35:55.445,00:35:57.196,"YEAH, ANOTHER TIME."
00:35:57.280,00:36:00.533,"1160, WZPZ, 7:45."
00:36:04.955,00:36:07.624,I HATE BEING KEPT IN THE DARK.
00:36:16.049,00:36:18.010,USELESS.
00:36:49.499,00:36:51.668,- LET'S DANCE. - WHOO-HOO! YEAH.
00:36:51.751,00:36:53.086,IT'S NOT A BIG DEAL.
00:36:53.170,00:36:55.296,"COME ON, LET'S DO IT."
00:36:55.380,00:36:57.465,"- COME ON, LET'S DO IT. - NO."
00:36:57.549,00:37:00.385,"NO, PLEASE, I CAN'T. NOT NOW."
00:37:05.515,00:37:06.641,COME ON.
00:37:30.373,00:37:32.291,THIS IS REALLY NICE.
00:37:32.375,00:37:35.461,DO YOU WANT ANYTHING? WATER? JUICE?
00:37:35.545,00:37:38.757,"NO, THANKS. I'M GOOD."
00:37:38.840,00:37:41.467,"UH, YOU CAN HAVE THE BED. I'LL SLEEP ON THE COUCH."
00:37:41.551,00:37:42.552,NO. NO.
00:37:42.635,00:37:44.054,IT'S FINE.
00:37:44.137,00:37:46.056,"PLEASE, LUCAS, LET ME SLEEP ON THE COUCH."
00:37:46.139,00:37:48.225,I'LL FEEL BAD.
00:37:48.307,00:37:49.768,ALL RIGHT.
00:37:53.939,00:37:56.024,- CAN I HELP? - I GOT IT.
00:38:04.032,00:38:10.329,"SO, YOU KNOW, WE DON'T HAVE TO TALK IF YOU DON'T WANT TO."
00:38:10.413,00:38:16.836,"BUT I HAVEN'T SEEN YOU IN, LIKE, SIX MONTHS."
00:38:16.920,00:38:19.839,EXCEPT FOR WHEN I DRUNKENLY STALKED YOU AT YOUR...
00:38:21.340,00:38:23.426,- RIGHT. - THAT WAS KIND OF ADORABLE.
00:38:23.509,00:38:26.679,IT WAS EITHER PSYCHOTIC OR SAD.
00:38:26.763,00:38:28.140,NOT ADORABLE.
00:38:37.523,00:38:39.567,"SO, WHY DO YOU NEED TO GET OUT OF YOUR APARTMENT?"
00:38:41.987,00:38:45.115,IT JUST FELT SMALL.
00:38:45.198,00:38:48.201,"WELL, IT CAN'T BE SMALLER THAN MY PLACE."
00:38:48.285,00:38:50.703,NO. I DON'T MEAN SIZE. I MEAN...
00:38:50.787,00:38:52.747,I FELT TRAPPED.
00:38:52.831,00:38:56.084,LIKE I WAS IN A PLACE THAT I DIDN'T ACTUALLY LIVE.
00:38:58.336,00:39:00.172,DOES THAT MAKE ANY SENSE?
00:39:01.840,00:39:03.883,I GUESS.
00:39:09.514,00:39:12.225,OKAY.
00:39:13.476,00:39:15.770,THERE YOU GO.
00:39:15.854,00:39:21.276,"UM, ANYTIME YOU NEED TO GET UP OR-- UM, I'LL JUST SET AN ALARM ON MY PHONE."
00:39:21.359,00:39:23.486,"ALL RIGHT. WELL, FEEL FREE TO WATCH TV."
00:39:23.569,00:39:26.072,I CAN SLEEP THROUGH ANYTHING.
00:39:28.449,00:39:30.285,"HEY, THANK YOU, LUCAS."
00:39:54.559,00:39:56.811,"BETTER MAKE IT COUNT, THEN."
00:40:07.655,00:40:09.324,- DRINK UP. - MM.
00:40:13.661,00:40:15.413,MMM.
00:40:20.252,00:40:22.212,DO I LOOK FAMILIAR TO YOU?
00:40:24.172,00:40:26.591,NO.
00:40:26.674,00:40:30.011,- MY FACE? MY BODY? - NO.
00:40:36.768,00:40:38.353,HAVE WE...
00:40:38.436,00:40:40.772,NO.
00:40:40.855,00:40:44.025,NO. I WAS JUST WONDERING IF YOU HAD A THING FOR BRUNETTES WITH BLUE EYES.
00:40:44.109,00:40:47.112,"- HEY, WHERE YOU GOING? COME BACK HERE. - I WANNA SEE YOU BETTER."
00:40:52.033,00:40:53.993,SHIT. THE SUN'S UP?
00:40:58.915,00:41:02.668,FUCK. I HAVE AN INTERVIEW IN HALF AN HOUR.
00:41:02.752,00:41:04.921,- SKIP IT. - I CAN'T. I GOTTA DO IT.
00:41:23.398,00:41:25.442,YOU CAN KEEP THE ROOM TILL NOON.
00:41:42.041,00:41:44.294,"THE FRONT DESK KEEPS CALLING UP, BUT THERE'S NO ANSWER."
00:41:44.377,00:41:47.880,- I'M NOT THERE. - THEN I'LL COME TO YOU. WHERE ARE YOU?
00:41:47.964,00:41:51.134,I'M-- I'M AT THE PARK HIGHMORE HOTEL.
