start,end,script
00:00:28.320,00:00:30.364,- JESUS. - DID YOU GET A GOOD LOOK?
00:00:30.447,00:00:32.366,BLUE TOYOTA CAMRY. THAT'S ALL I SAW.
00:00:32.449,00:00:33.617,THAT'S THE WHARTONS' DOG.
00:00:35.494,00:00:37.830,HE'S NOT GOING TO MAKE IT. GO SEE IF THEY'RE HOME.
00:00:49.967,00:00:52.011,IT'S OKAY.
00:00:54.680,00:01:04.231,"THERE ARE TWO KINDS OF PAIN: THE SORT OF PAIN THAT MAKES YOU STRONG, OR USELESS PAIN, THE SORT OF PAIN THAT'S ONLY SUFFERING."
00:01:04.314,00:01:07.526,I HAVE NO PATIENCE FOR USELESS THINGS.
00:01:09.277,00:01:17.619,"MOMENTS LIKE THIS REQUIRE SOMEONE WHO WILL ACT, WHO WILL DO THE UNPLEASANT THING, THE NECESSARY THING."
00:01:22.457,00:01:23.792,THERE.
00:01:23.876,00:01:25.419,NO MORE PAIN.
00:01:27.755,00:01:30.507,IT WAS A HIT-AND-RUN. I'M AWFULLY SORRY.
00:01:30.591,00:01:32.634,HE MUST HAVE JUMPED OVER THE FENCE AGAIN.
00:01:32.718,00:01:36.263,"LOOK, STEVE IS GOING TO FILE THE REPORT ON THE CAR, AND HE'LL PUT HIS PEOPLE ON IT."
00:01:36.346,00:01:38.139,WE'LL TRACK THEM DOWN.
00:01:58.077,00:02:00.996,YOU LOOK STUNNING. SHALL WE?
00:02:03.415,00:02:05.876,HAPPY NEW YEAR!
00:02:12.215,00:02:14.635,OH. PRESIDENT-ELECT GARRETT WALKER.
00:02:14.718,00:02:16.261,DO I LIKE HIM? NO.
00:02:16.344,00:02:18.097,DO I BELIEVE IN HIM? THAT'S BESIDE THE POINT.
00:02:18.179,00:02:24.728,"ANY POLITICIAN THAT GETS 70 MILLION VOTES HAS TAPPED INTO SOMETHING LARGER THAN HIMSELF, LARGER THAN EVEN ME, AS MUCH AS I HATE TO ADMIT IT."
00:02:24.812,00:02:27.731,"AND LOOK AT THAT WINNING SMILE, THOSE TRUSTING EYES."
00:02:27.815,00:02:30.651,I LATCHED ONTO HIM EARLY ON AND MADE MYSELF VITAL.
00:02:30.734,00:02:35.030,"AFTER 22 YEARS IN CONGRESS, I CAN SMELL WHICH WAY THE WIND IS BLOWING."
00:02:35.114,00:02:38.241,"OH, JIM MATTHEWS, HIS RIGHT HONORABLE VICE-PRESIDENT."
00:02:38.325,00:02:40.077,FORMER GOVERNOR OF PENNSYLVANIA.
00:02:40.160,00:02:45.833,"HE DID HIS DUTY IN DELIVERING THE KEYSTONE STATE, BLESS HIS HEART, AND NOW THEY'RE ABOUT TO PUT HIM OUT TO PASTURE."
00:02:45.916,00:02:47.876,"BUT HE LOOKS HAPPY ENOUGH, DOESN'T HE?"
00:02:47.960,00:02:51.880,"FOR SOME, IT'S SIMPLY THE SIZE OF THE CHAIR."
00:02:51.964,00:02:53.715,HUH.
00:02:53.799,00:02:55.926,"LINDA VASQUEZ, WALKER'S CHIEF OF STAFF."
00:02:56.010,00:02:57.511,I GOT HER HIRED.
00:02:57.594,00:03:03.224,"SHE'S A WOMAN, CHECK, AND A LATINA, CHECK, BUT MORE IMPORTANT THAN THAT, SHE'S AS TOUGH AS A TWO-DOLLAR STEAK."
00:03:03.308,00:03:04.852,"CHECK, CHECK, CHECK."
00:03:04.935,00:03:10.231,"WHEN IT COMES TO THE WHITE HOUSE, YOU NOT ONLY NEED THE KEYS IN YOUR BACK POCKET, YOU NEED THE GATEKEEPER."
00:03:10.315,00:03:12.860,"AS FOR ME, I'M JUST A LOWLY HOUSE MAJORITY WHIP."
00:03:12.943,00:03:16.905,I KEEP THINGS MOVING IN A CONGRESS CHOKED BY PETTINESS AND LASSITUDE.
00:03:16.989,00:03:20.117,MY JOB IS TO CLEAR THE PIPES AND KEEP THE SLUDGE MOVING.
00:03:20.199,00:03:22.036,BUT I WON'T HAVE TO BE A PLUMBER MUCH LONGER.
00:03:22.119,00:03:24.287,I'VE DONE MY TIME. I BACKED THE RIGHT MAN.
00:03:27.457,00:03:29.168,GIVE AND TAKE.
00:03:29.250,00:03:31.086,WELCOME TO WASHINGTON.
00:05:09.601,00:05:11.519,YOU NEED A HAIRCUT.
00:05:11.603,00:05:12.938,YOU THINK?
00:05:13.021,00:05:14.731,A LITTLE TRIM.
00:05:16.316,00:05:17.859,WHAT ARE YOU GOING TO WEAR?
00:05:17.943,00:05:20.112,- YOU MEAN FOR THE MEETING? - FOR THE ANNOUNCEMENT.
00:05:20.195,00:05:23.073,"GONNA WEAR MY NAVY BLUE, THE ONE WITH THE PINSTRIPES."
00:05:23.157,00:05:26.034,GOOD. YOU LOOK HANDSOME IN THAT SUIT.
00:05:27.702,00:05:30.622,I DON'T KNOW IF THEY'LL ANNOUNCE IT BEFORE YOUR BOARD MEETING.
00:05:30.705,00:05:32.291,"WELL, AS LONG AS I CAN SAY THE DONATION IS COMING."
00:05:32.373,00:05:35.961,"AS SOON AS IT'S OFFICIAL, SANCORP WILL WRITE YOU A CHECK."
00:05:39.131,00:05:41.967,THIS IS GOING TO BE A BIG YEAR FOR US.
00:05:56.355,00:05:58.150,"YOU KNOW, THE MEETING'S ON TUESDAY."
00:06:03.989,00:06:05.532,COMMUNITY OF WHAT?
00:06:05.615,00:06:10.078,"OR I COULD SAY IMMIGRATION, BANKING, OR EDUCATION, BUT NONE OF MY REGULAR SOURCES CAN CONFIRM THAT."
00:06:10.162,00:06:13.581,"BECAUSE THEY DON'T KNOW, OR BECAUSE THEY'RE NOT TALKING?"
00:06:13.665,00:06:15.125,BECAUSE THEY DON'T KNOW.
00:06:15.209,00:06:17.376,KEEP AT IT. GET ME SOMETHING.
00:06:17.460,00:06:20.297,"SORRY. SORRY, MR. HAMMERSCHMIDT."
00:06:20.379,00:06:22.632,ZOE.
00:06:22.716,00:06:24.759,- BARNES. - RIGHT.
00:06:28.055,00:06:30.182,DID IT TAKE HIM A YEAR TO REMEMBER YOUR NAME?
00:06:30.265,00:06:31.266,LONGER.
00:06:31.350,00:06:33.434,"GOOD MORNING, LUCAS."
00:06:33.518,00:06:35.729,"WHAT CAN I DO FOR YOU, ZOE?"
00:06:37.605,00:06:39.691,I AM SICK OF THE FAIRFAX COUNTY COUNCIL.
00:06:39.774,00:06:41.318,YOU TELL ME EVERY DAY.
00:06:41.400,00:06:45.697,"MOVE ME ONLINE. MY OWN BLOG-- FIRST PERSON, SUBJECTIVE, 500 WORDS."
00:06:45.780,00:06:47.782,- NOT GOING TO HAPPEN. - I'LL GO UNDERGROUND.
00:06:47.866,00:06:49.408,BACK ROOMS. THE URINALS.
00:06:49.492,00:06:51.203,I'LL WIN OVER STAFF MEMBERS ON THE HILL.
00:06:51.286,00:06:53.288,- THEY NEED A PLACE TO VENT. - A GOSSIP COLUMN.
00:06:53.372,00:06:55.874,"NO. WE LIFT THE VEIL, WHAT'S REALLY GOING ON."
00:06:55.957,00:06:57.709,"THIS IS THE WASHINGTON HERALD, ZOE."
00:06:57.792,00:06:59.544,IT'S NOT TMZ.
00:06:59.627,00:07:00.795,DO YOU KNOW HOW MANY PEOPLE WATCH TMZ?
00:07:00.879,00:07:02.214,I COULDN'T CARE LESS.
00:07:02.297,00:07:04.007,WHICH IS WHY PRINT JOURNALISM IS DYING.
00:07:04.091,00:07:06.260,"THEN IT'LL DIE WITH DIGNITY, AT LEAST AT THIS PAPER."
00:07:06.343,00:07:09.096,"YOU ARE STUCK IN THE 20TH CENTURY, LUCAS. YOU LACK IMAGINATION."
00:07:09.179,00:07:12.432,"MAYBE SO, BUT RIGHT NOW, I DON'T NEED IMAGINATION. I NEED COPY."
00:07:12.515,00:07:14.309,YOUR NIGHTS AND WEEKENDS ARE YOURS.
00:07:14.393,00:07:17.729,"I APPLAUD WHATEVER YOU WANT TO DO, AS LONG AS IT'S NOT ON MY TIME."
00:07:17.812,00:07:19.731,-YOU'RE TELLING ME TO GET BACK TO WORK. -I AM.
00:07:19.814,00:07:22.609,WHAT YOU'RE REALLY TELLING ME IS TO FUCK OFF.
00:07:22.692,00:07:24.027,I'M TELLING YOU BOTH.
00:07:27.364,00:07:31.618,IT'S MR. CHAPMAN ALREADY FROM PROVINCE TRUST.
00:07:36.998,00:07:38.792,"HOLD MY CALLS, CHRISTINA."
00:07:40.877,00:07:44.214,HENRY. IT'S GOOD TO SEE YOU.
00:07:44.298,00:07:46.341,- HOW LONG ARE YOU IN TOWN FOR? - JUST TODAY.
00:07:46.425,00:07:48.468,"WELL, YOU GOTTA COME BACK DOWN FOR THE INAUGURATION."
00:07:48.551,00:07:50.637,I CAN HOOK YOU UP.
00:07:50.720,00:07:52.806,HOW ABOUT YOU HOOK ME UP WITH THE ZONING LAWS YOU PROMISED TO GET CHANGED?
00:07:52.889,00:07:56.643,WE GOT 12 MILLION SITTING IN ESCROW FOR AN EMPTY LOT WE CAN'T BUILD ON.
00:07:56.726,00:07:59.687,"I KNOW, BUT YOU GOTTA UNDERSTAND, IT'S A LOCAL MUNICIPAL ISSUE."
00:07:59.771,00:08:06.236,I CAN'T JUST PICK UP THE PHONE-- YOU CAN'T? BECAUSE THAT'S NOT WHAT YOU LED US TO BELIEVE WHEN YOU BEGGED FOR 50 GRAND IN DONATIONS.
00:08:09.072,00:08:10.240,ONE SECOND.
00:08:10.324,00:08:13.660,"CHRISTINA, I SAID NO CALLS, NOT WHILE I'M MEETING WITH MR. CHAPMAN."
00:08:15.662,00:08:17.705,THE PRESIDENT-ELECT?
00:08:19.249,00:08:20.875,I-- DO YOU MIND?
00:08:20.959,00:08:22.169,"NO. GO AHEAD, PLEASE."
00:08:22.252,00:08:23.920,"UH, PUT HIM THROUGH, CHRISTINA."
00:08:24.004,00:08:25.255,AHEM.
00:08:27.924,00:08:29.592,MR. PRESIDENT-ELECT?
00:08:32.846,00:08:37.434,"THANK YOU. UH, YES, WE WERE, UH-- WE WERE PLEASED TO WIN BY DOUBLE DIGITS."
00:08:38.810,00:08:40.479,ABSOLUTELY. ANYTHING YOU NEED.
00:08:40.561,00:08:51.739,"I NEED YOU TO PUT YOUR LONG, WET, TALENTED TONGUE BETWEEN MY THIGHS AND MAKE ME SQUEAL LIKE MONICA LEWIN-- ME, TOO. ME, TOO."
00:08:52.949,00:08:54.617,"OKAY. THANK YOU, SIR."
00:08:56.161,00:08:58.746,"I'M SO SORRY. UH, WHERE WERE WE?"
00:09:00.290,00:09:02.459,WALKER...
00:09:02.542,00:09:03.918,WHAT'S HE LIKE?
00:09:17.391,00:09:19.309,MR. PRESIDENT-ELECT RUNNING LATE?
00:09:19.393,00:09:21.811,"NO, HE COULDN'T MAKE IT. I'LL BRIEF HIM, THOUGH."
00:09:23.397,00:09:27.859,OKAY. THIS IS THE MEMO I'VE DRAFTED ON OUR MIDDLE EAST POLICY WE'VE BEEN DEVELOPING.
00:09:27.942,00:09:29.819,"NOW, I WANT TO BORROW FROM REAGAN."
00:09:29.903,00:09:32.613,I'D LIKE TO COIN THE PHRASE TRICKLE-DOWN DIPLOMACY.
00:09:32.697,00:09:35.492,"- THAT WAY-- - FRANK, I'M GOING TO STOP YOU THERE."
00:09:35.575,00:09:38.328,WE ARE NOT NOMINATING YOU FOR SECRETARY OF STATE.
00:09:38.412,00:09:41.998,"I KNOW HE MADE YOU A PROMISE, BUT CIRCUMSTANCES HAVE CHANGED."
00:09:42.082,00:09:46.920,"THE NATURE OF PROMISES, LINDA, IS THAT THEY REMAIN IMMUNE TO CHANGING CIRCUMSTANCES."
00:09:47.003,00:09:52.092,"GARRETT HAS THOUGHT LONG AND HARD ABOUT THIS, AND HE'S DECIDED WE NEED YOU TO STAY IN CONGRESS."
00:09:52.175,00:09:57.264,"WHEN WAS THIS DECISION MADE, AND WHY WASN'T I PART OF A CONVERSATION?"
00:09:57.347,00:10:00.392,"I'M SORRY, FRANK. IF IT HAD BEEN UP TO ME, I WOULDN'T HAVE WAITED THIS LONG TO TELL YOU."
00:10:00.475,00:10:02.685,"SO, YOU KNEW YOU WERE GOING TO DO THIS."
00:10:02.769,00:10:04.563,IT HAS BEEN AN EVOLVING DISCUSSION.
00:10:04.645,00:10:07.648,IT'S A CHICKEN-SHIT MOVE.
00:10:07.732,00:10:09.067,- FRANK-- - I WAS VETTED.
00:10:09.150,00:10:10.444,- WAS THAT A RUSE? - NO.
00:10:10.527,00:10:11.819,LET'S BE ABSOLUTELY CLEAR.
00:10:11.903,00:10:13.780,YOU WOULDN'T HAVE WON WITHOUT ME.
00:10:13.863,00:10:18.076,"YOU'RE RIGHT, BUT NOW WE HAVE TO LEAD, AND THAT MEANS MAKING TOUGH CHOICES."
00:10:18.159,00:10:22.705,"AS YOU KNOW, EDUCATION IS A TOP PRIORITY FOR US, A COMPLETE FEDERAL OVERHAUL."
00:10:22.789,00:10:25.125,"BUT IT'S NOT JUST EDUCATION. FRANK, CONGRESS IS SPLIT."
00:10:25.208,00:10:29.337,WE NEED YOU THERE MORE THAN WE NEED YOU IN THE STATE DEPARTMENT.
00:10:29.421,00:10:31.423,"I GOT YOU HIRED, LINDA."
00:10:33.091,00:10:34.175,I KNOW.
00:10:34.259,00:10:35.635,"DONATIONS, ENDORSEMENTS."
00:10:35.718,00:10:39.222,I WROTE THE CAMPAIGN'S ENTIRE FOREIGN POLICY PLATFORM.
00:10:39.306,00:10:43.810,"I BRING YEARS OF FOREIGN AFFAIRS COMMITTEE-- FRANK, PLEASE."
00:10:46.646,00:10:48.856,I WANT TO SPEAK TO WALKER PERSONALLY.
00:10:48.940,00:10:50.900,THE DECISION IS MADE.
00:10:54.946,00:10:57.491,"WE NEED YOU, FRANK."
00:10:57.574,00:10:59.700,WILL YOU STAND BESIDE US OR NOT?
00:11:09.503,00:11:11.671,OF COURSE. IF THAT'S WHAT THE PRESIDENT WANTS.
00:11:11.754,00:11:14.799,I'M VERY GLAD TO HEAR THAT.
00:11:16.343,00:11:18.386,I'M CURIOUS.
00:11:18.470,00:11:20.054,"IF NOT ME, THEN WHO?"
00:11:22.182,00:11:23.724,MICHAEL KERN.
00:11:23.808,00:11:25.268,MICHAEL KERN?
00:11:26.853,00:11:28.605,WELL...
00:11:28.687,00:11:30.982,THAT IS AN EXCELLENT CHOICE.
00:11:34.944,00:11:36.446,CAN YOU MAKE IT MORE CLEAR?
00:11:36.530,00:11:42.827,"I JUST WANT TO MAKE SURE IT DOESN'T LOOK LIKE WE'RE NEGLECTING OUR DOMESTIC-- NO. NO, NO, NO. I'M GOING TO SAY THAT WE'RE EXPANDING OUR MISSION."
00:11:42.910,00:11:44.329,OKAY.
00:11:44.412,00:11:47.040,AND WE'RE BRINGING ON A NEW ORGANIZATION TO HELP US.
00:11:47.123,00:11:48.707,DO YOU KNOW WHICH ONE YET?
00:11:48.791,00:11:55.006,"I'M STILL LOOKING INTO A FEW OPTIONS, BUT, UM, TELL ME, WHAT DID WE AGREE ON, THAT WE COULD HIRE HOW MANY NEW PEOPLE? SIX?"
00:11:55.089,00:11:56.466,"- SIX, MAYBE SEVEN. - HMM?"
00:11:56.550,00:11:58.259,WE'LL HAVE ENOUGH.
00:11:58.343,00:12:00.053,"OOH, IT'S EXCITING, HUH?"
00:12:00.136,00:12:03.264,"THIS, UH, NEW DIRECTION WE'RE HEADING."
00:12:03.348,00:12:06.100,I JUST DON'T KNOW WHERE WE'RE GOING TO FIT ALL THE PEOPLE.
00:12:06.184,00:12:08.102,"WELL, DO YOU THINK WE HAVE TO LOOK INTO ADDITIONAL SPACE?"
00:12:08.186,00:12:09.896,"NO. NO, NO, NO. I'LL FIND A WAY."
00:12:09.979,00:12:13.191,"OKAY, SO MAKE THE CHANGES TO THE POWERPOINT, AND LET'S MEET AGAIN AT 2:30."
00:12:13.274,00:12:14.359,OKAY.
00:12:25.744,00:12:27.247,IT'S ME.
00:12:27.330,00:12:29.207,I FEEL LIKE AN IDIOT LEAVING MESSAGES LIKE THIS.
00:12:29.290,00:12:30.667,CALL ME BACK.
00:12:42.761,00:12:43.846,"WHAT IS IT, ZOE?"
00:12:43.930,00:12:46.015,UM...
00:12:46.099,00:12:54.232,"I KNOW YOU'RE GOING TO HAVE YOUR HANDS FULL AT THE WHITE HOUSE, SO IF YOU NEED SOMEONE TO DO RESEARCH OR-- OR PRINT OUT BACKGROUND-- I THINK I'LL BE FINE."
00:12:54.315,00:13:00.821,"WELL, IF THINGS GET HECTIC AND YOU NEED ANY HELP-- SO YOU CAN BLOG ABOUT RUBBING SHOULDERS WITH THE BIG BOYS?"
00:13:03.991,00:13:05.535,WHAT DID LUCAS TELL YOU?
00:13:05.619,00:13:09.623,"LOOK, NO OFFENSE, ZOE, BUT I DON'T HAVE TIME TO BE ANYONE'S TRAINING WHEELS."
00:13:09.706,00:13:12.041,I JUST THOUGHT...
00:13:12.125,00:13:14.753,"NO, I WAS ACTUALLY OFFERING TO LEND A HAND."
00:13:14.835,00:13:16.337,- THAT'S IT. - GOT IT.
00:13:16.421,00:13:17.922,THANKS.
00:13:58.296,00:14:00.089,- CLAIRE. - YOU DIDN'T CALL.
00:14:00.173,00:14:03.468,"- I WAS-- - YOU DIDN'T CALL ME, FRANCIS."
00:14:03.551,00:14:07.514,"NINE HOURS. YOU DON'T NOT CALL ME, NOT WHEN IT'S THIS BIG."
00:14:07.597,00:14:08.889,YOU'RE RIGHT.
00:14:08.973,00:14:11.685,WHEN HAVE WE EVER AVOIDED EACH OTHER?
00:14:13.894,00:14:15.772,I WANTED THE SOLUTION FIRST.
00:14:15.854,00:14:17.148,DO YOU HAVE ONE?
00:14:17.231,00:14:19.150,NOT YET.
00:14:19.233,00:14:21.277,"THIS AFFECTS ME, TOO, FRANCIS."
00:14:21.361,00:14:24.113,AND IT'S NOT THE MONEY I'M UPSET ABOUT.
00:14:24.197,00:14:26.949,IT'S THAT WE DO THINGS TOGETHER.
00:14:27.033,00:14:29.577,"WHEN YOU DON'T INVOLVE ME, WE'RE IN FREE-FALL."
00:14:29.661,00:14:32.205,"I SHOULD'VE CALLED YOU, AND I DIDN'T."
00:14:32.288,00:14:33.456,WHAT HAPPENED?
00:14:35.166,00:14:37.377,SHE SAYS THEY NEEDED TO KEEP ME IN CONGRESS.
00:14:37.460,00:14:38.670,LINDA SAID THAT?
00:14:38.753,00:14:39.879,WALKER WASN'T EVEN THERE.
00:14:39.962,00:14:41.548,THAT'S WHAT REALLY GETS ME.
00:14:41.631,00:14:43.383,HE DIDN'T HAVE THE COURAGE TO LOOK ME IN THE EYE.
00:14:43.466,00:14:45.218,I KNEW YOU SHOULDN'T TRUST THAT WOMAN.
00:14:45.301,00:14:46.845,I DIDN'T. I DON'T. I DON'T TRUST ANYONE.
00:14:46.927,00:14:48.888,THEN HOW COULD YOU NOT SEE THIS COMING?
00:14:50.598,00:14:52.726,I NEVER THOUGHT THEY WERE CAPABLE.
00:14:52.809,00:14:55.436,"YOU DON'T USUALLY UNDERESTIMATE PEOPLE, FRANCIS."
00:14:55.520,00:14:58.231,I KNOW.
00:14:58.314,00:15:00.859,HUBRIS. AMBITION.
00:15:00.941,00:15:02.109,YOU SHOULD BE ANGRY.
00:15:02.193,00:15:03.444,I'M LIVID.
00:15:03.528,00:15:05.363,THEN WHERE IS THAT? I DON'T SEE IT.
00:15:05.446,00:15:07.741,WHAT DO YOU WANT ME TO DO? SCREAM AND YELL? THROW A TANTRUM?
00:15:07.824,00:15:10.201,"I WANT MORE THAN I'M SEEING. YOU'RE BETTER THAN THIS, FRANCIS."
00:15:10.284,00:15:13.287,"WELL, I'M SORRY, CLAIRE. I AM SORRY."
00:15:13.371,00:15:15.122,"NO, THAT I WON'T ACCEPT."
00:15:15.206,00:15:17.667,- WHAT? - APOLOGIES.
00:15:20.211,00:15:24.507,"MY HUSBAND DOESN'T APOLOGIZE, EVEN TO ME."
00:17:10.488,00:17:12.031,HOW LONG YOU BEEN UP?
00:17:12.114,00:17:13.574,HOURS.
00:17:16.285,00:17:18.412,I KNOW WHAT I HAVE TO DO.
00:17:18.496,00:17:20.122,GOOD.
00:17:20.206,00:17:26.504,"WE'LL HAVE A LOT OF NIGHTS LIKE THIS-- MAKING PLANS, VERY LITTLE SLEEP."
00:17:26.587,00:17:28.882,I EXPECTED THAT.
00:17:28.965,00:17:31.217,IT DOESN'T WORRY ME.
00:17:40.434,00:17:42.770,I'D BETTER GET TO WORK.
00:17:42.854,00:17:46.232,I LAID A SUIT OUT FOR YOU UPSTAIRS.
00:17:46.315,00:17:48.401,THE NAVY-BLUE ONE.
00:17:54.323,00:17:55.742,I LOVE THAT WOMAN.
00:17:55.825,00:17:57.785,I LOVE HER MORE THAN SHARKS LOVE BLOOD.
00:18:05.334,00:18:07.795,WE'RE TOO GOOD. THEY CAN'T AFFORD TO LOSE US IN CONGRESS.
00:18:09.714,00:18:11.298,CHIN TUCK PROBABLY.
00:18:11.382,00:18:12.508,DEFINITELY DYES HIS HAIR.
00:18:14.343,00:18:15.386,DO WE SAY ANYTHING?
00:18:15.469,00:18:16.804,"NO. GOD, NO."
00:18:16.888,00:18:18.639,NOT UNLESS HE BRINGS IT UP.
00:18:20.349,00:18:21.726,- 9:20-- - CANCEL EVERYTHING.
00:18:21.809,00:18:23.937,"STAMPER, YOU'RE WITH ME."
00:18:24.020,00:18:25.396,"NOW, LOOK..."
00:18:29.650,00:18:32.070,WE ARE NO LONGER BOUND BY ALLEGIANCES.
00:18:32.152,00:18:33.905,WE SERVE NO ONE.
00:18:33.988,00:18:40.327,WE LIVE BY ONE RULE AND ONE RULE ONLY: NEVER AGAIN WILL WE ALLOW OURSELVES TO BE PUT IN SUCH A POSITION.
00:18:40.411,00:18:41.788,WALKER AND VASQUEZ.
00:18:41.871,00:18:44.916,ALL OF THEM. I HOLD THEM ALL ACCOUNTABLE.
00:18:44.999,00:18:47.334,- WANT RETRIBUTION? - NO. NO.
00:18:47.418,00:18:49.879,IT'S MORE THAN THAT.
00:18:49.963,00:18:52.298,TAKE A STEP BACK.
00:18:52.381,00:18:54.092,LOOK AT THE BIGGER PICTURE.
00:18:54.174,00:18:56.803,I THINK I SEE WHAT YOU'RE GETTING AT.
00:18:56.886,00:18:58.262,KERN FIRST?
00:18:58.345,00:19:02.016,"THAT'S HOW YOU DEVOUR A WHALE, DOUG, ONE BITE AT A TIME."
00:19:04.310,00:19:05.937,GIVE ME A LIST OF CHOICES.
00:19:06.020,00:19:09.023,"AND HOWEVER WE DO THIS, WE'LL ALSO NEED A BUFFER."
00:19:09.107,00:19:10.524,YOU MEAN AN ERRAND BOY.
00:19:10.608,00:19:12.777,"YES, SOMEONE WE CONTROL COMPLETELY."
00:19:14.278,00:19:15.947,I'LL KEEP MY EAR TO THE GROUND.
00:19:16.030,00:19:17.406,GOOD.
00:19:17.490,00:19:20.159,I HAVEN'T EATEN SINCE YESTERDAY.
00:19:38.636,00:19:40.429,I ALMOST PITY HIM.
00:19:40.513,00:19:42.515,HE DIDN'T CHOOSE TO BE PUT ON MY PLATTER.
00:19:42.598,00:19:48.771,"WHEN I CARVE HIM UP AND TOSS HIM TO THE DOGS, ONLY THEN WILL HE CONFRONT THAT BRUTAL, INESCAPABLE TRUTH..."
00:19:48.855,00:19:50.773,MY GOD.
00:19:50.857,00:19:54.276,ALL I EVER AMOUNTED TO WAS CHITLINS.
00:19:57.279,00:19:59.949,SHALL BE EXALTED.
00:20:01.659,00:20:05.538,"MATTHEW, CHAPTER 23, VERSE 12."
00:20:08.916,00:20:14.672,I'D LIKE TO SPEAK TODAY ON THE SUBJECT OF HUMILITY.
00:20:14.755,00:20:17.800,A LOT OF YOU HAVE JUST WON RE-ELECTION.
00:20:17.884,00:20:20.469,"IF YOU HADN'T, YOU MIGHT NOT BE SITTING HERE."
00:20:22.055,00:20:31.355,"AND, OF COURSE, WE SHOULD ENJOY OUR SUCCESS AND BE GRATEFUL FOR IT, BUT NEVER LET YOUR GRATITUDE SOUR INTO PRIDE."
00:20:31.438,00:20:46.537,"YOU'LL HAVE MANY CHALLENGES AHEAD OVER THE NEXT COUPLE OF YEARS, AND A PERSON'S CHARACTER ISN'T DETERMINED BY HOW HE OR SHE ENJOYS VICTORY BUT RATHER HOW HE OR SHE ENDURES DEFEAT."
00:20:46.620,00:20:53.669,NOTHING CAN HELP US ENDURE DARK TIMES BETTER THAN OUR FAITH.
00:20:53.753,00:20:55.088,CLAIRE.
00:20:55.171,00:20:56.463,"OH, HELLO, FELICITY."
00:20:56.547,00:20:58.340,- HOW ARE YOU? - GOOD. HOW ARE YOU?
00:20:58.424,00:21:01.468,GOOD. I'M SORRY. IT'S JUST NOT RIGHT.
00:21:01.594,00:21:02.636,OH.
00:21:02.720,00:21:04.597,CHARLES AND I CAN'T UNDERSTAND WHAT WALKER WAS THINKING.
00:21:04.680,00:21:09.852,"OH, THAT'S VERY SWEET OF YOU, BUT REALLY BETWEEN YOU AND ME, I THINK FRANCIS IS RELIEVED."
00:21:09.936,00:21:13.480,HE JUST FEELS MUCH MORE AT HOME IN CONGRESS.
00:21:13.564,00:21:15.566,I WOULD'VE BET A MILLION DOLLARS THEY WERE GONNA PICK YOU.
00:21:15.649,00:21:18.819,"WELL, IT'S A GOOD THING YOU HAVE A MILLION DOLLARS TO SPARE."
00:21:18.903,00:21:21.280,"BUT YOU ARE, BY FAR AND AWAY, THE ONLY CHOICE."
00:21:21.363,00:21:23.199,I APPRECIATE YOU SAYING THAT.
00:21:23.282,00:21:28.955,"I MEAN, MICHAEL? COME ON. HE'S GOT HALF THE EXPERIENCE-- GARRETT IS A SMART MAN. HE KNOWS WHAT HE'S DOING."
00:21:29.038,00:21:31.916,"YOU'RE A BIGGER MAN THAN I, FRANK."
00:22:02.488,00:22:05.825,"YOU, UH-- YOU WANT SOME OF THAT WINE?"
00:22:06.993,00:22:09.245,"YES, DEFINITELY."
00:22:15.251,00:22:17.503,"MAN, THIS IS SOME GOOD SHIT. WHERE'D YOU GET IT?"
00:22:17.586,00:22:23.717,"UH, I KIND OF LIFTED IT FROM THE V.I.P. ROOM OF THE SPEAKER'S HOLIDAY PARTY."
00:22:23.801,00:22:27.345,"I'M IMPRESSED. BORDEAUX, 20 YEARS OLD."
00:22:27.429,00:22:29.640,"OH, IT SEEMED ABOUT RIGHT FOR YOU."
00:22:29.723,00:22:32.310,OUCH. WHY WOULD YOU SAY THAT TO ME?
00:22:32.392,00:22:34.687,I'M ALMOST 30. THAT'S PRACTICALLY ANCIENT IN YOUR BOOK.
00:22:34.770,00:22:36.772,I DON'T DISCRIMINATE WHEN IT COMES TO AGE.
00:22:36.856,00:22:38.732,REALLY? WHEN WAS THE LAST TIME YOU HIRED A 40-YEAR-OLD STAFFER?
00:22:38.816,00:22:40.609,DOESN'T MEAN I WOULDN'T.
00:22:40.693,00:22:42.236,"WELL, AS LONG AS SHE'S GOOD IN THE SACK."
00:22:42.320,00:22:44.905,"- COME ON. - WELL, IT'S TRUE, ISN'T IT?"
00:22:44.989,00:22:47.033,WHERE IS THIS COMING FROM?
00:22:49.076,00:22:53.622,YOU'RE NOT GOING TO JUST TOSS ME ASIDE FOR SOME SLUT STRAIGHT OUT OF VASSAR.
00:22:53.706,00:22:55.875,"SO, WE'RE HAVING THAT CONVERSATION."
00:22:55.958,00:22:57.543,IT'S BEEN SIX MONTHS.
00:22:57.626,00:22:59.045,IT'S NOT A LITTLE OFFICE FLING ANYMORE.
00:22:59.128,00:23:04.175,"YOU WANT ME TO SAY THOSE THREE MAGIC WORDS, ONE OF WHICH STARTS WITH AN L."
00:23:04.258,00:23:06.260,- MM-MM. NO. - OKAY.
00:23:06.344,00:23:07.887,I'LL SAY 'EM.
00:23:07.970,00:23:10.306,CHRISTINA GALLAGHER...
00:23:11.473,00:23:13.351,LICK MY BALLS.
00:23:13.433,00:23:15.644,"OH, MY-- YOU BASTARD."
00:23:15.728,00:23:18.105,- HEY. - I LOVE YOU.
00:23:18.189,00:23:20.941,"I LOVE YOU, CHRISTINA."
00:23:21.025,00:23:22.860,I LOVE YOU.
00:23:30.201,00:23:31.952,NOW WILL YOU LICK MY BALLS?
00:23:44.382,00:23:45.716,"SO, I'M CURIOUS."
00:23:45.799,00:23:48.886,"ARE WE PATRONS, BENEFACTORS, OR LEPERS?"
00:23:48.969,00:23:52.014,"BELIEVE IT OR NOT, WE'RE ANGELS."
00:23:57.686,00:24:00.022,I'M GOING TO GO OUTSIDE AND PRETEND TO USE MY CELL PHONE.
00:24:00.106,00:24:01.190,GO.
00:24:11.325,00:24:12.659,CAN I HAVE YOUR JACKET?
00:24:12.743,00:24:14.703,YEAH. HERE YOU GO.
00:24:55.702,00:24:57.121,ARE YOU COMING TO BED?
00:24:57.204,00:24:58.956,I'LL BE UP IN A BIT.
00:24:59.039,00:25:00.333,DON'T STAY UP ALL NIGHT.
00:25:00.416,00:25:01.667,"NO, I'LL BE RIGHT THERE."
00:25:11.260,00:25:13.095,THANKS SO MUCH. I'LL CALL YOU.
00:25:14.680,00:25:17.808,WAIT. I THOUGHT YOU HAD A GOOD TIME.
00:25:17.891,00:25:20.019,"OH, I DID. I LOVED IT."
00:25:20.102,00:25:21.312,I'VE NEVER BEEN BEFORE.
00:25:21.395,00:25:24.315,"WELL, MAYBE I COULD COME UP."
00:25:24.398,00:25:27.567,"OH, RYAN, YOU'RE SO SWEET."
00:25:27.651,00:25:29.403,REALLY.
00:25:29.487,00:25:32.698,"BUT IF I WAS GONNA FUCK YOU, YOU'D KNOW."
00:25:32.781,00:25:34.825,THANKS SO MUCH.
00:27:06.125,00:27:07.960,- SHE'S HERE. - SEND HER IN.
00:27:08.043,00:27:14.592,"IT'S QUITE RARE FOR A PRESIDENT'S CHIEF OF STAFF TO CLIMB THE HILL, A GESTURE OF RESPECT, NO DOUBT, OR DESPERATION."
00:27:14.674,00:27:18.053,"I'M GUESSING SHE'LL SAY, DONALD BLYTHE FOR EDUCATION."
00:27:19.721,00:27:21.765,LET'S SEE IF I'M RIGHT.
00:27:23.058,00:27:25.185,"GOOD MORNING, LINDA."
00:27:25.269,00:27:27.187,THANK YOU SO MUCH FOR MAKING THE TRIP UP.
00:27:27.271,00:27:28.730,OF COURSE. MY PLEASURE.
00:27:28.814,00:27:31.775,- EDUCATION. - FIRST THINGS FIRST.
00:27:31.858,00:27:33.986,THE SEATING CHART FOR THE INAUGURATION.
00:27:34.069,00:27:35.821,HOW DO THESE TWO WORK FOR YOU AND CLAIRE?
00:27:35.904,00:27:37.615,WOW.
00:27:37.697,00:27:40.242,THEY COME WITH A COMPLIMENTARY SET OF TICKETS TO THE JEFFERSON BALL.
00:27:40.326,00:27:41.994,CLAIRE WILL BE OVER THE MOON.
00:27:42.077,00:27:43.996,GOOD. I'M SO GLAD.
00:27:44.079,00:27:46.832,SO...EDUCATION.
00:27:46.915,00:27:49.251,WE HAVE DONALD BLYTHE DRAFTING THE LEGISLATION.
00:27:49.335,00:27:52.296,- DONALD BLYTHE. JESUS. - I KNOW.
00:27:52.379,00:27:56.383,"SO, YOU WANT A BILL JUST TWO STEPS LEFT OF KARL MARX."
00:27:56.467,00:28:00.053,"I ADVISED THE PRESIDENT-ELECT AGAINST IT, BUT DONALD IS THE FACE OF EDUCATION."
00:28:00.137,00:28:02.264,HE'S BEEN PUSHING REFORM FOR 25 YEARS.
00:28:02.348,00:28:04.224,YOU WANT ME TO GUIDE HIM TO THE MIDDLE.
00:28:04.308,00:28:06.935,WE NEED A BILL WE CAN PASS.
00:28:07.019,00:28:09.938,DO I HAVE ABSOLUTE AUTONOMY AND AUTHORITY ON THIS?
00:28:10.022,00:28:11.815,THERE'S MORE.
00:28:11.898,00:28:15.361,GARRETT WANTS THE BILL ON THE FLOOR IN THE FIRST 100 DAYS.
00:28:15.444,00:28:19.031,HE WANTS TO MAKE A PLEDGE IN HIS INAUGURAL ADDRESS.
00:28:19.114,00:28:20.658,"WELL, THAT'S..."
00:28:22.368,00:28:24.036,"THAT'S VERY AMBITIOUS, LINDA."
00:28:24.119,00:28:25.829,CAN WE MAKE THAT PLEDGE?
00:28:28.706,00:28:29.958,100 DAYS?
00:28:31.627,00:28:33.462,I CAN DELIVER.
00:28:38.133,00:28:39.926,- KEEP ME POSTED. - I'LL TALK WITH DONALD.
00:28:40.010,00:28:41.637,I'LL CHECK IN WITH YOU LATER IN THE WEEK.
00:28:43.138,00:28:44.473,DID YOU SMELL THAT?
00:28:44.557,00:28:46.766,"THE SMUGNESS, THE FALSE DEFERENCE."
00:28:46.850,00:28:49.186,SHE THINKS I CAN BE BOUGHT WITH A PAIR OF TICKETS.
00:28:49.269,00:28:54.483,"WHAT AM I, A WHORE IN POST-WAR BERLIN, SALIVATING OVER FREE STOCKINGS AND CHOCOLATE?"
00:28:54.567,00:28:57.777,WHAT SHE'S ASKING WILL COST FAR MORE THAN THAT.
00:29:01.948,00:29:05.035,- WILLIS. - TOO STUPID.
00:29:05.118,00:29:08.330,- BOYD. - TOO QUEER.
00:29:08.414,00:29:10.499,REALLY?
00:29:10.583,00:29:12.626,HE'S MARRIED WITH THREE KIDS.
00:29:12.710,00:29:14.127,AND WOULDN'T THEY BE DEVASTATED?
00:29:14.211,00:29:18.131,ALL RIGHT. WHAT ABOUT CATHERINE DURANT?
00:29:18.215,00:29:19.966,CATHY DURANT?
00:29:20.050,00:29:22.094,SHE WAS VOCALLY ANTI-WALKER.
00:29:22.177,00:29:23.637,SHE'S GOT THE EXPERIENCE.
00:29:24.846,00:29:26.682,SET UP A MEETING.
00:29:30.644,00:29:32.104,HEY.
00:29:34.106,00:29:37.025,- THE DONATION FROM SANCORP. - HMM?
00:29:37.109,00:29:38.818,THE MONEY WILL HAVE TO COME FROM SOMEWHERE ELSE.
00:29:38.902,00:29:41.447,"GOD, WHAT-- WHAT HAPPENED?"
00:29:41.530,00:29:46.702,"I'VE LOOKED OVER THE BUDGET FOR FISCAL '13, AND WE'VE ALLOCATED 1.6 MILLION FOR SALARIES."
00:29:46.785,00:29:48.704,WE NEED TO CUT THAT IN HALF.
00:29:48.787,00:29:52.666,"WELL, YOU'RE SUGGESTING-- EVELYN, WE'RE GOING TO LET SOME PEOPLE GO."
00:29:52.750,00:29:54.668,THAT WOULD BE HALF OF OUR STAFF.
00:29:54.752,00:29:56.295,WE HAVE TO CARVE OUT SOME ROOM.
00:29:56.378,00:30:01.508,BUT YOU WOULD HAVE TO FIRE SOME ESSENTIAL PEOPLE WHO'VE BEEN WITH US SINCE THE BEGINNING.
00:30:01.592,00:30:05.262,"WE ARE A CHARITY, BUT NOT FOR OUR EMPLOYEES."
00:30:05.345,00:30:11.769,"YOU KNOW, UM, CLAIRE, I HAVE HELD MY TONGUE ABOUT THIS WHOLE INTERNATIONAL THING FOR A WHILE, BUT I DON'T GET IT."
00:30:11.851,00:30:13.562,"I MEAN, WE ARE REALLY GOOD AT WHAT WE DO."
00:30:13.646,00:30:16.231,WHY DO WE HAVE TO TRY AND BE SOMETHING WE'RE NOT?
