start,end,script
00:35:30.795,00:35:33.047,THEY'RE ABOUT TO WALK. THEY WON'T LISTEN TO A WORD I SAY.
00:35:33.131,00:35:34.632,- BOTH UNIONS? - YEAH.
00:35:34.715,00:35:35.925,PUT MARTY ON THE PHONE.
00:35:36.008,00:35:37.051,HANG ON.
00:35:37.135,00:35:38.553,MARTY.
00:35:38.636,00:35:41.681,YEAH. IT'S FRANK?
00:35:44.183,00:35:45.726,"THIS ISN'T WORKING, FRANK."
00:35:45.810,00:35:48.312,"MARTY, YOU HAVE GOT TO KEEP THEM IN THAT ROOM."
00:35:48.396,00:35:49.939,THEY LOST THEIR PATIENCE.
00:35:50.022,00:35:51.941,"THEY'RE UPSET YOU'RE NOT IN THE ROOM, FRANK."
00:35:52.024,00:35:54.152,"- I'LL BE BACK THIS AFTERNOON. - NO, IT'S TOO LATE."
00:35:54.235,00:35:58.614,"LOOK, TELL THEM I'LL COME DOWN ON SUBSIDIES FOR CHARTER SCHOOLS."
00:35:58.698,00:36:01.617,"EVEN SO, THEY'RE ANGRY ABOUT THE PERFORMANCE STANDARDS."
00:36:01.701,00:36:03.202,WE'RE NOT EVEN HALFWAY THROUGH THIS THING.
00:36:03.286,00:36:09.375,"THERE'S SO MUCH IN IT THAT THEY-- TELL THEM THAT I'LL ROLL OVER ON PERFORMANCE STANDARDS, FIVE-YEAR INTERVALS."
00:36:09.458,00:36:14.380,"IT SHOULD BE YOU TELLING THEM THAT, FRANK, YOU HERE, AT THIS TABLE."
00:36:14.463,00:36:18.301,"I KNOW THAT. I'M DOING THE BEST I CAN, BUT I CAN'T BE IN TWO PLACES AT ONCE."
00:36:18.384,00:36:26.893,"NOW, LOOK. I PROMISE YOU, IF YOU KEEP THEM IN THAT ROOM, WE WILL GET THROUGH THIS HUMP AS SOON AS I GET BACK."
00:36:26.976,00:36:29.979,"MARTY, YOU ARE THEIR LOBBYIST. YOU KNOW WHAT'S BEST FOR THEM."
00:36:30.062,00:36:32.190,SAVE THEM FROM THEMSELVES.
00:36:34.150,00:36:36.652,"OKAY, I'LL SEE WHAT I CAN DO."
00:36:38.905,00:36:40.239,STAMPER.
00:36:40.323,00:36:45.119,DO NOT LET SPINELLA OUT OF YOUR SIGHT AND LOCK THE GODDAMN DOORS IF YOU HAVE TO.
00:36:45.203,00:36:46.787,YOU GOT IT.
00:36:50.666,00:36:52.251,I KNOW YOU'RE A BUSY MAN. I HOPE WE'RE NOT KEEPING YOU.
00:36:52.335,00:36:54.253,"NO, NO, NO, I'VE GOT ALL THE TIME IN THE WORLD."
00:36:54.337,00:36:56.797,THIS IS HAM AND THESE ARE TURKEY.
00:36:56.881,00:36:58.883,AND THERE'S SOME POTATO SALAD.
00:36:58.966,00:37:01.135,SHALL WE HAVE A PRAYER?
00:37:01.219,00:37:02.553,GRACIOUS LOVING GOD...
00:37:02.637,00:37:04.222,HAVE YOU HAD THIS BEFORE?
00:37:04.305,00:37:07.099,THIS IS THE THIRD TIME. I'M USED TO IT BY NOW.
00:37:07.183,00:37:09.435,"WELL, I'M NOT USED TO IT, BUT IT BEATS MALARIA."
00:37:09.518,00:37:10.978,YOU'VE HAD MALARIA.
00:37:11.062,00:37:12.104,IN ZIMBABWE.
00:37:12.188,00:37:13.564,THAT TOOK ME OUT FOR A MONTH.
00:37:13.648,00:37:16.984,YOU MAKE A LOT OF SACRIFICES.
00:37:17.068,00:37:18.819,I DON'T SEE IT AS A SACRIFICE.
00:37:18.903,00:37:23.199,YOU TURNED DOWN A SIX-FIGURE SALARY AT GOOGLE TO START YOUR OWN NON-PROFIT.
00:37:23.282,00:37:25.451,PEOPLE DON'T GET MALARIA IN PALO ALTO.
00:37:28.788,00:37:30.414,YOU DO YOUR RESEARCH.
00:37:30.498,00:37:32.625,WHEN IT'S SOMEONE I CARE ABOUT.
00:37:35.044,00:37:39.048,"CLAIRE, I TURNED DOWN THAT JOB BECAUSE I WOULD'VE HATED MYSELF."
00:37:39.131,00:37:41.133,"IT WAS A LOT OF MONEY, BUT FOR WHAT?"
00:37:41.217,00:37:45.680,SO THEY COULD FULFILL THEIR DIVERSITY QUOTA WITH AN ASIAN GIRL PEDDLING A STANFORD DEGREE?
00:37:45.763,00:37:46.889,NOT JUST ANY ASIAN GIRL.
00:37:46.973,00:37:49.558,A VALEDICTORIAN.
00:37:49.642,00:37:52.645,LET ME OFFER YOU WHAT GOOGLE COULDN'T.
00:37:52.728,00:38:01.195,I KNOW WHAT IT IS TO BE CAPABLE AND BEAUTIFUL AND AMBITIOUS AND BE ON PEOPLE LIKE SERGEY AND LARRY'S CHECKLIST OF THINGS THAT LOOK GOOD TO HAVE ON A SHELF.
00:38:05.241,00:38:07.535,I'M NOT TRYING TO ACQUISITION YOU.
00:38:07.618,00:38:12.331,"WHAT I SEE IN YOU IS A WOMAN I ADMIRE, WHICH DOESN'T HAPPEN OFTEN."
00:38:14.375,00:38:15.876,I WANT TO ENABLE YOU.
00:38:15.960,00:38:21.674,"I WANT TO CLEAR THE WAY FOR YOU SO THAT YOU CAN ACHIEVE WHAT YOU WANT TO ACHIEVE, ON YOUR OWN TERMS."
00:38:24.260,00:38:25.845,THANKS FOR THE TEA.
00:38:27.430,00:38:30.808,AND I WILL SEND A CAR TO PICK YOU UP FOR THE DOCTOR TOMORROW.
00:38:30.891,00:38:34.979,"WHEN YOU'RE BACK ON YOUR FEET, DO YOU THINK MAYBE WE CAN WORK SOMETHING OUT?"
00:38:39.734,00:38:41.652,"YES, I THINK WE COULD."
00:38:44.739,00:38:46.657,THAT'S HER AT JUNIOR PROM.
00:38:48.159,00:38:49.702,BEAUTIFUL.
00:38:53.998,00:38:56.375,HERE SHE IS IN HER LETTER JACKET.
00:38:56.459,00:39:00.713,SHE MADE VARSITY AS A FRESHMAN.
00:39:00.796,00:39:02.590,I REMEMBER THE DAY SHE FOUND OUT.
00:39:02.673,00:39:04.258,COACH CALLED.
00:39:04.342,00:39:06.927,JESSIE STARTS JUMPING UP AND DOWN.
00:39:07.011,00:39:09.263,"MOM, GUESS WHAT?"
00:39:14.977,00:39:16.187,I'M SORRY.
00:39:16.270,00:39:18.105,DON'T BE. IT'S FINE.
00:39:19.648,00:39:20.733,WHY ARE WE DOING THIS?
00:39:20.816,00:39:26.364,"HONESTLY, WHAT'S TO BE GAINED IN DREDGING UP ALL THIS STUFF?"
00:39:26.447,00:39:30.201,REMEMBERING THE GOOD THINGS HELPS SOMETIMES-- NOT WHEN IT PUTS MY WIFE IN TEARS.
00:39:31.952,00:39:34.622,"I APPRECIATE WHAT YOU SAID AT THE CHURCH, BUT IT DOESN'T DO US ANY GOOD."
00:39:34.705,00:39:36.123,NEITHER DOES THIS.
00:39:36.207,00:39:37.666,"WELL, WHAT CAN I DO TO HELP?"
00:39:37.750,00:39:39.293,YOU CAN'T DO ANYTHING.
00:39:39.377,00:39:41.087,SHE'S GONE.
00:39:41.170,00:39:48.928,"YOU'RE RIGHT. I CAN'T CHANGE THAT, BUT I CAN MAKE SURE THE CITY OFFERS YOU A SIZABLE SETTLEMENT."
00:39:49.011,00:39:50.638,YOU MEAN BUY US OFF?
00:39:50.721,00:39:54.475,"NO, I MEAN HELP YOU AVOIDING YEARS OF COURT BATTLES."
00:39:54.558,00:39:56.310,JESSICA WAS GOING TO GO TO FURMAN.
00:39:56.394,00:39:58.396,IS THAT RIGHT? ON A VOLLEYBALL SCHOLARSHIP?
00:39:58.479,00:40:00.314,"YES, A FULL RIDE."
00:40:00.398,00:40:05.778,"WELL, I SPOKE TO THE PRESIDENT OF THE UNIVERSITY THIS MORNING, AND WE'D LIKE TO CREATE A NEW SCHOLARSHIP IN YOUR DAUGHTER'S NAME."
00:40:05.861,00:40:07.029,IF YOU'D LIKE THAT.
00:40:07.113,00:40:08.239,IT'S ENTIRELY UP TO YOU.
00:40:08.322,00:40:12.576,"BUT, MOST IMPORTANTLY, WE HAVE TO MAKE SURE THAT THIS NEVER HAPPENS AGAIN."
00:40:12.660,00:40:18.791,"WE'VE GOT SAFETY BILLBOARDS GOING UP, WE'LL STOP LIGHTING THE TOWER AT NIGHT, AND WE'RE PUTTING THE GUARD RAILS IN."
00:40:18.874,00:40:22.336,SHOULD'VE DONE ALL THAT BEFORE SHE RAN OFF THE ROAD.
00:40:22.420,00:40:25.339,"WOULD YOU LIKE ME TO RESIGN, MR. MASTERS?"
00:40:27.133,00:40:28.801,"JUST SAY THE WORD, AND IT'S DONE."
00:40:28.884,00:40:30.970,IF IT WILL BRING YOU ANY SATISFACTION.
00:40:41.564,00:40:48.446,"I ASKED THE REVEREND ONCE, WHAT ARE WE SUPPOSED TO DO IN THE FACE OF SO MUCH SENSELESS PAIN?"
00:40:48.529,00:40:58.831,"AND HE SAID TO ME, WHAT ELSE CAN WE DO BUT TAKE WHAT SEEMS MEANINGLESS AND TRY TO MAKE SOMETHING MEANINGFUL FROM IT."
00:40:58.914,00:41:00.541,HE'S RIGHT.
00:41:00.624,00:41:04.462,THAT'S HOW GOD WORKS-- THROUGH US.
00:41:06.172,00:41:08.924,WILL YOU LET ME WORK FOR YOU?
00:41:15.639,00:41:19.602,WHAT YOU HAVE TO UNDERSTAND ABOUT MY PEOPLE IS THAT THEY ARE A NOBLE PEOPLE.
00:41:19.685,00:41:22.313,HUMILITY IS THEIR FORM OF PRIDE.
00:41:22.396,00:41:32.198,"IT IS THEIR STRENGTH, IT IS THEIR WEAKNESS, AND IF YOU CAN HUMBLE YOURSELF BEFORE THEM, THEY WILL DO ANYTHING YOU ASK."
00:41:36.118,00:41:38.078,TELL US MORE ABOUT THE SCHOLARSHIP.
00:42:03.145,00:42:05.689,- HEY. - HEY.
00:42:05.773,00:42:07.066,WHAT ARE YOU DOING?
00:42:07.149,00:42:08.943,- WORKING. - ON WHAT?
00:42:09.026,00:42:11.820,"THE, UH, BRACK COMMISSION STUFF."
00:42:11.904,00:42:13.864,I'M BEHIND ON IT.
00:42:13.948,00:42:15.991,IT'S SUNDAY.
00:42:18.160,00:42:20.579,YOU DON'T USUALLY WORK ON THE WEEKEND.
00:42:20.663,00:42:22.456,"WELL, NOW I DO."
00:42:22.540,00:42:25.251,"THERE'S, UH, COFFEE IN THE KITCHEN. YOU WANT SOME?"
00:42:28.337,00:42:29.588,PETER...
00:42:33.133,00:42:34.218,PETER.
00:42:35.594,00:42:39.473,"IF I DECIDE TO STAY, IT'S BECAUSE IT'S WHAT I WANT, NOT WHAT YOU WANT."
00:42:44.603,00:42:45.854,I UNDERSTAND.
00:42:49.775,00:42:51.986,WHICH DRAFT ARE YOU READING OF THE WRITTEN TESTIMONY?
00:42:52.069,00:42:53.404,THE ONE YOU SENT ON THURSDAY.
00:42:53.487,00:42:55.614,I ACTUALLY CHANGED IT ON FRIDAY.
00:42:55.698,00:42:56.991,CAN I SHOW YOU?
00:42:59.577,00:43:06.041,"YEAH, I WAS THINKING THAT WE COULD START WITH JOB NUMBERS AND THEN GO TO ECONOMIC MULTIPLIERS INSTEAD OF THE OTHER WAY AROUND."
00:43:06.125,00:43:07.626,WHAT DO YOU THINK?
00:43:07.710,00:43:09.753,LET'S SEE WHAT IT LOOKS LIKE.
00:43:28.230,00:43:29.648,PICTURE THIS...
00:43:29.732,00:43:34.862,A 17-YEAR-OLD GIRL TRAVELING AT 60 MILES AN HOUR SPINS OUT OF CONTROL IN NO TRAFFIC.
00:43:34.945,00:43:36.280,SHE HITS A GUARD RAIL.
00:43:36.363,00:43:45.205,"BUT IF SHE'S WEARING HER SEATBELT, WHICH SHE WAS, AND HER CAR DOESN'T ROLL OVER THREE TIMES DOWN A 20-FOOT DITCH, WHICH IT DID, THEN THAT YOUNG WOMAN IS STILL ALIVE."
00:43:46.624,00:43:48.250,BUT YOU KNOW WHAT?
00:43:48.334,00:43:52.838,"THE COUNTY ADMINISTRATOR DIDN'T BUILD THOSE GUARD RAILS, SO NOW SHE'S DEAD."
00:43:52.921,00:43:54.632,WE LOOKED UP THE STATUTE.
00:43:54.715,00:43:57.468,GUARD RAILS ARE UNDER COUNTY SUPERVISION.
00:43:59.720,00:44:01.847,ARE YOU TRYING TO TURN THIS AROUND ON ME?
00:44:01.930,00:44:03.140,"THAT'S NOT ALL, ORRIN."
00:44:03.265,00:44:04.558,YOUR EASEMENT.
00:44:04.642,00:44:09.021,"YOU SEE, EVERY COUPLE OF YEARS THE PIEDMONT ELECTRIC, THEY APPLY TO BRING POWER LINES THROUGH GAFFNEY."
00:44:09.104,00:44:10.814,THE ROUTE COMES RIGHT THROUGH YOUR LOT.
00:44:10.898,00:44:14.652,"NOW, GENE AND I ALWAYS FIGHT THEM OFF, BUT THIS YEAR, IF THEY WERE TO REAPPLY, HMM..."
00:44:14.735,00:44:16.195,EMINENT DOMAIN.
00:44:16.278,00:44:19.323,IT WOULD BE SUCH A SHAME TO HAVE TO TEAR DOWN THIS BEAUTIFUL HOME.
00:44:19.448,00:44:20.908,"FUCK YOU, FRANK."
00:44:20.991,00:44:24.495,YOU CAN'T JUST ROLL UP ON MY PROPERTY AND ACT LIKE YOU OWN IT.
00:44:29.792,00:44:31.210,"OH, BUT I CAN."
00:44:31.293,00:44:32.419,WE JUST DID.
00:44:35.923,00:44:38.592,I'VE WON THIS DISTRICT 11 TIMES.
00:44:38.676,00:44:41.679,DO YOU THINK THAT'S JUST LUCK AND A FIRM HANDSHAKE?
00:44:41.762,00:44:44.556,BUT I'LL TELL YOU WHAT. I'M NOT A VINDICTIVE PERSON.
00:44:44.640,00:44:49.561,"I DON'T LIKE FOR ANYBODY TO LOSE IF EVERYBODY CAN WIN, SO I'M GOING TO HELP YOU GET ELECTED IN THE FOURTH."
00:44:49.645,00:44:51.605,YOU GET TO KEEP YOUR HOUSE. I KEEP THE FIFTH.
00:44:51.688,00:44:54.149,"WE PUT THE PEACHOID BEHIND US, AND EVERYBODY'S HAPPY."
00:44:54.233,00:44:56.276,WHAT DO YOU SAY?
00:44:56.360,00:44:57.694,"WELL, THAT'S ALL RIGHT. YOU THINK ABOUT IT."
00:44:57.778,00:44:59.822,I'M SURE YOU'LL DO THE RIGHT THING.
00:44:59.905,00:45:02.658,"OH, AND I'M LOOKING FORWARD TO HAVING YOU IN CONGRESS, ORRIN."
00:45:02.741,00:45:05.702,IT'S ALWAYS GOOD TO HAVE FRIENDS ON THE OTHER SIDE OF THE AISLE.
00:45:26.682,00:45:29.017,I'VE BEEN OFFERED A SPOT ON NIGHTLINE.
00:45:31.186,00:45:32.896,I DON'T WANT IT. I NEED IT.
00:45:32.980,00:45:34.398,CLOSE YOUR EYES.
00:45:36.608,00:45:38.277,OKAY.
00:45:38.360,00:45:41.530,IT'S 11:25. NIGHTLINE IS ABOUT TO COME ON.
00:45:41.613,00:45:43.574,MILLIONS OF PEOPLE ARE WATCHING.
00:45:43.657,00:45:45.033,"WHERE ARE YOU, HOME?"
00:45:45.117,00:45:46.994,NO.
00:45:47.077,00:45:48.412,AT THE STUDIO?
00:45:48.495,00:45:49.913,YES.
00:45:49.997,00:45:51.457,AND WHAT DO YOU SEE?
00:45:51.540,00:45:53.333,I SEE LIGHTS.
00:45:53.417,00:45:54.751,I SEE A CAMERA.
00:45:54.835,00:45:56.795,AND THAT LITTLE RED DOT GOES ON.
00:45:56.879,00:45:59.089,TELL ME WHAT YOU HEAR?
00:45:59.173,00:46:00.966,I HEAR MY VOICE.
00:46:01.049,00:46:03.927,"AND THOSE MILLIONS OF PEOPLE, WHAT DO THEY HEAR?"
00:46:04.011,00:46:05.929,MY VOICE.
00:46:06.013,00:46:07.514,AND WHAT DO THEY SEE?
00:46:07.598,00:46:09.683,MY FACE.
00:46:09.766,00:46:11.185,SO YOU DON'T NEED MY ADVICE.
00:46:14.146,00:46:15.314,HAMMERSCHMIDT'S GOING TO FREAK.
00:46:15.397,00:46:19.193,"YOU DON'T WANT TO WORK ANYWHERE YOU'RE NOT WILLING TO GET FIRED FROM, ZOE."
00:46:19.276,00:46:22.821,TREADING WATER'S THE SAME AS DROWNING FOR PEOPLE LIKE YOU AND ME.
00:46:22.905,00:46:24.239,GOOD LUCK. I'LL BE WATCHING.
00:46:24.323,00:46:25.782,"- HEY, WAIT. - YES?"
00:46:25.866,00:46:26.992,WHEN DO YOU GET BACK?
00:46:27.075,00:46:30.162,"WHEN I GET BACK, YOU'LL KNOW."
00:46:34.082,00:46:36.168,"HELLO, NANCY."
00:46:36.251,00:46:38.629,"WELCOME BACK, SIR. LINDA VASQUEZ CALLED FOR YOU."
00:46:38.712,00:46:40.130,TELL HER I'LL CALL HER IN A COUPLE HOURS WITH AN UPDATE.
00:46:40.214,00:46:41.715,- VERY WELL. - SIR?
00:46:41.798,00:46:44.968,"UNLESS YOU NEED ANYTHING, KYLE HAS YOU COVERED."
00:46:45.052,00:46:46.720,"NO, GO HOME."
00:46:46.803,00:46:48.096,YOU DID WELL THIS WEEKEND.
00:46:48.180,00:46:49.723,"THANK YOU, SIR."
00:46:49.806,00:46:52.476,"OH, AND BEFORE YOU GO HOME, CAN YOU DO ME A FAVOR?"
00:46:52.559,00:46:55.521,WOULD YOU SWING BY MY HOUSE AND MAKE SURE THESE GET TO CLAIRE?
00:46:55.604,00:46:57.147,"YES, SIR."
00:46:57.231,00:46:59.274,"AND THANK YOU, SIR, FOR BEING SO PATIENT."
00:47:06.573,00:47:07.866,OKAY.
00:01:45.355,00:01:47.608,SO THAT WE CAN LOCK DOWN PERFORMANCE STANDARDS.
00:01:47.691,00:01:50.652,YOU DON'T TOSS AROUND THEIR RIGHT TO COLLECTIVE BARGAINING LIKE A POKER CHIP.
00:01:50.736,00:01:52.529,"IF WE DON'T, THEY WON'T BUDGE."
00:01:52.613,00:01:54.406,HAS MARTY SPINELLA SEEN THIS?
00:01:54.489,00:01:56.033,NOT THE VERSION I SHOWED HIM.
00:01:56.116,00:01:57.576,SO YOU LIED TO HIS FACE.
00:01:57.659,00:02:00.161,NO. I REVISED THE PARAMETERS OF MY PROMISE.
00:02:00.245,00:02:01.246,WHICH IS LYING.
00:02:02.664,00:02:04.959,"THE SORT YOU'RE WELL VERSED IN, BOB."
00:02:05.042,00:02:06.418,HERE'S SOME POLITICS FOR YOU.
00:02:06.501,00:02:10.255,"I ALLOW THIS TO GO TO THE FLOOR, I GET MURDERED NEXT ELECTION."
00:02:12.257,00:02:16.971,"LAST TIME I CHECKED, I WAS STILL A DEMOCRAT, FRANK, AND YOU WERE TOO."
00:02:17.054,00:02:19.222,ARE YOU TELLING ME THE PRESIDENT ISN'T?
00:02:19.306,00:02:21.976,BECAUSE HE'S ACTING A HELL OF A LOT LIKE A REPUBLICAN.
00:02:22.059,00:02:23.769,I THOUGHT BOB WAS ON OUR TEAM.
00:02:23.852,00:02:26.105,JUST SIT HIM DOWN WITH THE PRESIDENT TEN MINUTES.
00:02:26.229,00:02:27.940,WE WON'T TOUCH COLLECTIVE BARGAINING.
00:02:28.023,00:02:31.276,"ARE YOU INTERESTED IN MY ADVICE ON THIS, OR DO YOU JUST WANT ME TO DELIVER THE MESSAGE?"
00:02:31.359,00:02:33.153,"I'M ALWAYS INTERESTED IN YOUR ADVICE, FRANK."
00:02:33.236,00:02:35.530,BIRCH IS RIGHT. YOU'RE GOING TO BURN A LOT OF BRIDGES.
00:02:35.614,00:02:38.283,THE PRESIDENT SHOULD AT LEAST SIT DOWN WITH HIM AND LET HIM MAKE HIS CASE.
00:02:38.366,00:02:44.623,YOU TELL BOB I'M HAPPY TO SCHEDULE A MEETING WITH THE PRESIDENT ONCE HE'S SET A DATE TO PUT THIS BILL ON THE FLOOR.
00:02:44.706,00:02:46.249,THE PRESIDENT CAN FUCK HIMSELF.
00:02:46.333,00:02:48.669,THIS IS THE PLATFORM. IT'S WHAT HE RAN ON.
00:02:48.752,00:02:50.462,I DON'T GIVE A SHIT WHAT HE RAN ON.
00:02:50.545,00:02:53.090,HE CAN'T STEAMROLL THE HOUSE.
00:02:53.172,00:02:55.634,"AND DON'T FORGET, YOU WORK FOR ME, FRANK, NOT HIM."
00:02:55.717,00:02:59.429,"IF HE WANTS SOMETHING ON THE FLOOR, HE'S GONNA HAVE TO TALK TO ME DIRECTLY."
00:02:59.513,00:03:06.770,"I KNOW YOU TAKE A LOT OF PRIDE IN YOUR MANHOOD, BOB, AND IT'S IMPRESSIVE, BUT AS BIG AS IT IS, LINDA CAN STILL SHUT THE DOOR ON IT."
00:03:08.563,00:03:11.025,TELL VASQUEZ THE BILL IS DEAD.
00:03:14.695,00:03:17.447,THAT'S NOT THE FIRST TIME HE'S PULLED THAT STUNT ON ME.
00:03:17.531,00:03:21.409,"PROBABLY SHOULD HAVE HELD MY TONGUE, BUT I JUST COULDN'T RESIST THE CHANCE TO SEE HIM SHRIVEL."
00:03:25.288,00:03:26.289,GOOD MORNING.
00:03:26.373,00:03:27.499,FRANK.
00:03:27.582,00:03:29.877,MR. PRESIDENT.
00:03:29.960,00:03:31.795,LINDA.
00:03:31.879,00:03:35.256,LET'S STRIKE THE ANTI-COLLECTIVE BARGAINING PROVISION FROM THE BILL.
00:03:35.340,00:03:38.052,"LINDA AND I HAVE TALKED IT OVER, AND I THINK SHE'S RIGHT ON THIS."
00:03:38.135,00:03:39.928,TELL BOB HE CAN COME BY TOMORROW AFTERNOON.
00:03:40.012,00:03:43.431,"SIR, RESPECTFULLY, I DO NOT THINK YOU SHOULD GIVE HIM THE SATISFACTION."
00:03:43.515,00:03:44.558,"WELL, GIVE ME A REASON."
00:03:44.641,00:03:46.060,MAKES US APPEAR WEAK.
00:03:46.143,00:03:48.770,THERE'S AN OPPORTUNITY FOR YOU TO ESTABLISH YOUR SUPREMACY.
00:03:48.854,00:03:50.271,WE SHOULD SEIZE IT.
00:03:54.776,00:03:55.861,"FRANK, WE DISCUSSED THIS."
00:03:55.944,00:04:00.532,"SIR, IF YOU GIVE IN NOW, BIRCH WILL WALK ALL OVER YOU FOR THE NEXT FOUR YEARS."
00:04:00.615,00:04:02.993,I CAN GET THIS BILL ON THE HOUSE FLOOR AS IS.
00:04:03.077,00:04:04.285,I PROMISE YOU.
00:04:08.373,00:04:09.875,"ALL RIGHT, FRANK. SHOW ME WHAT YOU CAN DO."
00:04:09.958,00:04:10.959,"THANK YOU, MR. PRESIDENT."
00:04:15.505,00:04:17.966,THAT WAS HER TRYING TO TAKE CREDIT FOR MY IDEA.
00:04:20.761,00:04:24.556,I WILL NOT ALLOW HER TO SELL MY GOODS WHEN SHE CUTS ME OUT OF THE PROFITS.
00:04:24.639,00:04:26.433,I SPECIFICALLY TOLD HER NO INTERVIEWS.
00:04:26.516,00:04:29.310,SHE DISOBEYED ME-- NOT JUST ONCE.
00:04:29.394,00:04:30.562,AT LEAST EIGHT TIMES IN THE PAST MONTH.
00:04:30.645,00:04:32.106,"SHE STAYS, TOM."
00:04:34.566,00:04:36.526,I SAID SHE STAYS.
00:04:36.610,00:04:38.028,THERE ARE RULES.
00:04:38.112,00:04:39.154,THERE'S A WAY OF DOING THINGS.
00:04:39.238,00:04:43.533,IF I HAVE A REPORTER-- TWO FRESHMEN GIRLS ARE MOVING INTO THEIR DORM ROOM TOGETHER.
00:04:43.617,00:04:46.661,"ONE OF THEM'S FROM GEORGIA, ONE OF THEM'S FROM CONNECTICUT."
00:04:46.745,00:04:49.748,THE GIRL FROM CONNECTICUT'S HELPING HER MOTHER PUT UP CURTAINS.
00:04:49.831,00:04:53.418,"THE GIRL FROM GEORGIA TURNS TO THEM AND SAYS, HI. WHERE Y'ALL FROM?"
00:04:53.501,00:04:58.298,"THE GIRL FROM CONNECTICUT SAYS, WE'RE FROM A PLACE WHERE WE KNOW NOT TO END A SENTENCE WITH A PREPOSITION."
00:04:58.381,00:05:02.177,"THE GIRL FROM GEORGIA SAYS, OH, BEG MY PARDON."
00:05:02.261,00:05:03.386,WHERE Y'ALL FROM...
00:05:03.470,00:05:04.471,CUNT?
00:05:04.554,00:05:06.140,YOU HEARD THAT ONE BEFORE?
00:05:07.724,00:05:10.351,A VERSION OF IT. WITH SOFTER LANGUAGE.
00:05:10.435,00:05:12.146,"TOM, WE DON'T NEED PEOPLE WHO FOLLOW THE RULES."
00:05:12.229,00:05:13.939,WE NEED PEOPLE WITH PERSONALITY.
00:05:14.022,00:05:17.358,"WE WANT ZOE'S FACE, HER ENERGY."
00:05:17.442,00:05:19.569,WE WANT TO GET HER ON TV AS MUCH AS POSSIBLE.
00:05:19.653,00:05:22.114,IT HELPS US CUT THROUGH THE NOISE.
00:05:22.197,00:05:23.282,SEE WHAT I'M SAYING?
00:05:26.493,00:05:28.703,"THANK YOU, TOM."
00:05:31.498,00:05:32.833,THANK YOU.
00:05:38.337,00:05:39.338,COME IN.
00:05:41.925,00:05:47.222,"OH. I, UH, THOUGHT-- I WANTED TO SAY HI TO EVELYN."
00:05:47.306,00:05:49.183,EVELYN?
00:05:49.266,00:05:50.642,THIS WAS HER OFFICE.
00:05:50.725,00:05:52.644,I DON'T THINK SHE WORKS HERE ANYMORE.
00:05:52.727,00:05:54.437,- OH. - GILLIAN COLE.
00:05:54.521,00:05:56.064,I CAME ON BOARD A COUPLE WEEKS AGO.
00:05:56.148,00:05:57.565,GILLIAN. WORLD WELL.
00:05:57.649,00:05:59.234,YEAH.
00:05:59.318,00:06:00.443,I'VE HEARD GREAT THINGS.
00:06:00.527,00:06:01.528,REMY DANTON.
00:06:01.611,00:06:03.446,YOU WORK WITH CLAIRE?
00:06:03.530,00:06:04.531,IN A WAY.
00:06:04.614,00:06:06.033,"HELLO, REMY."
00:06:06.116,00:06:07.534,CLAIRE.
00:06:07.617,00:06:08.994,I SEE YOU'VE MET GILLIAN.
00:06:09.077,00:06:10.411,"YES, JUST NOW."
00:06:10.495,00:06:13.290,"SHE'S DOING FANTASTIC WORK FOR US, AS YOU CAN SEE."
00:06:13.372,00:06:21.506,"RED IS COMPLETED WELLS, GREEN, UH, POTENTIAL SITES, YELLOW APPROVED SITES, AND BLUE ARE THE FILTRATION CENTERS."
00:06:21.589,00:06:24.134,NICE. SO YOU LIKING IT HERE?
00:06:24.218,00:06:26.178,YEAH. MY STAFF AND I ARE LOVING IT.
00:06:26.261,00:06:27.637,CLAIRE'S OPENED A LOT OF DOORS FOR US.
00:06:27.721,00:06:29.097,SOUNDS LIKE CLAIRE.
00:06:29.181,00:06:31.099,SHALL WE HEAD TO MY OFFICE?
00:06:31.183,00:06:32.600,"GILLIAN, NICE TO MEET YOU."
00:06:32.684,00:06:34.311,NICE TO MEET YOU.
00:06:35.520,00:06:38.106,THINGS GOT COMPLICATED.
00:06:41.400,00:06:45.989,"I WOULD HAVE THOUGHT YOU'D STEP UP WHEN THINGS WERE DIFFICULT, NOT HOLD THE DONATION HOSTAGE."
00:06:46.073,00:06:47.908,"WELL, THINGS ARE LESS COMPLICATED NOW."
00:06:47.991,00:06:49.784,THE DONATION IS BACK ON THE TABLE.
00:06:52.246,00:06:54.497,I HAD TO FIRE HALF MY STAFF.
00:06:54.581,00:06:55.749,NOW YOU CAN HIRE THEM BACK.
00:06:55.832,00:07:01.755,"SANCORP IS PREPARED TO DOUBLE ITS INITIAL COMMITMENT-- 1.5 MILLION, LUMP SUM, THIS QUARTER."
00:07:01.838,00:07:03.840,- WHY? - PUBLIC RELATIONS. SAME AS BEFORE.
00:07:03.924,00:07:05.759,AND WHAT DO THEY WANT FROM FRANCIS?
00:07:08.636,00:07:09.804,WE'RE ONLY TALKING ABOUT THE C.W.I.
00:07:09.888,00:07:10.931,BUT WHY DOUBLE IT?
00:07:11.014,00:07:12.349,BECAUSE I SAID THEY SHOULD.
00:07:12.432,00:07:14.142,"THE MORE THEY GIVE, THE MORE YOU CAN DO."
00:07:14.226,00:07:16.436,"THE MORE YOU CAN DO, THE BETTER THEY LOOK."
00:07:16.519,00:07:19.398,"AND THAT'S WHY THEY HIRED GLENDON HILL, TO MAKE THEM LOOK GOOD."
00:07:19.480,00:07:21.775,AND THEY ALSO HIRED YOU TO GET TRACTION IN CONGRESS.
00:07:21.858,00:07:23.193,NOT IN THIS CASE.
00:07:23.277,00:07:25.404,"WE WANT A LONG-TERM PARTNERSHIP, CLAIRE."
00:07:25.486,00:07:27.614,THIS IS AN INVESTMENT IN THE FUTURE.
00:07:27.697,00:07:29.324,WE'RE NOT ATTACHING STRINGS.
00:07:32.911,00:07:34.579,THEY'D REALLY LOVE TO MOVE QUICKLY ON THIS.
00:07:34.662,00:07:37.291,I SAID I'LL THINK ABOUT IT.
00:07:37.374,00:07:39.542,"MADELEINE, YOU HAVE TO EMAIL ME THIS SHIT."
00:07:39.626,00:07:41.002,I NEED IT IN WRITING.
00:07:41.086,00:07:43.838,AND WITH MORE THAN AN HOUR'S NOTICE.
00:07:43.922,00:07:47.342,"YEAH, I KNOW THAT, BUT YOU HAVE TO UNDERSTAND WE-- WE HAVE A PLAN."
00:07:55.100,00:07:56.435,FINE.
00:07:57.644,00:07:59.438,YEAH. YEAH. BYE.
00:08:03.233,00:08:08.738,MADELEINE HAS DECIDED TO HAVE A SPUR-OF-THE-MOMENT TRIP TO ORLANDO WITH HER LATEST eHARMONY CATCH.
00:08:08.822,00:08:09.823,"NO HEADS-UP, NO WARNING."
00:08:09.906,00:08:10.949,THE KIDS?
00:08:11.032,00:08:12.742,THEY GET OUT OF SCHOOL AT 2:30.
00:08:12.826,00:08:14.744,I CAN DO THE SHIPBUILDERS MEETING.
00:08:14.828,00:08:16.537,YOU SURE?
00:08:16.621,00:08:18.623,"YEAH, IT'S JUST A PUBLIC AFFAIRS TEAM."
00:08:18.706,00:08:20.625,"I'LL BRIEF YOU, AND THEN YOU CAN CALL THEM TOMORROW."
00:08:20.708,00:08:21.835,GO GET YOUR KIDS.
00:08:36.099,00:08:37.100,HEY.
00:08:42.897,00:08:45.942,REMY CAME BY THIS MORNING. TO THE OFFICE.
00:08:46.026,00:08:47.319,WHAT DOES HE WANT?
00:08:47.402,00:08:48.820,THE DONATION'S BACK ON THE TABLE.
00:08:51.823,00:08:54.201,"- YOU SAID NO, RIGHT? - I DIDN'T."
00:08:54.284,00:08:57.204,"HE DOESN'T WANT ANYTHING FROM YOU, FRANCIS."
00:08:57.287,00:08:59.206,"COME ON, CLAIRE. YOU KNOW BETTER THAN THAT."
00:08:59.289,00:09:00.874,I SPECIFICALLY ASKED.
00:09:00.957,00:09:05.003,"MAYBE NOT RIGHT NOW, BUT LOOK, I INVENTED THIS GUY, ALL RIGHT?"
00:09:05.086,00:09:08.131,IT'S A SLIPPERY SLOPE. YOU OPEN THE-- THINK OF WHAT I CAN DO WITH THIS MONEY.
00:09:08.215,00:09:09.757,I CAN HIRE BACK THE PEOPLE I LET GO.
00:09:09.841,00:09:13.261,I CAN HELP ACCELERATE THE FUNDING FOR THE PROJECTS THAT GILLIAN HAS BROUGHT IN.
00:09:13.345,00:09:15.180,LET'S FIND ANOTHER WAY TO RAISE THE MONEY.
00:09:15.263,00:09:16.764,BUT IT'S RIGHT THERE AT MY FEET.
00:09:16.848,00:09:19.393,"CLAIRE, I HAVE TOO MUCH ON MY PLATE RIGHT NOW."
00:09:19.476,00:09:21.478,I CAN'T HAVE SANCORP BREATHING DOWN MY NECK AGAIN.
00:09:21.561,00:09:24.481,"I CAN'T HAVE REMY-- LOOK, IT IS REMY."
00:09:24.523,00:09:26.607,HE KNOWS ME TOO WELL. IT'S DANGEROUS.
00:09:26.691,00:09:29.652,LOOK AT THE BIGGER PICTURE HERE.
00:09:32.113,00:09:33.114,I'M ASKING.
00:09:33.198,00:09:35.075,NO. YOU'RE NOT.
00:09:40.997,00:09:42.040,CLAIRE.
00:09:43.333,00:09:44.625,I'LL TELL YOU WHAT I TOLD HIM.
00:09:44.709,00:09:46.002,WHICH WAS?
00:09:46.086,00:09:47.128,I'LL THINK ABOUT IT.
00:09:56.596,00:10:00.808,"I KNOW THERE'S BEEN SOME TENSION, AND I'M PROBABLY MORE TO BLAME THAN YOU ARE."
00:10:00.892,00:10:02.519,BUT I'D LIKE TO PUT THAT BEHIND US.
00:10:02.602,00:10:07.023,"ZOE, YOU'RE GOING TO BE OUR NEW WHITE HOUSE CORRESPONDENT."
00:10:08.400,00:10:09.609,WHAT ABOUT JANINE?
00:10:09.692,00:10:11.861,I PROMOTED HER TO MIDWEST BUREAU CHIEF.
00:10:11.945,00:10:13.321,SHE'S OKAY WITH THAT?
00:10:13.405,00:10:14.739,SHE WANTS TO GIVE UP THE WHITE HOUSE?
00:10:14.822,00:10:16.366,IT'S THE DECISION I'VE MADE.
00:10:16.450,00:10:19.911,IT'S JUST THAT JANINE HAS SO MUCH EXPERIENCE.
00:10:19.994,00:10:21.829,I THOUGHT YOU'D BE MORE EXCITED ABOUT THIS.
00:10:21.913,00:10:28.128,I'M SORRY. I-- I JUST THOUGHT YOU BROUGHT ME IN HERE TO... I DON'T KNOW.
00:10:28.211,00:10:29.754,TO FIRE YOU.
00:10:29.837,00:10:31.923,MAYBE.
00:10:32.006,00:10:34.634,WATER UNDER THE BRIDGE.
00:10:34.717,00:10:35.718,WE'RE STARTING OVER.
00:10:37.304,00:10:39.931,SO ARE YOU READY TO TAKE THIS ON?
00:10:41.975,00:10:42.976,CAN I THINK ABOUT IT?
00:10:44.685,00:10:47.606,"PEOPLE USUALLY DON'T HAVE TO THINK ABOUT IT WHEN THEY'RE OFFERED THE WHITE HOUSE, ZOE."
00:10:47.730,00:10:49.065,JUST A DAY OR TWO.
00:10:49.149,00:10:51.859,JANINE IS BOOKED FOR A FLIGHT TO CHICAGO ON FRIDAY.
00:10:51.943,00:10:53.069,I'LL LET YOU KNOW BEFORE THEN.
00:10:53.153,00:10:57.657,"I JUST NEED TO-- THANK YOU. THANK YOU, TOM."
00:11:05.540,00:11:14.090,"DAVID RASMUSSEN IS THE MAJORITY LEADER, WHICH MEANS HE'S ONE STEP ABOVE ME AND ONE BELOW BIRCH, WHICH IS AKIN TO BEING BETWEEN A VERY HUNGRY WOLF AND A VERY QUARRELSOME SHEEP."
00:11:14.174,00:11:17.093,LET'S SEE IF HE STAYS WITH THE HERD OR JOINS THE PACK.
00:11:17.177,00:11:18.970,DAVID. YOU MIND IF I JOIN YOU?
00:11:19.053,00:11:21.389,"PLEASE. A SALAD, HUH?"
00:11:21.473,00:11:23.600,YES. I'M TRYING TO TAKE BETTER CARE OF MYSELF.
00:11:23.682,00:11:24.976,GOOD MAN. DIET?
00:11:25.059,00:11:27.103,"DIET, EXERCISE, EVERYTHING."
00:11:29.147,00:11:31.858,YOU OUGHT TO TAKE BETTER CARE OF YOURSELF TOO.
00:11:31.941,00:11:34.194,"WELL, THEY SHOULD STOP SERVING SUCH GOOD PIZZA."
00:11:34.277,00:11:36.613,"OH, I'M NOT TALKING ABOUT THE FOOD."
00:11:36.695,00:11:38.239,I'M TALKING ABOUT BIRCH.
