start,end,script
00:26:07.941,00:26:10.610,I DON'T KNOW WHY YOU HAD IT ON IN THE FIRST PLACE.
00:26:13.447,00:26:17.159,"I LOVE YOU, FRANCIS."
00:26:17.243,00:26:19.577,I KNOW.
00:26:19.661,00:26:22.915,WE SHOULD SAY THAT MORE OFTEN TO EACH OTHER.
00:26:26.919,00:26:28.795,I NEED TO CLEAR MY HEAD.
00:27:03.456,00:27:05.958,...NORTH AND EAST OF THE AIRPORT.
00:27:06.041,00:27:08.544,I'M GONNA NEED THAT IN TIME FOR THAT MEETING.
00:27:08.626,00:27:10.421,"PETER, LET'S TALK."
00:27:16.469,00:27:19.263,SO. I'VE SPOKEN TO PATRICIA WHITTAKER.
00:27:19.346,00:27:20.973,SHE'S ON BOARD.
00:27:21.056,00:27:24.059,YOU'LL BE GETTING FOUR MILLION IN START-UP FUNDING FROM THE D.N.C.
00:27:24.143,00:27:26.186,I'LL PICK THE TEAM. YOU ANNOUNCE IN AUGUST.
00:27:26.270,00:27:28.606,BUT THE CAMPAIGN STARTS TODAY.
00:27:28.688,00:27:29.982,ARE YOU READY?
00:27:30.065,00:27:32.151,I'VE ALREADY PUT TOGETHER A PLATFORM.
00:27:32.234,00:27:33.944,"IT'S MOSTLY BROAD STROKES, BUT WE CAN HONE IT."
00:27:34.027,00:27:37.531,GOOD. THE FIRST THING WE NEED TO ADDRESS IS YOUR SOBRIETY.
00:27:37.615,00:27:39.074,"OH, YOU DON'T NEED TO WORRY ABOUT THAT."
00:27:39.158,00:27:40.409,HAVE YOU BEEN GOING TO MEETINGS?
00:27:40.493,00:27:42.869,YOU MEAN A.A.?
00:27:42.953,00:27:45.122,- YES. - THAT'S NOT REALLY MY THING.
00:27:45.205,00:27:52.171,"IF YOU WANT MY HELP, THEN GOING TO MEETINGS IS MY ONE REQUIREMENT."
00:27:52.254,00:27:53.880,"I KNOW I HAD A PROBLEM, FRANK."
00:27:53.964,00:27:55.257,I ACCEPT THAT.
00:27:55.341,00:27:59.553,"AND I'VE TAKEN RESPONSIBILITY FOR THAT, BUT I DON'T THINK GOING TO MEETINGS IS NECESSARY."
00:27:59.637,00:28:02.097,"YOU CANNOT WHITE-KNUCKLE YOUR RECOVERY, PETER."
00:28:02.181,00:28:05.142,THIS CAMPAIGN WILL BE THE HARDEST THING YOU'VE EVER DONE IN YOUR LIFE.
00:28:05.225,00:28:06.852,I REALIZE THAT. I'M PREPARED FOR THAT.
00:28:06.935,00:28:09.687,YOU THINK YOU ARE. BUT WE CAN'T TAKE ANY CHANCES.
00:28:09.771,00:28:12.149,THE PARTY'S INVESTING IN YOU.
00:28:12.232,00:28:15.693,I NEED TO MAKE SURE YOU'RE INVESTING IN YOURSELF.
00:28:19.448,00:28:22.451,ALL RIGHT. I'LL DO WHATEVER I HAVE TO DO.
00:28:22.535,00:28:23.701,GOOD. YOU'LL START TOMORROW MORNING.
00:28:23.785,00:28:26.079,- DOUG WILL TAKE YOU. - STAMPER?
00:28:26.163,00:28:27.414,HE'S BEEN SOBER 14 YEARS.
00:28:27.498,00:28:29.082,DOUG HAS A DRINKING PROBLEM?
00:28:29.166,00:28:31.877,HAD. NOT ANYMORE. HE'LL BE YOUR SPONSOR.
00:28:31.960,00:28:33.837,"IN THE MEANTIME, I WANT YOU TO MEET WITH MY WIFE, CLAIRE."
00:28:33.920,00:28:35.381,SHE RUNS THE CLEAN WATER INITIATIVE.
00:28:35.464,00:28:38.717,"SHE'S EXPECTING YOU, SO CLEAR YOUR SCHEDULE AND HEAD OVER THERE NOW."
00:28:38.800,00:28:40.678,FRANK.
00:28:42.137,00:28:43.972,THANK YOU.
00:28:44.056,00:28:46.392,FOR BELIEVING IN ME.
00:28:46.475,00:28:48.935,"YOU'RE GONNA MAKE A GREAT CANDIDATE, PETER."
00:28:58.654,00:29:02.366,OUR GOAL IS TO PASS A WATERSHED ACT FOR THE DELAWARE RIVER.
00:29:02.449,00:29:06.662,"WE DEVELOP THE LAND IN AN ENVIRONMENTALLY-RESPONSIBLE WAY, CREATING JOBS IN THE PROCESS."
00:29:06.745,00:29:08.664,HOW MANY JOBS? THOUSANDS.
00:29:08.747,00:29:11.458,WE'RE AIMING FOR THE $200 MILLION MARK.
00:29:11.542,00:29:12.876,WE GOT A LOT OF WORK TO DO.
00:29:12.959,00:29:17.005,"WE DO, BUT YOU CAN START WITH THE CONGRESSMAN WHOSE DISTRICTS FALL WITHIN THE WATERSHED."
00:29:17.089,00:29:18.757,DO YOU HAVE A DRAFT OF THE BILL YOU CAN SHOW ME?
00:29:18.840,00:29:20.718,WE HAVEN'T SPONSORED ANY ENVIRONMENTAL LEGISLATION.
00:29:24.555,00:29:26.848,WE'LL DRAFT IT IN CONSULTATION WITH YOUR STAFF.
00:29:26.932,00:29:28.601,GILLIAN WILL BE THE POINT PERSON ON OUR END.
00:29:28.684,00:29:30.269,I DON'T HAVE ANY LEGISLATION EXPERIENCE.
00:29:30.352,00:29:31.353,- I'LL HELP YOU. - WHEN DO WE START?
00:29:31.437,00:29:32.854,WE JUST DID.
00:29:32.938,00:29:34.648,WILL YOU INTRODUCE HIM TO THE RESEARCH TEAM?
00:29:34.732,00:29:37.192,- I'LL BE THERE IN ONE SECOND. - SURE.
00:29:46.326,00:29:47.536,I WANT IT OVER.
00:29:47.620,00:29:48.828,AS SOON AS POSSIBLE.
00:29:48.912,00:29:50.163,"GUT THE BILL, FRANK."
00:29:50.247,00:29:51.498,DO WHATEVER'S NECESSARY TO END THIS.
00:29:51.582,00:29:54.960,"MR. PRESIDENT, IF WE GIVE IN NOW, THE PUBLIC WON'T CREDIT YOU WITH A VICTORY."
00:29:55.043,00:29:58.046,NOT EVEN A HOLLOW ONE. THEY'LL CHALK IT UP AS A COLOSSAL DEFEAT.
00:29:58.130,00:29:59.548,"WELL, THAT'S ON YOU, FRANK."
00:29:59.632,00:30:01.967,YOU LET THIS SITUATION DEVOLVE TO WHERE IT IS.
00:30:02.050,00:30:05.763,I'VE ALREADY BEEN BLAMED FOR THE LARGEST TEACHERS' STRIKE IN U.S. HISTORY.
00:30:05.845,00:30:09.141,I WON'T BE HELD ACCOUNTABLE FOR IT DRAGGING ON MONTHS AND MONTHS.
00:30:09.224,00:30:11.435,"MR. PRESIDENT, WE HAVE TO END THIS STRIKE ON YOUR TERMS."
00:30:11.518,00:30:12.728,NOT ANYONE ELSE'S.
00:30:12.811,00:30:16.982,HOW? BY DEBATING MARTY SPINELLA ON CNN?
00:30:18.108,00:30:20.778,"SIR, YOU HAVE PLACED YOUR FAITH IN ME THUS FAR."
00:30:20.860,00:30:22.696,I WOULD ASK THAT YOU CONTINUE TO DO SO.
00:30:22.780,00:30:26.074,"WHATEVER YOU'RE DOING, FRANK, ISN'T WORKING, SO I'M STEPPING IN."
00:30:26.158,00:30:27.576,GUT THE BILL. LIKE LINDA SAID.
00:30:31.580,00:30:35.501,"I'M SORRY, MR. PRESIDENT, BUT I WILL NOT DO THAT."
00:30:36.960,00:30:39.755,"ARE YOU LETTING PRIDE CLOUD YOUR JUDGMENT, FRANK?"
00:30:39.838,00:30:43.550,"RESPECTFULLY, SIR, YOU'RE ALLOWING FEAR TO CLOUD YOURS."
00:30:43.634,00:30:47.763,NOT AN EASY THING TO SAY NO TO THE MOST POWERFUL MAN IN THE FREE WORLD.
00:30:47.846,00:30:52.017,BUT SOMETIMES THE ONLY WAY TO GAIN YOUR SUPERIOR'S RESPECT IS TO DEFY HIM.
00:30:57.105,00:30:58.774,"WHAT DO WE HAVE ON THE SCHEDULE, LINDA?"
00:30:58.816,00:31:00.526,YOUR MEETING WITH THE...
00:31:00.609,00:31:01.943,"THANK YOU, MR. PRESIDENT."
00:31:02.027,00:31:03.529,- DO YOU HAVE MY BRIEFING? - RIGHT HERE.
00:31:03.612,00:31:04.904,GOOD. LET'S LOOK IT OVER.
00:31:07.533,00:31:09.827,HI. HOW'D IT GO WITH PETER?
00:31:11.704,00:31:12.871,IS HE GAME?
00:31:12.954,00:31:14.164,COMPLETELY.
00:31:14.247,00:31:15.791,UGH. THANK YOU.
00:31:15.874,00:31:17.292,THAT'S A BIG WEIGHT OFF MY SHOULDERS.
00:31:17.376,00:31:18.460,YOU SOUND TIRED.
00:31:18.544,00:31:20.420,TIRED. IMPATIENT.
00:31:20.504,00:31:22.005,WHAT CAN I DO?
00:31:22.088,00:31:24.341,NOTHING. THIS ONE'S UP TO FATE.
00:31:24.424,00:31:27.511,I DON'T LIKE WHEN WE LEAVE THINGS TO FATE.
00:31:27.594,00:31:29.429,NEITHER DO I.
00:31:29.513,00:31:32.808,DOES THAT MEAN I'M GONNA HAVE THE BED TO MYSELF TONIGHT?
00:31:32.891,00:31:34.685,PROBABLY.
00:31:34.768,00:31:36.436,CAN'T DOUG MAN THE FORT?
00:31:36.520,00:31:39.147,"WELL, HE COULD, BUT I'D JUST TOSS AND TURN."
00:31:39.231,00:31:41.859,"IF I'M NOT GONNA SLEEP, I MIGHT AS WELL NOT SLEEP HERE."
00:31:41.941,00:31:43.736,"WELL, I'LL LEAVE THE RINGER ON."
00:31:43.819,00:31:45.987,CALL ME IF YOU WANT COMPANY.
00:31:46.071,00:31:48.948,I WILL. GOODNIGHT.
00:31:49.032,00:31:51.076,GOODNIGHT.
00:31:53.579,00:31:55.622,YOU SHOULD GO HOME. I CAN TAKE IT FROM HERE.
00:31:55.706,00:31:58.208,VIGILANCE. IT'S GOOD FOR THE SOUL.
00:32:03.463,00:32:05.131,WHAT'S THAT?
00:32:05.215,00:32:07.384,DISORDERLY CONDUCT.
00:32:11.513,00:32:13.724,DO YOU BELIEVE IN KARMA?
00:32:13.807,00:32:15.517,ABSOLUTELY NOT.
00:32:15.601,00:32:18.019,"WELL, I DO."
00:32:18.103,00:32:19.855,AT LEAST TONIGHT.
00:32:19.938,00:32:21.648,GET CAPTAIN CARDIFF ON THE PHONE.
00:32:21.732,00:32:23.316,LET'S DO SOMETHING ABOUT MEECHUM.
00:32:23.400,00:32:24.443,WHAT?
00:32:24.526,00:32:26.319,GET HIM HIS JOB BACK.
00:32:26.403,00:32:27.404,HE FIRED HIS WEAPON.
00:32:27.487,00:32:29.197,HE OVERREACTED.
00:32:29.281,00:32:30.866,CARDIFF. ON THE PHONE. NOW.
00:32:37.372,00:32:39.374,"NANCY, GIVE ME CAPTAIN CARDIFF, PLEASE."
00:32:39.458,00:32:43.378,WE MIGHT AS WELL DO ONE PRODUCTIVE THING WHILE WE WAIT.
00:32:43.462,00:32:46.757,IT REQUIRES VERY LITTLE OF ME AND WILL MEAN THE WORLD TO HIM.
00:32:46.840,00:32:49.175,IT'S A VERY INEXPENSIVE INVESTMENT.
00:32:49.259,00:32:50.260,"HELLO, SIR. THIS IS DOUG STAMPER."
00:32:50.343,00:32:52.304,I HAVE FRANCIS UNDERWOOD FOR YOU.
00:32:52.387,00:32:54.431,I GOT HIM ON.
00:32:56.349,00:33:02.439,"CAPTAIN, I KNOW IT'S LATE, BUT I'D LIKE TO TALK TO YOU ABOUT EDWARD MEECHUM."
00:33:09.947,00:33:12.365,"GOOD MORNING, GENTLEMEN."
00:33:18.497,00:33:20.290,THANK YOU.
00:33:23.042,00:33:25.838,- ARE YOU HUNGRY? - MM-HMM.
00:33:41.394,00:33:42.896,YOU HAVE ANY TROUBLE GETTING IN?
00:33:42.980,00:33:45.190,"NAH, THEY MADE ME PUT IT THROUGH THE X-RAY MACHINE TWICE."
00:33:45.273,00:33:48.026,SO I HOPE IT DIDN'T OVERCOOK IT.
00:33:48.109,00:33:50.904,"FRANK, YOU ALWAYS PAY TOO MUCH. THIS IS WAY TOO MUCH."
00:33:50.988,00:33:52.823,FOR THE INCONVENIENCE.
00:33:52.906,00:33:56.869,"YOU KNOW, 20 YEARS YOU BEEN COMING TO MY JOINT."
00:33:56.952,00:33:58.829,THIS THE FIRST TIME I BEEN TO YOURS.
00:33:58.912,00:34:01.164,WHAT DO YOU THINK?
00:34:01.247,00:34:02.332,I COULD GET USED TO IT.
00:34:02.415,00:34:03.917,"WELL, YOU'RE WELCOME ANY TIME."
00:34:05.293,00:34:06.336,"ALWAYS, FRANK."
00:34:12.425,00:34:14.177,GET DETAILS.
00:34:29.735,00:34:32.070,"SIR, I WANT TO THANK YOU FOR TALKING TO THE CAPTAIN."
00:34:32.153,00:34:36.491,"HE TOLD ME YOU CALLED, AND I CAN'T TELL YOU HOW GRATEFUL I AM."
00:34:37.826,00:34:41.496,I WANT YOU TO LISTEN VERY CLOSELY TO WHAT I'M ABOUT TO SAY.
00:34:41.580,00:34:45.959,"FROM THIS MOMENT ON, YOU ARE A ROCK."
00:34:46.043,00:34:53.174,"YOU ABSORB NOTHING, YOU SAY NOTHING, AND NOTHING BREAKS YOU."
00:34:53.258,00:34:55.635,"- IS THAT CLEAR? - YES, SIR."
00:34:55.719,00:34:57.637,WELCOME BACK.
00:35:35.717,00:35:36.927,STEVE?
00:35:37.010,00:35:38.762,I'LL LEAVE YOU BE.
00:35:40.055,00:35:43.349,"WHERE, UH-- WHERE'S JANET?"
00:35:43.433,00:35:46.561,SHE'S BEEN HERE EVERY DAY FOR THE LAST FEW WEEKS.
00:35:46.645,00:35:49.481,"I TOLD HER GO HOME, GET SOME REST."
00:35:49.564,00:35:50.899,"WELL, IS EVERYTHING OKAY?"
00:35:50.983,00:35:52.901,YOUR TEXT SAID IT WAS IMPORTANT.
00:35:52.985,00:35:56.195,I DON'T KNOW HOW TO PUT THIS.
00:35:56.279,00:35:59.825,"THE THING IS, I..."
00:35:59.908,00:36:01.827,I'VE BEEN THINKING.
00:36:01.910,00:36:03.870,A LOT.
00:36:08.166,00:36:11.377,ABOUT THE THINGS I HAVEN'T DONE.
00:36:11.461,00:36:14.714,THINGS I HAVEN'T SAID.
00:36:16.758,00:36:19.469,I HATE YOUR HUSBAND.
00:36:24.141,00:36:27.435,A LOT OF PEOPLE DO.
00:36:27.519,00:36:31.690,"THE PAST EIGHT YEARS, I WATCHED OVER HIM."
00:36:35.443,00:36:38.363,BUT IT WASN'T HIM I WAS WATCHING.
00:36:39.990,00:36:50.959,"AND EVERY TIME I SAW YOU, EVERY TIME I HEARD YOUR VOICE, ALL I COULD THINK TO MYSELF WAS, JESUS, WHAT I WOULDN'T GIVE."
00:36:52.878,00:36:58.257,I CAN'T TELL YOU HOW MANY TIMES I THOUGHT ABOUT THAT.
00:37:07.059,00:37:10.353,YOU KNOW WHAT FRANCIS SAID TO ME WHEN HE PROPOSED?
00:37:10.436,00:37:12.772,I REMEMBER HIS EXACT WORDS.
00:37:12.856,00:37:19.571,"HE SAID, CLAIRE, IF ALL YOU WANT IS HAPPINESS, SAY NO."
00:37:19.654,00:37:25.577,I'M NOT GONNA GIVE YOU A COUPLE OF KIDS AND COUNT THE DAYS UNTIL RETIREMENT.
00:37:25.660,00:37:28.121,I PROMISE YOU FREEDOM FROM THAT.
00:37:28.205,00:37:32.084,I PROMISE YOU'LL NEVER BE BORED.
00:37:34.669,00:37:38.215,"YOU KNOW, HE WAS THE ONLY MAN-- AND THERE WERE A LOT OF OTHERS WHO PROPOSED."
00:37:38.297,00:37:44.221,BUT HE WAS THE ONLY ONE WHO UNDERSTOOD ME.
00:37:44.303,00:37:46.973,HE DIDN'T PUT ME ON SOME PEDESTAL.
00:37:47.057,00:37:51.352,HE KNEW THAT I DIDN'T WANT TO BE ADORED OR CODDLED.
00:37:51.436,00:37:56.399,SO HE TOOK MY HAND AND HE PUT A RING ON IT.
00:37:56.482,00:37:59.360,BECAUSE HE KNEW I'D SAY YES.
00:37:59.444,00:38:03.949,HE'S A MAN WHO KNOWS HOW TO TAKE WHAT HE WANTS.
00:38:15.168,00:38:17.712,IS THIS WHAT YOU WANTED?
00:38:17.796,00:38:19.881,IS THAT THE WAY YOU WANTED IT?
00:38:19.965,00:38:22.675,STOP. STOP.
00:38:22.759,00:38:26.345,PLEASE. PLEASE. STOP.
00:38:26.429,00:38:28.306,DON'T.
00:38:34.687,00:38:37.190,YOU TOLD ME YOUR TRUTH.
00:38:37.274,00:38:38.942,NOW YOU KNOW MINE.
00:39:15.979,00:39:17.438,"HEY, IT'S PETER."
00:39:17.522,00:39:28.158,"I DON'T EXPECT YOU TO CALL ME BACK, BUT I WANTED TO LET YOU KNOW I STOPPED DRINKING, AND I WENT TO MY FIRST A.A. MEETING."
00:39:28.241,00:39:34.080,"UM, I'M SUPPOSED TO REACH OUT AND MAKE AMENDS TO THOSE I'VE HURT."
00:39:35.665,00:39:41.504,BUT I GUESS THE REAL REASON I CALLED YOU IS JUST TO SAY I LOVE YOU AND I MISS YOU.
00:39:43.715,00:39:46.092,I HOPE YOU'RE WELL.
00:39:55.143,00:39:57.062,"THIS IS WORK, NOT PLAY."
00:39:57.145,00:39:59.272,THEN WHY'D YOU BOTHER COMING OVER?
00:39:59.356,00:40:02.192,I WAS HOPING YOU'D ANSWER THE DOOR NAKED.
00:40:02.275,00:40:03.776,THAT WOULD BE PLAY.
00:40:03.860,00:40:05.611,THAT WOULD BE WORK WITH A VIEW.
00:40:07.405,00:40:09.241,HOW MANY CHARACTERS IN A TWEET?
00:40:09.324,00:40:10.533,140.
00:40:10.616,00:40:13.494,"TYPE THIS, LET ME KNOW WHERE YOU LAND."
00:40:13.578,00:40:18.666,EIGHT-YEAR-OLD WASHINGTON D.C. BOY KILLED BY A STRAY BULLET IN GANGLAND SHOOT-OUT.
00:40:18.750,00:40:21.878,61 CHARACTERS LEFT.
00:40:21.961,00:40:24.964,SHOULD HAVE BEEN IN SCHOOL?
00:40:28.509,00:40:29.719,30 LEFT.
00:40:29.802,00:40:32.931,SPINELLA TO BLAME?
00:40:34.307,00:40:35.725,PRESS SEND.
00:40:37.643,00:40:39.271,"NOW GIVE ME A NAME, DETAILS."
00:40:39.354,00:40:42.357,TYLER DAVIS. THIRD GRADER AT VERNON BAKER ELEMENTARY.
00:40:42.399,00:40:46.319,SHOT OUTSIDE HIS HOME IN SOUTHEAST JUST BEFORE NOON TODAY.
00:40:47.737,00:40:51.074,SENT. WHERE ARE YOU GOING?
00:40:51.157,00:40:52.867,- TO SEE THE MOTHER. - YOU DON'T WANNA...?
00:40:52.951,00:40:55.828,THERE'S WORK TO DO. I'LL SEE YOU LATER TONIGHT.
00:40:58.623,00:41:02.210,HE WAS A GOOD BOY.
00:41:06.464,00:41:08.258,IT'S OKAY.
00:41:08.341,00:41:12.804,"IF TYLER'S SCHOOL HAD BEEN IN SESSION, THIS SENSELESS KILLING WOULD HAVE NEVER TAKEN PLACE."
00:41:12.887,00:41:21.313,WE NEED TO END THIS STRIKE NOW AND GET ALL OUR CHILDREN BACK IN SCHOOL WHERE THEY BELONG BEFORE WE RISK ANOTHER DEATH LIKE THIS.
00:41:21.396,00:41:31.323,"SO, MR. SPINELLA, I AM HEADED TO THE CAPITOL RIGHT NOW, AND I WILL REMAIN THERE UNTIL YOU ARE READY TO MEET AND TALK SO THAT WE CAN END THIS POINTLESS STRIKE."
00:41:31.406,00:41:33.450,THANK YOU ALL FOR COMING.
00:41:33.532,00:41:35.660,LET'S GO BACK INSIDE.
00:41:39.872,00:41:42.083,MR. SPINELLA IS NOT TO MAKE A COMMENT AT THIS TIME.
00:41:42.167,00:41:44.419,NO COMMENT. NO COMMENT.
00:41:53.428,00:41:55.513,THANK YOU.
00:42:01.060,00:42:03.062,FRANK.
00:42:12.489,00:42:14.282,SO?
00:42:15.783,00:42:17.827,YOU SAID YOU WANTED TO TALK.
00:42:20.538,00:42:24.959,YOU SAID YOU WANTED TO WORK OUT A COMPROMISE.
00:42:25.043,00:42:26.461,I LIED.
00:42:26.544,00:42:28.380,EXCUSE ME?
00:42:28.463,00:42:32.550,I HAVE NO INTENTION OF WORKING OUT A COMPROMISE.
00:42:34.344,00:42:37.680,"SO THEN WHY THE FUCK ARE WE HERE, FRANK?"
00:42:48.358,00:42:49.567,YOU THINK THIS IS SOME KIND OF A GAME?
00:42:49.650,00:42:51.069,NO.
00:42:51.152,00:42:53.363,THESE ARE REAL PEOPLE WITH FAMILIES TO FEED.
00:42:58.617,00:43:01.162,WOULD YOU PLEASE STOP THAT?
00:43:03.873,00:43:06.418,"IN FIVE SECONDS, I'M OUT OF HERE."
00:43:06.501,00:43:11.381,ONE. TWO. THREE.
00:43:11.464,00:43:14.717,"- FOUR. - GOODBYE, FRANK."
00:43:14.800,00:43:18.012,"YOU KNOW THE DIFFERENCE BETWEEN YOU AND ME, MARTY?"
00:43:22.725,00:43:26.938,I'M A WHITE-TRASH CRACKER FROM A WHITE-TRASH TOWN THAT NO ONE WOULD EVEN BOTHER TO PISS ON.
00:43:27.021,00:43:29.774,BUT HERE'S THE DIFFERENCE-- I'VE MADE SOMETHING OF MYSELF.
00:43:29.857,00:43:31.984,I HAVE THE KEYS TO THE CAPITOL. PEOPLE RESPECT ME.
00:43:32.068,00:43:33.736,"BUT YOU, YOU'RE STILL NOTHING."
00:43:33.819,00:43:38.074,YOU'RE JUST AN UPPITY DAGO IN AN EXPENSIVE SUIT TURNING TRICKS FOR THE UNIONS.
00:43:38.157,00:43:40.243,"NOBODY RESPECTS THE UNIONS ANYMORE, MARTY."
00:43:40.326,00:43:43.621,THEY'RE DYING. AND NO ONE RESPECTS YOU.
00:43:43.704,00:43:47.792,THE MOST YOU'LL EVER MAKE OF YOURSELF IS BLOWING MEN LIKE ME.
00:43:55.425,00:43:57.093,YOU THINK YOU CAN GET UNDER MY SKIN?
00:43:57.176,00:43:59.554,I KNOW I CAN.
00:43:59.637,00:44:03.141,"KISS MY ASS, FRANK."
00:44:03.224,00:44:04.683,YOU CAN'T AFFORD TO WALK OUT.
00:44:04.767,00:44:06.311,WATCH ME.
00:44:06.394,00:44:08.771,"I'VE GOT A DEAD, UNDERPRIVILEGED KID IN MY POCKET."
00:44:08.854,00:44:10.356,WHAT DO YOU HAVE?
00:44:10.440,00:44:13.485,I HAVE 2 MILLION HONORABLE TEACHERS.
00:44:13.568,00:44:16.446,FAIR ENOUGH. BUT I GOT SOMETHING EVEN BETTER.
00:44:20.617,00:44:23.786,GO AHEAD. OPEN IT.
00:44:27.165,00:44:28.707,OKAY.
00:44:28.791,00:44:30.460,I'LL PLAY YOUR GAME.
00:44:41.346,00:44:43.598,YOU'RE AN IDIOT.
00:44:45.724,00:44:48.144,STAMPER THREW IT.
00:44:56.986,00:44:58.613,"OH, NO, STAMPER THREW THE BRICK."
00:44:58.695,00:45:01.949,AND I MADE SURE CLAIRE DISTRACTED MY SECURITY.
00:45:02.033,00:45:04.577,ARE YOU KIDDING ME?
00:45:04.661,00:45:06.996,AND TO THINK YOU WANTED ME TO APOLOGIZE TO MY WIFE.
00:45:07.079,00:45:09.123,"YOU WOULD DO SOMETHING THAT LOW, FRANK?"
00:45:09.207,00:45:12.960,"I ARRANGED THE BRICK, MARTY, JUST LIKE I ARRANGED THIS MEETING THIS AFTERNOON."
00:45:13.044,00:45:14.462,"BACK OFF, FRANK."
00:45:14.546,00:45:18.550,"WHY DON'T YOU JUST GET DOWN ON YOUR KNEES - WHERE YOU REALLY BELONG? - BACK OFF, FRANK."
00:45:18.633,00:45:22.345,BECAUSE THE ONLY THING YOU'RE GONNA GET FROM ME - IS CUM ON YOUR-- - FUCK YOU!
00:45:32.564,00:45:34.566,UGH.
00:45:46.619,00:45:48.287,AND WHO'S GOING TO BELIEVE YOU?
00:45:48.371,00:45:53.042,"YOU JUST ASSAULTED A UNITED STATES CONGRESSMAN, WHICH IS A FELONY."
00:45:54.419,00:45:56.837,"BUT I'M NOT GONNA PRESS CHARGES, MARTY."
00:45:56.921,00:46:01.593,BECAUSE THE STRIKE ENDS NOW.
00:46:23.364,00:46:25.408,YOU THINK IT'LL LEAVE A SCAR?
00:46:25.491,00:46:28.244,I HAVE A THICK SKIN.
00:46:30.829,00:46:38.504,"THE NEXT TIME YOU ASK ME TO INVITE SOMEONE IN FOR COFFEE, WILL YOU PLEASE MAKE SURE NO GUNS GO OFF?"
00:46:38.588,00:46:40.965,I'LL DO MY BEST.
00:46:41.048,00:46:43.175,I SAW STEVE AGAIN TODAY.
00:46:43.259,00:46:44.552,HOW IS HE?
00:46:44.636,00:46:46.803,IN A LOT OF PAIN.
00:46:46.887,00:46:49.599,SHOULD I GO SEE HIM?
00:46:49.682,00:46:50.891,I DON'T THINK YOU NEED TO.
00:46:54.604,00:46:55.812,ZOE BARNES.
00:46:57.732,00:47:00.777,"WHEN HE DIES, WE'LL PAY FOR HIS FUNERAL."
00:47:04.656,00:47:06.198,YOU DON'T NEED TO TAKE IT?
00:47:06.282,00:47:11.203,NO. I'M DONE WITH WORK TODAY.
00:01:47.566,00:01:50.527,SET THEM UP OVER HERE.
00:03:32.921,00:03:34.756,VICE PRESIDENT MATTHEWS.
00:03:36.591,00:03:39.011,- BOB. - MR. VICE PRESIDENT.
00:03:58.279,00:04:00.323,- MR. VICE PRESIDENT. - FRANK.
00:04:07.748,00:04:09.208,I'M FINE RIGHT HERE.
00:04:24.848,00:04:28.227,"BOTH LEGS BROKEN, FRACTURED SKULL, PUNCTURED LUNG."
00:04:28.309,00:04:31.105,MY HEART STOPS. TWO FULL MINUTES.
00:04:31.188,00:04:33.565,THEY'RE PUMPING MY CHEST. NOTHING.
00:04:33.648,00:04:35.567,THEY GRAB THE DEFIBRILLATORS. PACHOOM!
00:04:35.650,00:04:37.360,NOTHING.
00:04:40.447,00:04:42.616,DOCTORS TELL ME IT'S A MIRACLE I'M ALIVE.
00:04:42.699,00:04:45.202,"BUT, SERIOUSLY, YOU TALK ABOUT A WAKE-UP CALL FROM GOD."
00:04:45.285,00:04:48.580,YOU DON'T GET TO COME BACK FROM THE DEAD TWICE.
00:05:07.849,00:05:09.768,GOOD MORNING.
00:05:09.851,00:05:25.742,"THE EDUCATION REFORM AND ACHIEVEMENT ACT THAT I SIGN INTO LAW TODAY WILL AFFECT EVERY CHILD AND PARENT IN THE UNITED STATES, WILL ENSURE A BETTER EDUCATED WORKFORCE FOR DECADES TO COME, AND WILL REINFORCE AMERICA'S PREEMINENCE AS AN INTELLECTUAL SUPERPOWER."
00:05:28.578,00:05:38.088,"AND I'D LIKE TO THANK ONE MAN IN PARTICULAR WHO NEVER LOST SIGHT OF THE LARGER MISSION, WHO SPEARHEADED THIS BILL FROM THE BEGINNING, AND THAT'S CONGRESSMAN FRANK UNDERWOOD."
00:06:16.877,00:06:18.670,IN THE EAST ROOM FOR REFRESHMENTS.
00:06:18.753,00:06:23.091,"MEDIA, WE WILL CONVENE IMMEDIATELY IN THE BRIEFING ROOM FOR OUR CONFERENCE."
00:06:33.518,00:06:34.853,"NO, THANK YOU, FRANK."
00:06:34.936,00:06:36.688,THIS WAS YOUR BABY FROM THE BEGINNING.
00:06:36.771,00:06:38.899,"I APPRECIATE YOU STANDING YOUR GROUND ON THIS ONE, FRANK."
00:06:38.982,00:06:41.360,I'M SMART ENOUGH TO ADMIT WHEN I WAS WRONG.
00:06:41.442,00:06:45.822,I WAS JUST TELLING FRANK WE SHOULD SET UP A WEEKLY SO HE CAN KEEP US UP TO DATE ON WHAT'S GOING ON IN THE HOUSE.
00:06:45.906,00:06:47.574,THAT SOUNDS LIKE A GREAT IDEA.
00:06:47.657,00:06:49.576,"CONGRATULATIONS, SIR."
00:06:49.659,00:06:52.954,"GARRETT, I WAS WONDERING IF WE COULD TALK FOR A FEW MINUTES."
00:06:53.038,00:06:59.044,"THAT THING I MENTIONED A COUPLE OF WEEKS AGO ABOUT THE JOBS TAX CREDIT-- I'VE BEEN GIVING IT A LOT OF THOUGHT, JIM, AND I THINK IT'S A GOOD IDEA."
00:07:06.343,00:07:08.595,BUSY MAN.
00:07:08.678,00:07:10.597,"YES, HE IS."
00:07:10.680,00:07:16.561,"FRANK, I HEAR THAT YOU ARE HEADING UP THE SPECIAL ELECTION IN MY HOME STATE."
00:07:16.644,00:07:20.357,- PETER RUSSO. - WE'RE TRYING TO KEEP THAT UNDER THE RADAR UNTIL HE OFFICIALLY ANNOUNCES.
00:07:20.440,00:07:22.943,"IN FACT, WE'RE NOT EVEN WORKING OUT OF MY OFFICE UNTIL THAT HAPPENS."
00:07:23.026,00:07:25.737,- WHERE ARE YOU WORKING FROM? - THE BASEMENT OF MY HOUSE.
00:07:25.820,00:07:29.490,ANY REASON WHY THE D.N.C. DIDN'T ASK MY ADVICE ON THE CANDIDATE?
00:07:29.574,00:07:32.035,"WELL, I THOUGHT THEY PASSED IT BY YOU, OR LINDA DID."
00:07:32.119,00:07:34.871,"- NOBODY DID. - WELL, THAT IS UNACCEPTABLE."
00:07:34.955,00:07:36.831,AND I HAVE MAJOR DOUBTS ABOUT RUSSO.
00:07:36.915,00:07:40.377,"- HIS INEXPERIENCE? - YES, AND HE'S URBAN-BASED."
00:07:40.460,00:07:42.587,- MM. - I DON'T KNOW IF HE'LL CONNECT WITH RURAL VOTERS.
00:07:42.670,00:07:44.423,"LOOK, FRANKLY, THAT'S ONE OF MY CONCERNS AS WELL."
00:07:46.091,00:07:53.432,"BUT IF YOU WERE TO COME OUT AND STUMP WITH HIM, THAT WOULD GO A LONG WAY TO CONVINCE-- FRANK, I CAN'T STUMP FOR SOMEBODY I DON'T BELIEVE IN."
00:07:53.514,00:07:56.184,IT'S EARLY DAYS YET. I'D ASK YOU TO KEEP AN OPEN MIND.
00:07:56.268,00:08:03.442,"AND LET ME KNOW IF YOU WANT ME TO SET UP A MEETING BETWEEN THE TWO OF YOU, BECAUSE, SIR, AN ENDORSEMENT FROM YOU WOULD BE A BIG COUP FOR HIM."
00:08:05.693,00:08:07.362,FRANK.
00:08:25.339,00:08:26.714,SLUGLINE JUST GOT ACCESS YESTERDAY.
00:08:26.798,00:08:31.136,"- I KNOW. - I LEFT THE HERALD BECAUSE I DIDN'T WANNA COVER THE WHITE HOUSE, AND NOW HERE I AM."
00:08:31.219,00:08:33.638,ACCESS ISN'T THE SAME AS A BALL AND CHAIN.
00:08:33.721,00:08:36.433,AM I ONLY GONNA SEE YOU AT BILL SIGNINGS NOW?
00:08:36.516,00:08:38.059,I HAVEN'T HEARD FROM YOU IN THREE WEEKS.
00:08:38.143,00:08:39.936,INSECURITY BORES ME.
00:08:40.020,00:08:43.148,I FEEL THE SAME WAY ABOUT CONDESCENSION.
00:08:43.231,00:08:46.360,"YOUR PLACE, THIS EVENING, AND I'LL TEXT YOU WHEN I'M ABOUT TO ARRIVE."
00:08:46.443,00:08:48.569,WHAT IF I'M BUSY?
00:08:48.653,00:08:51.114,YOU'RE JUST AFRAID I'M GONNA STAND YOU UP AGAIN.
00:08:51.198,00:08:53.367,I JUST WANNA MAKE SURE IT'S WORTH MY WHILE.
00:08:53.450,00:08:55.327,IT'LL BE WORTH YOUR WHILE.
00:08:55.410,00:08:57.120,THIS'LL MAKE UP FOR LAST TIME.
00:08:57.204,00:08:58.538,IT'S A PIECE OF HISTORY.
00:08:58.621,00:09:00.957,FROM THE PRESIDENT'S HAND TO YOURS.
00:09:05.712,00:09:07.422,THEY TALK ABOUT IN THE ROOM?
00:09:07.506,00:09:10.509,I BELIEVE THERE ARE THINGS BEYOND OUR CONTROL.
00:09:10.591,00:09:12.511,WHO OR WHAT'S CONTROLLING THEM-- THAT I DON'T KNOW.
00:09:12.593,00:09:14.513,I DON'T BELIEVE IN GOD.
00:09:16.681,00:09:19.684,- TOO MUCH CATHOLIC SCHOOL? - MAYBE.
00:09:19.767,00:09:24.439,"I'M NOT SAYING YOU HAVE TO BELIEVE IN GOD, PETER, OR ANYTHING, FOR THAT MATTER."
00:09:24.523,00:09:26.107,BUT YOU SHOULDN'T RULE ANYTHING OUT.
00:09:32.989,00:09:34.908,I SHOULD GO.
00:10:34.926,00:10:36.844,ARE WILLING TO CONSIDER A RECOVERING ALCOHOLIC.
00:10:36.928,00:10:41.391,"NOW, THOSE NUMBERS DIP A LITTLE WHEN YOU INTRODUCE COCAINE, BUT NOT BY MUCH. RANDY?"
00:10:41.475,00:10:43.101,"IT'S A RISK, BUT IT'LL MAKE WAVES."
00:10:43.184,00:10:44.727,FREE COVERAGE ACROSS THE BOARD.
00:10:44.811,00:10:46.187,THE NARRATIVE HAS TO BE REDEMPTION.
00:10:46.271,00:10:47.772,A PHOENIX FROM THE ASHES.
00:10:49.816,00:10:51.943,WE DON'T WANT PEOPLE TO THINK PETER WAS A DISASTER.
00:10:54.154,00:10:57.115,A FRESH START AND A CLEAN START BOTH DID WELL IN FOCUS GROUPS.
00:10:57.198,00:10:59.618,CLEAN START SOUNDS TOO MUCH LIKE CLEAN SLATE.
00:10:59.700,00:11:01.620,"- I LIKE FRESH START. - YEAH, I DO TOO."
00:11:01.702,00:11:06.749,"- HOW WE DOING ON THE FUNDRAISING? - THE ALCOHOLIC THING WILL TURN OFF SOME OF THE IN-STATE DONORS, BUT IT'S AN OFF-YEAR ELECTION."
00:11:06.833,00:11:08.876,WE CAN HIT UP THE USUAL SUSPECTS IN NEW YORK AND CALIFORNIA.
00:11:08.960,00:11:11.338,"WALTER, HOW VULNERABLE ARE WE?"
00:11:11.421,00:11:13.714,I'M NOT PREPARED TO ANSWER THAT QUESTION.
00:11:23.141,00:11:29.981,"CALLED THE DELAWARE RIVER WATERSHED ACT, AND I THINK IT'S GOING TO BRING ABOUT 5,000 JOBS INTO PETER'S DISTRICTS OVER THE NEXT THREE YEARS."
00:11:30.064,00:11:31.983,WE HAVE A DRAFT OF THE BILL COMPLETED.
00:11:32.066,00:11:34.611,PETER'S IN THE PROCESS OF SECURING COSPONSORS.
00:11:36.695,00:11:40.283,"I HAVE SOME E-MAILS OUT, BUT MOST OF THEM WANNA SEE A BILL FIRST."
00:11:40.367,00:11:41.826,HAVE YOU SET UP A MEETING WITH THE SHIPBUILDERS YET?
00:11:41.909,00:11:43.495,I DON'T THINK THEY'RE GONNA BACK ME.
00:11:43.578,00:11:45.622,"THAT'S THE ENTIRE POINT OF THE BILL, PETER."
00:11:45.704,00:11:57.551,"WELL, IF I GO TO THEM AND I SAY, HEY, SOME OF YOU MAYBE WILL GET YOUR JOBS BACK, NOT TOMORROW, BUT THREE YEARS FROM NOW, AND MOST OF YOU WON'T BE GETTING YOUR JOBS BACK ANYWAY-- ALL RIGHT, LET'S PUT A PIN IN THIS UNTIL WE GET MORE SPONSORS."
00:11:57.634,00:11:59.636,I HAVE TO GO TO THE OFFICE. I'LL CATCH YOU ALL LATER.
00:11:59.718,00:12:01.304,"OKAY, LET'S MOVE ON TO OUR FIELD PLAN."
00:12:01.388,00:12:03.139,I WANT TO GO THROUGH THE REGIONS ONE BY ONE...
00:12:03.223,00:12:05.350,FRANCIS.
00:12:05.433,00:12:07.810,WE SPENT SIX WEEKS ON THAT BILL.
