start,end,script
00:44:32.837,00:44:36.924,"Russia took all the necessary measures, he says, to fight the doping problem."
00:44:37.007,00:44:41.887,Moscow's anti-doping lab was recently recognized as one of the best in the world.
00:44:44.598,00:44:46.141,You don't want to talk to us?
00:44:46.225,00:44:59.654,"Well, the employees at this lab are clearly being very tight-lipped, but the report from the World Anti-Doping Agency goes into great detail describing the alleged activities inside that building."
00:45:17.547,00:45:18.799,Holy shit.
00:45:20.008,00:45:28.725,"The World Anti-Doping Agency suspended Russia's sports drug-testing lab, and the head of the lab resigned."
00:46:06.221,00:46:09.349,"He was talking, blah, blah, blah, about football."
00:46:37.377,00:46:38.212,Empty.
00:46:38.838,00:46:41.173,I don't know what's going on.
00:46:41.256,00:46:44.510,I just know what I'm reading in the newspaper and in the press and...
00:46:44.593,00:46:45.719,You know.
00:46:47.888,00:46:50.807,"I mean, will they come after you?"
00:46:50.891,00:46:53.185,Are they gonna arrest you? Are they gonna...
00:46:53.685,00:46:55.770,Would they try to put you in jail?
00:46:56.480,00:46:57.898,In jail? No.
00:46:59.649,00:47:00.567,-You know. -No.
00:47:00.650,00:47:02.527,Are you in any danger?
00:47:13.998,00:47:15.249,Security guard.
00:47:15.332,00:47:16.208,No.
00:47:19.086,00:47:20.921,-In your home? -Coming to my car.
00:48:05.007,00:48:06.550,They're deliberately lying.
00:48:23.358,00:48:24.401,You know Snowden?
00:48:25.069,00:48:26.111,"Yeah, of course."
00:48:30.532,00:48:36.080,We still don't know... We still don't know whether Russia is participating in Olympic Games or not.
00:48:51.595,00:48:53.347,"-Listen, I, uh... -Yes."
00:48:56.641,00:48:59.811,I'm just... I'm worried about you.
00:49:02.231,00:49:03.565,"Tomorrow, I drop you."
00:49:26.796,00:49:35.389,"And that is why I can confirm the council has overwhelmingly voted, with immediate effect, to suspend the Russian Federation."
00:49:35.472,00:49:39.476,"It's done so, uh, by 22 votes to one."
00:50:10.507,00:50:14.678,"Secondly, it is vital to conduct our own internal investigation."
00:50:32.654,00:50:33.738,Yeah.
00:50:37.242,00:50:38.868,You can go wherever you want.
00:50:42.914,00:50:44.583,So you wanna get out?
00:50:48.002,00:50:50.547,"What do you want to, uh..."
00:50:50.630,00:50:53.175,"It's very suspicious when you have one-way ticket, you know."
00:50:53.258,00:50:57.096,"Yeah, right. You have to book a round trip."
00:51:04.394,00:51:06.188,-So... -Okay?
00:51:07.731,00:51:11.235,"I'll send you... Let me figure out some flight options, okay?"
00:51:28.710,00:51:30.086,I don't know.
00:51:33.340,00:51:34.341,Okay.
00:52:31.315,00:52:36.194,I asked you if you thought your investigation would be a defining moment in the history of sport.
00:52:39.739,00:52:43.451,"Yes, it can be a defining moment, and I think it should."
00:52:43.952,00:52:57.674,"You've got your number one Olympic sport in the crosshairs, and you've got one of the major Olympic countries in the world in the crosshairs, even if it's the crosshairs only on athletics at the moment."
00:52:58.258,00:53:06.808,"That has the potential of affecting the credibility of all sport and, therefore, the continued viability of all sport."
00:53:06.891,00:53:09.478,Why would I watch an event that's fixed?
00:53:51.936,00:53:53.938,"-I'm here, yes! -He's escaped."
00:53:56.858,00:53:57.859,Come on.
00:54:26.388,00:54:30.266,"I have everything with me, and also I destroyed my office computer."
00:54:31.142,00:54:34.521,Put it in a very safe place and dropped there like a dummy.
00:54:59.338,00:55:01.965,"Okay, this is the place."
00:55:04.217,00:55:06.052,"bed, bathroom."
00:55:13.059,00:55:14.060,and what we're gonna do.
00:55:17.814,00:55:19.358,You will be learning Russian.
00:55:27.281,00:55:37.584,"There was one thing that I noticed in the IC report, and that was that there were KGB people hanging around the lab."
00:55:39.002,00:55:40.754,And that's a real no-no.
00:55:41.838,00:55:44.215,"You know, KGB people are not nice people."
00:55:51.556,00:55:53.349,from the leadership of Russian athletics.
00:55:53.433,00:55:58.605,"In 60 days, we will present the renewed athletics with new people..."
00:56:10.241,00:56:14.203,"Oh, I don't think Vitaly Mutko finances the FSB."
00:56:14.287,00:56:18.041,-That's a state security operation. -But... but Putin?
00:56:18.124,00:56:27.008,"Well, whoever finances it and runs the state security apparatus, it's not the sport minister."
00:56:32.722,00:56:37.268,but we are trying and have already taken steps to address those problems.
00:56:37.351,00:56:43.357,And all of the officials are essentially rejecting the idea that there's still a major problem.
00:58:40.266,00:58:54.823,It's time for you to enter upon the first stage.' I was thinking that we'd start...
00:58:54.906,00:58:58.492,"I ask you questions, and you answer yes or no."
00:59:00.453,00:59:05.374,"Does Russia have a systematic, statewide doping system in place to cheat the Olympics?"
00:59:07.835,00:59:12.715,Were you the mastermind of a statewide system that cheated the Olympics?
00:59:15.343,00:59:20.223,Russia won a total of 73 medals in the 2008 Beijing Olympics.
00:59:20.306,00:59:22.601,How many of those athletes were dirty?
00:59:26.980,00:59:31.610,Russia won 81 total medals in London. How many of those were dirty?
00:59:42.871,00:59:47.166,Was Putin aware of the existence of a Russian doping system?
00:59:54.299,00:59:56.050,-From prison? -Yes.
00:59:59.345,01:00:02.015,"Okay, let's back up one sec here."
01:00:02.098,01:00:05.559,My concern is that it's something they would use to discredit you.
01:00:07.103,01:00:13.985,"So, the first criminal investigation against you, when was it and what happened?"
01:00:35.381,01:00:38.843,"And all these anabolics are coming to Europe, to the United States."
01:01:54.252,01:01:57.005,They have impurities which could be detectable.
01:02:12.353,01:02:21.237,"I'm very proud that I created the test for long term metabolites, which caused the detection window to enlarge from two or three weeks to six months."
01:02:22.280,01:02:26.034,That's why Portugalov suddenly had so many positives.
01:03:40.274,01:03:41.525,And...
01:03:43.736,01:03:46.072,And... it was...
01:04:24.360,01:04:26.404,I was sent to a psychiatric clinic.
01:05:10.406,01:05:12.325,"But I get better, better, better."
01:05:48.361,01:05:52.156,"If you don't send him to London, we send to London another director."
01:06:22.019,01:06:23.562,your case is dropped.
01:06:25.106,01:06:27.150,Who took care of it? Who got the charges dropped?
01:06:59.140,01:07:01.267,has unexpectedly died.
01:07:19.993,01:07:24.207,"No, no, no."
01:07:27.501,01:07:33.924,"which is the doping agency he was formerly the head of, that he appears to have had a massive heart attack."
01:07:41.849,01:07:43.016,"You know, my friend?"
01:08:14.173,01:08:17.676,They dreamed about children. I was talking to him day before.
01:08:18.511,01:08:19.928,This is...
01:08:40.824,01:08:43.327,Do you think that they would...
01:09:15.359,01:09:19.363,"He's very dangerous. He has no moral at all. No, no."
01:09:27.538,01:09:28.747,He's desperate.
01:09:51.395,01:09:53.689,"Yuri Nagornykh, vice minister."
01:11:28.909,01:11:36.959,They want him to go to New York and appear in a grand jury and provide his information.
01:11:38.168,01:11:41.797,It triggered a whole series of decisions that had to be made.
01:11:43.841,01:11:50.764,"I've checked out these two guys, and both of these guys are not your everyday agent."
01:12:02.192,01:12:06.238,"His boss, Mutko, was actually the guy."
01:12:07.990,01:12:11.243,Because he's Putin's best friend. He's the head of the sports ministry.
01:12:15.331,01:12:19.501,"like, example, I could be done against or under US legislature?"
01:12:41.315,01:12:46.070,They're looking for him to plea to what's called a cooperation agreement.
01:12:55.245,01:12:57.581,what the bureau's interested in at this point.
01:13:14.557,01:13:18.394,whether or not he should go public in some way prior to the Olympics.
01:13:44.294,01:13:45.546,Uh...
01:14:03.063,01:14:06.484,They're asking us how they can verify the authenticity of the Sochi list.
01:14:20.456,01:14:27.129,"So under properties of the file, you can see it was created Tuesday, January 21st, from the ministry."
01:15:03.999,01:15:05.208,Not recognizable at all.
01:15:09.755,01:15:11.840,The New York Times is breaking tomorrow.
01:15:16.595,01:15:20.641,intravenous injections -to relax. Tomorrow? -Tomorrow.
01:15:32.528,01:15:33.571,-Right. -So...
01:15:41.704,01:15:47.668,He provided an FSB file of how the testing was arranged at Sochi.
01:16:13.610,01:16:22.202,has the honor of announcing that the 22nd Olympic Winter Games in 2014 are awarded to the city of Sochi.
01:16:25.873,01:16:30.210,That's future for everything. That's future for my country! For Russia!
01:16:31.795,01:16:35.507,Millions of citizens of Russia are united by the Olympic dream.
01:16:36.383,01:16:41.138,"Our national pledge to you is, the choice of Sochi is the best choice."
01:17:04.577,01:17:06.914,Hurrah!
01:17:22.721,01:17:26.391,Through the competition so they could be at their very top level?
01:17:26.474,01:17:27.392,"Right, right."
01:17:34.983,01:17:40.739,"the science that you developed to get around the system, you abandoned the science?"
01:18:37.170,01:18:38.130,Okay.
01:19:14.541,01:19:16.459,The athletes deserve it.
01:19:18.045,01:19:28.013,"And to you, my fellow Olympic athletes, I say, respect the rules, play fair, be clean."
01:19:34.477,01:19:39.942,did Russia swap out dirty urine for clean urine?
01:19:56.166,01:19:59.086,helps keep sport on the level playing field.
01:19:59.169,01:20:05.217,"That's why we created ADAMS, the free Anti-Doping Administration and Management System from WADA."
01:20:05.300,01:20:10.222,All operating under a level of security typically used by financial institutions.
01:20:10.305,01:20:14.810,"In effect, becoming the centralized clearing house for all anti-doping information."
01:20:15.477,01:20:18.771,ADAMS. Everyone should play true.
01:20:29.449,01:20:31.910,It's in this container. It's divided into two.
01:20:37.958,01:20:42.128,Yes. It's one particular company in Switzerland that makes them.
01:20:44.714,01:20:47.300,and the Berlinger bottle is state of the art.
01:20:47.384,01:20:51.471,It's sealed very tight with a vice-like device.
01:20:51.554,01:20:54.182,"A collector is right there, watching."
01:20:57.269,01:20:58.728,And then it goes to the lab.
01:21:00.981,01:21:05.818,It's in the lab that the B bottles are pulled aside and put in the freezer.
01:21:08.280,01:21:11.449,The analytical work is done on the A sample.
01:21:14.452,01:21:21.626,"the trustability of the sample, the fact that we've got an A and a B sample is a very, very, uh, safe system."
01:21:24.629,01:21:28.800,they're designed in such a way that they need to be destroyed to be taken off.
01:21:34.222,01:21:36.058,It's the only way you can get it off.
01:21:42.689,01:21:44.566,The B has to confirm the A.
01:21:45.317,01:21:48.069,That's this enormous protection.
01:22:53.051,01:22:57.930,you had clean samples of their urine being held?
01:23:23.290,01:23:25.042,who were embedded in the laboratory.
01:23:25.125,01:23:30.755,"So, if there were substitutions, manipulations, these people would've been in the front line to observe this."
01:23:35.635,01:23:43.560,"It was our entrance, but from this behind, where we have a fire exit, there is another building. It was a KGB building."
01:23:49.191,01:23:52.777,Pilot Alexander Zubkov and brakeman Alexey Voevoda...
01:24:01.203,01:24:06.583,"Gold to Russia, making their pilot the oldest man ever to win the four-man bobsleigh."
01:24:25.935,01:24:33.818,"Meanwhile, all the urines collected from the athletes during the day were transported to the Olympic village and held until 1:00 or 2:00 a.m."
01:24:36.237,01:24:39.449,"Grigory, I will be delivering the samples in 15 minutes."
01:25:33.503,01:25:36.297,So we take this little bit...
01:25:36.381,01:25:39.008,-How you say this thing? It's-- -Uh...
01:25:41.427,01:25:44.556,"You take this table out, and there is a... like a..."
01:25:52.564,01:25:55.650,"So it looks like it's a power outlet without a socket, but it's not."
01:25:55.733,01:25:57.569,-It's not. It's a hole. -It's a hole.
01:27:12.269,01:27:22.069,"that showed that a country or WADA lab had found a way to break into the collection bottles, what do you think that would say about the entire testing system?"
01:27:22.153,01:27:26.658,What it would say is that corruption has gone to the depths of...
01:27:28.618,01:27:32.163,"that part of the process, which would be most disturbing."
01:27:33.122,01:27:34.249,"It would be, uh..."
01:27:35.583,01:27:42.424,"obviously a very serious, serious act of manipulation from that lab."
01:27:43.300,01:27:45.635,It would be done. It wouldn't work.
01:27:45.718,01:27:51.223,"If that can be done successfully, then the testing system is over."
01:27:58.356,01:27:59.441,No.
01:28:14.247,01:28:16.332,I pulled off 13 gold medals.
01:28:46.321,01:28:51.451,"winning 33 overall, including an Olympic high of 13 gold."
01:29:24.316,01:29:28.488,his popularity rating in Russia had been falling steadily for years.
01:29:28.571,01:29:31.198,"But when the games began, this."
01:29:54.597,01:30:00.478,nor is it borrowed from the elegant prose of John le Carr or adapted from Robert Ludlum's work.
01:30:00.562,01:30:08.360,"But if the protagonist is to be believed, this drama is the ultimate handiwork of Vladimir Putin and the intelligence successors to the KGB."
01:30:08.445,01:30:11.823,"LA may be a lot safer than Mother Russia, given the recent..."
01:30:29.131,01:30:32.134,-I just spoke to our lawyer. -What happened?
01:31:14.511,01:31:20.975,"adding they were a continuation of the attack on Russian sport, which was backed up by the deputy sports minister."
01:31:36.658,01:31:39.368,who has handled a lot of criminal cases.
01:31:44.582,01:31:51.463,"It appears that the firm got cold feet due to a conflict of interest, they said."
01:31:55.092,01:32:00.014,"If this is true, it is an unimaginable level of criminality."
01:32:05.728,01:32:07.897,to investigate immediately.
01:32:11.275,01:32:15.655,"into Russian government officials, athletes, coaches and anti-doping authorities."
01:32:25.665,01:32:34.465,"Dear Grigory, in light of your recent declarations to The New York Times, we would like to meet to better understand the basis of your allegations and your proposed way forward."
01:32:34.548,01:32:38.094,"Sincerely, David Howman and Olivier Niggli."
01:32:38.845,01:32:42.306,I'm talking tomorrow to another lawyer.
01:32:43.683,01:32:44.684,So...
01:32:45.893,01:32:49.396,"He seems credible, but of course, it's his word against Russia."
01:33:38.320,01:33:41.323,We're trying to get this... To make it right.
01:34:57.608,01:35:01.237,They're turning us into the monster now.
01:35:02.863,01:35:04.532,Or trying to.
01:35:31.225,01:35:35.104,when truth exists and what is done cannot be undone.
01:35:41.861,01:35:48.159,both in terms of the documents on his computer and the cell phone that he was using at the time.
01:35:49.160,01:35:55.416,Two people connected with the Russian doping program are dead under circumstances that seem highly suspect.
01:35:55.499,01:36:04.091,One of the first things that I learned from authorities when I came onto the case was that the Russian government has the resources and the will.
01:36:04.175,01:36:11.348,So we've had to develop a very multi-stage protocol to minimize the chances our conversations will be intercepted.
01:36:12.266,01:36:23.569,"The main concern is that they would be able, through those communications, to try to triangulate his location, and if they have agents in the United States, then to do him harm."
01:36:29.200,01:36:31.911,till the Summer Games in Rio de Janeiro in Brazil.
01:36:36.082,01:36:39.085,but this is pointing the finger at a whole range of sports.
01:36:47.426,01:36:53.515,Grigory's been advised by his lawyer he should not be here for security reasons.
01:36:55.226,01:37:02.566,I worked with Grigory over about six months to compile a record of what happened in Russia.
01:37:03.650,01:37:09.323,This is the spreadsheet of every single athlete that was on the state-mandated protocol.
01:37:10.241,01:37:15.537,"What every single athlete was taking in London, including their sample numbers and collection."
01:37:16.080,01:37:21.835,"When Christiane goes back and tests these samples correctly, she will basically find them all positive."
01:37:23.379,01:37:26.840,And we have all their protocols before the London Games.
01:37:29.176,01:37:32.346,We have the same for Beijing.
01:37:33.014,01:37:40.729,And this outlines how Russia was collecting thousands and thousands of clean samples for swapping.
01:37:40.812,01:37:51.615,"No, no, this we saw, but we want to ask question as well as how it was done, understanding-- So, sodium chloride is added to the sample to increase specific gravity."
01:37:51.698,01:37:58.705,Many of these samples are gonna have a hundred times the sodium content that should be in somebody's urine.
01:38:04.545,01:38:05.629,Yes.
01:38:11.552,01:38:12.553,"Yes, yes."
01:38:12.636,01:38:16.890,"Both the Olympic and the Paralympic Games, they swapped urine."
01:38:17.891,01:38:22.063,Vancouver was really the impetus for the urine swapping operation.
01:38:22.146,01:38:27.359,"They only won a handful of medals, and to see to it that that didn't happen again at Sochi."
01:38:39.621,01:38:42.083,This goes all the way back to 1968.
01:38:42.166,01:38:46.128,There never was anti-doping in Russia. Period. Ever.
01:38:46.212,01:38:47.671,Across all summer sports?
01:38:47.754,01:38:49.131,Every sport.
01:39:14.991,01:39:19.328,"Grigory risked his life, and is risking his life, to do this."
01:39:19.411,01:39:26.669,"He left his wife behind, he left his children behind, he left all of his belongings behind, all of his financial security behind."
01:39:27.586,01:39:30.131,We're here to get everything out.
01:39:30.714,01:39:31.632,Okay.
01:39:35.594,01:39:43.310,the IOC has full confidence in the authority of Professor Richard McLaren and respects his judgment to ensure a comprehensive inquiry.
01:39:43.394,01:39:46.230,We will act swiftly to take the necessary measures.
01:39:46.313,01:39:49.775,"Sincerely yours, Thomas Bach. President."
01:40:02.246,01:40:05.916,"Yes, Nagornykh is ordering Grigory."
01:40:05.999,01:40:10.629,"There's e-mails, like, explicitly about soccer players."
01:40:10.712,01:40:17.386,"There's e-mails explicitly of, you know, of weightlifters."
01:40:18.804,01:40:20.847,And that essentially were...
01:40:20.931,01:40:24.976,"Of rowers, of swimmers..."
01:40:25.686,01:40:27.854,where Grigory had found the positive.
01:40:39.616,01:40:40.742,You got it.
01:40:42.453,01:40:44.913,"If this all can be proved, it's quite mind-blowing."
01:40:45.497,01:40:48.042,"-The sooner I have it, the better. -Okay."
01:41:07.811,01:41:17.654,...Russian athletes could not credibly return to international competition without undermining the confidence of their competitors and the public.
01:41:21.992,01:41:32.294,"But track and field stars, like pole-vaulter Yelena Isinbayeva, won't be going for gold at next month's Rio Olympics, despite having friends in high places."
01:42:58.839,01:43:03.552,"Please let me repeat, these allegations are not facts, just rumors and speculations."
01:43:08.640,01:43:10.309,news conference here in Toronto.
01:43:11.352,01:43:23.572,"In May, Professor McLaren was mandated by the World Anti-Doping Agency with respect to the allegations made by the former director of the WADA-accredited Moscow laboratory, Dr. Grigory Rodchenkov."
01:43:25.198,01:43:31.622,The investigation has established the findings set out in the report beyond a reasonable doubt.
01:43:32.206,01:43:41.298,"Our experts were to determine if samples had scratches and marks on the inside of the bottle caps, representative of a tool used to open the cap."
01:43:42.549,01:43:45.636,Of the set of samples suspected of being swapped...
01:43:47.220,01:43:48.764,we were able to confirm...
01:43:50.432,01:43:53.310,100% had evidence of tampering.
01:43:55.437,01:44:03.111,"We've conducted cyber and forensic analysis, secured data from hard drives, and reviewed thousands of pages of documents."
01:44:03.945,01:44:13.955,"The Moscow laboratory operated for the protection of doped Russian athletes within a state-directed, fail-safe system."
01:44:16.082,01:44:37.521,"Ministry of Sport, Deputy Minister of Sport Yuri Nagornykh, RUSADA, that's the anti-doping agency in Russia, and the former director of the Moscow testing laboratory were all involved in this operation with the active participation and assistance of the Russian Federal Security Service, formerly known as the KGB."
01:44:38.397,01:44:46.530,"The FSB, who had access to the Sochi lab under the guise of the building maintenance contractor, can be identified in the evidence we have."
01:44:47.030,01:44:48.574,"Alex Mihailovich, RT."
01:44:48.657,01:44:53.370,Rodchenkov himself is a person who's under investigation in Russia currently.
01:44:53.454,01:44:54.996,He took off from Russia.
01:44:55.080,01:45:00.961,"He seems to be a character that you really can't rely on, and a lot of this relies on Rodchenkov."
01:45:01.044,01:45:03.339,Does this compromise your work?
01:45:03.422,01:45:08.677,"He is a person in this investigation, but not the only person in this investigation."
01:45:09.260,01:45:16.477,"I can say without a doubt, Dr. Rodchenkov is telling the truth and was a truthful witness."
01:45:16.560,01:45:21.815,I was able to corroborate that because of all the scientific and forensic information.
01:45:22.858,01:45:28.780,My team can demonstrate the existence of this system beyond a reasonable doubt.
01:45:45.547,01:45:50.677,"that was contained in our independent commission, it's proven that offenses were committed."
01:45:50.761,01:45:55.098,"So, I don't think anybody can accuse us of sitting back and doing nothing."
01:46:02.689,01:46:07.193,saying the world is seeing a dangerous recurrence of politics interfering in sport.
01:46:09.362,01:46:13.867,any decision which collectively punishes its competitors is unacceptable.
01:46:13.950,01:46:15.619,"Richard Conway, BBC News."
01:46:41.144,01:46:43.439,I'm gonna be rolling your hands like that.
01:46:43.522,01:46:45.857,Let me do all of the work. It makes it easier for everybody.
01:46:56.868,01:46:58.328,"Oh, you have new glasses!"
01:47:07.463,01:47:09.881,I am going into the witness protection program.
01:47:13.469,01:47:14.803,Why?
01:47:21.017,01:47:22.811,"-So, this is serious? -Yes."
01:47:59.931,01:48:06.437,You wrote down the lawyer's contact information and have everything?
01:48:58.073,01:49:01.785,Protection means protection that you don't know how it's organized.
01:49:58.174,01:50:02.888,We have decided today that Russian athletes can compete in Rio.
01:50:09.269,01:50:13.940,"will carry out individual analysis, taking into account..."
01:50:23.366,01:50:26.912,The IOC going against the World Anti-Doping Agency recommendations...
01:51:46.032,01:51:50.871,"Respect the rules, play fair, be clean."
01:51:59.796,01:52:03.299,Justice has to be independent from politics.
01:52:05.010,01:52:06.636,Hurrah!
01:52:26.739,01:52:31.036,How many times do I have to say it? I've never taken drugs. How clear is that?
01:53:03.819,01:53:05.904,into sharper and clearer focus.
01:53:05.987,01:53:11.242,"I can confirm, for years, that spectators have been deceived."
01:53:12.202,01:53:18.249,"The desire to win medals superseded their collective moral and ethical compass, and Olympic values..."
