start,end,script
01:47:32.654,01:47:37.158,"Visa is just one thing, but-- You are my bride and keeper of the family and the dogs."
01:47:37.242,01:47:41.997,"Grigory, I was worrying all day, and on top of that, trying to reach you."
01:47:42.080,01:47:43.081,Don't tell anyone anything.
01:47:43.749,01:47:46.960,Who would I even tell? I don't see much of anyone these days.
01:47:47.043,01:47:52.465,Maybe they'll pay off some officials to sit in prison for some time?
01:47:52.549,01:47:55.176,As a formality.
01:47:55.260,01:47:57.053,I have to get going.
01:47:58.179,01:47:59.848,-Veronika? -Yes?
01:47:59.931,01:48:06.438,You wrote down the lawyer's contact information and have everything?
01:48:07.439,01:48:08.940,You know what I'm talking about?
01:48:12.736,01:48:16.072,Of course I understand. It's just... this is all so sad.
01:48:29.502,01:48:32.631,Whatever packing you need to do and getting dressed...
01:48:54.110,01:48:57.989,I still don't know how it will be organized.
01:48:58.073,01:49:02.160,Protection means protection that you don't know how it's organized.
01:49:07.791,01:49:09.626,I will start writing book.
01:49:10.836,01:49:12.713,"Oh, we are on the first floor."
01:49:13.589,01:49:14.756,Where is the exit?
01:49:21.512,01:49:24.474,I wonder when I'm going to see you again.
01:49:25.809,01:49:27.978,Don't worry. I'll be back.
01:49:32.315,01:49:36.778,"Bryan, you are medium-sized monster!"
01:49:36.862,01:49:38.154,Remember me.
01:50:59.235,01:51:06.076,Winston sank his arms to his sides and slowly refilled his lungs with air.
01:51:12.165,01:51:16.169,His mind slid away into the labyrinthine world of doublethink.
01:51:18.046,01:51:26.096,"To know and not to know, to be conscious of complete truthfulness while telling carefully constructed lies."
01:51:27.931,01:51:31.226,To repudiate morality while laying claim to it.
01:51:37.565,01:51:40.986,To forget whatever it was necessary to forget...
01:51:52.080,01:51:56.709,then to draw it back into memory again at the moment when it was needed...
01:52:09.597,01:52:12.142,and then promptly to forget it again.
01:52:20.566,01:52:24.988,"And above all, to apply the same process to the process itself."
01:52:33.580,01:52:39.127,"And if all others accepted the lie, then the lie passed into history and became truth."
01:52:40.420,01:52:42.630,We've never had a doping program in Russia.
01:52:42.713,01:52:47.260,"This is just impossible, unthinkable. We would never do something like that."
01:52:47.343,01:52:55.268,"I don't even recall the name of that citizen who defected, the one who ran the Russian anti-doping lab."
01:52:55.351,01:53:00.606,Even to understand the word 'doublethink' involves the use of doublethink.
01:53:18.333,01:53:24.714,I was doing in parallel two things which canceled out each other in being fully contradictory.
01:53:30.303,01:53:31.930,Doping and anti-doping.
01:53:36.684,01:53:40.105,"It was pure, exact doublethink."
01:53:44.817,01:53:46.444,I was like a slave.
01:53:49.906,01:53:51.574,Slavery was my freedom...
01:53:56.579,01:53:57.914,till the end.
01:54:11.511,01:54:12.637,So...
01:54:17.142,01:54:18.101,truth.
00:00:40.373,00:00:43.293,"Before, during and after the Olympics."
00:00:44.043,00:00:47.380,Over 160 drug tests.
00:00:47.464,00:00:50.467,I have never failed a test.
00:00:54.304,00:00:57.265,or any other performance-enhancing substance?
00:01:02.979,00:01:04.314,I've never taken drugs.
00:01:08.902,00:01:12.197,like the all-time greats who've ever won this big event.
00:01:14.907,00:01:19.329,must be followed up with extraordinary proof.
00:01:21.790,00:01:24.084,And they have not come up with extraordinary proof.
00:01:45.939,00:01:46.815,We have...
00:01:47.565,00:01:50.610,...this mountain bike.
00:01:52.862,00:01:54.447,Loading up the Thule rack.
00:01:54.531,00:02:02.664,"And this is my entire life in the car right now, set up, ready for insanity."
00:02:03.665,00:02:08.002,I'm getting ready for the single hardest amateur cycling event in the world.
00:02:08.085,00:02:11.756,It's basically a miniature Tour de France for insane people.
00:02:19.681,00:02:25.186,"I've been riding for 28 years seriously, but never as a professional."
00:02:25.270,00:02:46.291,"Going to these massive amateur events that are not professional, what it was gonna lead to."
00:02:49.794,00:02:54.507,"When LeMond won that first Tour de France, I was in seventh grade, I think."
00:02:58.094,00:03:02.682,"His name in French means the world, and this is the world of Greg LeMond in Paris today."
00:03:05.227,00:03:07.354,it really brought me into the sport.
00:03:08.271,00:03:10.648,I ate a wheel going about 40 miles an hour.
00:03:10.732,00:03:15.028,I spent my entire freshman year of college with plastic teeth in my mouth.
00:03:15.612,00:03:17.488,I would've kept racing if it wasn't for that.
00:03:27.707,00:03:30.167,He is just going faster and faster and faster.
00:03:32.712,00:03:35.632,The fact that Armstrong managed to conquer cancer was unbelievable.
00:03:35.715,00:03:38.468,Now he's riding at the front of the Tour de France like a Trojan.
00:03:44.599,00:03:46.183,He was kind of my hero.
00:03:52.064,00:03:56.027,Did you ever take banned substances to enhance your cycling performance?
00:03:56.110,00:03:56.986,Yes.
00:04:08.122,00:04:12.001,I felt that I didn't really wanna know.
00:04:14.379,00:04:21.010,Because a lot of the guys that he raced with and guys who had raced against him that I'd just known over the years...
00:04:22.262,00:04:23.638,they were my friends.
00:04:25.181,00:04:29.477,"If you would've had your choice, you would've never doped?"
00:04:32.229,00:04:42.324,"Up until it directly affected me, It's... messy."
00:04:53.084,00:05:00.008,"In competition, out of competition, at home, at a race, Seven in the morning, seven at night, whatever, and they're all clean."
00:05:10.768,00:05:12.770,as part of the federal investigation.
00:05:16.148,00:05:25.157,"If this guy had passed, whatever it is, 500 doping tests over his entire career, clearly the system didn't work."
00:05:26.659,00:05:30.663,How many times did you test Lance during his career?
00:05:34.709,00:05:39.672,I'm estimating that I would've tested him 50 times. 5-0.
00:05:44.636,00:05:45.887,Correct.
00:05:47.639,00:05:53.811,I developed and operated the UCLA Olympic Laboratory for 25 years.
00:05:54.479,00:06:01.068,I'm known mostly for developing tests so that athletes get caught if they're using drugs.
00:06:05.532,00:06:08.117,Did you believe that it was just Lance?
00:06:10.495,00:06:12.497,-Do you think that-- -They're all doping.
00:06:13.456,00:06:15.041,Every single one of 'em.
00:06:20.463,00:06:26.678,"With certain knowledge, you can get around the testing all the time."
00:06:27.512,00:06:29.556,It's really easy to beat.
00:06:30.890,00:06:32.016,Very easy.
00:06:36.228,00:06:41.776,was to prove the system in place to test athletes was bullshit.
00:06:43.778,00:06:52.286,"I had read about the hardest amateur cycling race on the planet, this seven-day race through the French Alps, called the Haute Route."
00:06:55.957,00:07:05.467,"If you were to take the hardest seven days in the Tour de France, put 'em all together back-to-back-to-back-to-back, that would be what this Haute Route course was like."
00:07:08.595,00:07:10.680,The first year I did it totally clean.
00:07:11.848,00:07:14.559,There were 440 masochists.
00:07:16.936,00:07:19.564,My goal was to be in the top 100.
00:07:30.032,00:07:34.495,"After seven days, 75,000 feet of climbing and 1,000 miles..."
00:07:36.998,00:07:39.501,I was destroyed.
00:07:47.008,00:07:48.718,But I finished 14th.
00:07:50.678,00:07:56.934,"There's about ten guys, it seems, that are on just another level than everybody else."
00:07:58.435,00:08:01.731,"Then there's this next group, and then there's me."
00:08:33.805,00:08:36.641,"Yeah. Basically, go through..."
00:08:36.724,00:08:43.397,"go through an entire doping program, but overseen by the scientist."
00:08:44.148,00:08:51.948,I'm gonna have Don Catlin design a program for me that's gonna get through every single one of the doping controls in the world...
00:08:52.532,00:08:53.533,clean.
00:09:06.588,00:09:15.722,"If I could do that and I could get away with it, that would mean that pretty much any athlete could do that and any athlete could get away with it."
00:09:24.731,00:09:29.360,The only labs that test professional athletes are WADA-accredited labs.
00:09:38.535,00:09:45.209,"Because if somebody could just send their samples into a lab, then anybody could figure out how to game the system."
00:09:47.086,00:09:48.087,And then...
00:09:59.932,00:10:05.813,"But, you know, God bless Don Catlin, because he told me that he knew this guy..."
00:10:18.284,00:10:22.246,And that set off this whole chain of events.
00:10:35.217,00:10:36.052,Hi.
00:10:36.135,00:10:37.386,Oh! Great.
00:10:37.470,00:10:39.847,-It's a secret window. Now it's clean. -Hmm.
00:10:40.097,00:10:41.683,"Yeah, you look good now."
00:10:45.227,00:10:50.232,"I met with this guy who's gonna at least, like, prescribe me the protocol."
00:10:54.028,00:10:56.197,You would like to start your hormonal program?
00:11:00.702,00:11:01.703,Yes.
00:11:01.786,00:11:03.120,"Ha, ha, ha."
00:11:19.887,00:11:21.848,"Hey, you wanna see my dog?"
00:11:22.431,00:11:24.058,-Let me get him. -Yes.
00:11:29.646,00:11:30.647,Male.
00:11:35.987,00:11:37.238,He's got the balls.
00:11:37.321,00:11:40.532,"Yeah. There is the balls. Yes, yes."
00:11:44.620,00:11:45.913,Max. Yeah.
00:11:45.996,00:11:49.500,"Testosterone, you have to have a prescription."
00:11:49.583,00:11:51.669,"Yes, uh, injectable."
00:11:55.506,00:11:56.716,Like Lance Armstrong.
00:12:11.397,00:12:14.441,We've got three medications that you'll take by injection.
00:12:14.525,00:12:18.279,"-This is five times a week? -Yeah, it's all on your regimen sheet."
00:12:18.905,00:12:21.032,We'll draw up half a cc.
00:12:21.115,00:12:23.200,-Looks like a big needle. -It's a tiny needle.
00:12:23.284,00:12:24.285,-Really? -Yeah.
00:12:24.368,00:12:29.206,"Your testosterone comes ready to go. This is very, very viscous."
00:12:30.040,00:12:33.878,"It's a very thick substance, so you need a big needle to draw it up."
00:12:35.629,00:12:36.964,Then we're gonna pull out.
00:12:37.756,00:12:39.716,So there's your .2 cc's.
00:12:39.801,00:12:42.719,And that one goes also in the top of your thigh.
00:12:44.263,00:12:46.974,"-I'm a little nervous, but all right. -Okay."
00:12:48.684,00:12:50.519,And does it hurt the muscle? Do you flex?
00:12:53.397,00:12:57.026,"You just pinch it, and we're just gonna go just through the skin."
00:12:57.109,00:12:58.194,That's it.
00:12:58.277,00:13:00.863,And then we're just gonna put that underneath the skin.
00:13:02.990,00:13:06.077,"-I mean, I see it there. -It'll go away in no time."
00:13:10.789,00:13:13.417,Pop it through the skin. That's all we're looking to do.
00:13:13.500,00:13:15.711,Just through the skin. It's real thick now.
00:13:16.879,00:13:19.590,-And you are pumped up. -Whoa!
00:13:19.673,00:13:21.258,How long till those bumps go down?
00:13:21.342,00:13:23.635,-They'll go quick. Within a half hour. -Okay. Whoa.
00:13:23.719,00:13:25.179,And so we begin.
00:13:33.604,00:13:35.564,Going to do an injection.
00:13:42.154,00:13:43.990,as well as nutrition coaching.
00:13:59.088,00:14:01.632,This is my morning pill-popping routine.
00:14:03.092,00:14:06.888,And then I prepare the testosterone.
00:14:12.559,00:14:14.395,It's really thick.
00:14:15.354,00:14:18.774,What made you think that Grigory might help me?
00:14:19.650,00:14:23.112,"Well, it's difficult for me to answer that without..."
00:14:24.363,00:14:28.367,saying things about Grigory that aren't very kind.
00:14:47.929,00:14:51.974,"So just pee, take some urine and put it in the freezer?"
00:14:53.559,00:14:56.938,"There's day eight, day ten..."
00:14:57.771,00:14:58.689,Needle.
00:15:03.319,00:15:08.991,"The testosterone with the HGH, it's a weird feeling because it doesn't feel like I'm on anything."
00:15:09.783,00:15:12.369,Are you now training? And you feel a little bit stronger?
00:15:12.453,00:15:14.788,"Yeah, I really felt stronger."
00:15:25.132,00:15:34.766,"who did all the testing for the Sochi Olympics would agree to do this, because his job was supposed to be to catch athletes."
00:15:35.726,00:15:38.645,"So you want me to do 24,000 units in one month?"
00:15:50.866,00:15:54.620,I'm getting kind of bruises all over my legs.
00:16:07.008,00:16:09.093,This is starting to get ridiculous.
00:16:09.635,00:16:10.677,Ow!
00:16:14.515,00:16:17.268,"Oh, fuck, I'm really bleeding from that one, too."
00:16:18.102,00:16:19.228,Let me get some alcohol.
00:16:21.105,00:16:23.524,"Um, okay, so then a half of this one."
00:16:29.488,00:16:31.032,"Oh, fuck!"
00:16:40.582,00:16:41.583,Okay.
00:16:43.252,00:16:44.753,"So, that's that."
00:16:50.259,00:16:52.302,You put it right into your ass.
00:16:55.389,00:16:57.349,Show me that bottle again.
00:17:04.856,00:17:06.650,-Which movie? -No?
00:17:07.443,00:17:08.277,About me.
00:17:31.175,00:17:32.718,Grigory Rodchenkov.
00:17:54.490,00:18:00.496,It was inflammatory enough that they were afraid to run it while the whistle-blowers were still in Russia.
00:18:01.330,00:18:06.502,"So they got them out of Russia, ran the program, and it was a bombshell."
00:18:10.714,00:18:14.551,That's according to a recent German documentary aired on ARD.
00:18:18.430,00:18:19.890,effective immediately.
00:18:22.768,00:18:24.561,on allegations in the media.
00:18:24.645,00:18:28.690,Athletes must be presumed to be innocent until proven guilty.
00:18:28.774,00:18:32.944,"These are wild allegations, and we'll have to check them out."
00:18:36.323,00:18:38.950,That's how the Independent Commission was created.
00:18:39.868,00:18:50.171,"I had investigative experience for a decade and a half, and some big investigations, like US Olympic Committees and Major League Baseball."
00:18:55.801,00:19:00.347,"Our mandate was athletics, track and field and Russia."
00:19:01.473,00:19:06.770,"The WADA chairman named this Independent Commission and said, Let's get at it."
00:19:10.857,00:19:13.277,and athletics officials say they'll cooperate.
00:19:13.360,00:19:15.779,"It's unclear, though, what actions might be taken."
00:19:15.862,00:19:17.156,"Thomas Daigle, CBC News."
00:19:22.536,00:19:23.537,It's growing?
00:19:35.674,00:19:41.305,"who did all the testing for Sochi, who's now at the center of this big Russian doping scandal."
00:19:41.388,00:19:43.724,Russia was doping their athletes in the '80s.
00:19:43.807,00:19:47.018,"-Apparently, they've never stopped. -Really?"
00:19:49.480,00:19:58.029,"the guy who was the head of WADA for 15 years, has actually been hired to lead the investigation against Grigory."
00:19:58.614,00:20:01.825,Um... I don't know what you want me to do with that.
00:20:02.409,00:20:03.702,Meaning?
00:20:03.785,00:20:07.038,I don't know how... Shit. My computer's about to die.
00:20:07.122,00:20:09.040,I don't know how...
00:20:10.626,00:20:13.712,-Let me grab my power cord. I'll be back. -Do you have a charger? All right.
00:20:15.381,00:20:20.302,There might be someone else out there that might be a better decision or choice.
00:20:20.386,00:20:23.930,You're using this guy as your coach. What's your comfort level?
00:20:24.014,00:20:27.351,-Here's how I'm looking at it... -You can find someone else.
00:20:28.018,00:20:32.481,I guess you call it doping doctors. I don't know what you would label Grigory.
00:20:32.564,00:20:34.691,Is he a biochemist? I don't even know.
00:20:35.192,00:20:38.153,It doesn't even matter. I don't like this shit.
00:20:54.878,00:20:57.839,Your testosterone is pretty much right where we want you.
00:20:58.340,00:21:04.763,"Grigory, what's the typical wash-out for urine to go to negative from a full treatment of testosterone?"
00:21:04.846,00:21:07.015,How many days does that take usually? Seven?
00:21:10.185,00:21:16.107,"Is there any way that we could test that here in the States, or it's gotta go back to you to test those frozen urines?"
00:21:20.362,00:21:23.865,"WADA now, they have an inquiry about me."
00:21:29.580,00:21:33.375,How do you think is the best way to basically get that test done?
00:21:35.586,00:21:42.301,"I would like to do this, to come to, maybe, LA, and to smuggle something to Russia. Some urines from you."
00:21:45.011,00:21:48.307,Could we send 'em to Salt Lake City or another lab?
00:21:48.390,00:21:50.559,"No, no, no. It's strictly prohibited."
00:22:05.907,00:22:06.783,No!
00:22:28.930,00:22:31.057,Then we recode them.
00:22:32.267,00:22:33.268,Perfect.
00:22:35.521,00:22:36.522,Right.
00:22:36.605,00:22:42.235,"The goal during this two- to three-week period is to push you to an extreme on a chronic level, not just acute."
00:22:49.325,00:22:52.287,"-Max, go away. Out. -No, no, no."
00:23:13.475,00:23:14.851,-And like this... -Right.
00:23:28.699,00:23:32.410,actually friendly with what was then the Soviets.
00:23:32.494,00:23:44.297,"We, the US, would invite Soviets to come to the US and pick and choose athletes that they wanted to test, bring 'em in and test them where the Soviets were watching."
00:23:44.798,00:23:48.093,Grigory was the first representative.
00:23:49.094,00:23:58.812,He shows up at the second day of work in bright orange shorts and announces that he's gonna enter the Santa Monica Marathon.
00:23:58.895,00:24:00.897,And he won the darn thing.
00:24:02.023,00:24:03.358,He's a good athlete.
00:24:12.242,00:24:15.954,"My mother always pushed me to swim, to ski."
00:24:31.136,00:24:33.346,And all injections were done by my mother.
00:24:33.930,00:24:37.267,"And, of course, it was 50 milligrams, this simple thing."
00:24:41.021,00:24:41.897,"Yes, of course."
00:24:44.065,00:24:50.614,"But if you are not national team level, like Olympic, you cannot afford any more training camp."
00:25:31.029,00:25:32.823,-We'll sit down with a piece of paper. -Yes.
00:25:41.873,00:25:45.001,"So, here's day one. Okay? Here's day two."
00:25:46.002,00:25:48.463,"Here's day three, day four, day five."
00:25:51.633,00:25:53.802,We have nine urines. Okay.
00:25:56.847,00:25:58.974,Is that enough? Or do I need any more?
00:26:01.768,00:26:04.646,"-Three, three, three. -I hear you got the real code."
00:26:27.377,00:26:29.379,"-Fantastic. -Oh, God. What is that?"
00:26:31.089,00:26:33.466,What is that? What is that?
00:26:45.395,00:26:46.730,And on the top.
00:27:07.000,00:27:10.920,"Okay, next time. Next time, if I survive."
00:27:14.758,00:27:21.348,"At my lab, WADA is keeping laboratory on a very short leash. Leash?"
00:27:45.830,00:27:47.666,But they were looking for something.
00:27:47.916,00:27:50.794,"-Like a secret lab? -Yes, yes, yes, yes, underground."
00:27:50.877,00:27:52.963,"-Batman? -Yes, yes."
00:27:53.671,00:27:55.673,Who owns the lab?
00:27:57.175,00:27:58.509,-The state. -The state does?
00:28:13.817,00:28:15.276,"-No, no, no! -No, no, no."
00:28:21.074,00:28:22.826,-Remember me. -I will.
00:28:22.909,00:28:26.079,"-So I'm gonna see you-- -So, so, so nice with you."
00:28:26.162,00:28:27.748,"-Grigory, thanks for coming. -Yes."
00:28:34.295,00:28:35.797,Sports pornography and erotics.
00:28:38.299,00:28:40.343,"And I see you, uh, in September."
00:28:49.436,00:28:51.354,"No, I did not, and Dick Pound did not."
00:28:51.938,00:28:57.485,We wanted to send an investigative group of WADA specialists into the Moscow lab.
00:28:58.111,00:29:01.740,"The director of the lab, he was the last fail-safe position, right?"
00:29:01.823,00:29:06.077,"If there is a sample that's potentially positive, where can you stop it from being reported?"
00:29:06.161,00:29:07.120,In the lab.
00:29:07.620,00:29:11.249,So he was interviewed. Didn't provide us with much information.
00:29:27.808,00:29:31.311,"-I have a full agenda, so don't worry. -Okay."
00:29:59.714,00:30:02.633,What do you see the outcome or the solution as?
00:30:13.603,00:30:15.981,"Keep digging, keep digging. Keep digging, come on."
00:30:16.064,00:30:18.900,"Come on, you got it. Come on. Four, two, one."
00:30:18.984,00:30:20.318,Taking it down. Taking it down.
00:30:21.652,00:30:23.613,This is already better than last time.
00:30:25.866,00:30:31.037,"Last year, 250 watts. This year, 349. It's 100 watts."
00:30:40.588,00:30:42.340,I can't wait to come to Moscow.
00:30:53.184,00:30:55.895,-The last injection is on US soil. -Okay.
00:31:10.159,00:31:13.288,Your body's gonna shut down. It's gonna break down entirely.
00:31:17.918,00:31:20.253,and we do have an anti-doping policy.
00:31:24.257,00:31:26.509,"They may come and test, just so you're aware."
00:31:33.808,00:31:40.690,"He had helped me dope, and he was gonna test my samples through his WADA lab in Moscow."
00:31:42.567,00:31:46.321,I have not done a urine sample since I've been here.
00:31:55.621,00:31:58.458,August 21st.
00:31:58.541,00:32:01.753,See you at the end. And good luck tomorrow.
00:32:29.739,00:32:32.575,Are you ready?
00:32:33.701,00:32:34.953,Start!
00:32:55.556,00:32:56.932,"Ninety, ninety. That's it."
00:33:22.708,00:33:24.710,You guys were hauling ass.
00:33:35.513,00:33:39.309,Bryan's in that group data. He's in there with the top ten guys.
00:34:03.583,00:34:07.378,"Can't raise him on the walkie-talkie. Bryan, come back."
00:34:17.722,00:34:19.974,The battery's dead. It needed to be charged.
00:34:20.600,00:34:23.894,Now it won't go up. You see? Dead. It's totally dead.
00:34:46.084,00:34:49.754,-I dropped ten places in the rankings. -Okay. Hmm.
00:35:03.143,00:35:09.857,I'm not beating 'em. They're in a different-- There's guys that I don't know that you could've beat on your best day.
00:35:17.490,00:35:21.119,to have a substantially better performance this year.
00:35:22.412,00:35:23.579,And...
00:35:24.955,00:35:25.998,I'm not.
00:35:29.460,00:35:30.753,Neutral descent now?
00:35:37.593,00:35:47.687,"I mean, I could have been 21 years old and taken all the blood bags and EPO in the world, and I was still not going to be a Tour de France champion."
00:35:47.770,00:35:49.689,It doesn't matter.
00:36:23.764,00:36:25.850,You are what you are. I am what I am.
00:36:28.644,00:36:30.897,"It's a turning point, what we are doing."
00:37:14.274,00:37:17.277,How many tests... I've probably had 15 or 20 blood tests.
00:37:34.669,00:37:36.879,Be very careful with all your material.
00:38:18.921,00:38:25.345,"or those working in WADA laboratories today, that you suspect could have been corrupted?"
00:38:51.245,00:38:56.041,with the hiding blood passports of all the athletes?
00:39:01.047,00:39:04.967,"If you hide fight against doping, you cannot be 50% honest."
00:39:12.391,00:39:15.102,"WADA is like a religion, and you cannot escape."
00:39:43.130,00:39:47.718,How do we go about the analysis? What do we wanna show?
00:40:02.066,00:40:04.359,-The best vodka. -What kind?
00:40:05.861,00:40:07.321,"-Oh, awesome! -You do drink vodka?"
00:40:07.405,00:40:10.282,"-Yeah, I like vodka. -You like-- I have vodka for you."
00:40:10.365,00:40:14.203,I've decided I'm not gonna leave Russia. I'm gonna stay here.
00:40:19.792,00:40:20.918,You think?
00:40:35.683,00:40:36.684,Smile.
00:41:20.185,00:41:26.484,"Almost a year ago, very serious doping allegations were first raised on German television channel ARD."
00:41:27.234,00:41:32.948,"The WADA president, Sir Craig Reedie, announced that a full and thorough inquiry would be conducted."
00:41:33.699,00:41:39.664,"The founding president of the World Anti-Doping Agency, Mr. Dick Pound, the chair of that commission."
00:41:41.373,00:41:51.133,Overwhelming portions of the allegations made on the ARD program have been found by the Independent Commission to be true.
00:41:51.217,00:41:54.136,It's worse than we thought. We have found cover-ups.
00:41:54.220,00:41:57.431,We found destruction of samples in the laboratories.
00:41:58.348,00:42:03.187,We found payments of money in order to conceal doping tests...
00:42:04.271,00:42:05.272,among others.
00:42:05.981,00:42:17.159,"Our conclusion was that all of this could not have happened, and continue to happen, without the knowledge of and either actual or implied consent of the state authorities."
00:42:18.994,00:42:22.206,Forty pages of this report is Grigory.
00:42:22.998,00:42:29.964,It's hard to imagine what the Russian state interest in athletes' urine would be.
00:42:30.047,00:42:37.930,"One of our big concerns about tests were the 1,400 that were destroyed by the director of the Moscow laboratory."
00:42:38.597,00:42:48.941,"In fact, our recommendation is the director of the laboratory be removed from his position, that the WADA accreditation be withdrawn, and the Russian Federation be suspended."
00:42:57.074,00:42:58.283,Where did Grigory go?
00:43:04.373,00:43:06.166,Maybe he's a little bit nervous.
00:43:09.754,00:43:14.049,I'm not-- I'm sorry. I'm trying to understand what you're saying.
00:43:20.514,00:43:23.267,"So, Bryan, I hardly could talk to you tonight."
00:43:26.771,00:43:29.899,and could have a profound impact on the future of Russian athletics.
00:43:32.985,00:43:35.279,of state-sponsored doping.
00:43:48.709,00:43:52.379,Does this mean they could potentially miss next year's Olympics?
00:43:52.462,00:43:55.174,"Well, that is certainly one of the potential outcomes here."
00:43:58.886,00:44:03.015,You will see athletes being sanctioned by the IAAF.
00:44:03.098,00:44:07.477,You will see athletes and officials being excluded.
00:44:07.561,00:44:11.816,And you will see an action led by the IOC.
00:44:11.899,00:44:14.902,We'll apply this zero-tolerance policy.
00:44:18.113,00:44:23.327,on whether Russia's track and field athletes will be allowed to compete at the Rio Olympics.
00:44:23.828,00:44:29.583,I want to hear what the Athletics Federation of Russia is actually saying in answer to those allegations.
