start,end,script
01:28:13.538,01:28:14.790,Go home to your mother!
01:29:16.810,01:29:19.229,take them with you!
01:29:20.939,01:29:27.612,"However, leave the limbs you've lost."
01:29:28.905,01:29:31.700,They belong to me now.
01:29:40.333,01:29:43.169,You stay right where you are.
01:29:55.140,01:31:18.306,My place… I hope you've saved your energy.
01:31:22.185,01:31:27.565,If you haven't… you might not last five minutes.
01:31:29.526,01:31:34.406,"But as last looks go, you could do worse."
01:34:20.572,01:34:29.164,You may not be able to fight like a samurai… but you can at least die like a samurai.
01:36:04.884,01:36:06.511,I apologize.
01:37:20.668,01:37:22.503,Hattori Hanzo sword.
01:39:30.923,01:39:36.220,Sofie… My Sofie… I'm so sorry.
01:39:40.349,01:39:43.603,Please. Please forgive my betrayal.
01:39:45.813,01:39:57.992,But still… except my aching heart over what she's done to my beautiful and brilliant Sofie.
01:40:02.413,01:40:04.624,The first reason is information.
01:40:15.593,01:40:21.933,"And every time you don't give me answers, I'm gonna cut something off."
01:40:23.100,01:40:28.523,"And I promise you, they will be things you will miss!"
01:40:48.793,01:40:50.545,Guessing won't be necessary.
01:40:51.587,01:40:53.089,She informed me.
01:40:55.299,01:40:59.345,She said I could keep my wicked life for two reasons.
01:41:02.181,01:41:05.726,I've allowed you to keep your wicked life for two reasons.
01:41:06.769,01:41:14.610,"And the second reason is so you can tell him, in person, everything that happened here tonight."
01:41:16.112,01:41:21.826,I want him to witness the extent of my mercy by witnessing your deformed body.
01:41:23.202,01:41:26.789,I want you to tell him all the information you just told me.
01:41:27.415,01:41:29.875,I want him to know what I know.
01:41:30.543,01:41:33.629,I want him to know I want him to know.
01:41:34.714,01:41:42.513,And I want them all to know they'll all soon be as dead as O-Ren.
01:42:15.004,01:42:16.631,It's a forest.
01:42:18.132,01:42:25.056,"And like a forest, it's easy to lose your way, to get lost, to forget where you came in."
01:42:28.809,01:42:32.605,That woman deserves her revenge.
01:42:37.860,01:42:41.656,And… we deserve to die.
01:42:45.868,01:42:49.163,She must suffer to her last breath.
01:43:02.593,01:43:03.844,How did you find me?
01:43:14.814,01:43:18.150,Is she aware her daughter is still alive?
