start,end,script
00:08:24.629,00:08:26.088,That helps.
00:08:32.553,00:08:33.721,No radar.
00:08:34.180,00:08:35.348,No sensors.
00:08:35.431,00:08:37.600,The computer would not be there to handle any problems.
00:08:38.434,00:08:40.394,I was trained for problems.
00:08:40.853,00:08:42.730,Think about you daughter!
00:08:46.025,00:08:50.071,"This'll be just like the Mercury-Redstone 3, NASA's first manned mission to space."
00:08:50.154,00:08:53.616,"The first mission was number three? As in, the first two blew up?"
00:08:53.699,00:08:57.870,As in the first two were unmanned. The Jupiter still needs someone to fly it.
00:08:59.330,00:09:00.414,I trust her.
00:09:23.563,00:09:25.189,I feel like we should talk.
00:09:33.823,00:09:35.783,You promised me you weren't gonna tell.
00:09:36.951,00:09:40.705,"We sat by a waterfall, and, granted, it was mud, but whatever."
00:09:40.788,00:09:45.001,We sat there and you gave me your word that you wouldn't.
00:09:45.793,00:09:59.140,"And I know that it was a lot to lay on you, that we're all gonna die in this place, but honestly, I was scared, and I didn't know what to do, and I trusted you, which is not something I do on a regular basis."
00:10:01.100,00:10:02.101,I'm sorry.
00:10:04.020,00:10:05.021,That's it?
00:10:07.148,00:10:09.609,-I gotta go. -Are you serious?
00:10:10.109,00:10:11.193,What are you doing?
00:10:15.573,00:10:16.907,We shouldn't hang out anymore.
00:10:20.244,00:10:21.912,Are you breaking up with me?
00:10:22.747,00:10:24.165,Breaking up?
00:10:27.168,00:10:30.880,"We weren't really together or anything, were we?"
00:10:38.804,00:10:41.932,You're a bad kisser. So...
00:11:09.960,00:11:13.964,I'm trying to patch the UHF radio so this Jupiter can be linked to ours.
00:11:28.479,00:11:30.314,Yeah? What if I helped you?
00:11:31.649,00:11:32.900,Two hours.
00:11:37.321,00:11:39.699,You've been hanging out with Penny too much.
00:11:48.040,00:11:49.250,Uh...
00:11:50.835,00:11:52.795,Beckert hit me with a crowbar.
00:11:54.213,00:11:55.589,Is he okay?
00:11:56.590,00:11:58.843,"Yeah, he'll be sore in the morning."
00:12:04.306,00:12:06.725,Could you show me sometime?
00:12:07.852,00:12:09.145,Show you what?
00:12:09.228,00:12:12.565,What to do if someone tries to hit me with a crowbar.
00:12:13.274,00:12:15.484,Uh... sure.
00:12:16.485,00:12:21.282,"I mean, maybe we could start with something a little less intense. Huh?"
00:12:49.393,00:12:52.813,"Okay, great. Once we're done with those, let's start stripping the med lab."
00:12:52.897,00:12:56.025,"Mom, I'm being prompted to plug in the Dhar's security codes."
00:12:56.859,00:12:58.235,"Okay, I'll talk to Victor."
00:13:03.032,00:13:07.369,"-Okay, uh, I'll get you a ride. -Do you want me to take him?"
00:13:10.498,00:13:13.292,Unless people wanna talk about how they feel about taking this ship apart.
00:13:29.600,00:13:31.560,I need your security codes.
00:13:32.686,00:13:36.065,Why not? You've taken everything else.
00:13:38.609,00:13:42.530,"You know, I want everyone to survive as much as you do."
00:13:48.035,00:13:49.787,You put my family's lives at risk.
00:13:49.870,00:13:52.206,-I was going to get help. -I'm not talking about today.
00:13:54.041,00:13:58.003,I stood up for you. I told them you didn't have it in you.
00:13:58.087,00:14:01.090,-What are you talking about? -The gun.
00:14:01.173,00:14:03.467,The one you gave Angela.
00:14:03.551,00:14:08.514,"When your family's lives are at risk, you don't think clearly, believe me."
00:14:09.348,00:14:11.350,"And right now, you're not thinking clearly."
00:14:12.059,00:14:14.061,I had nothing to do with that business with the robot.
00:14:14.144,00:14:15.854,I suggest you look somewhere else.
00:14:26.407,00:14:29.034,"Aw, honey, I heard what happened."
00:14:30.119,00:14:32.788,There's something I need to tell you about Dr. Smith.
00:14:33.122,00:14:35.457,-What do you mean? -Where is she?
00:14:45.801,00:14:48.095,Are you gonna help or you just gonna watch?
00:14:48.470,00:14:50.347,The math doesn't add up.
00:14:50.431,00:14:52.558,"Believe me, Maureen's math always adds up."
00:14:52.641,00:14:56.687,The way the Jupiters were built on paper isn't the same as they are in real life.
00:14:56.770,00:14:58.856,There are things that only a mechanic knows.
00:14:58.939,00:14:59.773,Such as?
00:14:59.857,00:15:03.027,They were over-engineered. Redundant systems up the wazoo.
00:15:03.110,00:15:07.615,"Your wife thinks you can strip away those redundant systems, and the ones that are left will work."
00:15:07.698,00:15:09.575,"She's assuming they're perfect, but they're not."
00:15:10.034,00:15:13.037,They're just like people. They kinda just chug along...
00:15:14.204,00:15:17.207,"some missing the mark, others picking up the slack."
00:15:18.334,00:15:24.006,"I love a woman who can reroute a coolant system, but we need the whole system. And it's too heavy."
00:15:32.056,00:15:35.267,"Yeah, it's fairly important if you wanna, you know, keep living."
00:15:36.393,00:15:37.603,Huh.
00:15:46.028,00:15:47.696,-Stay here. -Be careful.
00:16:32.408,00:16:35.244,We were just bringing supplies back for everyone.
00:16:37.413,00:16:40.165,"People work better on a full stomach, right?"
00:16:43.168,00:16:44.336,I've got the codes.
00:16:44.420,00:16:48.340,They're on my laptop out in the Chariot. With Judy.
00:16:49.842,00:16:52.344,"-Judy's back? -Yeah. Go get them, okay?"
00:16:52.428,00:16:53.846,"Yeah, thanks, Mom."
00:16:56.098,00:16:59.018,You seem stressed out. Do you need to talk?
00:16:59.601,00:17:02.771,"No, I'm fine. I mean, plus or minus a few variables."
00:17:06.567,00:17:07.651,Of course.
00:17:07.735,00:17:11.238,"Okay, there's some equipment that we need down in the garage."
00:17:23.625,00:17:25.711,It's crazy what people will do when they're scared.
00:17:28.547,00:17:32.384,"Well, at least we caught him before he did any real damage."
00:17:34.845,00:17:36.972,So what is it we're looking for?
00:17:38.557,00:17:41.894,"Just, uh, anything to help strip the ship, you know?"
00:17:42.853,00:17:46.940,"Cordless drill packs, miter saws, or whatever."
00:17:47.024,00:17:50.986,You Robinsons are such a little tribe of fixer-uppers.
00:17:53.238,00:18:02.790,"I've learned more in the past few weeks about repairing engines, rewiring wires and refueling radios..."
00:18:06.001,00:18:08.670,"-Maureen, what are you doing? -Who are you?"
00:18:09.588,00:18:12.424,-You know who I am. -No. The truth.
00:18:16.053,00:18:17.096,It's complicated.
00:18:24.478,00:18:30.234,"When the Resolute was evacuated, the path to my Jupiter was cut off."
00:18:31.360,00:18:32.486,And...
00:18:33.821,00:18:38.117,"I begged anyone I could find to take me in, but they..."
00:18:39.743,00:18:44.123,And that's when I saw him. The real Dr. Smith.
00:18:45.457,00:18:46.583,He was hurt...
00:18:48.418,00:18:50.129,"he was bleeding, and I..."
00:18:53.507,00:18:59.263,"I tried to save him, but I just thought, Why should both of us have to die?"
00:19:02.683,00:19:04.726,So I took his access tag.
00:19:06.436,00:19:09.356,"I'm sorry, I should have told you sooner."
00:19:14.903,00:19:16.321,I wanted you to like me.
00:19:18.448,00:19:22.578,"-Clearly, you wanted more than that. -Just to survive."
00:19:24.496,00:19:26.331,Then why did you give Angela the gun?
00:19:27.249,00:19:31.044,"Maureen, why would I want to hurt the people-- I don't know, you tell me."
00:19:36.216,00:19:38.343,"If I'm wrong, I apologize."
00:19:38.427,00:19:43.015,"But right now, I need to protect my family, and I think the best way to do that is to keep you away from them."
00:19:46.643,00:19:48.145,Jessica Harris.
00:19:50.189,00:19:51.481,That's my name.
00:19:51.857,00:19:55.360,Look it up in the manifest. I'm a physicist.
00:19:55.444,00:19:57.154,You're a physicist?
00:19:58.822,00:20:02.201,-Why would you lie about that? -You're asking the wrong questions.
00:20:02.826,00:20:08.498,"What you should be asking is, how long was I on that Jupiter today?"
00:20:08.582,00:20:10.667,The one you're preparing to launch.
00:20:14.421,00:20:19.176,What might a woman of my expertise have done to it?
00:20:19.259,00:20:23.639,"-You're lying. -Maybe I am, maybe I'm not."
00:20:23.722,00:20:25.515,That ship is your only means of survival.
00:20:25.599,00:20:28.769,"Let's just say, for the sake of argument, that it wasn't."
00:20:29.186,00:20:34.566,If you did anything to sabotage that ship-- Here's what I suggest. You let me out. I come clean.
00:20:34.650,00:20:38.362,We both go our separate ways and call it happily ever after.
00:20:38.445,00:20:41.448,"-Go to hell. -We're already there, Maureen."
00:20:41.740,00:20:45.494,It's up to you whether or not your family makes it out before they get burned.
00:21:02.719,00:21:03.804,That checks out.
00:21:09.017,00:21:11.270,"Victor's Jupiter, you think she messed with it?"
00:21:11.353,00:21:15.023,No. I think she'd say anything to save her ass.
00:21:17.067,00:21:18.777,"No, we'll be fine."
00:21:24.658,00:21:30.998,"Don and I went over the plan. He thinks the Jupiter's still too heavy, even after stripping out everything from your list."
00:21:31.581,00:21:34.501,"-So we strip more. -Well, there's not much left."
00:21:34.584,00:21:37.671,"We're down to life support, pressure systems, -servo systems. -Servo systems."
00:21:37.754,00:21:39.715,"I mean, can it even fly without those?"
00:21:40.465,00:21:42.342,-Theoretically. -Theoretically?
00:21:52.102,00:21:55.397,-She will black out. -Yeah. She will.
00:21:55.480,00:21:57.941,There isn't a person alive who wouldn't.
00:21:58.025,00:22:02.696,"The question is, will she wake up in time to manually pilot out of the atmosphere?"
00:22:04.197,00:22:05.657,What if she can't?
00:22:16.626,00:22:17.753,Is that fast enough?
00:22:19.379,00:22:26.219,"During liftoff, the Jupiter rises at one mile per second, and it's a 70-mile trip out of this atmosphere -into the safety of space. -70 seconds."
00:22:26.303,00:22:29.806,"Oh, God, and it's a rough 70 seconds."
00:22:30.390,00:22:36.938,"The pilot will have to manually steer around atmospheric hazards, which is hard enough, but at the same time vent the engines so they don't overheat."
00:22:37.022,00:22:41.735,It's basically like threading a needle when you've just woken up from a knock-out punch.
00:22:44.279,00:22:45.781,She'll never have enough time.
00:23:01.671,00:23:07.177,Of course. Full cognitive recovery in 19 seconds.
00:23:09.179,00:23:10.806,That's 35 seconds faster.
00:23:10.889,00:23:12.474,That doesn't mean I'm the right person.
00:23:12.557,00:23:15.227,"When every second counts, 35 seconds is a lot."
00:23:15.310,00:23:16.812,-Check again. -I don't need to.
00:23:16.895,00:23:18.271,"-Maureen, listen-- -John..."
00:23:18.355,00:23:21.942,I am not leaving you and the kids. Not again.
00:23:25.779,00:23:27.030,I made a promise.
00:23:29.533,00:23:30.867,Then keep it.
00:23:33.161,00:23:34.204,How?
00:23:35.247,00:23:36.665,Come back safely.
00:23:47.968,00:23:49.094,This decision...
00:23:51.513,00:23:53.223,It can't be just ours.
00:23:56.476,00:23:58.979,"I know this isn't easy, so..."
00:24:01.314,00:24:04.776,"Look, the only way I do this is if we all talk it through."
00:24:05.777,00:24:07.362,"Okay, let's do pros and cons."
00:24:07.446,00:24:11.032,"And pro, he's the only one that can do it."
00:24:11.575,00:24:13.952,That's not a pro. He might not make it.
00:24:15.745,00:24:19.124,That's not a pro either. That's a con. They're all cons.
00:24:27.924,00:24:31.386,You sure you'll be okay? That you'll come back?
00:24:32.554,00:24:35.056,"If anyone can do this, it's your dad."
00:24:35.765,00:24:38.852,Can you promise me he'll make it back?
00:24:43.523,00:24:46.109,"If I could, we wouldn't be having this discussion."
00:24:53.700,00:24:54.993,What happens if I say no?
00:25:07.964,00:25:09.424,"Hey. Hey, Will."
00:25:10.509,00:25:11.384,Will.
00:25:18.141,00:25:19.434,Talk to me.
00:25:20.560,00:25:23.772,The robot. I let him die.
00:25:23.855,00:25:26.566,I told him it was okay to walk off the cliff.
00:25:26.650,00:25:30.028,"And now, you want me to do the same for you?"
00:25:30.904,00:25:35.033,"Will, I don't wanna do this."
00:25:35.825,00:25:37.535,But you have to?
00:25:37.619,00:25:41.957,"That's what you said three years ago, when you left."
00:25:45.168,00:25:47.087,Not gonna say it's okay for you to go.
00:25:58.807,00:26:00.725,"Hey, hey. Listen to me."
00:26:01.935,00:26:03.186,It's all right.
00:26:04.813,00:26:06.606,It's not okay with me either.
00:26:19.411,00:26:21.705,"If your dad's gonna do this, he's gonna need our help."
00:26:25.542,00:26:26.710,"Yeah, what's the second part?"
00:26:29.379,00:26:30.297,Right.
00:26:39.264,00:26:40.223,John?
00:26:42.600,00:26:46.479,"I don't know what Maureen told you, but I think the pressure..."
00:26:48.023,00:26:49.190,I think it's getting to her.
00:26:50.984,00:26:55.322,Her behavior is a clear indication of clinical anxiety disorder.
00:26:56.197,00:26:57.949,"You're wasting your breath, Jessica."
00:26:58.033,00:27:00.994,Jessica? Who's Jessica?
00:27:01.453,00:27:03.455,Is that who Maureen thinks I am?
00:27:07.167,00:27:09.711,"Let me out, and we can help her together."
00:27:11.963,00:27:15.216,Do you know why she locked me in here? Because I spoke up.
00:27:15.800,00:27:22.974,"I told her I was worried that she wasn't thinking clearly, that she might be sending Naoko to her death."
00:27:26.645,00:27:29.564,"Only it's not Naoko anymore, is it?"
00:27:31.107,00:27:34.986,"Don't get on that ship, John. I'm trying to protect you."
00:27:35.862,00:27:43.286,"You know, over the years, a lot of people have put their life in my hands."
00:27:44.245,00:27:49.542,"But if I had to trust someone with mine, I'd choose my wife."
00:27:52.128,00:27:57.884,You mean the woman who wanted to take your kids away and start a whole new life without you?
00:27:58.968,00:28:05.725,"And now she suddenly claims, let me guess, that you're the only one who can fly this Jupiter."
00:28:06.976,00:28:08.645,That's convenient.
00:28:11.481,00:28:24.077,"If I were you, I'd spend your time getting your story straight, because when we get to the Resolute, and we will get to the Resolute, it's gonna have to be a hell of a lot more convincing."
00:28:27.622,00:28:30.375,Fly safe. We're all depending on you.
00:28:36.589,00:28:38.049,You ready for a practice run?
00:28:39.592,00:28:41.845,-Good to go. -Okay.
00:28:43.596,00:28:51.604,"So, remember, the actual Jupiter that you'll be flying, all these bells and whistles, they might as well be actual bells and actual whistles for all the good they'll do you."
00:28:53.773,00:28:55.024,Is that necessary?
00:28:55.108,00:28:58.194,"You want it to be as close as possible to reality, right?"
00:28:58.278,00:28:59.904,You really gonna knock me out?
00:29:02.615,00:29:06.494,"So, we'll skip the pre-launch protocols because you wouldn't be able to execute them anyway."
00:29:06.578,00:29:09.456,You just sit back and let me do the work until it's time to launch.
00:29:09.831,00:29:12.459,"But once you're up there, only you'll be able to steer."
00:29:12.542,00:29:14.169,And vent the engines before they explode.
00:29:15.837,00:29:17.380,before you get out of the atmosphere.
00:29:17.464,00:29:19.090,And always vent them away from the sun.
00:29:19.174,00:29:21.634,And always be aware of variables. Something will go wrong.
00:29:21.968,00:29:23.094,It always does.
00:29:25.138,00:29:26.723,T-minus 30 seconds to liftoff.
00:29:37.233,00:29:38.109,Arms up.
00:29:49.412,00:29:55.835,"...five, four, three, two, one, liftoff."
00:30:05.512,00:30:08.431,"No, don't touch those. Let the SRBs carry you up."
00:30:09.307,00:30:13.019,"Okay. You're approaching 9G, where you're gonna lose consciousness."
00:30:13.102,00:30:14.771,I'm cutting your suit pressure to simulate.
00:30:15.355,00:30:19.776,Your cognitive recovery was 19 seconds. Feel free to improve on that.
00:30:32.413,00:30:33.665,Nineteen seconds.
00:30:34.290,00:30:36.543,You're nothing if not consistent. How's your head?
00:30:36.626,00:30:38.211,-Foggy. -Push through.
00:30:38.294,00:30:41.339,You're hitting tropospheric winds at ten o'clock. Roll left.
00:30:59.107,00:30:59.983,Again.
00:31:04.571,00:31:05.446,Okay.
00:31:12.245,00:31:15.456,"two, one, liftoff."
00:31:24.048,00:31:25.049,You lost a second.
00:31:26.092,00:31:29.095,"No, you can't vent towards the sun. Bank left."
00:31:31.514,00:31:32.765,"Oh, God."
00:31:34.517,00:31:37.520,"Yeah, I need a few more seconds to recover before venting."
00:31:41.649,00:31:47.697,"Five, four, three, two, one, liftoff."
00:31:54.287,00:31:56.414,Something's wrong. Your weight distribution's off.
00:31:56.497,00:31:58.207,Which means so is your trajectory.
00:31:58.291,00:31:59.459,Course correct.
00:32:00.835,00:32:02.921,You just hit the boosters way too hard.
00:32:03.254,00:32:06.466,Your brain smashed against the inside of your skull. It's swelling.
00:32:06.549,00:32:07.884,"Yeah, but I'm not dead, right?"
00:32:09.385,00:32:10.303,But now you are.
00:32:10.386,00:32:11.596,"Oh, God."
00:32:11.679,00:32:12.847,Again.
00:32:17.060,00:32:20.229,System malfunction. Engines are hot. Too hot. What do you do?
00:32:20.939,00:32:22.023,Uh...
00:32:23.983,00:32:25.944,"No, it's too late. You're dead."
00:32:27.862,00:32:29.405,-Too late. You're dead. -Oh.
00:32:36.871,00:32:39.040,-Ahhh! -You're dead.
00:32:45.505,00:32:47.215,You're dead. Again.
00:32:51.219,00:32:52.428,"Dad, are you okay?"
00:32:52.512,00:32:55.515,"Yeah, I just need, uh... I just need some more reps."
00:32:58.685,00:33:00.812,"As his doctor, I'm advising that he take a break."
00:33:01.229,00:33:04.232,His heart is at serious risk if he continues like this.
00:33:04.315,00:33:07.944,"Hey, hey. Maybe we should all take a break, huh? Huh?"
00:33:09.821,00:33:11.781,"Yeah, okay. I'll get you some water."
00:33:15.284,00:33:16.703,Can you help me take...
00:33:33.302,00:33:34.512,Yeah.
00:33:50.653,00:33:54.073,I would be worried about you making it even if she hadn't said anything.
00:33:54.824,00:33:56.909,Why don't we take a couple of extra days?
00:33:59.078,00:34:00.246,Relieve some of the pressure.
00:34:01.039,00:34:06.002,"I mean, you could run a comb over the Jupiter, and I can work on this."
00:34:12.216,00:34:13.551,You should put on the radio.
00:34:14.427,00:34:16.596,-What's happening? -The Resolute.
00:34:23.936,00:34:27.398,which indicates the presence -of a gravitational singularity. -The black hole.
00:34:27.482,00:34:33.196,"To protect the lives onboard, we'll be forced to vacate the current orbit 24 hours from now."
00:34:36.616,00:34:46.250,"We are aware that some of you are still out there, trying to make it back. So, it's with a heavy heart that the surviving members of the Resolute 24th Colony Group -send this final broadcast. -No!"
00:34:46.334,00:34:47.168,24 hours.
00:35:00.681,00:35:01.808,"Hey, where are you going?"
00:35:02.558,00:35:04.060,To the Jupiter 4.
00:35:05.353,00:35:07.939,A lot of people have been doing unsupervised work there.
00:35:08.022,00:35:09.774,I wanna check it. Again.
00:35:17.532,00:35:20.535,"Hey, guys. So why don't you go get your gear ready?"
00:35:21.702,00:35:24.122,We're gonna be back on the Resolute tomorrow. Together.
00:35:25.164,00:35:26.082,Huh?
00:35:27.166,00:35:28.918,"Come on, let's get going."
00:35:52.984,00:35:54.110,Hmm.
00:36:00.950,00:36:02.827,"Will, is that you?"
00:36:11.836,00:36:13.254,Then don't.
00:36:17.258,00:36:20.011,I don't want you to get caught up in this.
00:36:30.271,00:36:31.314,In what?
00:36:33.566,00:36:35.276,It's really not my place.
00:36:35.860,00:36:37.195,It's just...
00:36:38.905,00:36:44.160,Some people think that kids aren't mature enough to handle the truth.
00:36:44.577,00:36:47.997,-The truth about what? -The mission.
00:36:48.831,00:36:51.292,Has your mother told you how dangerous it is?
00:36:51.709,00:36:54.003,"Yeah, she told us all about it."
00:36:56.339,00:36:57.256,Wow.
00:37:00.384,00:37:02.261,You're such a strong kid.
00:37:05.473,00:37:06.474,I mean...
00:37:09.060,00:37:17.109,"I don't think I could let my dad sacrifice himself, even if it did get everyone off this planet."
00:37:17.193,00:37:18.694,He's not sacrificing.
00:37:20.071,00:37:21.530,He's gonna make it.
00:37:22.198,00:37:23.950,He said he'll be fine.
00:37:26.035,00:37:31.165,I was about your age when my dad went into the hospital.
00:37:31.749,00:37:40.591,"And I remember, everyone was there, and when I asked what was going on, they told me not to worry, that he was going to be fine."
00:37:42.176,00:37:46.514,Turns out everyone was just saying that...
00:37:49.267,00:37:51.602,because they didn't want me to be sad.
00:37:54.730,00:37:56.315,But when he died...
00:37:57.858,00:37:59.360,it hurt so much.
00:37:59.986,00:38:03.030,Would it have been easier if I'd been able to prepare for it?
00:38:04.448,00:38:05.283,Maybe.
00:38:09.203,00:38:14.875,Sometimes parents think they have to lie to protect their kids.
00:38:16.377,00:38:19.046,But friends can be honest with each other.
00:38:19.505,00:38:24.677,"And right now, I'm the only one telling the truth."
00:38:26.637,00:38:35.604,"There's a chance that Jupiter makes it to the Resolute, but whoever flies it won't survive the trip."
00:38:36.439,00:38:40.192,"-No, but my mom, she said-- -Is a very intelligent woman..."
00:38:41.902,00:38:43.654,but she doesn't know everything.
00:38:45.031,00:38:48.701,She doesn't know there's someone else who can fly this Jupiter.
00:38:48.784,00:38:50.202,It doesn't have to be your dad.
00:39:07.345,00:39:10.222,I don't go to your place and triple check your rocket science stuff.
00:39:10.306,00:39:12.433,"Sorry, I just need to make sure there's nothing wrong."
00:39:12.516,00:39:14.769,"You do know that's literally my job, right?"
00:39:17.104,00:39:19.648,"1967, Soyuz 1, parachute failure."
00:39:19.732,00:39:22.485,"1971, Soyuz 11, cabin vent valve."
00:39:22.568,00:39:25.154,"1986, Challenger, faulty O-ring seal."
00:39:25.237,00:39:29.325,"2003, Columbia, damaged thermal protection system."
00:39:29.408,00:39:33.329,Everyone died in these accidents and you know what they all have in common?
00:39:35.247,00:39:37.625,A mechanic cleared them for launch.
00:39:37.708,00:39:41.253,You know what else they have in common? Don West wasn't born yet.
00:39:41.629,00:39:45.466,"Now call me thorough, call me lucky, but nothing's ever gone wrong on my watch."
00:39:45.549,00:39:47.218,Weren't you working on the Resolute?
00:39:47.301,00:39:49.804,-We were attacked by an alien robot. -On your watch.
00:39:51.722,00:39:53.933,Okay. I'm sorry. I'm...
00:39:56.602,00:39:59.146,This is our last chance.
00:39:59.897,00:40:01.273,And my husband...
00:40:02.983,00:40:10.324,"My husband's gonna be up there hurtling through space, and I don't know if he can-- You're not the only one who needs this to work, Mrs. Robinson."
00:40:16.622,00:40:18.958,Maybe there's something you can do to help us.
00:40:20.793,00:40:23.337,"Finally, this guy's reading the directions."
00:40:28.509,00:40:29.927,Get the weight down on the Jupiter?
00:40:30.010,00:40:33.264,"Oh, like any good fighter, she had to shed the last few pounds."
00:40:33.347,00:40:36.142,"But we're actually 200 under, if you can believe it."
00:40:36.225,00:40:40.354,Pretty sure the CPDS took us over the top. All she needs now is a good pilot.
00:40:46.193,00:40:48.821,-What intervals are you running at? -20 seconds.
00:40:48.904,00:40:54.285,-You can get away with 30. -But standard iteration-- Standard iteration's for standard situations.
00:40:54.910,00:40:58.789,"With such low fuel pressure to begin with, vent too soon, you won't make it into orbit."
00:40:59.165,00:41:01.792,Vent every 30. She can take it.
00:41:03.794,00:41:05.421,Maybe we should put the CPDS back in.
00:41:05.504,00:41:08.466,Mmm. That's over 700 pounds.
00:41:11.135,00:41:15.764,-Interesting. How much do you weigh? -Excuse me?
00:41:15.848,00:41:17.725,"You're, like, 174-75?"
00:41:25.274,00:41:28.319,Wait a minute. No. See what you're doing.
00:41:28.402,00:41:32.615,You know these ships better than anyone. Who better to be there -if something goes wrong-- -Stop. I'm sorry.
00:41:32.698,00:41:35.326,"I'm the wrong guy, okay? Good luck with that."
00:41:35.409,00:41:37.244,Send me a postcard. Hi. Bye.
00:41:37.953,00:41:39.872,"Don. Don, stop."
00:41:41.499,00:41:44.376,"-This is about my dad's life. -Yeah. It's my life, too."
00:41:44.460,00:41:46.420,"Look, he can't do it on his own, okay?"
00:41:46.504,00:41:48.797,"And if he doesn't make it, then it is all of our lives."
00:41:48.881,00:41:49.882,Ease off.
00:41:50.549,00:41:52.468,Is this about money again?
00:41:53.052,00:41:54.678,I thought we were past that.
00:41:59.225,00:42:01.435,Then what is it gonna take for you to do the right thing?
00:42:02.561,00:42:05.314,You know what doing the right thing has done for me?
00:42:05.814,00:42:08.150,"Save a lady in the desert, get left for dead."
00:42:08.234,00:42:12.029,"Flip a tanker for you, lose a very comfortable retirement."
00:42:12.112,00:42:15.282,"So, from where I'm standing, doing the right thing kinda sucks."
00:42:21.080,00:42:23.791,No. I'm not gonna do it.
00:42:24.375,00:42:27.378,"Nope. Nope, nope, nope. No."
00:42:30.130,00:42:30.965,Son of a...
00:42:32.007,00:42:33.968,"If anyone asks, I got paid for this."
00:42:34.051,00:42:35.427,-A lot. -Mmm-hmm.
00:42:38.806,00:42:40.474,"-No. I want a holiday. -...nine, eight..."
00:42:41.058,00:42:43.769,"-Don West Appreciation Day. -...seven, six..."
00:42:43.852,00:42:47.898,"-Colony Salvation Day for Don West. -...five, -four, three... -I want my face on a postage stamp."
00:42:57.408,00:42:59.702,What kind of a torture chamber have you got going on?
00:43:01.036,00:43:02.788,I'm swallowing my tongue...
