start,end,script
00:19:53.791,00:19:55.708,Wait for me!
00:19:56.333,00:19:58.250,Don't go!
00:20:10.666,00:20:12.125,Don't leave me.
00:20:15.750,00:20:17.208,Come back!
00:20:19.750,00:20:21.458,Don't leave me!
00:20:24.416,00:20:26.125,Don't go!
00:20:36.083,00:20:41.708,"It's me, daughter of Turning Water and Three Spotted!"
00:20:42.875,00:20:44.291,Come back!
00:33:31.333,00:33:32.875,Welcome.
00:33:32.958,00:33:34.375,I am friend.
00:33:35.250,00:33:37.000,You are Johanna?
00:33:38.666,00:33:42.000,My name is Cicada. I do not know Cho-hanna.
00:33:58.708,00:34:00.083,He's taking you home.
00:34:02.250,00:34:03.750,I have no home.
00:34:03.833,00:34:07.000,It was burned by soldiers when I was taken.
00:34:09.500,00:34:10.833,Your Kiowa family?
00:34:16.416,00:34:17.791,All dead.
00:35:07.833,00:35:10.416,He's taking you to another home.
00:53:46.041,00:53:49.375,Captain did a wondrous thing!
00:53:53.708,00:53:57.166,Three hands.
00:54:00.750,00:54:04.041,Three enemies dead.
00:54:12.916,00:54:16.833,His lightning brought us victory.
01:02:29.833,01:02:44.833,All the buffalo are dying… And we must choose… Make a stand or fall forever.
01:09:57.375,01:09:58.625,Horses.
01:14:17.291,01:14:18.291,Water.
01:17:52.041,01:17:53.916,They know we are here.
01:19:13.750,01:19:15.166,This way.
01:23:39.375,01:23:40.375,No.
01:23:41.833,01:23:49.333,To move forward… you must first remember.
01:26:44.458,01:26:45.583,Water.
01:34:04.500,01:34:07.458,"Wolf, he wouldn't listen."
01:35:38.000,01:35:39.166,What is that?
01:35:40.333,01:35:41.541,Books.
01:35:41.625,01:35:43.000,Stories.
01:35:44.625,01:35:48.333,There is no time for stories.
01:48:02.625,01:48:04.625,We did what we could.
01:48:27.583,01:48:32.166,You belong with me.
01:48:40.166,01:48:41.791,You belong with me.
00:02:23.916,00:02:26.583,"-Good evening, ladies and gentlemen. -Good evening."
00:02:27.541,00:02:30.041,It's good to be back with you all here in Wichita Falls.
00:02:30.125,00:02:36.083,"My name is Captain Jefferson Kyle Kidd, and I'm here tonight to bring y'all the news from across this great world of ours."
00:02:39.166,00:02:40.166,Pleasure.
00:02:40.958,00:02:44.375,"Now, I know how life is in these parts, working a trade sunup to sundown."
00:02:44.458,00:02:46.791,No time for reading newspapers. Am I correct?
00:02:48.541,00:02:50.208,Let me do that work for you.
00:02:50.291,00:03:00.041,"And maybe, just for tonight, we can escape our troubles and hear of the great changes that are happening out there."
00:03:03.041,00:03:04.125,"Starting local, then."
00:03:04.708,00:03:10.875,"Our own Houston Telegraph from 1st February, this news."
00:03:12.125,00:03:20.333,The meningitis epidemic continues to spread without prejudice across the Panhandle and North Texas region.
00:03:20.416,00:04:04.750,"So far, it has claimed of the state of Texas up there in the capital… -There. -Much obliged."
00:05:53.416,00:05:54.625,Hey!
00:05:56.916,00:05:57.916,Hey!
00:06:00.833,00:06:02.208,Hey!
00:06:02.833,00:06:03.958,Stop!
00:06:06.666,00:06:08.083,I'm not gonna hurt you!
00:06:10.333,00:06:11.333,Come here!
00:06:29.791,00:06:30.958,Who are you?
00:06:35.083,00:06:36.250,Do you have a name?
00:06:57.666,00:06:59.250,I don't speak Kiowa.
00:07:00.250,00:07:01.250,Come.
00:07:03.958,00:07:04.958,Come on.
00:07:07.000,00:07:09.416,It's all right. It's all right.
00:07:11.208,00:07:12.208,Come on.
00:07:13.750,00:07:15.541,You can't stay out here.
00:07:16.333,00:07:17.541,Give me your hand.
00:07:45.333,00:07:47.541,Johanna Leonberger.
00:07:49.333,00:07:50.583,Is that your name?
00:08:20.416,00:08:21.833,Go check it on that side.
00:08:28.083,00:08:29.791,"Where'd you serve, Captain?"
00:08:29.875,00:08:34.791,"Third Texas Infantry. Surrendered Galveston, 26th May, 1865."
00:08:35.708,00:08:36.708,Any sidearms?
00:08:36.791,00:08:37.833,"No, sir."
00:08:39.458,00:08:41.041,Just bird shot.
00:08:41.833,00:08:45.208,Says here you're from San Antonio. What's your business up here?
00:08:45.291,00:08:47.458,I read the news from town to town.
00:08:48.750,00:08:51.791,I was headed down to the Red River and-- and I seen him.
00:08:53.083,00:08:57.333,I think he was transporting this little girl here for the federal authorities.
00:09:00.500,00:09:02.375,Looks like the Indians had her.
00:09:04.750,00:09:08.166,Here's her agency papers. Just found them.
00:09:23.916,00:09:27.083,-You're good. -What the hell do I do with this child?
00:09:27.166,00:09:29.500,Fetch her to Red River. Command post will know.
00:09:29.583,00:09:31.958,"-Hyah. -Hyah, hyah."
00:10:03.166,00:10:05.625,when they cleared the Kiowa out of Montague County.
00:10:07.125,00:10:13.208,"You've been living with them since they kidnapped you, when they attacked your family in Hill Country six years prior."
00:10:15.583,00:10:16.916,Dear Heaven.
00:10:20.958,00:10:30.875,"Her mother, father and sister were… Well, they passed. But you have an aunt and an uncle."
00:10:33.583,00:10:35.458,Still living down there.
00:10:36.458,00:10:37.791,Near Castroville.
00:10:40.583,00:10:42.625,So that's where you were being taken.
00:10:45.750,00:10:47.166,I know Castroville.
00:10:48.250,00:10:50.333,I used to live near there before the war.
00:10:58.583,00:11:00.375,Lot of German folk down there.
00:11:07.333,00:11:10.500,Kannst du Deutsch sprechen?
00:11:11.291,00:11:29.083,"Kann-- Kannst du deine Familie… Remember your German family? Uh… Come tomorrow, we will find somebody who can take you home."
00:12:24.083,00:12:25.250,Come on. Uh-uh.
00:12:29.083,00:12:31.375,Pardon me. Lost child here.
00:12:35.583,00:12:37.375,"Much obliged. Bless you, sir."
00:12:37.458,00:12:38.625,I got a lost child.
00:12:41.000,00:12:42.083,Thank you.
00:12:49.125,00:12:52.291,-What's your business? -Here to see your Indian agent.
00:12:53.375,00:12:55.041,He's up north of the Red.
00:12:55.125,00:12:56.750,On the reservation.
00:12:57.458,00:13:00.125,"Well, I found this child, see."
00:13:00.208,00:13:04.833,And the lieutenant who was patrolling the road told me to bring her to see you.
00:13:07.916,00:13:09.333,What do you expect me to do?
00:13:09.416,00:13:10.958,She needs taking home.
00:13:11.041,00:13:13.625,The agent won't be back for another three months.
00:13:13.708,00:13:15.916,Strays are his responsibility.
00:13:16.000,00:13:18.166,Looks like you'll need to take her.
00:13:18.250,00:13:19.791,"I can't take her, sir."
00:13:19.875,00:13:22.791,I work and travel from town to town.
00:13:22.875,00:13:24.500,I can't take her.
00:13:25.500,00:13:26.541,"Listen, friend."
00:13:27.166,00:13:30.083,Wait for the agent or take her yourself. It's up to you.
00:13:33.416,00:13:34.666,"If you will, please."
00:14:17.208,00:14:19.625,"Good to lay eyes on you, Captain."
00:14:19.708,00:14:21.166,"Hello, Simon."
00:14:22.041,00:14:24.958,Wonder if I could have a word with you and Mrs. Boudlin.
00:14:26.375,00:14:27.833,"Well, of course, sir."
00:14:34.250,00:14:36.166,"Wait for the agent, it appears."
00:14:49.750,00:14:52.166,"Got kind of a wild look about her, doesn't she?"
00:14:53.083,00:14:54.291,"No, she's scared."
00:14:57.875,00:14:59.291,"Be careful, honey."
00:15:00.458,00:15:01.875,Don't get too close.
00:15:07.166,00:15:08.541,"All right, now, see here, child."
00:15:08.625,00:15:12.750,I have to work. You're gonna stay here with these kind folks.
00:15:13.958,00:15:16.583,Friends. Friends.
00:15:17.416,00:15:19.125,"You got that, child?"
00:15:23.000,00:15:25.166,"She don't understand a damn thing, does she?"
00:15:28.000,00:15:29.250,Thank you kindly.
00:15:40.666,00:15:44.541,The Red River ferry is sunk near Cross Timbers.
00:15:49.416,00:15:53.041,…and parts down to Elm Creek are completely washed out.
00:15:54.625,00:15:59.208,"Yanks sending soldiers too blue to muddy their boots, that's why."
00:16:03.208,00:16:12.500,"Well, now The Clifton Record is reporting big changes that are coming to these parts that'll have a bearing on all of these travel issues."
00:16:12.583,00:16:29.208,"On page one, The Pacific Railroad Committee voted today that Missouri, Fort Scott and Gulf lines are to be consolidated into a new line that will run from the Kansas border all the way to Galveston, Texas."
00:16:33.833,00:16:38.083,This will be the first railroad to cross the Indian reservation.
00:16:45.833,00:16:48.875,"Now, for some federal news."
00:16:54.041,00:17:12.041,"President Ulysses S. Grant… has ordered the Texas legislature to accept Amendments 13, 14 and 15 of the United States Constitution before any return to the Union can be considered."
00:17:12.916,00:17:19.166,Those amendments include the abolition of slavery… Say no to abolition. Never!
00:17:22.208,00:17:24.625,and the repayment of our war debts.
00:17:26.541,00:17:27.916,I'm saying no.
00:17:28.000,00:17:32.708,I say Texas first and damn them amendments.
00:17:35.875,00:17:41.166,"I ain't digging no Texas soil, sweating and bleeding for some rich Yankee type."
00:17:42.125,00:17:43.833,I suggest y'all watch yourself.
00:17:43.916,00:17:45.541,Suggest y'all the same!
00:17:47.458,00:17:49.250,"What are y'all even doing here, huh?"
00:17:49.875,00:17:52.416,You ain't dealing with the Injuns. Fixing our roads.
00:17:52.500,00:17:54.083,Minding our river crossings.
00:17:54.166,00:17:56.791,All they're doing is beating up on Southern folk!
00:18:00.375,00:18:02.625,"Yeah, all right. I hear you. I hear you."
00:18:07.791,00:18:10.333,Northern blues are not helping us a lot.
00:18:10.416,00:18:12.750,And they're asking for a great deal in return.
00:18:16.875,00:18:18.250,We're all hurting.
00:18:19.708,00:18:21.041,All of us.
00:18:23.541,00:18:27.208,But I'm thinking we got a part to play in all of this as well.
00:18:29.875,00:18:36.333,There's more than rain and Indians and Northern blues troubling our roads.
00:18:36.416,00:18:39.458,"I've seen it myself, coming in from Wichita Falls."
00:18:40.125,00:18:41.166,Yeah.
00:18:42.958,00:18:44.125,We're all hurting.
00:18:47.000,00:18:48.541,These are difficult times.
00:18:55.041,00:18:57.041,"-Appreciate it, thank you. -Thanks."
00:18:57.125,00:18:58.333,-Much obliged. -Thank you.
00:18:58.416,00:19:00.666,-Thank you so much. -Thank you for your attention.
00:19:00.750,00:19:03.041,Excuse me. Pardon me. Pardon me.
00:19:06.083,00:19:07.333,She's gone.
00:19:09.125,00:19:11.041,Little one! Child!
00:19:14.291,00:19:17.750,"I-- I was singing her a hymn, and I turned my back and she was gone!"
00:19:17.833,00:19:20.250,She didn't take the horses. She can't be gone far.
00:19:25.125,00:19:26.791,You come out now!
00:19:33.625,00:19:35.083,"Little girl, where are ya?"
00:19:35.791,00:19:37.125,Where you at?
00:19:37.208,00:19:38.416,We need to split up!
00:20:22.208,00:20:24.333,Johanna! It's not safe! You'll fall!
00:20:27.708,00:20:29.708,Step back! Johanna!
00:21:20.250,00:21:21.250,Oh.
00:21:26.708,00:21:28.250,Running off like that?
00:21:32.250,00:21:34.375,I said she's wild. Didn't I say that?
00:21:34.458,00:21:36.708,"Please, Mr. Boudlin."
00:21:37.875,00:21:39.416,"Well, it's the goddamn truth."
00:21:42.750,00:21:44.375,Child's got a curse on her.
00:21:57.833,00:21:59.666,"Well, shit, Captain."
00:21:59.750,00:22:01.750,What the hell are you gonna do with her?
00:22:07.250,00:22:08.250,I'll take her.
00:22:10.125,00:22:12.250,I found her. I'll take her.
00:22:13.833,00:22:15.416,"You sure about that, Captain?"
00:22:16.541,00:22:19.000,Castroville's damn near 400 miles.
00:22:20.583,00:22:23.416,Those roads have changed since you lived down that way.
00:22:25.458,00:22:27.333,The little girl is lost.
00:22:29.000,00:22:30.708,She needs to be home.
00:22:41.333,00:22:44.250,Much obliged if you keep her. I'll be back first thing.
00:23:07.833,00:23:11.166,"She ain't been used in a while, but still runs pretty good."
00:23:24.083,00:23:25.083,You carrying?
00:23:26.291,00:23:27.541,Scattergun bird shot.
00:23:27.625,00:23:32.375,"I, uh… I kept mine from Palmito."
00:23:33.666,00:23:35.875,"Well, I'm sure you need it more than me."
00:23:36.458,00:23:38.000,Got 20 rounds too.
00:23:44.708,00:23:46.291,I'll fetch it back to ya.
00:23:46.958,00:23:48.291,Don't make no matter.
00:23:59.666,00:24:00.791,Captain.
00:24:01.416,00:24:03.041,Why are you doing this?
00:24:07.750,00:24:08.750,Johanna!
00:24:17.291,00:24:20.458,There we are. Come now. Come now.
00:25:25.583,00:25:27.583,Makes no matter to me what you wear.
00:25:39.833,00:25:43.083,We'll be on this road for about six days till we make Dallas.
00:25:44.166,00:25:46.583,Then across central Texas to the Hill Country.
00:25:47.125,00:25:48.583,It'll be a few weeks.
00:25:50.833,00:25:53.000,"We'll have to stop and give readings, of course."
00:25:53.083,00:25:54.500,We have to pay our way.
00:25:54.583,00:25:56.291,And keep an eye out for trouble.
00:25:57.583,00:26:02.750,"Settlers killing Indians for their land, and the Indians killing settlers for taking it."
00:26:05.208,00:26:07.458,I guess you know something about that.
00:26:11.500,00:26:13.916,"I'm Captain Kidd, by the by."
00:26:15.666,00:26:16.916,Captain.
00:26:17.000,00:26:18.333,Captain.
00:26:18.416,00:26:20.250,You're Johanna.
00:26:20.333,00:26:22.125,"You, Johanna."
00:26:27.291,00:26:30.750,"And it's a pleasure to make your acquaintance, make no mistake."
00:26:58.041,00:26:59.250,This is the bacon.
00:26:59.875,00:27:01.458,I guess I'll make some.
00:27:03.708,00:27:05.541,Please would be nice to hear.
00:27:07.291,00:27:08.958,That's the way it works.
00:27:24.500,00:27:26.833,"Yeah, coffee packs a punch, doesn't it?"
00:27:31.083,00:27:32.500,It's an acquired taste.
00:27:38.166,00:27:39.333,That's sugar.
00:27:44.833,00:27:45.833,Hmm?
00:27:47.958,00:27:49.791,"Bit more to your liking, huh?"
00:27:50.791,00:27:52.041,"Easy, now."
00:27:54.291,00:27:56.000,"All right, that's enough."
00:27:56.083,00:27:57.166,That's enough.
00:27:58.708,00:27:59.833,Hey!
00:28:27.541,00:28:29.666,"printed in a line, one after the other?"
00:28:32.458,00:28:36.125,"Put them all together, and you have a story."
00:28:42.125,00:28:43.125,Story.
00:28:45.041,00:28:46.333,Stories.
00:28:50.833,00:28:52.250,"Well, go right ahead."
00:29:05.666,00:29:10.333,That's my wife… down in San Antonio.
00:29:38.250,00:29:40.041,I'm gonna get some more water.
00:31:06.750,00:31:08.416,"Wanna make your fortune, that's the place."
00:31:30.375,00:31:31.708,We must keep America whole!
00:31:38.208,00:31:42.916,"that our nation, our great nation, must be made complete!"
00:31:47.000,00:31:48.166,Mrs. Gannett.
00:31:51.000,00:31:52.041,"Hey, Kidd."
00:31:53.333,00:31:54.500,She yours?
00:32:02.291,00:32:05.750,"They paying you to take her home, or you doing it out of the goodness of your heart?"
00:32:05.833,00:32:08.333,"No, they're not paying me. I just know the road."
00:32:08.416,00:32:11.458,But I'll take a pair of rooms if you have them.
00:32:30.625,00:32:31.791,"Thank you, ma'am."
00:32:35.791,00:32:36.916,"No. No, no."
00:32:37.000,00:32:43.541,We don't use our hands and fingers. We-- Look. See this?
00:32:43.625,00:32:45.708,Spoon? Spoon?
00:32:45.791,00:32:48.041,This-- This is how we eat.
00:32:48.125,00:32:49.250,Spoon.
00:33:02.666,00:33:04.666,"And, uh, we-- we don't sing."
00:33:10.083,00:33:13.583,What y'all looking at? Ain't you never seen a child eat before?
00:33:16.500,00:33:17.750,What's her name?
00:33:18.666,00:33:19.666,Johanna.
00:33:22.041,00:33:23.791,She doesn't have any English.
00:33:24.333,00:33:26.333,So what does she speak?
00:33:26.416,00:33:27.416,Kiowa.
00:33:44.791,00:33:46.583,She said you've been calling her the wrong name.
00:33:46.666,00:33:47.916,Her name's Cicada.
00:33:50.416,00:33:52.750,"Well, it's Johanna now."
00:33:52.833,00:33:54.958,Johanna Leonberger.
00:34:23.125,00:34:25.166,No Kiowa family neither.
00:34:25.250,00:34:26.791,You see the hair?
00:34:26.875,00:34:29.125,They cut it when they're in mourning.
00:34:32.083,00:34:34.583,This child is an orphan twice over.
00:34:45.500,00:34:51.166,"Can you tell her that I am taking her to family, to an aunt and an uncle down near Castroville?"
00:34:51.250,00:34:54.416,"Kidd, she don't got any idea what that means."
00:34:56.041,00:34:59.833,"Well, they're the only ones that will take her."
00:35:00.708,00:35:03.208,She's got no place else. Nobody wants her.
00:35:18.625,00:35:20.166,"Yeah. Yeah, so I hear."
00:35:22.208,00:35:28.041,Mr. Gannett used to take them… before he went to California.
00:35:36.625,00:35:38.666,Maybe he just didn't wanna come back.
00:35:54.250,00:35:57.750,I do not have a clue as to the care of a child.
00:35:59.083,00:36:02.583,Never had the need nor the patience required.
00:36:02.666,00:36:05.833,"She's still alive, ain't she? That's not nothing."
00:36:39.458,00:36:43.208,Sleeping through the night isn't what it once was.
00:36:44.833,00:36:45.833,Yeah.
00:36:47.416,00:36:50.375,Your stories can only keep you company for so long.
00:36:55.041,00:36:58.416,"So, what you gonna do once you've taken her?"
00:37:00.708,00:37:02.666,I may just keep heading south.
00:37:06.541,00:37:10.375,Work passage on a ship out of Galveston.
00:37:12.041,00:37:19.000,Go see those far-off places I… read about to people every night.
00:37:29.083,00:37:30.458,How long's it been?
00:37:32.625,00:37:34.250,Close to five years now.
00:37:37.333,00:37:40.250,Castroville's San Antonio way.
00:37:41.666,00:37:43.458,"Yeah. Yes, it is."
00:37:47.666,00:37:49.958,Isn't it time you went back?
00:37:51.541,00:37:53.250,Made things right with her?
00:37:59.833,00:38:05.875,Looking at you now… I'm thinking you don't have a choice.
00:38:32.750,00:38:39.250,"Good evening. My name is Captain Jefferson Kyle Kidd, and it is an honor to be back in the bustling city of Dallas."
00:38:40.125,00:38:45.833,"A busy town, and y'all are busy folk, so let's get right to it."
00:38:45.916,00:38:56.125,"Now, when I got in yesterday, I collected the latest newspapers, looking for suitable readings, something to take us away from our troubles."
00:38:56.666,00:39:20.208,"From The Times, on its page three… A word, Captain?"
00:39:21.208,00:39:22.333,Name's Almay.
00:39:23.333,00:39:24.958,These are my associates.
00:39:25.041,00:39:27.416,Mr. Almay. Gentlemen.
00:39:28.000,00:39:29.333,"Enjoyed your reading, Cap."
00:39:29.416,00:39:31.833,You take us away from our hard thoughts.
00:39:31.916,00:39:33.000,Thank you.
00:39:35.041,00:39:36.458,"So, where'd you serve, Captain?"
00:39:37.916,00:39:40.208,"Infantry, Third Texas. You?"
00:39:41.916,00:39:44.333,"First Texas Infantry, Northern Virginia."
00:39:45.333,00:39:46.958,Lot of good it did us.
00:39:47.041,00:39:49.125,Poor men fighting a rich man's war.
00:39:49.208,00:39:50.791,Left us lying here in the gutter.
00:39:52.833,00:39:56.208,"Way I see it, we fought, but ain't no piece of this ours."
00:39:56.291,00:39:59.583,"It's late, Mr. Almay. And what is your point?"
00:40:00.458,00:40:03.208,"Point is, us old soldiers gotta live, right?"
00:40:05.666,00:40:11.166,"Got a little business proposition for you, seeing you traveling alone like you are."
00:40:12.416,00:40:13.625,This young girl.
00:40:15.375,00:40:16.666,What do you want?
00:40:17.375,00:40:19.125,How much you want for her?
00:40:19.833,00:40:22.000,This child is not for sale.
00:40:24.333,00:40:27.500,Word is she's that captive out of Wichita Falls.
00:40:27.583,00:40:29.708,"Mr. Almay, you are well informed."
00:40:36.583,00:40:37.750,How about $50?
00:40:40.416,00:40:41.916,"All right, 100, then."
00:40:42.000,00:40:44.833,You can rest easy knowing at least she'll get paid.
00:40:45.875,00:40:47.458,"I mean, look at that fair skin."
00:40:48.708,00:40:51.041,I bet you were a lucky man out there in the desert.
00:40:52.250,00:40:53.916,You are scum.
00:40:54.000,00:40:55.916,"In the alternative, we could just take her."
00:40:58.083,00:41:01.250,"Oh, thank the Lord. We're local traders, sir."
00:41:01.333,00:41:05.708,We became concerned about the welfare of this here child in the clutches of a strange man such as this.
00:41:05.791,00:41:08.416,I am responsible for returning this child to her family down south.
00:41:08.500,00:41:10.083,-That's her papers and my oath. -Stay still.
00:41:10.875,00:41:12.250,Your hands.
00:41:13.041,00:41:14.041,Captain.
00:41:25.166,00:41:27.208,You take this girl and you get on your way.
00:41:35.583,00:41:38.916,I'm coming for you soon as I'm done with these blues.
00:41:44.583,00:41:45.583,Residency.
00:41:46.166,00:41:48.541,"12 Polk Street, Dallas, Texas."
00:42:49.083,00:42:49.916,Hyah!
00:43:10.458,00:43:12.083,Come on. Come on.
00:43:52.916,00:43:53.875,Hyah!
00:44:12.625,00:44:13.708,Come on.
00:46:02.083,00:46:03.666,Higher. Come. Come!
00:46:40.541,00:46:42.500,You're good for a man of years!
00:46:43.458,00:46:45.833,But ain't you just so damn tired of all this?
00:46:45.916,00:46:46.916,Help me.
00:46:49.166,00:46:52.625,Seems an awful shame for it to end like this when you can just join us.
00:46:52.708,00:46:57.791,"This world, rich pickings for some, slim pickings for the rest of us."
00:47:08.125,00:47:09.583,Oh. Goddamn it!
00:47:12.916,00:47:15.916,You go. Take the horses and go.
00:47:16.500,00:47:18.583,I shoot. You go.
00:47:22.916,00:47:24.041,Captain.
00:47:24.125,00:47:25.916,"No, no. No, this is worthless."
00:47:27.541,00:47:29.791,See this? It's for birds.
00:47:29.875,00:47:31.666,"It's for birds, understand?"
00:47:32.291,00:47:33.750,"You're not thinking straight, Cap."
00:47:35.625,00:47:37.166,She ain't worth dying for.
00:47:39.333,00:47:40.625,Go!
00:47:41.625,00:47:43.083,Get away while you can.
00:47:45.333,00:47:46.458,"What do you say, Cap?"
00:47:47.083,00:47:48.000,Talk to me.
00:47:55.708,00:47:56.750,Mr. Almay!
00:47:57.666,00:48:02.458,You have me in an uncomfortable circumstance!
00:48:06.041,00:48:08.541,How exactly are we gonna work this out?
00:48:09.750,00:48:12.833,I figure a share for each man and an extra for me!
00:48:14.333,00:48:18.500,Considering what you did to my associate over there!
00:48:19.875,00:48:21.416,That sounds pretty fair to me!
00:48:23.041,00:48:24.791,So what do you want me to do?
00:48:24.875,00:48:26.708,"Just gotta turn over the girl, that's all!"
00:48:26.791,00:48:27.708,"No! Johanna, no!"
00:48:28.875,00:48:30.125,They don't want our money.
00:48:30.208,00:48:31.916,-They want you! -Captain!
00:48:49.750,00:48:52.083,"Oh, Cap, what you trying to do, tickle us to death?"
00:48:52.166,00:48:54.625,"Well, we don't have a deal yet."
00:48:59.333,00:49:04.375,"Aha! I think it's 'cause you're out of bullets, and all you got left now is bird shot."
00:49:05.500,00:49:06.916,"Am I right, Cap?"
00:49:07.750,00:49:09.083,"All right, Almay."
00:49:10.083,00:49:11.583,"Damn it, you have a deal."
00:49:11.666,00:49:12.833,All right.
00:49:15.083,00:49:17.625,I'm gonna lay my gun down on this here rock.
00:49:17.708,00:49:19.083,How about you do the same?
00:49:20.625,00:49:22.500,Here's my sidearm.
00:49:22.583,00:49:23.958,Let me see yours.
00:49:24.041,00:49:26.000,I'm laying my weapon down.
00:49:30.000,00:49:31.000,Here's mine.
00:49:34.000,00:49:35.000,Dime-ah.
00:49:35.083,00:49:36.250,"Captain, boom?"
00:49:36.333,00:49:37.333,"Boom, boom."
00:49:46.708,00:49:48.375,Then how about you do the same?
00:49:49.666,00:49:51.125,Sounds good!
00:50:06.125,00:50:07.125,Stay down.
00:50:45.583,00:50:47.291,"Oh, goddamn it!"
00:50:48.500,00:50:50.583,"Well, now you done gone and spoiled it, Cap."
00:50:56.666,00:50:58.833,Looks like we're back on opposite sides.
00:50:58.916,00:51:00.166,Looks like it.
00:51:06.583,00:51:07.958,"All right, Cap."
00:51:08.708,00:51:11.000,Looks like I'm coming for you now.
00:53:34.250,00:53:35.250,Come on.
00:55:07.125,00:55:08.750,See that? See that bird?
00:55:10.458,00:55:11.541,Bird.
00:55:15.041,00:55:16.208,Bird.
00:55:17.208,00:55:18.208,Yeah.
00:55:19.625,00:55:20.708,"Yeah, that's good."
00:55:22.333,00:55:23.333,Gu-do.
00:55:25.083,00:55:26.083,Gu-do.
00:55:26.166,00:55:27.166,Gu-do.
00:55:28.291,00:55:29.958,A bird is gu-do?
00:55:31.375,00:55:32.375,Gu-do.
00:55:32.458,00:55:33.416,Gu-do.
00:55:45.375,00:55:49.791,"Since you're so smart, prickly pear cactus."
00:55:54.666,00:55:57.041,Pear cactus. And there's juniper out there.
00:55:58.416,00:56:00.416,And there's some sage.
00:56:01.333,00:56:02.500,Say-gya.
00:56:02.583,00:56:04.208,Say-juh?
00:56:04.291,00:56:05.333,Say-uh-gya.
00:56:05.416,00:56:06.958,Sage. Yeah.
00:56:07.708,00:56:09.541,That's right. It smells good.
00:56:10.208,00:56:11.500,Good.
00:56:11.583,00:56:12.583,Yeah.
00:56:12.666,00:56:15.666,"So, what else can you teach me in Kiowa?"
00:56:18.083,00:56:19.083,Dōm.
00:56:19.916,00:56:21.125,Dōm.
00:56:21.208,00:56:22.708,What is dōm?
00:56:26.375,00:56:27.416,Dōm.
00:56:28.416,00:56:30.500,The earth. All right.
00:56:31.041,00:56:32.541,Pahn.
00:56:32.625,00:56:33.708,The clouds?
00:56:35.083,00:56:36.083,The sky.
00:56:43.791,00:56:47.375,"Like, collected? Dōm? Daw?"
00:56:50.333,00:56:55.000,"Daw with a… is a spirit, a breath."
00:56:57.708,00:56:58.708,A circle.
00:57:02.125,00:57:06.000,"For us, it's more like a straight line."
00:57:06.875,00:57:07.875,A line.
00:57:09.791,00:57:10.916,Li-an.
00:57:11.000,00:57:12.125,"Li-an, yes."
00:57:12.208,00:57:14.750,We're all journeying across the prairie.
00:57:14.833,00:57:16.583,Straight line.
00:57:16.666,00:57:18.791,And looking for that place to be.
00:57:19.791,00:57:24.500,"And when we find it, we go straight out and we plow it and we plant it all in a straight line."
00:57:29.916,00:57:30.916,Yeah.
00:57:32.166,00:57:33.250,Very good.
00:57:33.833,00:57:34.875,Velly gut.
00:57:36.333,00:57:38.000,Velly gut indeed.
00:57:43.833,00:57:46.625,"Whoa, whoa, whoa, whoa."
00:57:47.750,00:57:50.208,"Sehr gut, Onkel. You just spoke German."
00:57:51.208,00:57:52.416,Deutsch.
