start,end,script
00:00:44.043,00:00:46.672,"It was dark, and it was cold."
00:00:47.882,00:00:49.174,And I was scared.
00:00:55.806,00:00:57.307,then I saw the moon.
00:00:58.559,00:01:01.144,It was so big and it was so bright.
00:01:02.437,00:01:04.773,It seemed to chase the darkness away.
00:01:09.277,00:01:13.824,"And when it did, I wasn't scared anymore."
00:01:22.499,00:01:27.671,"Why I was there and what I was meant to do, that I've never known."
00:01:30.007,00:01:31.842,And a part of me wonders if I ever will.
00:03:03.224,00:03:04.977,Hello. Hello.
00:03:05.894,00:03:08.438,"Good evening, ma'am. Ma'am?"
00:03:08.480,00:03:10.941,"Oh, uh, excuse me."
00:03:18.448,00:03:19.366,Hello?
00:03:20.283,00:03:22.536,My name is Jack Frost.
00:03:23.996,00:03:25.204,How do I know that?
00:03:26.165,00:03:27.875,The moon told me so.
00:03:29.501,00:03:31.336,But that was all he ever told me.
00:03:32.754,00:03:36.216,"And that was a long, long time ago."
00:04:02.910,00:04:05.662,NORTH: Still waiting for cookies!
00:04:20.969,00:04:22.429,"Ah, finally!"
00:04:41.322,00:04:44.159,have I told you to knock?
00:04:44.201,00:04:46.036,What?
00:04:46.078,00:04:46.954,The Globe?
00:04:49.330,00:04:51.708,Shoo with your pointy heads.
00:04:51.750,00:04:53.460,Why are you always under boot?
00:05:03.762,00:05:04.888,What is this?
00:05:08.642,00:05:10.685,Have you checked the axis?
00:05:40.174,00:05:41.842,Can it be?
00:05:43.218,00:05:44.385,Dingle!
00:05:44.427,00:05:45.512,Make preparations.
00:05:46.429,00:05:47.973,We are going to have company.
00:06:11.705,00:06:13.540,TOOTH: 18 central incisors.
00:06:13.581,00:06:16.710,"Moscow, sector 9."
00:06:16.751,00:06:18.337,Uh-oh. Heavy rain advisory.
00:06:18.377,00:06:20.005,"Des Moines, we've got a cuspid at 23 Maple. Head out!"
00:06:21.173,00:06:23.342,Wait! It's her first tooth.
00:06:23.382,00:06:26.261,Have you ever seen a more adorable lateral incisor in all of your life?
00:06:26.303,00:06:27.846,Look how she flossed.
00:06:35.187,00:06:42.986,"NORTH: My fellow Guardians, it is our job to watch over the children of the world and keep them safe."
00:06:43.028,00:06:46.614,"To bring wonder, hope, and dreams."
00:06:46.656,00:06:51.119,"And so I have called us all here for one reason, and one reason only."
00:06:51.161,00:06:52.787,The children are in danger.
00:07:03.215,00:07:09.346,An enemy we have kept at bay for centuries has finally decided to strike back.
00:07:09.388,00:07:11.223,We alone can stop him.
00:07:17.896,00:07:19.398,"Oh, it's freezing!"
00:07:21.816,00:07:24.485,"Oh, I can't feel my feet!"
00:07:25.862,00:07:28.115,NORTH: Cookies?
00:07:28.156,00:07:29.699,"BUNNY: This better be good, North."
00:07:29.741,00:07:31.410,"Sandy, thank you for coming."
00:07:31.451,00:07:33.661,"I know, I know."
00:07:33.703,00:07:37.165,But I obviously wouldn't have called you all here unless it was serious.
00:07:37.207,00:07:38.625,Shh!
00:07:38.666,00:07:41.586,The Boogeyman was here!
00:07:43.380,00:07:44.714,Pitch Black? Here?
00:07:45.590,00:07:47.050,NORTH: Yes.
00:07:47.092,00:07:48.969,There was black sand covering the Globe.
00:07:50.178,00:07:51.638,"What do you mean, black sand?"
00:07:51.679,00:07:53.765,And then a shadow!
00:07:53.807,00:07:55.683,"Hold on, hold on."
00:07:55.725,00:07:58.103,"Well, uh, not exactly."
00:07:58.145,00:07:59.479,Not exactly?
00:08:02.065,00:08:03.524,"Yeah. You said it, Sandy."
00:08:03.566,00:08:06.111,"Look, he's up to something very bad."
00:08:06.945,00:08:11.574,I feel it in my belly.
00:08:11.616,00:08:13.868,"Hang on, hang on."
00:08:11.616,00:08:16.913,You mean to say you summoned me here three days before Easter because of your belly?
00:08:16.955,00:08:18.957,"Mate, if I did this to you three days before Christmas..."
00:08:18.999,00:08:21.960,"Please, Bunny."
00:08:22.002,00:08:23.586,Here we go.
00:08:23.628,00:08:25.464,I don't have time for this!
00:08:25.505,00:08:28.049,I've still got two million eggs to finish up!
00:08:28.091,00:08:30.718,"No matter how much you paint, is still egg."
00:08:30.760,00:08:31.928,"Look, mate, I'm dealing with perishables."
00:08:33.138,00:08:35.140,Right? You've got all year to prepare!
00:08:35.182,00:08:37.976,Why are rabbits always so nervous?
00:08:38.018,00:08:38.935,And why are you always such a blowhard?
00:08:40.312,00:08:43.064,Tooth! Can't you see we're trying to argue?
00:08:43.106,00:08:45.192,Sorry. Not all of us get to work one night a year.
00:08:45.233,00:08:46.193,"Am I right, Sandy?"
00:08:47.402,00:08:49.154,"San Diego, sector 2."
00:08:49.196,00:08:50.989,"Come on, mate."
00:08:51.031,00:08:53.200,We made sure of it.
00:08:53.241,00:08:56.661,NORTH: I know it was him.
00:08:56.703,00:08:58.955,"Well, I've got a serious situation with some eggs."
00:09:07.755,00:09:10.300,Ah! Man in Moon!
00:09:10.342,00:09:12.010,"Sandy, why didn't you say something?"
00:09:14.888,00:09:16.348,"It's been a long time, old friend."
00:09:17.057,00:09:18.099,What is big news?
00:09:33.532,00:09:34.699,It is Pitch.
00:09:36.951,00:09:39.120,"Manny, what must we do?"
00:09:47.795,00:09:49.756,"TOOTH: Uh, guys, you know what this means?"
00:09:49.797,00:09:51.258,He's choosing a new Guardian.
00:09:51.299,00:09:53.385,What? Why?
00:09:53.427,00:09:55.720,NORTH: Must be big deal.
00:09:56.763,00:09:57.972,Since when do we need help?
00:09:58.890,00:09:59.807,I wonder who it's gonna be!
00:10:01.017,00:10:02.602,Maybe the Leprechaun?
00:10:02.643,00:10:03.644,"Please not the Groundhog, please not the Groundhog."
00:10:11.528,00:10:12.862,Jack Frost.
00:10:14.614,00:10:15.698,"Uh, I take it back."
00:10:17.284,00:10:20.661,As long as he helps to protect the children. Right?
00:10:20.703,00:10:23.957,Jack Frost?
00:10:23.998,00:10:27.377,All right? All he does is freeze water pipes and mess with my egg hunts!
00:10:27.419,00:10:28.587,All right?
00:10:29.087,00:10:30.505,Guardian.
00:10:30.547,00:10:33.633,"BUNNY: Jack Frost is many things, but he is not a Guardian."
00:10:43.435,00:10:44.436,Ya! Ugh!
00:10:58.283,00:11:00.785,"Oh! Now that, that was fun."
00:11:01.453,00:11:02.621,"Hey, wind!"
00:11:04.623,00:11:05.873,Take me home.
00:11:17.051,00:11:18.719,Snow day!
00:11:23.642,00:11:24.725,MAN: Oh! It's freezing!
00:11:29.523,00:11:30.482,Yeah!
00:11:33.943,00:11:35.195,Whoa! Whoa!
00:11:40.116,00:11:42.202,"Oh, that looks interesting."
00:11:42.243,00:11:43.995,CALEB: All right!
00:11:44.037,00:11:45.121,Snow day!
00:11:45.704,00:11:47.207,You're welcome.
00:11:47.248,00:11:50.210,"Hey, guys, wait up!"
00:11:50.251,00:11:52.003,CALEB: Yeah! Free candy.
00:11:52.045,00:11:53.796,CLAUDE: I hope we can find the eggs with all this snow!
00:11:56.257,00:12:00.554,It says here that they found Bigfoot hair samples and DNA in Michigan!
00:12:00.595,00:12:02.180,That's like super-close!
00:12:02.222,00:12:03.722,Here we go again.
00:12:03.764,00:12:05.600,"You saw the video too, Claude."
00:12:05.642,00:12:07.268,That's what you said about aliens.
00:12:07.310,00:12:08.562,And the Easter Bunny!
00:12:09.563,00:12:11.189,The Easter Bunny is real.
00:12:11.231,00:12:12.857,"Oh, he's real all right."
00:12:12.899,00:12:15.734,"Real annoying, real grumpy and really full of himself."
00:12:15.776,00:12:17.195,CLAUDE: Come on!
00:12:17.237,00:12:18.530,"Easter Bunny, hop, hop, hop!"
00:12:19.698,00:12:22.116,"Mom, Sophie fell again!"
00:12:22.158,00:12:23.410,"JAMIE'S MOM: You okay, Soph?"
00:12:23.451,00:12:24.994,"Jamie, hat."
00:12:25.036,00:12:26.371,We don't want Jack Frost nipping at your nose.
00:12:27.080,00:12:28.789,Who's Jack Frost?
00:12:28.831,00:12:29.999,"JAMIE'S MOM: No one, honey."
00:12:30.584,00:12:31.792,Hey!
00:12:33.712,00:12:34.671,Who's Jack Frost?
00:12:45.764,00:12:47.850,"Okay, who threw that?"
00:12:47.892,00:12:49.143,"Well, it wasn't Bigfoot, kiddo."
00:12:51.271,00:12:52.313,Ahhh!
00:12:53.523,00:12:54.399,"Jamie Bennett, no fair!"
00:12:55.316,00:12:56.234,You struck first!
00:12:58.027,00:12:58.903,Free-for-all!
00:13:01.197,00:13:02.407,"All right, who needs ammo?"
00:13:04.909,00:13:06.077,JACK: Look at that!
00:13:13.209,00:13:15.336,Crud! I hit Cupcake!
00:13:15.378,00:13:16.671,She hit Cupcake.
00:13:20.967,00:13:22.636,CLAUDE: Ohhh!
00:13:22.677,00:13:23.762,Did you throw that?
00:13:23.802,00:13:25.096,It wasn't me!
00:13:34.648,00:13:36.650,"Oh, a little slippery!"
00:13:36.691,00:13:38.067,"PIPPA: Jamie, watch out!"
00:13:38.109,00:13:39.319,Stop! There's traffic!
00:13:41.279,00:13:43.948,"Whoa! Don't worry, Jamie."
00:13:43.990,00:13:45.824,It's gonna be all right!
00:13:47.285,00:13:48.703,"Keep up with me, kid!"
00:13:48.745,00:13:49.746,"MAN: Hey, slow down!"
00:13:51.790,00:13:53.249,"Hold up. No, no, no, no."
00:13:53.291,00:13:54.041,WOMAN: Is that Jamie Bennett?
00:13:55.293,00:13:56.795,There you go.
00:14:01.675,00:14:02.634,Whoa!
00:14:15.647,00:14:17.982,"Oh, my gosh!"
00:14:18.024,00:14:19.233,"Wow, that looks serious."
00:14:20.985,00:14:22.403,Whoa!
00:14:22.445,00:14:25.114,Did you guys see that?
00:14:25.156,00:14:28.743,I did a jump and I slid Whoops.
00:14:28.785,00:14:29.910,ALL: Oh!
00:14:32.955,00:14:34.666,Cool! A tooth!
00:14:34.708,00:14:36.543,"CLAUDE: Dude, that means cash!"
00:14:36.584,00:14:38.461,CLAUDE: You lucky bum!
00:14:38.503,00:14:40.547,I got to put this under my pillow!
00:14:40.588,00:14:42.382,"Oh, wait a minute."
00:14:42.423,00:14:44.050,What about all the fun we just had?
00:14:44.091,00:14:45.635,"That wasn't the Tooth Fairy, that was me!"
00:14:45.677,00:14:46.969,CALEB: My ears are freezing!
00:14:47.011,00:14:49.723,What's a guy got to do to get a little attention around here?
00:14:51.265,00:14:53.434,MALE DRIVER: There was a patch of ice.
00:14:53.476,00:14:55.102,I don't understand how it got here.
00:14:55.144,00:14:56.979,"I mean, Easter is around the corner!"
00:14:58.314,00:14:59.774,JAMIE: ...it was awesome!
00:14:59.816,00:15:06.489,"So then I was flying down this hill and it was like whoosh, whoosh, through these cars and then the sled hit this thing and it was like way up in the air!"
00:15:06.531,00:15:08.115,"And then, bam, the sofa hit me..."
00:15:08.157,00:15:09.450,Wow!
00:15:09.492,00:15:10.660,"...and see, my tooth came out!"
00:15:12.328,00:15:13.747,"JAMIE'S MOM: All right, you."
00:15:13.788,00:15:15.790,"Yeah, I'm ready."
00:15:15.832,00:15:19.126,"JAMIE'S MOM: Now don't stay up trying to see her, Jamie, or she won't come."
00:15:19.168,00:15:21.504,But I can do it this time!
00:15:21.546,00:15:22.672,We can hide and see the Tooth Fairy!
00:15:22.714,00:15:24.048,"Hide, hide, hide, hide."
00:15:24.090,00:15:25.717,Uh-uh.
00:15:40.440,00:15:46.404,"If there's something I'm doing wrong, can you just tell me what it is?"
00:15:47.947,00:15:52.744,Because I've tried everything and no one ever sees me.
00:15:57.874,00:15:59.959,You put me here.
00:16:00.000,00:16:01.586,The least you can do is tell me...
00:16:03.129,00:16:04.338,Tell me why.
00:16:31.240,00:16:32.450,"Right on time, Sandman."
00:16:55.682,00:16:56.641,Mmm.
00:17:07.443,00:17:11.030,"Oh, I thought I heard the clippity-clop of a unicorn."
00:17:12.448,00:17:13.867,What an adorable dream!
00:17:15.075,00:17:17.036,And look at her.
00:17:18.705,00:17:19.998,Precious child.
00:17:20.915,00:17:22.500,So sweet.
00:17:22.542,00:17:24.335,So full of hope and wonder.
00:17:25.586,00:17:27.672,"Why, there's only one thing missing."
00:17:29.007,00:17:30.049,A touch of fear.
00:17:32.760,00:17:34.094,Mmm...
00:17:34.136,00:17:36.389,That never gets old.
00:17:36.430,00:17:41.019,Feel your fear. Come on.
00:17:41.060,00:17:45.773,"Yes, what a pretty little Nightmare!"
00:17:47.316,00:17:52.530,"Now, I want you to go tell the others the wait is over."
00:18:00.162,00:18:01.748,"Don't look at me like that, old friend."
00:18:02.999,00:18:04.709,You must have known this day would come.
00:18:05.835,00:18:07.420,My Nightmares are finally ready.
00:18:08.796,00:18:09.923,Are your Guardians?
00:18:17.931,00:18:18.890,Whoa!
00:18:41.537,00:18:42.914,"BUNNY: Hello, mate."
00:18:44.582,00:18:46.793,Been a long time.
00:18:47.961,00:18:50.004,"Easter Sunday, wasn't it?"
00:18:50.046,00:18:52.840,"Bunny! You're not still mad about that, are you?"
00:18:53.549,00:18:54.550,Yes.
00:18:56.260,00:18:57.428,But this is about something else.
00:18:58.846,00:19:00.098,Fellas?
00:19:00.139,00:19:01.557,Hey!
00:19:01.599,00:19:02.976,Put me down!
00:19:12.318,00:19:14.320,Not on your nelly.
00:19:25.414,00:19:27.708,Whoa!
00:19:27.750,00:19:28.835,NORTH: He's here.
00:19:30.503,00:19:31.671,Quiet.
00:19:31.712,00:19:33.131,Hey! There he is!
00:19:34.340,00:19:35.508,Jack Frost!
00:19:36.592,00:19:38.052,Wow.
00:19:38.094,00:19:39.012,You got to be kidding me.
00:19:39.053,00:19:41.014,"Hey, hey."
00:19:41.055,00:19:43.349,Put me down.
00:19:43.390,00:19:48.021,"Oh, yeah, I love being shoved in a sack and tossed through a magic portal."
00:19:48.062,00:19:49.772,"Oh, good."
00:19:50.690,00:19:51.774,"You know Bunny, obviously."
00:19:53.026,00:19:54.485,Obviously.
00:19:54.527,00:19:56.112,"Hello, Jack."
00:19:56.154,00:19:57.237,And your teeth!
00:19:57.279,00:19:58.739,My what?
00:19:58.781,00:19:59.824,Open up! Are they really as white as they say?
00:20:01.492,00:20:03.410,"Oh, they really do sparkle like freshly fallen snow!"
00:20:05.663,00:20:06.873,"Girls, pull yourselves together!"
00:20:06.914,00:20:07.957,Let's not disgrace the uniform.
00:20:07.999,00:20:09.416,NORTH: And Sandman.
00:20:09.458,00:20:10.543,Sandy?
00:20:11.044,00:20:12.378,Sandy? Wake up!
00:20:13.754,00:20:15.339,"Hey, ho, anyone want to tell me why I'm here?"
00:20:20.053,00:20:23.097,"that's not really helping, but thanks, little man."
00:20:24.390,00:20:27.185,I must've done something really bad to get you four together.
00:20:27.226,00:20:28.352,Am I on the naughty list?
00:20:28.394,00:20:30.104,NORTH: Ha!
00:20:30.146,00:20:32.065,You hold the record.
00:20:32.106,00:20:34.067,"But, no matter."
00:20:34.108,00:20:35.735,Now we are wiping clean the slate.
00:20:36.360,00:20:37.695,How come?
00:20:37.737,00:20:38.905,"Ah, good question."
00:20:38.946,00:20:41.199,How come?
00:20:42.241,00:20:44.827,Because now you are Guardian!
00:20:52.919,00:20:55.004,What are you doing?
00:20:55.046,00:20:55.838,This is the best part!
00:21:10.310,00:21:11.229,Huh?
00:21:26.285,00:21:27.494,What makes you think I want to be a Guardian?
00:21:35.294,00:21:36.670,Of course you do.
00:21:36.712,00:21:37.880,Music!
00:21:38.756,00:21:40.049,No music!
00:21:42.426,00:21:46.305,"This is all very flattering, but, uh, you don't want me."
00:21:46.346,00:21:51.144,"You're all hard work and deadlines, and I'm snowballs and fun times."
00:21:51.185,00:21:52.561,I'm not a Guardian.
00:21:52.603,00:21:54.939,Yeah. That's exactly what I said.
00:21:54.981,00:21:56.941,"Jack, I don't think you understand what it is we do."
00:21:58.400,00:22:00.486,Each of those lights is a child.
00:22:00.527,00:22:02.029,NORTH: A child who believes.
00:22:03.072,00:22:06.826,"And good or bad, naughty or nice, we protect them."
00:22:07.576,00:22:08.911,JACK: Ah! Ah!
00:22:08.953,00:22:10.663,Tooth! Fingers out of mouth.
00:22:10.704,00:22:12.790,"Oh, sorry."
00:22:13.582,00:22:15.709,Okay. No more wishy-washy.
00:22:15.751,00:22:17.670,Pitch is out there doing who knows what!
00:22:17.711,00:22:19.630,You mean the Boogeyman?
00:22:19.672,00:22:24.551,"Yes! When Pitch threatens us, he threatens them as well."
00:22:24.593,00:22:25.970,All the more reason to pick someone more qualified.
00:22:26.012,00:22:28.346,Pick? You think we pick?
00:22:28.388,00:22:30.641,"No, you were chosen!"
00:22:31.349,00:22:32.726,By Man in Moon.
00:22:32.768,00:22:34.103,What?
00:22:34.145,00:22:35.688,"Last night, Jack, he chose you."
00:22:36.105,00:22:37.481,Maybe.
00:22:37.523,00:22:40.526,Man in the Moon...
00:22:42.820,00:22:45.572,"NORTH: You see, you cannot say no."
00:22:49.076,00:22:50.286,But why wouldn't he tell me that himself?
00:22:52.288,00:22:55.457,this is his answer?
00:22:55.499,00:23:01.588,"To spend eternity like you guys, cooped up in some hideout thinking of new ways to bribe kids?"
00:23:03.049,00:23:06.344,"No, no. That's not for me!"
00:23:07.303,00:23:08.804,How is that not offensive?
00:23:09.889,00:23:11.140,You know what I think?
00:23:11.182,00:23:12.558,I think we just dodged a bullet.
00:23:12.599,00:23:15.811,"I mean, what's this clown know about bringing joy to children anyway."
00:23:16.854,00:23:19.273,"Uh, you ever hear of a snow day?"
00:23:19.315,00:23:22.860,"I know it's no hard-boiled egg, but kids like what I do."
00:23:22.902,00:23:24.778,"But none of them believe in you, do they?"
00:23:24.820,00:23:26.530,"You see, you're invisible, mate."
00:23:26.572,00:23:27.531,It's like you don't even exist.
00:23:28.741,00:23:30.450,Bunny! Enough.
00:23:30.492,00:23:32.452,"No, the kangaroo's right."
00:23:32.494,00:23:34.580,The what?
00:23:34.621,00:23:36.582,"I'm not a kangaroo, mate."
00:23:36.623,00:23:39.459,"Oh, and this whole time I thought you were."
00:23:39.501,00:23:42.546,"If you're not a kangaroo, what are you?"
00:23:42.588,00:23:45.299,I'm a bunny.
00:23:46.300,00:23:47.801,People believe in me.
00:23:55.393,00:23:56.727,Jack. Walk with me.
00:23:59.021,00:24:01.065,"It's nothing personal, North."
00:24:01.107,00:24:03.150,"But what you all do, it's just not my thing."
00:24:03.192,00:24:04.402,Man in Moon says it is your thing!
00:24:04.860,00:24:06.653,We will see.
00:24:06.695,00:24:08.781,"Slow down, would you?"
00:24:08.822,00:24:10.783,I want a good look.
00:24:10.824,00:24:12.450,"Oh, don't worry."
00:24:12.492,00:24:13.411,"Oh, hey, Phil."
00:24:14.870,00:24:15.996,"NORTH: Keep up, Jack, keep up!"
00:24:25.381,00:24:28.466,Whoa! I always thought the elves made the toys.
00:24:28.508,00:24:30.344,We just let them believe that.
00:24:33.597,00:24:36.516,Very nice!
00:24:36.558,00:24:38.644,I don't like it!
00:24:41.397,00:24:42.648,"Step it up, everybody!"
00:25:02.042,00:25:03.252,Fruitcake?
00:25:03.294,00:25:04.378,"Uh, no, thanks."
00:25:06.504,00:25:08.424,Now we get down to tacks of brass.
00:25:09.716,00:25:10.843,Tacks of...
00:25:13.346,00:25:15.222,"Who are you, Jack Frost?"
00:25:16.598,00:25:19.517,What is your center?
00:25:19.559,00:25:24.982,"If Man in Moon chose you to be a Guardian, you must have something very special inside."
00:25:26.900,00:25:27.860,Hmm.
00:25:31.905,00:25:33.199,Here.
00:25:33.240,00:25:34.241,"This is how you see me, no?"
00:25:35.159,00:25:37.370,"Very big, intimidating."
00:25:38.745,00:25:41.290,But if you get to know me a little...
00:25:45.336,00:25:47.129,You are downright jolly?
00:25:48.130,00:25:50.383,But not just jolly!
00:25:51.217,00:25:59.557,"I am also mysterious, and fearless, and caring!"
00:26:01.310,00:26:02.436,And at my center?
00:26:05.481,00:26:07.733,There's a tiny wooden baby.
00:26:07.774,00:26:09.567,Look closer.
00:26:11.404,00:26:12.863,You have big eyes.
00:26:12.905,00:26:16.158,Yes! Big eyes.
00:26:16.200,00:26:18.285,Because they are full of wonder.
00:26:19.577,00:26:20.746,That is my center.
00:26:21.663,00:26:24.375,It is what I was born with.
00:26:24.417,00:26:28.962,Eyes that have always seen the wonder in everything!
00:26:29.004,00:26:32.758,Eyes that see lights in the trees and magic in the air.
00:26:34.634,00:26:38.180,This wonder is what I put into the world!
00:26:39.139,00:26:41.392,And what I protect in children.
00:26:42.435,00:26:43.727,It is what makes me a Guardian.
00:26:46.604,00:26:47.981,It is my center.
00:26:48.857,00:26:50.150,What is yours?
00:26:52.903,00:26:54.154,I don't know.
00:27:02.913,00:27:05.040,"We have a problem, mate."
00:27:06.375,00:27:07.960,JACK: North! North!
00:27:08.001,00:27:10.504,I told you I'm not going with you guys!
00:27:10.546,00:27:12.839,There is no way I'm climbing into some rickety old...
00:27:17.094,00:27:18.345,...sleigh?
00:27:28.063,00:27:30.316,"Whoa, whoa, hey!"
00:27:40.493,00:27:41.827,"Okay. One ride, but that's it."
00:27:42.786,00:27:45.038,Everyone loves the sleigh!
00:27:45.080,00:27:47.249,"Bunny, what are you waiting for?"
00:27:47.291,00:27:49.709,"I think my tunnels might be faster, mate, and, um, and safer."
00:27:50.503,00:27:52.546,Ugh! Get in!
00:27:52.588,00:27:54.089,NORTH: Buckle up!
00:27:54.131,00:27:55.299,Where are the bloody seatbelts?
00:27:55.341,00:27:58.469,Ha! That was just expression.
00:27:58.511,00:28:00.513,Good. Let's go! Clear!
00:28:02.431,00:28:03.974,Yah!
00:28:06.310,00:28:07.603,Out of the way!
00:28:14.610,00:28:15.611,Yah!
00:28:16.694,00:28:18.322,"BUNNY: Oh, no!"
00:28:24.453,00:28:25.703,BUNNY: Slow down!
00:28:29.458,00:28:31.585,I hope you like the loopty-loops.
00:28:31.627,00:28:33.003,I hope you like carrots.
00:28:34.254,00:28:35.339,Here we go!
00:28:40.553,00:28:41.928,NORTH: Whoo-hoo!
00:28:48.977,00:28:50.270,Blastoff!
00:28:55.067,00:28:56.109,Ohhh...
00:28:57.069,00:28:58.529,"Hey, Bunny."
00:28:58.571,00:29:00.698,Check out this view.
00:29:00.739,00:29:03.200,North! He's...
00:29:05.369,00:29:07.037,"Aw, you do care."
00:29:08.205,00:29:10.290,"Oh, rack off, you bloody show pony!"
00:29:10.332,00:29:12.668,"Hold on, everyone!"
00:29:12.710,00:29:15.128,"Oh, strewth, I knew I should've taken the tunnels."
00:29:15.170,00:29:18.048,I say Tooth Palace.
00:29:20.217,00:29:21.301,Yah!
00:29:25.764,00:29:26.724,What?
00:29:28.058,00:29:29.560,Oh! Whoa!
00:29:31.645,00:29:32.938,What are they?
00:29:34.106,00:29:35.065,Whoa!
00:29:38.444,00:29:39.236,They're taking the tooth fairies!
00:29:47.119,00:29:48.370,"Hey, little Baby Tooth, you okay?"
00:30:05.011,00:30:06.846,"-Huh?-Here, take over."
00:30:06.888,00:30:07.931,Yah!
00:30:09.433,00:30:10.684,NORTH: Yah!
00:30:11.851,00:30:12.728,They're stealing the teeth!
00:30:15.648,00:30:17.357,"Jack, look out!"
00:30:24.782,00:30:25.949,Tooth! Are you all right?
00:30:27.326,00:30:28.786,They... They took my fairies.
00:30:29.911,00:30:31.079,And the teeth!
00:30:32.372,00:30:33.290,Everything is gone.
00:30:34.458,00:30:35.459,Everything.
00:30:39.421,00:30:42.257,One of you is all right.
00:30:43.592,00:30:46.178,"PITCH: I have to say, this is very, very exciting."
00:30:47.262,00:30:49.473,"The Big Four, all in one place."
00:30:51.057,00:30:52.100,I'm a little starstruck.
00:30:53.644,00:30:54.853,"Did you like my show on the Globe, North?"
00:30:56.062,00:30:59.191,"Got you all together, didn't I?"
00:30:59.232,00:31:02.569,Pitch! You have got 30 seconds to return my fairies!
00:31:02.611,00:31:05.113,Or what? You'll stick a quarter under my pillow?
00:31:06.365,00:31:07.366,Why are you doing this?
00:31:08.158,00:31:10.410,Maybe I want what you have.
00:31:11.578,00:31:12.663,To be believed in.
00:31:14.373,00:31:16.958,Maybe I'm tired of hiding under beds!
00:31:18.126,00:31:20.045,Maybe that's where you belong!
00:31:20.086,00:31:21.839,"Go suck an egg, rabbit."
00:31:24.216,00:31:27.010,Hang on.
00:31:29.638,00:31:30.806,Since when are you all so chummy?
00:31:31.390,00:31:32.641,We're not.
00:31:32.683,00:31:34.727,"Oh, good."
00:31:36.019,00:31:38.063,Then I'm going to ignore you.
00:31:38.104,00:31:40.774,But you must be used to that by now.
00:31:40.816,00:31:42.693,"Pitch, you shadow-sneaking ratbag, come here!"
00:31:49.282,00:31:52.411,"Easy, girl, easy."
00:31:54.913,00:31:56.373,"Look familiar, Sandman?"
00:31:57.957,00:31:59.543,Took me a while to perfect this little trick.
00:32:01.086,00:32:02.880,Turning dreams into Nightmares.
00:32:04.798,00:32:06.383,Don't be nervous.
00:32:06.425,00:32:10.387,It only riles them up more.
00:32:10.429,00:32:12.848,What fear? Of you?
00:32:12.890,00:32:14.767,No one's been afraid of you since the Dark Ages!
00:32:15.308,00:32:17.977,"Oh, the Dark Ages."
00:32:18.019,00:32:20.146,Everyone frightened.
00:32:21.690,00:32:25.444,Such happy times for me.
00:32:26.653,00:32:32.409,But then the Man in the Moon chose you to replace my fear with your wonder and light.
00:32:34.494,00:32:37.205,Lifting their hearts and giving them hope.
00:32:39.207,00:32:41.919,"Meanwhile, everyone wrote me off as just a bad dream!"
00:32:41.960,00:32:43.503,"Oh, there's nothing to be afraid of."
00:32:43.545,00:32:44.922,There's no such thing as the Boogeyman!
00:32:46.882,00:32:49.301,"Well, that's all about to change."
00:32:52.971,00:32:54.681,"Oh, look."
00:32:54.723,00:32:56.182,It's happening already.
00:32:56.600,00:32:57.476,What is?
00:33:00.061,00:33:05.275,PITCH: Children are waking up and realizing the Tooth Fairy never came.
00:33:07.653,00:33:09.947,"I mean, such a little thing."
00:33:11.824,00:33:13.241,What's going on?
00:33:13.283,00:33:15.535,They... They don't believe in me anymore.
00:33:17.203,00:33:19.331,"Didn't they tell you, Jack?"
00:33:19.372,00:33:21.750,It's great being a Guardian.
00:33:21.792,00:33:23.418,But there's a catch.
00:33:23.460,00:33:30.300,"If enough kids stop believing, everything your friends protect, wonder, hopes and dreams, it all goes away."
00:33:31.635,00:33:33.679,"And little by little, so do they."
00:33:35.054,00:33:40.143,"No Christmas or Easter, or little fairies that come in the night."
00:33:41.728,00:33:45.607,There will be nothing but fear and darkness.
00:33:46.650,00:33:47.693,And me.
00:33:48.819,00:33:51.279,It's your turn not to be believed in.
00:34:11.800,00:34:12.968,He's gone.
00:34:17.055,00:34:18.765,"BUNNY: Okay, all right, I admit it."
00:34:18.807,00:34:20.976,You were right about Pitch.
00:34:21.018,00:34:21.977,I'm sorry about the fairies.
00:34:23.812,00:34:26.356,You should have seen them.
00:34:29.275,00:34:30.318,Why would Pitch take the teeth?
00:34:31.486,00:34:33.279,It's not the teeth he wanted.
00:34:33.321,00:34:34.698,It's the memories inside them.
00:34:35.699,00:34:37.784,What do you mean?
00:34:37.826,00:34:38.869,"That's why we collect the teeth, Jack."
