start,end,script
01:12:55.913,01:12:59.750,"Oh, yeah? Well, if I treated you so bad, how come you came back?"
01:13:00.250,01:13:03.462,Because that's what friends do! They forgive each other!
01:13:03.545,01:13:06.507,"Oh, yeah. You're right, Donkey."
01:13:06.757,01:13:09.843,I forgive you... for stabbin' me in the back!
01:13:11.345,01:13:16.392,"Ohh! You're so wrapped up in layers, onion boy, you're afraid of your own feelings."
01:13:16.475,01:13:20.104,"-Go away! -See! There you are, doing it again, just like you did to Fiona."
01:13:20.229,01:13:22.356,"All she ever do was like you, maybe even love you."
01:13:26.985,01:13:28.987,I heard the two of you talking.
01:13:29.113,01:13:30.114,She wasn't talkin' about you.
01:13:30.197,01:13:32.741,"She was talkin' about, uh, somebody else."
01:13:35.911,01:13:38.330,She wasn't talking about me?
01:13:38.997,01:13:40.749,"Well, then who was she talking about?"
01:13:40.833,01:13:43.544,"Uh-uh, no way. I ain't saying anything. You don't wanna listen to me."
01:13:43.627,01:13:45.671,-Right? Right? -Donkey!
01:13:45.754,01:13:48.298,"-No! -Okay, look."
01:13:48.549,01:13:50.384,"I'm sorry, all right?"
01:13:52.261,01:13:53.387,Hmph.
01:13:59.143,01:14:02.938,"I guess I am just a big, stupid, ugly ogre."
01:14:04.398,01:14:05.732,Can you forgive me?
01:14:08.777,01:14:10.279,"Hey, that's what friends are for, right?"
01:14:10.821,01:14:12.990,Right. Friends?
01:14:13.615,01:14:14.575,Friends.
01:14:16.118,01:14:20.831,"So, um, what did Fiona say about me?"
01:14:21.206,01:14:23.792,What are you asking me for? Why don't you just go ask her?
01:14:24.543,01:14:27.004,The wedding! We'll never make it in time.
01:14:27.087,01:14:41.768,"Ha-ha-ha! Never fear, for where there's a will, there's a way, I guess it's just my animal magnetism."
01:14:45.272,01:14:47.774,"All right, all right. Don't get all slobbery. No one likes a kiss ass."
01:14:47.858,01:14:50.402,"All right, hop on and hold on tight."
01:14:50.486,01:14:52.821,I haven't had a chance to install the seat belts yet.
01:15:25.145,01:15:37.574,"People of DuLoc, we gather here today, to bear witness, -to the union... -Um-- -...of our new king-- -Excuse me."
01:15:41.078,01:15:41.995,Go on.
01:15:47.668,01:15:50.712,"Go ahead, have some fun. If we need you, I'll whistle. How about that?"
01:15:53.882,01:15:55.759,"Shrek, wait, wait! Wait a minute!"
01:15:55.842,01:15:58.387,"-You wanna do this right, don't you? -What are you talking about?"
01:15:58.470,01:16:00.305,"There's a line, there's a line you gotta wait for."
01:16:00.389,01:16:02.516,"The preacher's gonna say, Speak now or forever hold your peace."
01:16:02.599,01:16:06.770,"-That's when you say, I object! -I don't have time for this!"
01:16:06.853,01:16:08.522,Wait. What are you doing? Listen to me!
01:16:08.605,01:16:10.274,"-Look, you love this woman, don't you? -Yes."
01:16:10.440,01:16:11.900,-You wanna hold her? -Yes.
01:16:11.984,01:16:13.318,-Please her? -Yes!
01:16:17.155,01:16:19.616,-The chicks love that romantic crap! -All right! Cut it out.
01:16:19.825,01:16:23.495,-When does this guy say the line? -We gotta check it out.
01:16:29.751,01:16:32.921,-I now pronounce you husband and wife-- -They're at the altar.
01:16:33.422,01:16:36.008,-King and queen... -Mother Fletcher! He already said it.
01:16:40.262,01:16:41.930,I object!
01:16:44.474,01:16:46.184,"Oh, now what does he want?"
01:16:49.771,01:16:52.774,"Hi, everyone. Havin' a good time, are ya?"
01:16:55.402,01:16:57.487,-Very clean. -What are you doing here?
01:16:57.571,01:17:03.660,"Really, it's rude enough being alive when no one wants you, -but showing up uninvited to a wedding-- -Fiona!"
01:17:04.286,01:17:06.788,"-I need to talk to you. -Oh, now you wanna talk?"
01:17:07.289,01:17:12.711,"Well, It's a little late for that, so if you'll excuse me-- -But you can't marry him. -And why not?"
01:17:12.961,01:17:16.715,Because-- Because he's just marrying you so he can be king.
01:17:16.965,01:17:19.343,"Outrageous! Fiona, don't listen to him."
01:17:19.426,01:17:22.679,-He's not your true love. -And what do you know about true love?
01:17:22.763,01:17:28.769,"Well, I-- Uh-- -I mean-- -Oh, this is precious."
01:17:36.068,01:17:37.944,An ogre and a princess!
01:17:43.742,01:17:46.203,"Shrek, is this true?"
01:17:47.371,01:17:49.956,Who cares? It's preposterous!
01:17:50.123,01:17:53.710,"Fiona, my love, we're but a kiss away from our happily ever after."
01:17:53.794,01:17:56.588,Now kiss me! Mmmm!
01:18:00.509,01:18:03.428,"By night one way, by day another."
01:18:06.181,01:18:07.724,I wanted to show you before.
01:18:31.748,01:18:35.585,"Well, uh, that explains a lot."
01:18:39.756,01:18:41.341,Guards! Guards!
01:18:41.425,01:18:44.970,I order you to get that out of my sight now! Get them!
01:18:45.053,01:18:47.013,"-Get them both! -No, no!"
01:18:47.097,01:18:48.932,This hocus-pocus alters nothing.
01:18:49.015,01:18:51.435,"This marriage is binding, and that makes me king!"
01:18:51.518,01:18:53.770,"-See? See? -No, let go of me! Shrek!"
01:18:53.854,01:18:54.688,No!
01:18:56.231,01:18:57.733,Get out of my way! Fiona!
01:19:01.236,01:19:02.571,Arrgh!
01:19:05.157,01:19:06.658,I'll see you drawn and quartered!
01:19:06.825,01:19:09.786,-You'll beg for death to save you! -No! Shrek!
01:19:09.870,01:19:12.748,"-And as for you, my wife, -Fiona!"
01:19:12.831,01:19:16.042,I'll have you locked back in that tower for the rest of your days!
01:19:18.086,01:19:25.302,I will have order! I will have perfection! I will have-- Aaah!
01:19:26.303,01:19:28.972,-Aah! All right. -Nobody move.
01:19:29.097,01:19:30.932,"I got a dragon here, and I'm not afraid to use it."
01:19:38.148,01:19:40.609,"Celebrity marriages. They never last, do they?"
01:19:43.987,01:19:45.238,"Go ahead, Shrek."
01:19:46.198,01:19:48.116,"Uh, Fiona?"
01:19:49.659,01:19:50.952,"Yes, Shrek?"
01:19:51.787,01:19:55.582,I-- I love you.
01:19:56.333,01:19:57.501,Really?
01:19:59.669,01:20:00.670,"Really, really."
01:20:02.631,01:20:04.341,I love you too.
01:20:53.223,01:20:54.349,Fiona?
01:20:57.978,01:20:58.895,Fiona.
01:21:00.313,01:21:01.773,Are you all right?
01:21:03.567,01:21:04.693,"Well, yes."
01:21:05.694,01:21:07.404,But I don't understand.
01:21:08.613,01:21:10.282,I'm supposed to be beautiful.
01:21:13.451,01:21:14.661,But you are beautiful.
01:21:17.664,01:21:19.708,I was hoping this would be a happy ending.
01:22:07.839,01:22:10.550,"God bless us, every one."
01:22:32.238,01:22:34.950,-Ooh! -Uh!
01:23:21.746,01:23:23.915,"Oh, that's funny. Oh. Oh."
