start,end,script
00:01:19.079,00:01:20.788,&lrm;...didn't work.
00:01:20.872,00:01:23.416,&lrm;And I'm already dead.
00:01:23.958,00:01:26.961,&lrm;-MAN 1: Evan? &lrm;-MAN 2: I think he's in here.
00:01:27.044,00:01:37.889,&lrm;But if I can somehow &lrm;go back to the beginning &lrm;to save her.
00:01:38.223,00:01:39.599,&lrm;MAN 2: Evan!
00:02:25.978,00:02:27.355,&lrm;Evan!
00:02:32.444,00:02:33.778,&lrm;We're gonna be late again.
00:02:34.654,00:02:37.031,&lrm;When did you ever care &lrm;about getting to school on time?
00:02:37.449,00:02:38.991,&lrm;We're putting up pictures &lrm;for parents' night.
00:02:39.826,00:02:41.911,"&lrm;Don't worry, you'll have plenty of time."
00:02:45.165,00:02:46.249,&lrm;Is Dad gonna come?
00:02:46.791,00:02:48.210,&lrm;You know the answer to that.
00:02:48.501,00:02:50.503,&lrm;Can't he just come out for one day?
00:02:50.837,00:02:53.881,&lrm;We've been over this a hundred times. &lrm;It's too dangerous for him.
00:02:54.716,00:03:00.222,"&lrm;But Lenny said his dad's coming, &lrm;-and Tommy and Kayleigh's dad... &lrm;-Okay, I get the point."
00:03:01.889,00:03:03.850,"&lrm;But I'm not so bad, am I?"
00:03:04.351,00:03:05.352,&lrm;No.
00:03:18.781,00:03:21.033,"&lrm;Okay, have a great day."
00:03:21.117,00:03:24.120,&lrm;I love you. &lrm;I'll pick you up later. Gotta go.
00:03:25.538,00:03:26.748,&lrm;Bye.
00:03:30.042,00:03:31.294,&lrm;Bye!
00:03:34.714,00:03:36.383,"&lrm;Mrs. Treborn, I need to speak with you."
00:03:36.466,00:03:38.801,&lrm;Can it wait till tonight? &lrm;I'm already late for work and I...
00:03:38.885,00:03:41.053,&lrm;I think you really need to see this.
00:03:43.265,00:03:45.308,"&lrm;Tommy, leave Lenny alone."
00:03:45.392,00:03:48.478,&lrm;Don't make me send you &lrm;to Mr. Voytek's office.
00:03:49.312,00:03:52.899,"&lrm;I was gonna show this to the principal, &lrm;but I thought I should talk to you first."
00:03:52.982,00:03:54.025,&lrm;What is it?
00:03:54.108,00:03:58.070,"&lrm;Yesterday, I had all the children &lrm;make drawings &lrm;of what they wanted to be &lrm;when they grew up."
00:03:58.154,00:04:00.156,&lrm;Most of them made drawings &lrm;of what their parents did.
00:04:00.240,00:04:01.533,&lrm;But this...
00:04:12.084,00:04:13.336,&lrm;ANDREA: I don't understand.
00:04:14.421,00:04:15.880,&lrm;Evan did this?
00:04:18.550,00:04:20.843,"&lrm;-Can I keep this drawing? &lrm;-Oh, of course."
00:04:21.303,00:04:25.848,"&lrm;Um, there is one more thing, Mrs. Treborn, &lrm;-I feel bad even mentioning. &lrm;-What?"
00:04:26.641,00:04:31.771,"&lrm;When I asked Evan about the drawing, &lrm;well, he couldn't remember doing it."
00:04:40.947,00:04:42.740,&lrm;EVAN: I don't wanna go.
00:04:44.284,00:04:46.369,"&lrm;I don't like this place, Mom."
00:04:46.453,00:04:47.954,&lrm;I think it's creepy.
00:04:49.706,00:04:52.584,&lrm;I promise I won't make any bad pictures. &lrm;I promise.
00:04:52.667,00:04:54.461,"&lrm;You're gonna be fine, okay?"
00:04:54.544,00:04:56.963,"&lrm;He just wants to do &lrm;a couple tests, that's all."
00:04:57.297,00:04:59.090,&lrm;-EVAN: Oh... &lrm;-You'll like him.
00:05:03.052,00:05:05.430,&lrm;WOMAN: That's good. You're doing great.
00:05:05.513,00:05:08.224,&lrm;ANDREA: Just tell me he hasn't inherited &lrm;his father's illness.
00:05:08.975,00:05:11.603,&lrm;I'm sure the test results &lrm;will come back negative.
00:05:11.686,00:05:13.813,&lrm;But there's something else you can do &lrm;to monitor his memory.
00:05:14.439,00:05:16.691,&lrm;-Anything. &lrm;-A journal.
00:05:16.774,00:05:18.776,&lrm;Just have him write down &lrm;everything that he does.
00:05:18.860,00:05:21.738,&lrm;-And what will that do? &lrm;-It could help jog his memory.
00:05:22.196,00:05:25.241,&lrm;See if he remembers &lrm;anything new the next day.
00:05:25.325,00:05:29.286,"&lrm;These test results &lrm;will come back in a few days, &lrm;-and we'll take it from there. &lrm;-Okay."
00:05:30.162,00:05:32.749,&lrm;EVAN: &lrm;Today Mommy is taking me &lrm;to play with Kayleigh and Tommy.
00:05:34.166,00:05:37.420,&lrm;I will meet their father &lrm;and see what a real dad is like.
00:05:40.214,00:05:41.841,"&lrm;Great, see you soon."
00:05:54.270,00:05:55.772,&lrm;Evan...
00:05:55.855,00:05:58.858,"&lrm;Evan, what are you doing with that knife?"
00:06:07.534,00:06:08.535,&lrm;What happened?
00:06:09.452,00:06:10.662,&lrm;Honey...
00:06:12.121,00:06:13.831,&lrm;What were you doing with that knife?
00:06:16.501,00:06:17.835,&lrm;I don't remember.
00:06:29.514,00:06:31.098,"&lrm;-Hey, Andrea. &lrm;-George."
00:06:32.058,00:06:33.392,"&lrm;Hello, little man."
00:06:34.769,00:06:36.103,&lrm;Watch your step.
00:06:40.733,00:06:42.151,"&lrm;Uh, thanks, George."
00:06:42.234,00:06:46.656,"&lrm;-Not a problem. &lrm;-Here's my number at the hospital, &lrm;in case there are any problems."
00:06:46.739,00:06:49.534,"&lrm;And, uh, please keep &lrm;an eye on him 'cause..."
00:06:49.617,00:06:50.993,"&lrm;What, are you kidding?"
00:06:51.077,00:06:52.829,"&lrm;We're going to have &lrm;a great time today, right, sport?"
00:06:53.455,00:06:56.916,"&lrm;Okay, be good, kiddo. I love you."
00:06:56.999,00:06:58.626,"&lrm;-Bye-bye. &lrm;-Bye, George."
00:07:00.086,00:07:03.506,&lrm;Go long. Go on. &lrm;Right in the back yard. Here it comes.
00:07:06.551,00:07:10.597,"&lrm;Evan, Evan, guess what? &lrm;Dad got a new video camera &lrm;and we're all going to be in a movie."
00:07:10.680,00:07:12.474,"&lrm;That's right, Evan."
00:07:13.099,00:07:15.935,&lrm;And you get to be the star.
00:07:16.018,00:07:19.230,"&lrm;-I thought I was the star. &lrm;-Hey, what did I tell you?"
00:07:21.148,00:07:22.900,"&lrm;Now, Evan..."
00:07:22.984,00:07:32.159,"&lrm;You have to promise &lrm;your bestest, super-duper promise, &lrm;that this will be our little secret."
00:07:32.243,00:07:34.120,&lrm;-You think you can do that? &lrm;-Uh-huh.
00:07:43.420,00:07:44.922,&lrm;Where am I?
00:07:45.006,00:07:46.423,&lrm;Where did we all go?
00:07:46.508,00:07:47.925,"&lrm;Calm down, kid, stand still."
00:07:48.009,00:07:49.719,&lrm;EVAN: I was just somewhere else.
00:07:50.720,00:07:51.846,&lrm;How did I get here?
00:07:55.307,00:07:57.434,&lrm;and tell her what a naughty little shit &lrm;you've been.
00:08:00.647,00:08:01.689,&lrm;Kayleigh.
00:08:02.482,00:08:03.608,&lrm;Kayleigh.
00:08:04.901,00:08:06.443,&lrm;What happened?
00:08:16.496,00:08:19.248,&lrm;The good news is the results are negative.
00:08:19.331,00:08:22.459,"&lrm;I found no evidence of lesions, &lrm;hemorrhaging, tumors."
00:08:22.544,00:08:24.336,&lrm;But you must have something you can go on.
00:08:24.962,00:08:27.882,"&lrm;If I was to guess, &lrm;I'd say the blackouts are stress related."
00:08:28.508,00:08:30.384,&lrm;But he's seven years old.
00:08:30.467,00:08:33.012,&lrm;What kind of stress &lrm;can a seven-year-old have?
00:08:33.095,00:08:36.974,&lrm;Plenty. Maybe he has &lrm;severe coping problems &lrm;about not having a father.
00:08:37.975,00:08:41.688,&lrm;You said the last time &lrm;the blackouts occurred &lrm;he was visiting his friend's dad.
00:08:43.690,00:08:50.572,"&lrm;Well, he has been pushing me &lrm;to meet his father, &lrm;-and I've been putting it off. &lrm;-It's worth a shot, Andrea."
00:08:51.238,00:08:53.115,&lrm;We can arrange a controlled meeting.
00:08:53.199,00:09:02.458,"&lrm;A careful dose of sedatives &lrm;for Jason, some security, &lrm;Evan comes in for a quick visit, &lrm;and with a little luck, &lrm;no more missing father complex."
00:09:06.838,00:09:08.881,&lrm;EVAN: &lrm;April 15th.
00:09:08.965,00:09:11.133,&lrm;Today I get to meet my father.
00:09:11.217,00:09:14.136,&lrm;His name is Jason and he's crazy.
00:09:14.220,00:09:16.180,&lrm;I hope he lets me call him Dad.
00:09:19.350,00:09:20.810,"&lrm;You mean, Dad lives here?"
00:09:20.893,00:09:23.020,"&lrm;Not in this wing, actually, no."
00:09:23.980,00:09:27.984,"&lrm;Now if your dad seems a little sleepy, &lrm;it's because of the medicine, okay?"
00:09:28.067,00:09:29.068,&lrm;Okay.
00:09:31.863,00:09:33.656,"&lrm;It'll just be a moment, okay?"
00:10:05.021,00:10:07.106,&lrm;It's okay. I won't bite.
00:10:08.816,00:10:10.943,"&lrm;-You've seen pictures of me, right? &lrm;-Uh-huh."
00:10:11.736,00:10:16.407,&lrm;Mom says I have your smile &lrm;and your hair.
00:10:17.283,00:10:21.245,&lrm;I love &lrm;-you! &lrm;-No!
00:10:22.789,00:10:25.166,&lrm;He has to die! It's the only way!
00:10:31.505,00:10:32.632,&lrm;It's gonna be okay.
00:10:32.715,00:10:34.050,&lrm;It's gonna be all right. &lrm;It's gonna be all right.
00:10:34.133,00:10:36.343,"&lrm;MAN 1: Yeah, man, he's hurt bad. &lrm;Get a stretcher."
00:10:38.345,00:10:39.639,"&lrm;MAN 2: Come on, let's get him out of here."
00:10:39.722,00:10:41.057,&lrm;ANDREA: I'm so sorry.
00:10:41.140,00:10:48.147,"&lrm;PRIEST: In sure and certain hope &lrm;of the resurrection to eternal life, &lrm;we commend to Almighty God, &lrm;our brother Jason."
00:10:48.856,00:10:58.825,"&lrm;The Lord bless him and keep him, &lrm;the Lord make his face to shine upon him, &lrm;and be gracious unto him &lrm;and give him peace. Amen."
00:11:37.696,00:11:41.533,"&lrm;TOMMY: Come on, where is it? &lrm;Damn, I know it's down here somewhere."
00:11:41.617,00:11:43.953,"&lrm;Tommy, I'm bored shitless over here. &lrm;What's up already?"
00:11:44.036,00:11:45.496,"&lrm;LENNY: Yeah, what are you &lrm;looking for, anyway?"
00:11:45.579,00:11:48.750,"&lrm;Shut up, lard ass. &lrm;And you, hold your fucking horses."
00:11:49.500,00:11:51.210,"&lrm;You know, it's here somewhere."
00:11:51.961,00:11:53.545,&lrm;We should go soon.
00:11:54.421,00:11:56.548,"&lrm;If Dad catches us smoking down here, &lrm;we're dead."
00:11:56.966,00:11:58.050,"&lrm;EVAN: So, let's go."
00:12:01.387,00:12:03.973,&lrm;I knew Dad had a blockbuster down here!
00:12:04.056,00:12:05.767,&lrm;Let's blow the shit out of something.
00:12:16.027,00:12:17.569,"&lrm;Here you go, buddy."
00:12:18.404,00:12:19.446,"&lrm;What? No friggin' way, man."
00:12:19.530,00:12:22.449,&lrm;-I'm not touching this thing. &lrm;-The hell you aren't.
00:12:22.533,00:12:24.701,&lrm;Any of us does it and you're gonna &lrm;puss out and narc for sure.
00:12:24.786,00:12:27.789,"&lrm;Ain't gonna work this time, buddy. &lrm;Look how small this fuse is."
00:12:27.872,00:12:30.082,&lrm;-I'll get killed. &lrm;-EVAN: Not necessarily.
00:12:34.336,00:12:35.671,&lrm;There you go.
00:12:35.754,00:12:37.756,&lrm;It should buy you two minutes at least.
00:12:38.757,00:12:40.092,"&lrm;Gee, thanks, friend."
00:12:49.435,00:12:51.979,"&lrm;Aw, for Christ's sake, Lenny, you moron, &lrm;just do it."
00:13:03.908,00:13:06.743,"&lrm;-Thanks. &lrm;-You got balls, man."
00:13:07.536,00:13:08.745,&lrm;Shit took you long enough.
00:13:36.983,00:13:38.234,&lrm;What the hell? Come on!
00:13:38.985,00:13:40.862,"&lrm;Evan, come on. Help me get him up!"
00:13:40.945,00:13:43.280,"&lrm;Evan, get your ass back here &lrm;and help me get him up."
00:13:43.364,00:13:44.823,&lrm;What the hell happened? Where are we?
00:13:44.907,00:13:47.034,"&lrm;KAYLEIGH: Oh, my God. What did we do?"
00:13:47.118,00:13:48.870,"&lrm;TOMMY: Evan, come on. Help me."
00:13:50.246,00:13:51.663,"&lrm;KAYLEIGH: Oh, my God, how could we?"
00:13:51.747,00:13:54.000,"&lrm;-Come on, let's go! &lrm;-Shit, Lenny, what happened to you?"
00:13:54.541,00:13:56.002,&lrm;TOMMY: He's fine. He's gonna be okay.
00:13:56.085,00:13:57.461,&lrm;Everything's gonna be fine.
00:13:58.712,00:14:00.381,&lrm;MRS. KAGAN: What's wrong with him? &lrm;Why isn't he speaking?
00:14:06.512,00:14:08.097,&lrm;ANDREA: What is it? What happened?
00:14:08.639,00:14:11.558,&lrm;We were just in the woods building a fort &lrm;when Lenny freaked out.
00:14:11.642,00:14:14.811,"&lrm;One minute he was okay, &lrm;and then he just froze up. Right, guys?"
00:14:17.689,00:14:19.942,&lrm;I don't know. I don't remember.
00:14:20.026,00:14:22.528,&lrm;Something must have happened. &lrm;Something set him off.
00:14:23.487,00:14:24.655,&lrm;I blacked it out.
00:14:25.656,00:14:27.783,&lrm;Don't try to use your blackouts &lrm;to get out of this one.
00:14:34.706,00:14:36.083,&lrm;You're not making it up?
00:14:43.840,00:14:46.969,&lrm;DR. REDFIELD: Breathe in and breathe out.
00:14:47.053,00:14:48.762,&lrm;And relax.
00:14:49.471,00:14:52.141,&lrm;You are completely asleep.
00:14:52.224,00:14:53.725,&lrm;Relaxed.
00:14:54.977,00:14:58.230,&lrm;I want you to take me to the time &lrm;you were in the woods with Lenny.
00:14:59.523,00:15:01.817,&lrm;Think of it like a movie.
00:15:01.901,00:15:07.489,"&lrm;You can pause, rewind, &lrm;or slow down any details you wish."
00:15:08.574,00:15:10.159,&lrm;Understand?
00:15:11.118,00:15:12.786,&lrm;Yes.
00:15:13.412,00:15:14.914,&lrm;DR. REDFIELD: Where are you now?
00:15:17.124,00:15:18.500,&lrm;I'm standing next to Kayleigh.
00:15:18.584,00:15:21.170,&lrm;My hands are over her ears.
00:15:21.253,00:15:23.089,&lrm;Are you hurting her?
00:15:23.172,00:15:26.175,"&lrm;No, I'm protecting her."
00:15:26.258,00:15:30.471,&lrm;Okay. Now let's move forward in time.
00:15:30.554,00:15:32.181,&lrm;What do you see?
00:15:35.684,00:15:37.228,&lrm;I see a car.
00:15:45.277,00:15:47.196,&lrm;Nothing can hurt you.
00:15:48.990,00:15:52.576,"&lrm;Remember, it's only a movie. &lrm;You are completely safe."
00:15:53.494,00:15:55.662,&lrm;I can't...
00:15:55.746,00:15:59.125,&lrm;The car vanishes and all of a sudden &lrm;I'm on the ground in the woods.
00:15:59.625,00:16:01.168,"&lrm;The car doesn't vanish, Evan."
00:16:01.961,00:16:04.213,"&lrm;The movie in your head is broken, &lrm;that's all."
00:16:04.296,00:16:06.340,&lrm;Now tell me about the car.
00:16:06.423,00:16:07.883,&lrm;I can't!
00:16:10.636,00:16:12.638,"&lrm;DR. REDFIELD: Fight it, Evan, hurry."
00:16:14.681,00:16:19.520,"&lrm;-ANDREA: Oh, my God! &lrm;-On the count of 10, &lrm;you're going to wake up &lrm;feeling refreshed..."
00:16:20.812,00:16:22.231,&lrm;...and remembering everything &lrm;that we talked about.
00:16:22.314,00:16:23.607,&lrm;What is happening to him? Make it stop!
00:16:23.690,00:16:25.359,"&lrm;-One, you're feeling awake. &lrm;-Come on. Wake up."
00:16:25.442,00:16:27.486,"&lrm;Two, your eyes are not feeling as heavy."
00:16:27.569,00:16:28.904,"&lrm;-Five, six. &lrm;-Wake up!"
00:16:28.988,00:16:31.907,"&lrm;-Come on, Evan, wake up! Nine, 10. &lrm;-ANDREA: Wake him up!"
00:16:33.825,00:16:35.202,"&lrm;Oh, God."
00:16:39.248,00:16:40.332,&lrm;What happened?
00:16:41.125,00:16:42.126,&lrm;Did it work?
00:16:49.925,00:16:52.344,"&lrm;EVAN: All right, thanks, Mom. &lrm;See you later."
00:17:00.977,00:17:04.356,&lrm;Wipe that sad-ass look off your face &lrm;before you get us busted.
00:17:04.440,00:17:06.942,&lrm;Did you see the way &lrm;Evan's mom was looking at you?
00:17:07.026,00:17:08.319,&lrm;Sorry.
00:17:12.531,00:17:16.243,"&lrm;All right, will someone tell me already &lrm;what the hell happened with the mailbox?"
00:17:19.038,00:17:20.872,&lrm;Don't you ever bring that shit up again.
00:17:21.582,00:17:23.042,&lrm;Not ever!
00:17:29.215,00:17:30.716,&lrm;Let's go.
00:17:34.136,00:17:35.471,&lrm;Are you okay?
00:17:49.901,00:17:51.362,&lrm;Holy shit!
00:17:51.445,00:17:53.364,&lrm;Look at that fat fuck!
00:17:53.447,00:17:55.574,&lrm;He's got bigger titties than Lenny's mom.
00:17:55.782,00:17:56.783,&lrm;Shh!
00:17:56.908,00:17:58.577,"&lrm;Shut up, faggot."
00:17:58.660,00:17:59.828,&lrm;No one's talking to you.
00:18:24.978,00:18:27.356,"&lrm;I'm sorry, Kayleigh, this was a bad idea."
00:18:28.107,00:18:30.276,&lrm;You really don't remember &lrm;anything that happened?
00:18:32.611,00:18:34.029,&lrm;You're so lucky.
00:18:34.113,00:18:35.864,"&lrm;Look, everything's gonna be okay."
00:18:35.947,00:18:37.824,&lrm;Lenny'll be fine. You'll see.
00:18:40.536,00:18:41.995,&lrm;Sorry.
00:18:42.078,00:18:46.375,&lrm;It's not your fault. Mrs. Kagan called Dad &lrm;and blamed us for what happened to Lenny.
00:18:47.251,00:18:48.502,&lrm;Your dad did that?
00:18:49.378,00:18:52.381,&lrm;-I deserve a lot worse. &lrm;-What are you talking about?
00:18:52.464,00:18:54.383,&lrm;What you deserve is &lrm;a better father and brother.
00:18:54.466,00:18:56.885,&lrm;All they do is make you feel like shit.
00:19:00.556,00:19:02.849,"&lrm;You really have no clue &lrm;how beautiful you are, do you?"
00:19:14.069,00:19:15.737,&lrm;What the fuck are you doing?
00:19:15.821,00:19:18.907,&lrm;BOY: Buying popcorn. &lrm;What the fuck are you doing?
00:19:20.284,00:19:21.910,&lrm;GIRL: I can't believe &lrm;you freaking did that.
00:19:21.993,00:19:24.913,&lrm;-BOY: He's a little punk. &lrm;-GIRL: Why do you have to be such a dick?
00:19:24.996,00:19:26.665,&lrm;BOY: Who the fuck cares?
00:19:30.669,00:19:32.421,&lrm;GIRL: I can't believe you just did that.
00:19:37.718,00:19:38.885,&lrm;Stop it!
00:19:39.345,00:19:40.679,&lrm;Stop hitting him.
00:19:41.388,00:19:43.098,&lrm;What's wrong with you?
00:19:45.226,00:19:47.102,"&lrm;GIRL: Somebody, please help us."
00:19:47.186,00:19:49.855,"&lrm;All right, that's it, kid. &lrm;You're out of here."
00:19:53.525,00:19:55.819,&lrm;GIRL: Get him away!
00:19:55.902,00:19:57.446,&lrm;Get him away!
00:19:58.113,00:20:05.120,"&lrm;Now in another story, &lrm;the peaceful town of Briarville &lrm;was rocked this afternoon &lrm;in the wake of a horrible act &lrm;of vandalism."
00:20:05.204,00:20:14.255,"&lrm;While police officials &lrm;in upstate New York believe &lrm;this was a simple act &lrm;of criminal mischief gone awry, &lrm;the tragedy has clearly &lrm;devastated the community."
00:20:14.338,00:20:20.969,&lrm;Now this was the grisly aftermath &lrm;of a powerful explosion &lrm;believed to have been caused &lrm;by an unknown quantity of dynamite.
00:20:21.720,00:20:25.098,"&lrm;The police have no leads, &lrm;no suspects and no motive..."
00:20:43.284,00:20:44.576,&lrm;Good night.
00:20:54.878,00:20:56.255,&lrm;We're moving.
00:21:14.440,00:21:17.108,&lrm;I can't believe &lrm;Tommy's still pissed at me.
00:21:17.192,00:21:19.528,"&lrm;He knows I'm moving away, right?"
00:21:19.611,00:21:21.530,&lrm;He's been acting real strange lately.
00:21:21.613,00:21:23.782,&lrm;He won't even look me in the eyes anymore.
00:21:25.116,00:21:26.159,"&lrm;Duck, here they come!"
00:21:32.207,00:21:34.835,&lrm;Did your mom say if Lenny was okay?
00:21:36.837,00:21:39.881,"&lrm;He must be. &lrm;I mean, they're letting him out, right?"
00:22:04.573,00:22:05.574,&lrm;EVAN: Welcome home.
00:22:05.657,00:22:07.493,&lrm;I thought you might like &lrm;some fresh air for a change.
00:22:08.410,00:22:12.331,&lrm;-Is Tommy with you guys? &lrm;-No. It's cool.
00:22:22.674,00:22:24.926,"&lrm;KAYLEIGH: So, what'd you do in there?"
00:22:25.010,00:22:29.806,&lrm;It was awful. You can't sleep &lrm;because everybody's screaming &lrm;all night long.
00:22:30.891,00:22:33.226,&lrm;I never want to go back.
00:22:33.309,00:22:34.561,&lrm;Do you see that?
00:22:34.645,00:22:36.438,"&lrm;EVAN: Yeah, what's up with the smoke?"
00:23:00.045,00:23:01.087,&lrm;Crockett!
00:23:01.672,00:23:03.048,&lrm;What are you doing with my dog?
00:23:08.970,00:23:11.432,&lrm;-Look what you made me do! &lrm;-What the hell's wrong with you?
00:23:26.404,00:23:29.616,"&lrm;Kayleigh. Oh, God, &lrm;come on, please wake up."
00:23:29.700,00:23:31.952,"&lrm;Wake up, please! Wake up!"
00:23:32.703,00:23:35.038,"&lrm;Why don't you fucking kiss her, &lrm;Prince Charming?"
00:23:51.262,00:23:52.598,&lrm;How long was I out?
00:23:55.934,00:23:57.519,"&lrm;Kayleigh, what's wrong?"
00:24:56.119,00:24:57.495,&lrm;I'm sorry.
00:25:26.274,00:25:27.275,&lrm;STUDENT: Aced it.
00:25:27.358,00:25:33.740,&lrm;And time. Put your pencils down &lrm;and place your blue books &lrm;on my desk before you leave.
00:25:33.824,00:25:36.785,"&lrm;You too, Mr. Nelson. &lrm;We're all in the same time zone here."
00:25:36.868,00:25:39.412,"&lrm;-NELSON: Fuck you. &lrm;-So, how'd you do, Evan?"
00:25:39.495,00:25:43.041,&lrm;I don't know. I might have got &lrm;some of the stories mixed up.
00:25:43.124,00:25:45.752,&lrm;Was it Pavlov that conditioned his dog &lrm;to lick his nuts?
00:25:47.879,00:25:50.173,"&lrm;Typical psych major, a complete wise-ass."
00:25:51.049,00:25:52.383,&lrm;And how's your project coming?
00:25:52.467,00:25:56.554,&lrm;Are you still planning to change the way &lrm;we humble scientists &lrm;view memory assimilation?
00:25:57.097,00:25:58.556,&lrm;Don't really have a choice.
00:26:28.169,00:26:31.131,"&lrm;Oh, jeez, it smells like &lrm;patchouli and ass in here."
00:26:31.214,00:26:34.509,"&lrm;Cricket, this is my &lrm;well-mannered roommate Evan."
00:26:34.592,00:26:35.761,&lrm;Yeah.
00:26:37.095,00:26:40.348,&lrm;You're the one &lrm;that fucked up the bell curve &lrm;on my anthropology final.
00:26:40.431,00:26:42.433,"&lrm;-Later, Thumper. &lrm;-Bye."
00:26:42.517,00:26:43.894,&lrm;CRICKET: Fucking dick.
00:26:45.311,00:26:47.522,"&lrm;-Wow, sweet girl, man. &lrm;-I found your shirt, bro."
00:26:52.235,00:26:55.781,"&lrm;All right, man, get dressed. &lrm;You're taking me out."
00:26:55.864,00:26:58.574,"&lrm;Why, what'd you do, ace another midterm?"
00:26:58.659,00:26:59.743,&lrm;No.
00:27:02.287,00:27:05.123,"&lrm;Better than that, &lrm;seven years, no blackouts."
00:27:05.957,00:27:08.669,"&lrm;-Fuck yeah, bro', let's do this! Come on. &lrm;-Oh, yeah."
00:27:09.460,00:27:11.713,&lrm;-Yeah? &lrm;-Come and get it. Be gentle with me!
00:27:11.797,00:27:14.090,&lrm;Be gentle! I'm postcoital. &lrm;I'm tender. There's chafing.
00:27:14.174,00:27:16.176,&lrm;Did she cradle the balls &lrm;and work the shaft? Did she?
00:27:21.514,00:27:22.557,&lrm;Nice.
00:27:25.101,00:27:26.102,&lrm;Look at this fucking guy.
00:27:28.313,00:27:29.815,&lrm;Get the fuck out of my bar.
00:27:29.898,00:27:32.067,"&lrm;So, which one of you has the pet worm?"
00:27:32.984,00:27:35.028,"&lrm;Worms, plural!"
00:27:35.278,00:27:37.781,&lrm;Ah. That's so gross.
00:27:38.699,00:27:41.034,&lrm;Talk to him about it. He's got the fetish.
00:27:41.659,00:27:43.912,&lrm;Watch it. It's a psych project actually.
00:27:43.995,00:27:46.247,&lrm;It's a study on memory loss.
00:27:46.331,00:27:49.084,&lrm;Better explain before all this &lrm;excitement gives me a heart attack.
00:27:51.878,00:27:53.671,&lrm;10 bucks says he eats it off the floor.
00:27:54.756,00:28:05.350,"&lrm;Well, if I can figure out &lrm;how the memories &lrm;of a simple worm function, &lrm;it should help me to understand &lrm;the complexities &lrm;of the human brain."
00:28:07.518,00:28:08.854,&lrm;THUMPER: Let me get this shot.
00:28:16.527,00:28:18.071,"&lrm;-What the fuck, weirdo? &lrm;-Fuck this!"
00:28:32.543,00:28:34.504,&lrm;MAN 1: What have you got there?
00:28:37.340,00:28:39.550,"&lrm;MAN 3: No, no!"
00:28:41.302,00:28:43.263,&lrm;It smells like sex in here.
00:28:44.806,00:28:46.557,&lrm;guess Thumper had a busy afternoon.
00:28:48.143,00:28:50.686,&lrm;You're kidding? He's so big.
00:28:51.938,00:28:53.064,&lrm;Yeah?
00:28:53.148,00:28:56.902,"&lrm;Well, I guess charisma &lrm;and eyeliner go a long way."
00:28:58.528,00:29:00.530,&lrm;-You want a beer? &lrm;-Yeah.
00:29:03.574,00:29:06.619,&lrm;You got any incense &lrm;or scented candles or something?
00:29:06.702,00:29:07.913,&lrm;EVAN: Okay.
00:29:10.123,00:29:12.667,"&lrm;Whoa, no."
00:29:13.584,00:29:15.503,&lrm;Let me put this away.
00:29:15.586,00:29:17.964,&lrm;Most guys usually &lrm;tuck porn under their bed.
00:29:18.048,00:29:19.966,&lrm;All you've got are comp books?
00:29:20.050,00:29:21.592,"&lrm;Yeah, they're my journals."
00:29:21.676,00:29:24.095,&lrm;I've been keeping them since I was seven.
00:29:24.220,00:29:26.347,&lrm;Wow. Hmm.
00:29:31.352,00:29:33.188,&lrm;I ought to be getting &lrm;something out of this.
00:29:39.778,00:29:42.948,&lrm;It's like my mind refuses &lrm;to believe what I'm seeing.
00:29:48.494,00:29:52.373,&lrm;Hearing Crockett &lrm;make those awful screams.
00:29:57.753,00:30:01.424,"&lrm;Uh, J... Just writing about it &lrm;gives me the shivers."
00:30:03.634,00:30:05.971,&lrm;Come on. Go on.
00:30:10.266,00:30:14.187,&lrm;It was like Tommy &lrm;was possessed or something.
00:30:15.563,00:30:18.108,&lrm;There was a hate in his eyes that...
00:30:24.655,00:30:25.824,&lrm;Are you okay?
00:30:33.331,00:30:34.374,&lrm;EVAN: Where am I?
00:30:36.501,00:30:38.169,&lrm;What the hell's going on?
00:30:49.514,00:30:51.224,&lrm;I can't get it open!
00:30:51.307,00:30:52.767,&lrm;Drop it.
00:30:52.851,00:30:55.311,&lrm;Or I'll slit your mother's throat &lrm;in her sleep.
00:31:10.826,00:31:12.828,"&lrm;Listen to me, Evan, &lrm;and you listen to me good."
00:31:12.913,00:31:16.374,"&lrm;There's a million &lrm;other sisters in the world, &lrm;so why'd you have to fuck with mine?"
00:31:22.005,00:31:24.007,&lrm;It's okay. It was just a dream.
00:31:26.009,00:31:27.010,&lrm;Uh-uh.
00:31:27.677,00:31:31.097,&lrm;-It didn't feel like a dream. &lrm;-Maybe because they never do.
00:31:32.848,00:31:35.560,"&lrm;So, Don Juan, &lrm;you pass out on all your dates?"
00:32:12.138,00:32:13.139,&lrm;WOMAN: Lenny...
00:32:13.223,00:32:15.141,"&lrm;Hey, I've got a surprise for you."
00:32:15.225,00:32:17.227,&lrm;You're never gonna guess who's here.
00:32:17.310,00:32:20.271,"&lrm;Hey, it's me. Evan."
00:32:56.891,00:32:59.477,&lrm;What are you working on there? A model?
00:33:02.730,00:33:04.274,"&lrm;Look, uh..."
00:33:04.357,00:33:07.652,"&lrm;I can see that you're busy, &lrm;so I'll try to make this quick."
00:33:08.694,00:33:10.155,"&lrm;Remember, uh..."
00:33:11.322,00:33:13.992,&lrm;That day at the junkyard &lrm;when we were kids?
00:33:15.910,00:33:18.579,"&lrm;Well, I was just hoping &lrm;that you could help me remember."
00:33:21.749,00:33:25.503,"&lrm;Like, just any details about it or..."
00:33:31.509,00:33:32.635,&lrm;Yeah.
00:33:33.553,00:33:35.388,&lrm;That's good. Um...
00:33:37.348,00:33:38.433,&lrm;Anything else?
