start,end,script
00:00:46.546,00:00:49.340,and a true American.
00:00:49.883,00:00:58.600,"The people's hero, Randy The Ram Robinson!"
00:01:02.562,00:01:04.647,throwing haymakers and a pile driver!
00:01:08.151,00:01:09.819,Randy The Ram Robinson.
00:01:11.988,00:01:14.282,They want to see the Ram Jam!
00:01:33.593,00:01:35.845,set to do battle with the Ayatollah.
00:01:38.389,00:01:41.476,what this can do to motivate Randy The Ram Robinson.
00:02:03.957,00:02:07.836,He is punishing the Ram. My goodness. How much can this man take?
00:02:10.922,00:02:18.263,The Ram right where we have seen him so many times before playing right to this sold-out Madison Square Garden.
00:02:18.346,00:02:21.808,The horns are out. Here it comes. Ram Jam! My goodness!
00:02:21.891,00:02:23.810,"One, two, three!"
00:02:26.229,00:02:31.860,"April 6, 1989 This will forever go down in professional wrestling history."
00:02:37.824,00:02:38.992,Oh.
00:02:53.756,00:02:55.216,You really put them over.
00:03:01.055,00:03:02.140,Here you go.
00:03:07.812,00:03:09.814,Sorry. I was sure the gate will be bigger.
00:03:11.566,00:03:15.069,"But don't forget, two months. Rahway. Legend signing."
00:03:15.153,00:03:16.279,"I need you, man."
00:03:34.964,00:03:37.634,"Think you could, uh, sign this for me?"
00:03:37.717,00:03:39.219,"-Sure. -Thanks a lot, man."
00:03:43.014,00:03:44.307,"-Thanks a lot. -Oh, yeah."
00:03:44.390,00:03:46.351,-1985. -That was a good one.
00:03:46.434,00:03:48.770,Yeah. You were awesome.
00:03:49.729,00:03:52.148,"-Appreciate it, bro. There you go. -Thanks. Thanks, Ram."
00:03:54.192,00:03:55.401,"Nice guy, don't you think?"
00:04:49.622,00:04:50.707,Oh.
00:04:55.253,00:04:56.879,"Oh, shit."
00:05:23.906,00:05:24.866,Lenny.
00:05:30.246,00:05:31.247,Lenny.
00:05:34.500,00:05:37.003,"Come on, Lenny. Open up."
00:05:40.798,00:05:42.133,"Goddamn it, Lenny."
00:05:42.633,00:05:43.718,Fuck.
00:06:08.618,00:06:09.702,Fuck.
00:07:24.986,00:07:26.154,Ram!
00:07:26.237,00:07:28.448,-Ram! -Wake up! Ram!
00:07:28.531,00:07:30.783,-Ram! -Come on! Ram! Wake up!
00:07:30.867,00:07:32.994,-Open up! -Ram!
00:07:33.077,00:07:35.955,-Wake up! -Wake up! Wake up!
00:07:36.038,00:07:37.498,-Ram! -Wake up!
00:07:39.834,00:07:40.835,Who woke me up?
00:07:44.213,00:07:45.423,Choke slam!
00:07:53.097,00:07:54.724,One more!
00:07:54.807,00:07:56.350,"Come on, Ram!"
00:07:58.227,00:08:00.313,I'll see you maniacs in a little while.
00:08:09.822,00:08:11.407,"Lenny, why are you doing this to me?"
00:08:13.326,00:08:15.745,"Aw, come on, Lenny. You know I'm always good for it."
00:08:15.828,00:08:18.539,"Yeah, you're always good for it every time this happens."
00:08:18.623,00:08:21.459,"Come on, brother. My back went out. Let me just at least get my ice packs."
00:08:21.542,00:08:23.794,"-I cannot help you. -Come on, man."
00:08:25.379,00:08:27.048,"Oh, God."
00:08:35.223,00:08:36.557,"Rafael, come here."
00:08:37.475,00:08:38.768,"Hey, Rafael!"
00:08:49.237,00:08:51.656,"Well, I was wondering if you could throw me some more hours."
00:08:52.532,00:08:54.617,What's the matter? Did they raise the price of tights?
00:08:55.201,00:08:57.453,Wow. Funny.
00:08:59.205,00:09:00.331,Let's see what we got.
00:09:00.414,00:09:02.458,Weekdays. I'm busy on the weekends.
00:09:42.665,00:09:45.042,Whoa. Hey. Hey.
00:09:45.126,00:09:46.502,"-You know the boys. -What's up, Ram?"
00:09:46.586,00:09:48.337,-Hey. What's up? -Good to see you.
00:09:48.421,00:09:51.215,"-You're all diesel, man. -How you doing, brother?"
00:09:51.299,00:09:54.677,"-Good to see you, man. -Okay. Right here, you can change."
00:09:55.303,00:09:57.471,"-All right, man. -I want my money."
00:09:57.555,00:09:58.889,There you go.
00:10:00.474,00:10:01.601,"All right, guys. Listen up."
00:10:02.685,00:10:04.270,"All right. S.L.G., where are you?"
00:10:04.353,00:10:06.647,-You're up first against T.D.S. -Thank you.
00:10:06.731,00:10:10.067,"Second, we got Havoc and Cobian versus Billy the Kid and Lex Lethal."
00:10:10.151,00:10:12.987,"-Yo, I got you tonight. -Third, Sabian versus Devon Moore."
00:10:13.070,00:10:16.949,"Fourth, Judas the Traitor versus Rob Eckos. Intermission."
00:10:17.033,00:10:19.368,"Fifth, Kevin Matthews versus Inferno."
00:10:19.452,00:10:23.414,"Sixth, we got Sugga and DJ Hyde versus the Funky Samoans."
00:10:23.497,00:10:27.460,"Seventh, Paul E. Normous and Andy Anderson versus Jim Powers and Papadon."
00:10:27.543,00:10:32.131,"And last but not least, for the strap, we got Tommy Rotten versus Randy the Ram."
00:10:32.214,00:10:33.382,All right. You guys got it?
00:10:33.466,00:10:34.842,-Yep. -Got it.
00:10:34.925,00:10:37.011,All right. Let's do this. Have a good time.
00:10:54.403,00:10:56.197,"Hey, there. How you doing, man?"
00:10:56.280,00:10:59.241,Hey. Tommy. We're gonna be working tonight.
00:10:59.325,00:11:02.703,"I know you, Tommy. I saw you out in, uh, Pennsylvania a couple months ago."
00:11:02.787,00:11:03.621,Allentown.
00:11:03.704,00:11:05.373,You were really good. You really brought it.
00:11:05.456,00:11:07.291,"-Thank you. Thank you. -Keep working, man."
00:11:07.375,00:11:12.129,"You know, people who drive the Cadillacs, the ones with the politics, they run the show."
00:11:12.213,00:11:14.131,"It ain't about ability, so you just hang in there."
00:11:14.215,00:11:15.633,"Yeah, I know, I know."
00:11:15.716,00:11:19.595,"-All right. -But, uh, as far as tonight, I don't know what you wanna do."
00:11:20.096,00:11:25.518,"I had a few ideas. I was thinking, you know, maybe just for the heat, I would give you a low blow, follow it up with a bulldog."
00:11:25.601,00:11:26.894,"Just bring the cheap heat, bro."
00:11:26.977,00:11:29.063,You guys should get the heat on us right away.
00:11:29.146,00:11:32.149,"Keep the heat on us, beat the shit out of us. Boom, boom, boom, boom."
00:11:32.233,00:11:34.151,"We'll come up, we'll get on the ropes."
00:11:34.235,00:11:36.237,-You guys bring us both in the hard way. -Okay.
00:11:36.320,00:11:38.864,"Then we get up, double dropkick, we powder out again."
00:11:38.948,00:11:40.950,All right. So we're gonna really milk it tonight.
00:11:41.033,00:11:43.494,"We're gonna milk it. Nice and slow, old-school, easy."
00:11:43.577,00:11:45.996,"Don't work his leg, man. That's, everybody does that."
00:11:46.080,00:11:48.874,"-Work his neck. Work his neck. -No, no. We working the neck."
00:11:48.958,00:11:50.835,-You're working the neck? -I already got the leg.
00:11:50.918,00:11:53.421,-All right. You guys got the leg? -Leg or neck. What you got?
00:11:53.504,00:11:55.339,Maybe make your comeback right off there.
00:11:55.423,00:11:58.968,"Bang off the ropes then super kick and, uh, Ram Jam."
00:11:59.051,00:12:01.762,"-And we go have a beer, okay? -That sounds great, man."
00:12:01.846,00:12:03.973,You hang in there. You got a lot of ability.
00:12:04.056,00:12:05.516,-All right. All right. -Okay?
00:12:05.599,00:12:06.559,-Right. -Thank you.
00:12:06.642,00:12:07.768,Bless you.
00:12:57.651,00:13:01.113,"Yeah! Come on, Ram! You're the man!"
00:13:37.775,00:13:39.026,"You all right, Ram?"
00:13:39.109,00:13:40.653,"Ram, you all right?"
00:14:53.809,00:14:55.853,"Come here, you fat piece of crap!"
00:14:56.687,00:14:59.064,Get out there with the rest of the party!
00:15:02.359,00:15:06.280,"I'm coming out there, and I'll beat the hell out of each and every one of you!"
00:15:10.034,00:15:13.704,You know who you're dealing with? I will destroy you people!
00:15:13.787,00:15:17.291,"Shut the hell up! That's it, old man!"
00:15:50.407,00:15:51.617,Huh?
00:16:33.242,00:16:37.496,Randy The Ram Robinson!
00:16:50.134,00:16:52.052,"-I'm just gonna glue this up, okay? -Yep."
00:16:54.179,00:16:55.347,Come on in.
00:16:58.392,00:16:59.560,You realize what's coming up?
00:17:02.855,00:17:05.566,Twentieth anniversary of you and Ayatollah at the Garden.
00:17:05.649,00:17:08.360,-I know. Hey. Mm-hmm. -Yeah.
00:17:08.444,00:17:10.571,"-Long time ago. -Time fucking flies, right?"
00:17:10.654,00:17:15.743,Here's what I'm thinkin' Two words. Re. Match.
00:17:17.870,00:17:21.206,We're doing this big Fanfest thing down in Wilmington with Ring of Honor that weekend.
00:17:21.290,00:17:23.876,I wanna main event it with you two guys.
00:17:24.376,00:17:26.754,"Ram, Ayatollah II."
00:17:27.629,00:17:31.050,Hey. I heard Bob was doing really good with his used car lot out in Arizona.
00:17:31.133,00:17:33.719,"-I don't know if he's gonna, you know. -Come on. For this?"
00:17:34.344,00:17:36.055,Bob's gonna dust off the old turban.
00:17:36.638,00:17:38.098,-Yeah? -Yeah.
00:17:38.182,00:17:40.559,"-Hey, bring it. -Okay."
00:17:46.440,00:17:48.692,-That's for Ram! -Ram!
00:17:49.276,00:17:52.488,-Good stuff. Good stuff. -Good stuff. Just like the old days.
00:17:54.823,00:17:56.992,"Come on, guys. Let's all go take a shower together."
00:17:57.576,00:17:59.286,"What's up, Ram? How you doing?"
00:17:59.369,00:18:01.538,"-What's up, Big Chris? What's shaking? -I'm all right."
00:18:01.622,00:18:04.625,"Yo, baby, you still got that hookup with that quack at your gym?"
00:18:04.708,00:18:06.043,-The juice head? -What do you need?
00:18:06.126,00:18:07.294,"Yo, my back is killing me."
00:18:07.377,00:18:09.004,"Vicodin, Perc, Nubain, whatever he's got."
00:18:09.088,00:18:11.465,"Come by the mansion in a couple of days, I'll hook you up."
00:18:11.548,00:18:14.051,"You the man, Ram. You the man."
00:18:28.732,00:18:34.696,"-Hey, Ruby. How you doing, baby? -Hey, Ram. How's it goin' -Ugh. I'll take a cold one. -All right."
00:18:37.783,00:18:38.951,There you go.
00:18:39.952,00:18:43.122,-Cassidy around? -I think she's working the V.I.P.
00:18:44.581,00:18:45.582,Huh.
00:18:48.794,00:18:49.837,Thank you.
00:19:13.152,00:19:15.696,"Trust me, baby. You're gonna be so happy."
00:19:20.701,00:19:22.703,"Well, yeah, but she's on break."
00:19:28.041,00:19:30.335,Hey. There's nothing like experience.
00:19:30.419,00:19:33.380,I do things your fiancée's never even dreamed of doing.
00:19:42.014,00:19:43.390,Don't talk to the lady like that.
00:19:43.473,00:19:45.100,I'll talk to her like I wanna talk to her.
00:19:47.394,00:19:50.439,"It's cool. I got it. It's all right, guys."
00:19:50.522,00:19:52.274,No. Let me tell you something.
00:19:52.357,00:19:58.238,"I guarantee you, this lady's a hundred times hotter than any skank-ass pussy you're gonna be marrying."
00:19:58.322,00:19:59.948,What the fuck? That's my fucking sister.
00:20:00.032,00:20:02.534,"Oh, oh, oh, oh, oh!"
00:20:02.618,00:20:05.120,Are you fucking kidding me? Are you kidding me?
00:20:05.204,00:20:06.872,-Fucker. -See you soon.
00:20:08.332,00:20:10.500,200 fuckin' bucks walked out.
00:20:10.584,00:20:12.252,"Hey, I'm just trying to help."
00:20:12.336,00:20:13.629,"Oh, come on. They were punks."
00:20:17.299,00:20:18.425,I'm sorry.
00:20:18.926,00:20:20.344,I'm better-looking than them anyway.
00:20:21.845,00:20:24.181,I didn't mean to piss you off. Come on.
00:20:27.100,00:20:30.020,"-It's good to see you, Ram. -Good to see you. Goddamn."
00:20:30.103,00:20:32.147,I haven't seen you in a while. How you been?
00:20:32.648,00:20:36.026,"Now, I'm telling you, it was one of the historic matches in history."
00:20:36.693,00:20:38.195,"It was 20,000 people."
00:20:38.737,00:20:41.907,Another million and a half sitting at home watching it on pay-per-view.
00:20:42.407,00:20:44.618,We're slamming the piss out of each other.
00:20:44.701,00:20:47.704,"I mean, for God knows how long. We're both gassing."
00:20:48.497,00:20:51.375,"You ask any wrestling fan, they've heard about that one."
00:20:51.458,00:20:53.835,"-Million and a half. Shit. -Oh, yeah, it was big."
00:20:53.919,00:20:56.588,And a rematch? Hey. This could be history all over again.
00:20:58.548,00:21:01.760,"Goddamn, look at you. You are one smoking baby."
00:21:02.761,00:21:04.638,Let me make an honest woman out of you.
00:21:04.721,00:21:05.931,Hmm?
00:21:06.014,00:21:08.225,"I mean, who knows? I'm in pretty good shape right now."
00:21:08.725,00:21:11.728,"You know, with a little luck, this could be my ticket back on top."
00:21:11.812,00:21:15.482,-You never know who's in that crowd. -Yeah. Yeah.
00:21:15.983,00:21:17.567,That would be a dream.
00:21:19.278,00:21:21.446,"Oh, Jesus. You're bleeding."
00:21:22.030,00:21:24.533,"-Oh! -Yeah, I got cut tonight."
00:21:26.910,00:21:31.832,"-Are you okay? -Yeah, it's nothin' -They say wrestling's fake, huh? -Fake? I'll show you fake."
00:21:31.915,00:21:34.376,"Look at this. 1986, Denver Coliseum."
00:21:34.459,00:21:36.920,Billy Bob Banjo hit me with a two-by-four.
00:21:37.004,00:21:40.382,"It had a loose nail in it, split my bicep right the hell open."
00:21:40.465,00:21:42.509,Look at that. I got a better one than that.
00:21:43.010,00:21:44.177,Take a look at this here.
00:21:44.845,00:21:48.598,"1988, okay? Orlando Civic Center."
00:21:49.099,00:21:51.643,Mr. Magnificent threw me over the top ropes.
00:21:51.727,00:21:55.022,I landed on my shoulder and cracked my clavicle right in half.
00:21:55.105,00:21:57.399,"Oh, my Gosh. Does it hurt?"
00:21:57.482,00:22:03.238,"Well, it hurts when I breathe but, I mean, you know, you hear the roar of the crowd, you just, you motor through, you know?"
00:22:05.115,00:22:07.034,He was pierced for our transgressions.
00:22:07.117,00:22:09.161,He was crushed for our iniquities.
00:22:09.244,00:22:17.461,The punishment that brought us peace was upon him and by his wounds we were healed.  Hmm. What was that all about?
00:22:18.045,00:22:20.964,It's The Passion of the Christ. You have the same hair.
00:22:21.048,00:22:23.550,-You never seen it? -No.
00:22:23.633,00:22:26.178,"Dude, you gotta! It's, It's amazing."
00:22:26.261,00:22:29.014,"They throw everything at him. Whips, arrows, rocks."
00:22:29.514,00:22:31.683,They beat the living fuck out of him the whole two hours.
00:22:32.309,00:22:33.935,And he just takes it.
00:22:39.274,00:22:40.734,Sacrificial Ram.
00:22:44.654,00:22:46.698,-Aw. -with Harmony on the small stage.
00:22:46.782,00:22:48.492,"Aw, fuck."
00:22:50.243,00:22:52.454,-Gotta go. -Where you going?
00:23:04.007,00:23:05.175,Goddamn.
00:23:28.490,00:23:31.076,"Bottle of Anadrol, 250. Bottle of E.Q., 75 bucks."
00:23:31.159,00:23:33.411,"Two bottles of tren, $75 each-a buck, 50."
00:23:33.495,00:23:36.081,"Bottle of insulin, 100 bucks. You got four boxes of Sustanon."
00:23:36.164,00:23:39.126,"There's three amps in a box, $30 on a box-a buck, 20."
00:23:39.209,00:23:40.293,"A bottle of DBOL, 100 bucks."
00:23:40.377,00:23:42.796,"For your bitch tits, I got you a bottle of Arimidex, 200 bucks."
00:23:42.879,00:23:46.216,"All together, 995. I know you only got 400. Give me the 400."
00:23:46.299,00:23:48.885,-I know you're good for the rest. -Got any G.H.?
00:23:49.469,00:23:51.054,Got Chinese and I got Serostim.
00:23:52.055,00:23:53.723,I don't want any of that Chinese stuff.
00:23:56.101,00:23:57.644,"You're my boy, Ram."
00:23:58.395,00:24:00.772,"-I'll hook you up, all right? -Okay."
00:24:01.898,00:24:03.942,You gotta take the bacteriostatic water with it too.
00:24:04.025,00:24:06.945,It makes the growth last longer. Need anything else?
00:24:07.028,00:24:09.948,Painkillers? Vics? Percs?
00:24:10.949,00:24:12.868,"-No, bro. I'm tapped. -Demerol?"
00:24:12.951,00:24:15.745,"-OxyContins? You sure? -No, this'll do me."
00:24:15.829,00:24:19.040,-Viagra? Maybe some blow? -No.
00:24:19.124,00:24:20.834,"Got it all, man. Whatever you need, you know."
00:24:20.917,00:24:22.252,"Open up a pharmacy, brother."
00:24:23.628,00:24:26.089,"-You're my man. I gotta look out for you. -Yeah, I'm square."
00:24:26.173,00:24:28.258,"Just need the juice, and you're all right, then, right?"
00:24:28.341,00:24:30.927,"-I'm just gonna get big and strong. -Yes, you are, my friend."
00:24:31.011,00:24:32.929,"-Okay. -All right? Anytime, man."
00:24:33.013,00:24:35.348,"-You're looking good, brother. -I'm trying, baby. I'm trying."
00:24:35.432,00:24:38.685,"-Show me what you got there. -Ah, come on, man. Come on."
00:24:38.768,00:24:41.188,"Just a little something. There's not much there, baby. Come on."
00:24:41.271,00:24:43.732,Bring it up. Bring it up. Look at that motherfucker.
00:25:15.180,00:25:17.807,"Okay, right up there. See? What you're doing right there."
00:25:17.891,00:25:21.478,"Don't leave the foils on too long, because last time they broke off."
00:25:21.561,00:25:23.313,I think they got too fried.
00:25:25.065,00:25:27.108,Yeah. I got it.
00:25:27.901,00:25:30.403,"So, how's the old man doing these days?"
00:25:33.031,00:25:35.242,"-Work, work, work. -Work, work, work. Well, hey."
00:25:35.325,00:25:38.536,"Hmm. At least he's got a job, right?"
00:26:17.284,00:26:19.494,"-Thanks again for the lift, bro. -You got it."
00:26:20.036,00:26:22.080,"Here you go. Lay it on, brother. Lay it on."
00:26:22.163,00:26:24.457,-Like-Like- -There you go.
00:26:26.793,00:26:29.838,-Ooh. -All right. Good.
00:26:29.921,00:26:32.841,-Where's the bug spray in here? Huh? -Lane six on the right side.
00:26:32.924,00:26:34.884,"-The right side, bottom. -Right side, bug spray."
00:26:39.639,00:26:40.974,-Hmm? -Go ahead. Once more.
00:26:42.809,00:26:44.686,"-Now give it to me, brother. -All right, man."
00:26:46.521,00:26:50.150,Fuck. Come on. Let's - Couple mousetraps?
00:26:50.233,00:26:52.027,"Load 'em and set 'em in the ring, body slam."
00:26:52.110,00:26:53.528,Hmm. Let's do it.
00:26:56.197,00:26:57.407,"What's going on, my man?"
00:26:57.490,00:26:59.659,"Tell me, what do you think? What do you think about this?"
00:26:59.743,00:27:00.577,Huh?
00:27:04.372,00:27:05.623,-Huh? -That will work.
00:27:05.707,00:27:06.791,Okay.
00:27:07.917,00:27:09.044,Come here.
00:27:10.670,00:27:11.588,Ah!
00:27:17.844,00:27:20.764,"-I don't look good, but I feel good. -Yeah."
00:27:20.847,00:27:24.309,"So, my-my knees, my back, anything you need me to do, sir."
00:27:24.392,00:27:26.311,"Just maybe, uh, keep the running to a minimum."
00:27:26.394,00:27:30.190,"Like maybe I can hit the ropes once, take a bump for you, but like, no crisscrossing, please."
00:27:30.774,00:27:34.361,"This hard-core stuff. What do you, Talk to me about it. What do you wanna do tonight?"
00:27:34.444,00:27:36.446,"Well, are you cool with the staples?"
00:27:36.946,00:27:39.032,-Staples? -Staple gun.
00:27:39.115,00:27:42.535,-What do you mean? -Like staple gun.
00:27:43.203,00:27:45.121,-Staple gun. -Yeah. You never did it before?
00:27:45.205,00:27:47.874,"-Uh, no. Does that hurt? -Silly question, but yeah."
00:27:47.957,00:27:50.293,"-Man, uh, not so bad going in. -Yeah."
00:27:50.377,00:27:56.800,"Kind of scary. You know, you got a big metal thing up against you, but pulling them out, they're gonna leave a couple little holes, a little bit of blood loss there."
00:27:57.384,00:27:59.928,"-Rock and roll. -Thank you, sir. It's an honor. Thank you."
00:28:36.589,00:28:42.303,Randy The Ram Robinson!
00:29:08.288,00:29:09.289,"Great show, Ram."
00:29:09.372,00:29:10.540,Great job.
00:29:11.458,00:29:12.667,There he is.
00:29:20.967,00:29:24.053,"Put yourself through hell, man. Great. Good work. Way to go."
00:29:24.137,00:29:26.848,"-It was fucking insane, Ram. -Let me just get some glue for that."
00:29:26.931,00:29:29.934,"Crazy shit, man. Crazy."
00:29:30.018,00:29:32.854,Hey. You okay with that table hit?
00:29:33.354,00:29:36.357,"-I'll live, sir. I'll live. -Yeah. Okay."
00:30:08.014,00:30:08.973,"Ah, shit."
00:30:11.601,00:30:12.769,"Fuck it. Take it easy, Doc."
00:30:15.063,00:30:16.064,Ow!
00:30:16.648,00:30:17.857,Goddamn it.
00:30:41.422,00:30:42.799,It's dinnertime!
00:30:46.553,00:30:47.637,"Oh, fuck!"
00:30:50.014,00:30:51.724,Goddamn it!
00:31:06.531,00:31:09.158,Yeah! Yeah! Hit him!
00:31:31.264,00:31:33.641,-Ram! -Yeah! Use his leg!
00:31:33.725,00:31:35.894,"Ram, use my leg! Use it! Use my leg!"
00:31:59.083,00:32:01.002,"Fuck you, Necro! Fuck you!"
00:32:10.094,00:32:11.763,"This is in there pretty good, Ram."
00:32:25.902,00:32:27.153,"Ah, fuck."
00:32:30.448,00:32:31.532,Yeah.
00:32:32.867,00:32:34.077,-You're good? -Yeah.
00:33:44.480,00:33:46.149,I think we did what we wanted to do.
00:33:47.817,00:33:54.323,"No, first time, coming off- Way over."
00:34:52.090,00:34:54.050,"Marlene, can I have some help in here, please?"
00:34:54.592,00:34:58.262,"Put your arms down. Okay, try and relax. Calm down."
00:35:04.435,00:35:05.812,"Okay, just relax."
00:35:06.771,00:35:10.066,Okay. Very good. Okay. Calm down.
00:35:39.011,00:35:40.888,"-Ah, fuck. -Mr. Ramzinski?"
00:35:43.474,00:35:44.475,Call me Randy.
00:35:45.518,00:35:47.645,"Randy, I'm Dr. Moayedizadeh."
00:35:48.187,00:35:49.730,"So, how's it all looking?"
00:35:52.567,00:35:54.902,"Oh. So, we're in the clear? We're all good?"
00:35:56.028,00:35:57.405,"Well, it's your heart."
00:35:57.488,00:35:59.490,You need to start taking better care of it.
00:35:59.991,00:36:01.409,Like how? What do I do?
00:36:01.492,00:36:04.078,"Well, for starters, you're going to be on a slew of medications."
00:36:04.829,00:36:08.416,"And the stuff that you're putting in your body, you need to cut it out."
00:36:09.500,00:36:14.297,I know. I know. I can- I can-I can do without that.
00:36:14.797,00:36:21.095,"When can I, uh, get back in the gym and, uh, start working out?"
00:36:21.179,00:36:24.932,"As far as exercise goes, it's still okay, as long as it's moderate."
00:36:26.142,00:36:28.519,"Doc, I'm a professional wrestler."
00:36:29.395,00:36:30.354,That's not a good idea.
00:36:31.856,00:36:33.149,"Well, what do you mean?"
00:36:33.733,00:36:36.444,"Well, your heart has been through a lot."
00:36:36.527,00:36:39.071,It won't be able to handle a strenuous activity.
00:36:41.407,00:36:44.911,"Well, I can slow my routine down. I can-I can just pace myself."
00:36:44.994,00:36:47.705,-Mr. Ramzinski- -Randy. Call me Randy.
00:36:47.788,00:36:51.292,"Randy, you almost died."
00:36:52.043,00:36:54.086,"Next time, you might not be so lucky."
00:36:58.966,00:37:00.343,"Well, hey, Doc."
00:37:01.552,00:37:02.845,Thanks for all the good news.
00:37:26.452,00:37:27.328,This copy's for you.
00:37:31.123,00:37:32.458,And somebody left this for you.
00:37:32.541,00:37:34.252,He said he was your promoter.
00:38:32.476,00:38:33.978,-Your prescription's ready. -Oh.
00:38:42.236,00:38:43.904,-Robin Ramzinski? -Randy.
00:38:45.489,00:38:46.782,"Just sign here, please."
00:38:51.871,00:38:53.080,Thank you.
00:38:55.082,00:38:56.292,Here you go.
00:38:57.835,00:38:58.919,My money.
00:39:00.046,00:39:12.808,"One, two, three, four, five- Welcome home."
00:40:11.909,00:40:13.661,"Oh, shit."
00:40:55.953,00:40:56.871,Ooh.
00:41:05.963,00:41:07.047,"Hey, Adam!"
00:41:20.728,00:41:21.645,Did I what?
00:41:21.729,00:41:23.606,-Call of Duty 4? -What?
00:41:23.689,00:41:25.900,-Call of Duty 4. -Call It Duty 4?
00:41:25.983,00:41:28.569,-Call of Duty 4. -Call of Duty 4?
00:41:28.652,00:41:32.406,"-Yeah. It's pretty cool, actually. -Really?"
00:41:36.327,00:41:39.163,-Wh-What's it about? -It's a war game.
00:41:39.246,00:41:44.710,"Most all the other Call of Duties, they were, like, based on World War II, but this one's with Iraq."
00:41:44.793,00:41:46.462,"-Oh, yeah? -And-Yeah."
00:41:46.545,00:41:50.799,You switch off between a Marine and an S and S British special operative.
00:41:50.883,00:41:54.595,"-So, it's pretty cool. -Wow."
00:41:56.805,00:42:00.059,All right. Here-There! There it is! Ram Jam! You're finished.
00:42:00.142,00:42:01.769,"-Okay, one more. -I gotta go."
00:42:01.852,00:42:03.103,-Huh? -I-I gotta leave.
00:42:03.187,00:42:05.397,I just gave you an ass-whipping. Don't you wanna get even?
00:42:05.481,00:42:06.899,"-Nah, that's okay. -All right."
00:42:06.982,00:42:09.235,"I'll catch you later, all right?"
00:42:09.318,00:42:10.986,"All right. See you later, man."
00:42:11.070,00:42:13.197,"-Do your push-ups, brother. -All right."
00:42:16.450,00:42:17.535,Ah.
00:42:55.531,00:42:56.991,"Oh, fuck."
00:43:26.937,00:43:28.063,-Hmm. -Hi.
00:43:28.147,00:43:32.401,"Yeah, I was in the neighborhood, thought maybe we could go grab a a hamburger."
00:43:33.152,00:43:34.445,I'm working.
00:43:34.528,00:43:37.406,"Okay. You know, maybe later."
00:43:37.906,00:43:38.991,You okay?
00:43:41.327,00:43:43.412,-Could we talk for a second? -Sure.
00:43:43.495,00:43:46.165,Sure. What's up? What's up?
00:43:46.248,00:43:55.466,"No, I mean somewhere quiet, not- Randy, I can't leave with a customer, you know."
00:43:56.592,00:43:59.303,Listen. I had a heart attack.
00:44:04.433,00:44:06.810,-Where you parked? -Out in the back.
00:44:06.894,00:44:09.313,Good. Go to your car. I'll meet you out there in 15 minutes.
00:44:17.196,00:44:19.698,You know what? I'm gonna-I'm gonna go on break.
00:44:19.782,00:44:22.034,-I need a cigarette. I can't quit. -Okay.
00:44:37.049,00:44:38.008,"No, it's okay."
00:44:39.259,00:44:43.263,"-When was it? -Uh, a couple weeks ago."
00:44:43.347,00:44:46.141,Oh. How are you feeling?
00:44:51.146,00:45:09.665,"-What happened? -I just- I was walking in the dressing room, and the guys told me I just dropped like a brick, and, you know, I don't remember nothin' Now the doctors tell me, uh, that I can't - that I can't wrestle no more."
00:45:12.334,00:45:13.710,What are you gonna do?
00:45:14.711,00:45:18.424,"You know, it just don't feel right."
00:45:19.341,00:45:25.305,"And that's why, That's why I wanted to talk to you, you know."
00:45:25.389,00:45:27.015,'Cause I don't want to be alone.
00:45:30.853,00:45:32.354,Randy.
00:45:36.525,00:45:38.652,You should be with your family now.
00:45:39.862,00:45:42.698,Don't you have a daughter? Where's your daughter?
00:45:46.034,00:45:49.037,I don't believe it. Everybody needs a father.
00:45:50.164,00:45:51.165,Trust me.
00:45:51.248,00:45:53.167,And this kind of thing brings people together.
00:45:53.250,00:45:54.334,Ah.
00:45:56.420,00:45:57.588,You should call her.
