start,end,script
01:27:15.291,01:27:16.916,Where's Anne? I wanna speak with her.
01:27:17.000,01:27:18.458,"I'm sorry, Anne is in a meeting right now."
01:27:18.541,01:27:21.333,No. Get her out of the meeting. It's an emergency. I wanna speak with her.
01:27:22.958,01:27:25.291,"Call her on the phone, please. Thank you."
01:27:27.666,01:27:30.375,-If you promise to keep your voice down. -Jesus. Yes.
01:27:30.458,01:27:31.625,I'm happy to call her.
01:27:31.708,01:27:33.958,Jesus fucking Christ.
01:27:35.041,01:27:37.416,"Hello, Anne? I'm down here with Howard Ratner."
01:27:37.500,01:27:39.875,Ask how this fucking 155 bullshit happened?
01:27:39.958,01:27:42.875,Did you hear that? Mm-hmm. Okay.
01:27:42.958,01:27:45.208,What? What did she say?
01:27:45.291,01:27:48.416,-I'm afraid that's your appraisal. -I know that's what it says.
01:27:48.500,01:27:50.208,I'm asking who came up with the fucking figure?
01:27:51.041,01:27:52.083,Oscar in Gems.
01:27:52.166,01:27:53.833,"Well, Oscar's fucking wrong."
01:27:53.916,01:28:00.125,"I could go out and get six appraisers right now, five of them would say at least $3,000 a carat."
01:28:00.208,01:28:01.458,He can go to six appraisers and...
01:28:01.541,01:28:03.458,"Give me the phone. Can I speak to her, please?"
01:28:03.541,01:28:04.625,Can I speak with her?
01:28:04.708,01:28:06.250,"I'm sorry, I'm gonna have to hand you over."
01:28:08.583,01:28:09.625,-Anne. -Yes.
01:28:09.708,01:28:11.125,This is fucking outrageous.
01:28:11.208,01:28:13.333,"You need to calm yourself down, Mr. Ratner."
01:28:13.416,01:28:17.166,I don't wanna be calm. This appraisal's a fucking joke.
01:28:17.250,01:28:22.541,Oscar happens to be one of our most experienced gemologists -who we were extremely lucky to get. -Knows nothing about colored stones.
01:28:22.625,01:28:25.041,Why the fuck am I hearing about it now? I mean...
01:28:25.125,01:28:32.083,Do I need to remind you that you brought the opal to us on a Friday night for an auction set on a Monday morning? We were lucky to be able -to get it appraised at all. -I don't give a fuck.
01:28:32.166,01:28:33.875,I don't care. It needs to be changed. Do it.
01:28:33.958,01:28:36.041,"Well, that's not an option, but if you like, we can pull it."
01:28:36.125,01:28:39.125,"-Pull it? No. No. Not gonna pull it, okay? -What?"
01:28:39.208,01:28:40.125,Here's what you'll do.
01:28:40.208,01:28:47.333,"You're gonna make an announcement at the top of the auction that the correction was wrong -and the original estimate stands. -No, no, no, no, no."
01:28:47.416,01:28:49.541,We are not correcting a correction.
01:28:49.625,01:28:52.125,"We can either pull it, or carry on as is. It's entirely up to you."
01:28:52.208,01:28:53.416,"Okay, thank you so much."
01:28:53.500,01:28:55.916,"-Okay, Anne. No, I'm sorry, too. -I've bent over backwards for you."
01:28:56.000,01:28:58.583,-We are done here. I've had enough. -That'll be perfect. I'll let her know.
01:28:58.666,01:29:01.208,Let who know? Me and my staff had to work the entire weekend...
01:29:01.291,01:29:02.375,Okay. Thank you so much.
01:29:02.458,01:29:04.416,-I don't care what we make. -From the bottom of my heart...
01:29:04.500,01:29:06.958,-I'm happy I won't have to work with you. -...I apologize. I'll tell her.
01:29:07.041,01:29:08.500,-I can assure you... -Thank you. Okay.
01:29:08.583,01:29:17.250,"So she said that we, uh, need to, uh, take the inserts out of each catalog before the auction starts."
01:29:17.333,01:29:19.083,"So, uh, you have those."
01:29:19.166,01:29:21.416,"If you want, I saw a box down there and I can start on these."
01:29:26.625,01:29:28.833,-What is that? What are you doing? -I have a question for Anne.
01:29:28.916,01:29:31.125,You don't need to call her. I just spoke with her.
01:29:31.208,01:29:32.375,"A separate question, don't worry."
01:29:32.458,01:29:33.458,Howard.
01:29:33.541,01:29:35.125,"Hi, Anne. He's saying you told him it was..."
01:29:35.208,01:29:38.750,"Okay. Hey, listen, just fuck 'em. Put 'em back in, I don't give a shit."
01:29:38.833,01:29:40.708,-Gooey! -We're here.
01:29:43.541,01:29:46.375,"Ah, KG? He is, uh... I didn't see him yet."
01:29:46.458,01:29:48.000,"-Is he here? -I haven't seen him, but I..."
01:29:48.083,01:29:51.375,"-I got all these things for him to sign. -Listen to me, listen. Do you want that?"
01:29:53.666,01:29:55.291,Go to the auction room. See if you can see him.
01:29:55.375,01:29:56.416,Find him in there.
01:29:57.875,01:30:00.750,"-He's excited. -So I wanna ask you a little favor, okay?"
01:30:00.833,01:30:06.000,"-Yeah, what? What favor? -So, um... I need you to jack up the bids."
01:30:07.125,01:30:09.375,"What? No, ab-- No. No, absolutely not."
01:30:09.458,01:30:12.458,"Gooey, a little bit. Here and there, you make a bid for it."
01:30:12.541,01:30:15.083,I just gotta ensure we get it up to $250.
01:30:17.083,01:30:18.416,What if I win at $250?
01:30:18.500,01:30:20.583,That's easy. I'll give it right back to you.
01:30:20.666,01:30:21.791,-But you're not gonna... -Jesus!
01:30:23.250,01:30:26.208,"This is not really a nice position you put me in, you know? I resent this."
01:30:26.291,01:30:27.333,-Think I wanna do this? -Very much.
01:30:27.416,01:30:28.541,I fucked up.
01:30:28.625,01:30:31.958,"I should have got my own appraisal, but I didn't have the time."
01:30:32.041,01:30:33.375,How much did they appraise it for?
01:30:33.458,01:30:34.833,-$200. -$200?
01:30:34.916,01:30:38.916,"-Yeah, but these assholes... -What happened to one point-- ...they don't have an opal specialist."
01:30:39.000,01:30:41.083,-My guy at the AGL says... -$200?
01:30:41.166,01:30:43.416,...$500 just based off the pictures.
01:30:43.500,01:30:46.916,"So, okay, listen. 20%, I'll give you for the winning bid."
01:30:47.000,01:30:48.208,To be a partner with me.
01:30:48.291,01:30:50.958,KG's gonna buy it. It's not a problem.
01:30:51.041,01:30:53.250,This guy's obsessed with the stone.
01:30:53.333,01:30:56.708,Today was supposed to be about Aaron meeting KG. Hmm?
01:30:56.791,01:30:58.208,-Gooey. -To show support.
01:30:58.291,01:30:59.916,That's what today was supposed to be about.
01:31:00.000,01:31:02.750,"Well, this is support, this is support like you've never known."
01:31:06.833,01:31:10.583,"We move on now, ladies and gentlemen, to lot number 38."
01:31:10.666,01:31:13.875,"Lot 38, we have a sale room notice."
01:31:14.666,01:31:28.041,"I'm required to inform you all that this fine Ethiopian black opal presented here before you all on your left, my right, is now offered with a revised estimate of $155 to $225,000 US."
01:31:28.125,01:31:41.708,"Ladies and gentlemen, it is a fine piece, a collector's work, and most importantly, it is windowed on either side to reveal the full spectrum of its dazzling color and the pin fire pattern within."
01:31:41.791,01:31:51.041,"So, with that in mind, ladies and gentlemen, my colleagues are ready and poised on the phones and you're all ready with your paddles, we shall start the bidding now at $20,000."
01:31:51.125,01:31:53.208,"$20,000, $30,000."
01:31:53.291,01:31:54.666,"Do I have $40,000?"
01:31:54.750,01:31:57.833,"$40,000, gentleman's bid. Pleasure to see you, sir. Thank you, sir."
01:31:57.916,01:32:00.208,"$40,000 now. Do I see 50?"
01:32:00.291,01:32:02.541,"$50,000 now, in a new place. Thank you, sir."
01:32:02.625,01:32:04.208,"Pleasure to have you back, too, sir."
01:32:04.291,01:32:06.916,"$50,000 now against you, sir. Shall we say 60?"
01:32:07.000,01:32:08.250,"$60,000 now against you, sir."
01:32:08.333,01:32:10.375,"$70,000 now against you, sir."
01:32:12.166,01:32:15.250,"One hundred thousand now bid with you, sir."
01:32:15.333,01:32:19.500,"In a great place, a big bold giant leap for a big, bold giant leaper."
01:32:19.583,01:32:20.708,"At $100,000 now."
01:32:20.791,01:32:23.250,"It's no longer yours, sir. It's against you, sir."
01:32:23.333,01:32:24.916,"Gonna try one more, sir?"
01:32:25.000,01:32:26.708,"I'll even break an increment for you, sir."
01:32:26.791,01:32:29.833,"Can I urge you to consider a bid of $105,000, sir?"
01:32:29.916,01:32:31.250,"Come on, sir, you sure?"
01:32:32.208,01:32:35.750,Positive? No further? A defiant nod then.
01:32:35.833,01:32:39.833,"Looking then for 110 in the room. It's $100,000 now."
01:32:39.916,01:32:42.125,"Is there any further bidding? $110,000 now?"
01:32:42.208,01:32:43.583,"Welcome back, sir."
01:32:43.666,01:32:45.583,"$110,000 now. Once again, against you, sir."
01:32:45.666,01:32:48.666,Shall we try 120? 120 now.
01:32:48.750,01:32:50.500,"Try one more, sir? Let's try 130?"
01:32:50.583,01:32:52.750,130 now. Shall we try 140?
01:32:52.833,01:32:54.208,"$140,000 now."
01:32:54.291,01:32:56.916,"Come on, sir, let's up it again to 150."
01:32:57.000,01:33:00.375,"Try one more at $150,000. No longer yours, sir."
01:33:00.458,01:33:02.625,Shall we try 160? 160 now.
01:33:02.708,01:33:04.875,"Back against you again, sir."
01:33:04.958,01:33:07.333,Can we try one more at 170?
01:33:07.416,01:33:08.458,170 now.
01:33:08.541,01:33:11.250,"Say 180? Say 180, sir?"
01:33:16.916,01:33:18.500,"I'm looking for $190,000."
01:33:19.458,01:33:23.083,"$190,000 is bid. Against you, sir."
01:33:32.583,01:33:34.458,Wanna move this up. Any higher? Any further?
01:33:38.958,01:33:41.458,"We have a good bid at $190,000."
01:33:41.541,01:33:43.166,"I'm looking for 200, sir."
01:33:45.250,01:33:47.916,"Gonna move this up. Any higher, any further?"
01:33:49.833,01:33:52.250,"Sure, sir? Last chance."
01:33:55.458,01:33:57.291,"At $190,000, against the phones."
01:34:00.125,01:34:03.041,"Sold to you, sir, at $190,000."
01:34:04.375,01:34:08.625,"Thank you so much. Thank you, sir. Paddle 172."
01:34:16.291,01:34:18.958,-Gooey. I'm so goddamn sorry. -Shh.
01:34:19.541,01:34:21.000,-Thank you very much. -You're welcome.
01:34:21.083,01:34:27.041,"I'm sorry. Listen, I-- 49th Street, I'm supposed to be on 48th Street."
01:34:27.125,01:34:28.291,Thank you. Thank you.
01:34:28.375,01:34:30.583,"It's 190 grand, Howard."
01:34:30.666,01:34:32.708,-190 grand. -That's temporary.
01:34:32.791,01:34:34.416,"Hey, I'm sorry."
01:34:34.500,01:34:37.375,"I gotta tell you, I was gonna stop past 200."
01:34:37.458,01:34:39.083,Did I not tell you that was gonna happen?
01:34:39.166,01:34:40.583,-I'm sorry. -So now what?
01:34:40.666,01:34:44.666,"Your money's gonna go into my account, and I'll wire it right back to you."
01:34:44.750,01:34:46.125,-Like it never happened. -Including 20%?
01:34:46.208,01:34:47.750,Absolutely. That comes right out of my pocket.
01:34:47.833,01:34:49.458,"That is nearly 38 grand, Howard."
01:34:50.916,01:34:53.500,"So I'm gonna need a couple of weeks on that, but it'll be done."
01:34:53.583,01:34:56.166,"-I promise you, okay? -All right. Aaron, let's go."
01:35:07.708,01:35:09.125,Please? Please don't be mad.
01:35:10.833,01:35:13.416,Come on. Can I get the opal? Let me get the opal.
01:35:13.500,01:35:15.750,-What for? -Because I gotta sell that.
01:35:15.833,01:35:17.333,"-Take the fucking opal. -Yes, all right."
01:35:19.125,01:35:21.166,Get 'em going. Open the fucking door.
01:35:21.250,01:35:23.333,What's he waiting for you for?
01:35:24.083,01:35:25.958,Okay. All right.
01:35:28.375,01:35:30.083,"I know, I know, I know. I know."
01:35:30.166,01:35:32.875,"Let 'em go, let 'em go and then we'll talk."
01:35:32.958,01:35:35.125,"-The fuck was that? -All right, I fucked up."
01:35:35.208,01:35:38.666,"I fucked up, it was a mistake, all right? I know. I admit it."
01:35:38.750,01:35:42.625,I gotta just... Let's hit pause for one fucking second.
01:35:42.708,01:35:46.000,Gonna call Kevin 'cause I know he fucking wants it.
01:35:46.083,01:35:51.791,And you saw he's got the 175 and then everything will be copasetic.
01:35:51.875,01:35:52.916,All right?
01:35:53.666,01:35:58.458,KG. It's me. I got great news for you. I-- Hello?
01:36:00.000,01:36:01.208,Hello?
01:36:01.291,01:36:02.958,No one on the fucking phone.
01:36:05.416,01:36:06.291,Shut the fuck up.
01:36:25.000,01:36:26.000,Hey!
01:36:27.541,01:36:29.458,"Arno, Arno."
01:36:29.541,01:36:31.166,"Just listen to me, please."
01:36:31.250,01:36:34.791,"I spoke to Demany, remember Demany?"
01:36:34.875,01:36:38.041,He's a business friend of mine. He gave me the fucking number...
01:36:38.125,01:36:40.833,"That's enough, Howard! That's fucking enough!"
01:36:43.916,01:36:46.625,"All right, fuck you, man. Suck my dick! Throw him in the fucking water."
01:36:48.666,01:36:50.333,"All right, let's get out of here. Let's go."
01:37:03.000,01:37:04.583,Where the fuck are my glasses?
01:37:05.375,01:37:07.375,"My fucking God, where are they?"
01:37:46.041,01:37:47.333,Got the Versace...
01:37:47.416,01:37:50.291,-I don't know if this is a $400 bag. -Mm-hmm.
01:38:25.250,01:38:27.708,-You okay? What's wrong? -I don't... I don't wanna work.
01:38:27.791,01:38:28.708,Send everybody home.
01:38:28.791,01:38:30.208,"All right, sweetie."
01:39:10.583,01:39:12.625,Hey. Sorry to bother you.
01:39:14.791,01:39:16.500,I just wanted to see how the auction went.
01:39:21.000,01:39:27.208,"Well, Damian and Joseph brought this amazing sweat suit that I think would look so nice on you. Do you wanna see it?"
01:39:29.916,01:39:31.291,"Come on, Howard."
01:39:33.666,01:39:35.250,Don't... Don't look at me.
01:39:35.333,01:39:36.625,"Oh, my God, Howard."
01:39:40.125,01:39:41.791,"Don't look at me, please."
01:39:46.250,01:39:47.958,I don't know if I can take it.
01:39:48.041,01:39:50.416,I don't know what everybody's...
01:39:50.500,01:39:52.500,Not ever going right.
01:39:54.041,01:39:57.666,I'm so sad. I'm so fucked up.
01:39:57.750,01:39:59.458,I'm so fucked up.
01:40:05.833,01:40:10.208,"I'm sorry if this is anything to do with me, but I swear, I really didn't do anything."
01:40:10.291,01:40:12.708,I wish you were nicer to me though.
01:40:12.791,01:40:16.041,It was not nice what you did to me.
01:40:16.125,01:40:18.166,"I try, but it's really hard."
01:40:18.250,01:40:20.916,I don't know what to do. I don't know what to do.
01:40:21.000,01:40:24.750,I don't have any place to go. I don't have anywhere to get better.
01:40:24.833,01:40:26.583,But you do.
01:40:26.666,01:40:31.000,"Like, really, Howard, you're my home. You could come to me."
01:40:31.250,01:40:33.833,"No, I don't-- I can't figure it out."
01:40:34.375,01:40:36.583,I can't figure out what I'm supposed to do.
01:40:36.666,01:40:38.750,Everything I do is not going right.
01:40:38.833,01:40:40.750,Everything I do is not going right.
01:40:40.833,01:40:43.041,I don't know what to do. I really don't.
01:40:43.125,01:40:44.958,-I don't want any more of this shit. -Yeah.
01:40:45.041,01:40:47.458,-I really don't. I gotta figure this out. -Yeah.
01:40:47.541,01:40:49.500,"I gotta figure this out, I really do."
01:40:50.583,01:40:53.750,"Well, I got something if you want. But you can't make fun of me."
01:40:54.333,01:40:55.333,What?
01:40:56.791,01:41:00.208,"My God, it's so stupid, but... I don't know... I got it, I thought..."
01:41:02.583,01:41:04.083,"Look, unzip my skirt."
01:41:06.916,01:41:09.166,"Not like that, just unzip my skirt."
01:41:13.083,01:41:13.958,"It says, Howie."
01:41:14.041,01:41:16.791,What did you do? Why would you do that?
01:41:20.500,01:41:22.583,"-Yes, you are worth it. -I'm not worth it."
01:41:22.666,01:41:25.625,"-Look, Howie, I'm so crazy about you. -I don't deserve this."
01:41:25.708,01:41:27.750,"Yes, you do. I love you."
01:41:29.958,01:41:31.291,You can't even get buried with me now.
01:41:36.458,01:41:38.333,"Oh, this fucking guy."
01:41:39.083,01:41:41.541,Do not let him in. Understand me?
01:41:41.625,01:41:43.416,"Just ignore him. Ignore him, Joani."
01:41:52.791,01:41:54.541,"You don't think it's broken, right?"
01:41:55.916,01:41:58.791,This is crazy. You can't be out here looking like this.
01:42:05.958,01:42:07.291,Can you answer that?
01:42:07.791,01:42:08.625,Hello?
01:42:11.000,01:42:14.041,-I'm actually looking for Howard. -This is Howard.
01:42:14.125,01:42:17.416,"Hi, yes, I got your message from Demany about the gem."
01:42:17.500,01:42:18.916,We're at the bank right now.
01:42:19.000,01:42:22.375,"Oh. Did, uh... So does he want it?"
01:42:22.458,01:42:27.083,"Yes. Kevin's still interested. We could actually be there-- It's like we discussed, right?"
01:42:27.166,01:42:30.708,"It's still, uh... It's still 175, right?"
01:42:30.791,01:42:32.083,-Yes. -In cash.
01:42:32.166,01:42:33.916,"Yes, in cash. Like I said, we're at the bank now."
01:42:36.750,01:42:38.166,"-Howard, I gotta go. -Okay."
01:42:38.250,01:42:39.625,I'll see you soon. Goodbye.
01:42:48.083,01:42:54.416,"Kevin Garnett is coming to my office right now with $175,000 cash. All right?"
01:42:54.500,01:42:56.208,You said I got till Monday.
01:42:56.291,01:43:01.541,"Today is still Monday so I don't know if you're hearing this, but Arno, this is real."
01:43:01.625,01:43:04.583,Kevin's really on the way. He was just at the bank.
01:43:04.666,01:43:06.458,"Come get your money, buddy."
01:43:06.541,01:43:08.083,I need the Celtic ring back.
01:43:08.166,01:43:09.625,-What happened to Friday? -I know.
01:43:09.708,01:43:11.375,"-It's Monday, Howie. -I know what we said."
01:43:11.458,01:43:13.416,-What did we say? -It was a short week. Pesach.
01:43:13.500,01:43:14.958,What happened to your face?
01:43:15.041,01:43:17.625,Car accident. Okay?
01:43:17.708,01:43:18.750,-So let's-- -What do you need?
01:43:20.625,01:43:22.875,and I'm gonna give you the Knicks ring. All right?
01:43:22.958,01:43:25.625,"You know what that means. Swap them out, please."
01:43:25.708,01:43:27.125,You've had this Knicks ring forever.
01:43:27.208,01:43:29.458,I just need the Celtic ring back. All right?
01:43:32.208,01:43:38.875,"-I own that ring right now. -I know, I know you do. And I'm-- So, I'll swap you the two rings but I'm gonna put a 15% vig on this one."
01:43:38.958,01:43:42.166,"And if you're not here by Friday, it's gonna be the same thing. Not gonna have a third ring."
01:43:42.250,01:43:43.583,Not gonna have to worry about that.
01:43:43.666,01:43:46.250,"Make it a 16%, I'm sorry I fucked you, all right?"
01:43:46.333,01:43:48.083,"Bubby, what's going on? You okay?"
01:43:48.166,01:43:50.250,I'm very good. Everything's going good.
01:43:50.333,01:43:52.625,-Yeah. -I promise you. I promise you.
01:43:58.041,01:44:00.250,Hey. There he is.
01:44:03.875,01:44:06.833,"I got your chip right here, all right? Game night."
01:44:12.958,01:44:14.791,let's get these guys some Powerades.
01:44:14.875,01:44:16.208,-Powerades? -By the way...
01:44:16.291,01:44:17.833,Water? Anything else?
01:44:19.458,01:44:22.416,"-They're cold, you know that. -Howard, let me get a second."
01:44:32.041,01:44:34.833,"Ever since I met you, you've been giving me the run around with everything."
01:44:34.916,01:44:35.791,What do you mean?
01:44:35.875,01:44:39.500,Feel like you're fucking with my emotions. You're just playing with me at some point.
01:44:39.583,01:44:41.458,This hasn't been straight since I came here.
01:44:41.541,01:44:43.000,-You understand? -Why are you saying that?
01:44:43.083,01:44:45.958,"I borrowed the opal is one thing, I come back over here, I brought it back."
01:44:46.041,01:44:48.375,"I brought it back. I didn't have to bring it back, you understand?"
01:44:48.458,01:44:51.875,"I show up at the auction, you have somebody bid against me, all these fucking games?"
01:44:51.958,01:44:53.458,What the fuck are you doing?
01:44:53.541,01:44:56.125,You don't think I notice? You don't think I know none of this?
01:44:58.791,01:45:00.166,"You see this face, do you see it?"
01:45:00.250,01:45:02.958,"Man, here's 165,000 right here. Cash."
01:45:03.041,01:45:05.208,"I'm showing you because it wasn't easy, man."
01:45:05.291,01:45:07.583,"Six percent goes to Demany, I've already taken that out, all right?"
01:45:07.666,01:45:09.208,"All right, I guess that's fair."
01:45:09.291,01:45:11.500,"Let me get the fucking opal, man. Let me get the fuck up out of here."
01:45:11.583,01:45:14.250,This opal's very valuable for you.
01:45:16.625,01:45:17.833,Get the fuck out...
01:45:21.916,01:45:24.750,"-Thought you was a fan too, man. -I'm a fucking huge fan."
01:45:24.833,01:45:27.458,What'd you pay for this? Real shit. What'd you pay for this right here?
01:45:27.541,01:45:29.875,"That's not a fair question, Kevin, all right?"
01:45:29.958,01:45:32.875,We're talking months and months of fucking my time.
01:45:32.958,01:45:35.166,"I'm not gonna take the money back. I mean, I did the deal now."
01:45:35.250,01:45:39.625,"I'm just saying. Straight up, me and you, How much you pay for this?"
01:45:39.708,01:45:43.750,Fuckin'... What'd I pay? I paid a... This is...
01:45:45.916,01:45:48.208,"If I answer that question, it's very misleading."
01:45:48.291,01:45:49.125,Why?
01:45:49.916,01:45:52.583,"-I paid 100 grand, okay? -So you doubled your money?"
01:45:55.791,01:45:57.958,A million dollars is what I was supposed to get.
01:45:58.041,01:46:01.708,I get a fucking what? Made 65 Gs?
01:46:01.791,01:46:06.500,You gave some niggas from Ethiopia 100 grand for something you thought was worth a million dollars.
01:46:06.583,01:46:08.041,You don't see nothing wrong with that?
01:46:08.125,01:46:10.875,"Ethiopian miners, you know what these fucking guys make?"
01:46:10.958,01:46:14.541,100 grand's 50 lifetimes for these fucking guys.
01:46:14.625,01:46:16.583,"A million dollars is more, that's my point. Understand?"
01:46:16.666,01:46:20.958,"Well, you wanna win by one point or fucking 30 points, KG, right?"
01:46:21.041,01:46:24.250,I see you out there with the fucking stadiums all booing you.
01:46:24.333,01:46:26.958,"You're 30 up, you're still going full tilt."
01:46:27.958,01:46:30.625,Let's see what Vegas... What does Vegas got you guys at tonight?
01:46:30.708,01:46:31.750,Take a look. Let's see.
01:46:31.833,01:46:34.083,"Hold on, are you serious? You're gonna pull this up right here?"
01:46:34.166,01:46:37.875,"Look at this shit. The Sixers are supposed to win the game tonight, they think."
01:46:37.958,01:46:39.500,I don't keep track of none of that shit.
01:46:39.583,01:46:42.958,"They think on game seven, you're not gonna get fucking 18 points."
01:46:43.041,01:46:44.708,They don't think you're gonna get eight rebounds?
01:46:44.791,01:46:46.208,These guys don't know shit about ball.
01:46:46.291,01:46:47.333,What the fuck do they do?
01:46:47.416,01:46:49.375,Doesn't that make you want to fucking kill them?
01:46:49.458,01:46:52.416,"Doesn't that make you wanna say, Fuck you for doubting me?"
01:46:52.500,01:46:56.916,Doesn't that make you wanna step on fucking Elton Brand's fucking neck?
01:46:57.000,01:47:01.083,"Come on, KG, this is no different than that. This is me."
01:47:01.166,01:47:05.583,"All right? I'm not a fucking athlete, this is my fucking way, this is how I win."
01:47:06.375,01:47:12.291,"All right? All the fucking hard work I do, all the fucking ass kicking, and the dues I pay."
01:47:12.375,01:47:16.125,"You're not gonna score on the big one, on game seven?"
01:47:16.208,01:47:20.166,"Fuck these people, right? That's how you feel, I know you do."
01:47:20.250,01:47:21.416,"So, look..."
01:47:23.833,01:47:27.458,Let's fucking bet on this. Let's bet on this shit.
01:47:29.291,01:47:32.291,"I'm fucking gonna bet all this money on you tonight, KG."
01:47:33.333,01:47:36.416,"You're here to win, KG. These fuckers don't know."
01:47:36.500,01:47:39.625,"Them out fucking west, do you think they fucking know you?"
01:47:39.708,01:47:41.833,They don't know you. They don't know us.
01:47:41.916,01:47:45.208,It's about fucking winning. It's about you.
01:47:45.291,01:47:50.833,"And I saw your fucking conviction, your fucking honesty."
01:47:50.916,01:47:52.958,And your fucking magic.
01:47:55.333,01:47:59.583,"KG, do you even understand how fucking great of a game you're gonna have tonight? I know it."
01:47:59.666,01:48:02.750,"-Listen... -We're a team tonight, KG."
01:48:02.833,01:48:05.833,This is a fucking lock-in. It's a fucking feeling.
01:48:05.916,01:48:09.833,"We both have it. They don't know. You and I know, all right?"
01:48:19.041,01:48:20.083,What the fuck are...
01:48:20.166,01:48:23.333,"Hey, do you mind watching the space while I run to the bathroom?"
01:48:23.416,01:48:25.166,-Sure. -Thank you.
01:48:25.791,01:48:27.166,I can leave you guys alone in here?
01:48:27.250,01:48:28.833,"Go handle your business, sweetheart."
01:48:28.916,01:48:29.916,Do you want company?
01:48:30.000,01:48:32.125,"I don't think so, but next time maybe."
01:48:36.208,01:48:38.083,"Hey, hey, hey. I'm looking for Howard."
01:48:38.666,01:48:41.000,"-I'm sorry, we're closed. -He gave me a fucking fake Rolex."
01:48:41.083,01:48:43.000,"I'm sorry, I don't know anything about that, sir."
01:48:43.083,01:48:44.833,Please calm down. I don't know anything about that.
01:48:44.916,01:48:46.666,Let me talk to you about this. You gotta help me.
01:48:46.750,01:48:47.708,"I'm sorry, I'm busy."
01:48:47.791,01:48:51.208,This is gonna be one of the best nights of our fucking life.
01:48:51.291,01:48:52.625,Howard. Howard.
01:48:59.625,01:49:01.208,Come on. Come on.
01:49:01.291,01:49:03.958,"Come on, come on. Where are you? Hey."
01:49:04.041,01:49:05.208,"Howard, what the fuck is going on?"
01:49:05.291,01:49:06.166,-Take this. -What is this?
01:49:06.250,01:49:07.375,I need you to listen to me carefully.
01:49:07.458,01:49:11.125,"I booked you on a blade, okay? You're gonna land on top of the Mohegan Sun."
01:49:11.208,01:49:12.250,Okay.
01:49:12.333,01:49:14.041,There's a bet in that bag.
01:49:14.125,01:49:18.208,"I want you to take all of it, all of it inside the bag and place it on that bet."
01:49:18.291,01:49:20.083,-How much is in the bag? -There's a lot.
01:49:20.166,01:49:22.000,I don't want you to think about that. All right?
