start,end,script
00:01:08.193,00:01:12.405,"The kind of man other men look up to, admire, and emulate."
00:01:14.115,00:01:24.918,"A man's man is the kind of man who… Nick, my ex-husband, is the ultimate man's man."
00:01:26.085,00:01:27.754,I probably never should have married him.
00:01:27.837,00:01:30.298,I don't think he understood a thing about me.
00:01:30.381,00:01:33.510,"So, this is Nick Marshall's office. Wanna peek?"
00:01:33.593,00:01:35.470,Don't worry. He never gets in before ten.
00:01:35.553,00:01:40.058,"He'll send you on more errands than anyone in the entire company, 'cause he can't do anything for himself."
00:01:40.141,00:01:44.354,He's like this total bachelor and the least politically correct guy in the universe.
00:01:44.437,00:01:46.773,He's the king of all the T&amp;A ads we do.
00:01:46.856,00:01:49.109,You want babes in bikinis? He's your man.
00:01:49.984,00:01:52.821,My dad? How can I best describe him?
00:01:52.904,00:01:55.782,He's always been like an uncle to me.
00:01:55.865,00:01:57.575,"Yeah, Uncle Dad."
00:01:57.659,00:02:00.703,"Although, Nick was a charmer."
00:02:01.538,00:02:07.669,"Completely irresistible at first, which feeds into the whole man's man thing."
00:02:08.336,00:02:10.964,"You know about Nick's mother, right?"
00:02:11.589,00:02:17.595,"Because once you understand about Nick's mother, you understand Nick."
00:02:25.311,00:02:29.983,"Nick's mother was a real, honest-to-God Las Vegas showgirl."
00:02:30.066,00:02:39.409,"When other boys were outside riding their bikes and playing ball, Nick was backstage hanging with the girls."
00:02:39.492,00:02:42.954,"He was their mascot, their little pet."
00:02:44.622,00:02:47.625,They couldn't get enough of those baby blues.
00:02:51.588,00:02:56.759,"If you ask me, I'd say Nick's mother just about killed it for every woman Nick would ever meet."
00:02:56.843,00:03:05.643,"She had a lot of sugar daddies in her life, but only one true love, the boy with the family jewels."
00:03:06.936,00:03:08.897,"Seventeen, eighteen, nineteen, twenty."
00:03:08.980,00:03:09.856,"Let me see that, kid."
00:03:12.191,00:03:16.738,his mom made sure he was always surrounded by strong male role models.
00:03:23.578,00:03:24.954,"Keep counting, kid. Keep counting."
00:03:29.125,00:03:31.294,"So, what can you expect?"
00:03:31.377,00:03:36.841,You don't have to be Freud to figure out this was one cockeyed way to enter the world.
00:04:09.457,00:04:10.959,Oh!
00:04:13.586,00:04:16.130,-Don't you ever knock? -It's almost ten.
00:04:16.714,00:04:18.591,"You gotta go to work, and I gotta vacuum in here."
00:04:18.675,00:04:21.427,And don't forget… Another one who wears vanilla perfume.
00:04:21.511,00:04:24.097,Don't you know any women who don't want to smell like candy?
00:04:24.180,00:04:26.808,"-Toss me my lighter, could you babe? -Babe?"
00:04:26.891,00:04:28.977,"What am I, a little pig?"
00:04:29.060,00:04:33.731,"I don't have time to make you no onion bagel, so please do not start to beg, okay?"
00:04:33.815,00:04:37.360,"And just for the record, I don't like finding these things in your sofa."
00:04:37.443,00:04:39.362,What kind of woman wears underwear like this?
00:04:39.445,00:04:41.781,"Hey, my mother wore underwear like that, all right?"
00:04:41.864,00:04:43.866,"Just put them somewhere, will you, babe?"
00:04:43.950,00:04:46.995,"Well, babe is gonna put it in the trash where it belongs."
00:04:47.078,00:04:49.080,"So, your mother should excuse me."
00:04:49.163,00:04:51.708,Did you ever consider dating a woman who wears real underwear?
00:04:51.791,00:04:54.711,"You know, the kind that covers the entire bottom the way it's supposed to?"
00:04:54.794,00:04:56.879,"No. But if I ever do, should I give you a call?"
00:04:59.424,00:05:01.175,I'm gonna go clean the kitchen.
00:05:01.259,00:05:03.594,"Oh, you couldn't toast me a little bagel, could you?"
00:05:03.678,00:05:06.014,"Light cream cheese, tomatoes. Capers if we have any."
00:05:06.556,00:05:09.225,Please! Come on. You know I can't think on an empty stomach.
00:05:09.309,00:05:12.186,Okay. All right. But only because you didn't call me that pig name.
00:05:12.270,00:05:14.272,"Okay, you got it, babe."
00:05:21.404,00:05:23.740,"Mr. Marshall, how are you doing today?"
00:05:23.823,00:05:26.326,-I'm fit as a dancing bear. -I'll get that cab for you.
00:05:29.454,00:05:32.123,"-You have an excellent day, sir. -And you."
00:05:36.169,00:05:37.045,At ease.
00:05:52.310,00:05:54.771,"Oh, oh, I'm so sorry!"
00:05:54.854,00:05:56.773,I absolutely did not mean to do that.
00:05:56.856,00:05:59.025,-Here. Let me get that for you. -It's okay.
00:05:59.108,00:06:01.611,"No, no, no. I'm mortified, really. I can see your hands are full."
00:06:01.694,00:06:03.196,-Thank you. -Sorry. Let me get the door.
00:06:05.990,00:06:07.200,-Thank you. -Thank you.
00:06:07.283,00:06:10.286,"Half cup, grande, nonfat, thick foam, wet cap, no lid."
00:06:10.369,00:06:12.997,"Half caff, grande, nonfat, thick foam, wet cap, no lid."
00:06:13.081,00:06:15.917,"-So, when do you find out? -Um, today, I think."
00:06:16.000,00:06:20.171,"Unless I didn't get it, and then I will just never find out."
00:06:20.254,00:06:21.464,I'm sure I didn't get it.
00:06:21.547,00:06:23.299,They were looking for an earth mother type.
00:06:23.382,00:06:25.593,I overheard the director say I was more space cadet.
00:06:25.676,00:06:28.679,I'm an actress. I can be whatever you want.
00:06:28.763,00:06:30.723,"-Is that true, can you? -Oh, better be true."
00:06:30.807,00:06:33.559,"Otherwise, I'm stuck playing ditsy coffee shop girl the rest of my life."
00:06:33.643,00:06:40.817,"-Thank you. Thanks. -Um… Oh! Hi, Nick. Hi."
00:06:40.900,00:06:42.401,"Oh, Lola, my love."
00:06:42.485,00:06:44.112,When are you gonna let me buy you dinner?
00:06:44.612,00:06:45.988,"Nick, I don't know why you don't believe me."
00:06:46.072,00:06:48.116,I'm not your type. Trust me on this one.
00:06:48.199,00:06:50.493,"Cappuccino, extra foam. Tall or grande?"
00:06:50.576,00:06:52.995,Grande. Or at least I like to think so.
00:06:53.079,00:06:55.915,"-Ha! Next. -You know, rumor has it."
00:06:55.998,00:06:57.792,I'm getting some really big news at work today.
00:06:57.875,00:07:01.087,Why don't you at least come out with me. Celebrate. I'll buy you a cup of coffee.
00:07:01.170,00:07:03.422,"Memo to you, I work in a coffee shop."
00:07:04.048,00:07:05.466,Hi. What can I get you?
00:07:05.550,00:07:07.426,-Hi. I'll take-- -Want me to stop asking you out?
00:07:07.510,00:07:09.137,Sorry. This will just take a sec.
00:07:09.220,00:07:11.139,"Because, Lola, if that's what you want, I'll stop."
00:07:11.222,00:07:13.307,"All you have to do is give me the word, and I'll stop."
00:07:13.391,00:07:15.768,"Yes, I'm gonna give you the word, because I'm an actress."
00:07:15.852,00:07:19.313,Or at least I'm trying to be one. I'm trying to concentrate on that.
00:07:19.397,00:07:24.819,"So, you know, it would be a good thing, if you wouldn't mind, to stop asking me out!"
00:07:28.239,00:07:30.616,"I am, I'm stressed. I'm stressed. I have a lot on my plate."
00:07:30.700,00:07:32.034,"So, let's not talk about this now."
00:07:32.118,00:07:34.745,"Why don't I meet you here, say, tomorrow? 10:00, 10:30?"
00:07:34.829,00:07:36.581,"-Okay, that would be good. -So, that's a date?"
00:07:36.664,00:07:38.624,It's a date. Thank you.
00:07:39.917,00:07:42.503,"Sir, that was inspiring."
00:07:42.587,00:07:43.671,I know.
00:07:48.634,00:07:49.927,"-Good morning, Mr. Marshall. -Hi, honey."
00:07:50.011,00:07:54.474,"-What's the dirt, kid? -I was at breakfast this morning… -Hey, Norm! You winning? -Of course."
00:07:54.557,00:07:57.560,"I heard Miller's shopping around, looking for a new agency."
00:07:57.643,00:07:59.395,Miller Lite. I know. I'm all over it.
00:07:59.479,00:08:01.814,"Also, I heard Darcy McGuire left BBD&amp;O."
00:08:01.898,00:08:03.399,"-Good morning, Angela. -You're kidding."
00:08:03.483,00:08:04.775,-Left or was fired? -I don't know.
00:08:04.859,00:08:07.028,I just know everyone there is thrilled to get rid of her.
00:08:09.864,00:08:14.827,"So, that girl we met last night at the club, nothing happened after you put her in the cab, right?"
00:08:15.536,00:08:17.121,It did? Something happened?
00:08:17.205,00:08:18.915,But she said she had to be in bed early.
00:08:18.998,00:08:21.626,"Well, I had her in bed by 11. Or was it quarter to… yeah."
00:08:21.709,00:08:23.586,"You… You're like a genius, you know that?"
00:08:23.669,00:08:25.922,"Oh, what can I tell you, buddy? I'm blessed."
00:08:26.005,00:08:27.840,And today is my lucky day.
00:08:27.924,00:08:34.805,"Not only is my ex-wife Gigi remarrying, right about now, as a matter of fact, but Wanamaker called me himself, said wanted to see me first thing."
00:08:34.889,00:08:37.225,-Called twice to confirm. -Call me when he makes it official.
00:08:37.308,00:08:41.395,"It's not gonna be as easy to suck up to creative director, you know?"
00:08:41.479,00:08:42.813,Not to worry.
00:08:42.897,00:08:44.357,I'll make us a lunch rez at the Drake to celebrate.
00:08:44.440,00:08:47.777,"Don't count your chickens, huh? One o'clock."
00:08:49.987,00:08:51.197,Can I borrow this?
00:08:56.202,00:08:57.078,Oh!
00:08:57.870,00:08:59.830,"-Hey, Dina. -Hey."
00:08:59.914,00:09:01.916,Do you know the difference between a wife and a job?
00:09:01.999,00:09:04.377,"-What is it? -After ten years, job still sucks."
00:09:06.379,00:09:09.590,"I wouldn't do that if I were you. That's not a good idea, no."
00:09:11.217,00:09:12.677,"-Oh, Mr. Marshall, hi. -Hey."
00:09:12.760,00:09:15.596,I put the story boards on your desk. Picked up your shoes from Barney's.
00:09:15.680,00:09:17.598,Got your glasses fixed. There was no charge.
00:09:17.682,00:09:19.559,This morning's staff meeting was canceled.
00:09:19.642,00:09:21.894,"Oh, and I got your cigarettes. They're next to your laptop."
00:09:21.978,00:09:23.604,This morning's staff meeting was canceled.
00:09:23.688,00:09:25.856,-That's what I was told. -Hmm.
00:09:27.358,00:09:28.943,"Good morning, girls."
00:09:31.028,00:09:32.780,"Good afternoon, sire."
00:09:33.281,00:09:36.325,"Hey, anybody know why the staff meeting was canceled?"
00:09:36.409,00:09:37.785,Nobody called us.
00:09:37.868,00:09:44.292,"Oh, but Mr. Wanamaker wants to see you as soon as you get in, which I told his office was 15 minutes ago."
00:09:44.375,00:09:46.502,-I know. -You couldn't show up on time today?
00:09:46.586,00:09:49.672,"You know you're being promoted. But you look very sharp, by the way."
00:09:49.755,00:09:51.382,-Thank you. -Like a creative director.
00:09:51.465,00:09:53.134,Very distinguished.
00:09:54.218,00:09:57.430,You able to handle yourselves on the 44th floor? Be truthful now.
00:09:57.513,00:09:59.890,Are you kidding? We were made for the 44th floor.
00:09:59.974,00:10:02.977,"Now, get up there already, so we can break out the bubbly."
00:10:10.735,00:10:11.819,Boy.
00:10:14.447,00:10:15.740,"I'm sorry, buddy."
00:10:15.823,00:10:17.825,I was in the board meeting that would never end.
00:10:17.908,00:10:19.994,-Have you been here long? -A couple minutes. That's all.
00:10:20.077,00:10:22.705,"Jess, can I get a cup of decaf and a couple Tylenol?"
00:10:22.788,00:10:25.458,And see if we got any Echinacea. And I need some club soda.
00:10:25.541,00:10:26.792,I got something on my tie.
00:10:30.254,00:10:32.298,I saw the mock-ups you did for Johnny Walker.
00:10:32.840,00:10:34.008,They're fantastic.
00:10:34.091,00:10:35.301,"Oh, that's my job, Dan."
00:10:35.384,00:10:40.931,"So, you know I'm not great at making speeches, especially when I haven't got you to write them for me."
00:10:42.475,00:10:43.559,"So, I'll do my best."
00:10:43.643,00:10:45.394,I've been in this racket over 30 years.
00:10:45.478,00:10:47.563,"Let me tell you something, it doesn't get any easier."
00:10:47.647,00:10:49.440,"As a matter of fact, it gets harder and harder."
00:10:50.441,00:10:52.360,The '80s were our glory days.
00:10:52.443,00:10:55.446,"They were all about alcohol, tobacco, and cars."
00:10:57.698,00:11:03.621,"And then in the '90s, men stopped dominating how dollars were spent, and we lost our compass."
00:11:03.704,00:11:09.251,Women between 16 and 24 are the fastest-growing consumer group in the country.
00:11:09.335,00:11:13.881,I'm talking about girls who were born in the mid-'80s who control our advertising dollars.
00:11:13.964,00:11:16.342,"Sorry. No Echinacea. Hi, Nick."
00:11:16.425,00:11:18.552,-Hey. -Red or lavender?
00:11:19.053,00:11:22.515,"Red. No, no, lavender. That's good. Lavender's good."
00:11:22.598,00:11:28.771,"While we've been getting our rocks off shooting beer commercials with the Swedish bikini team, the industry has been transformed."
00:11:29.855,00:11:32.108,We were the agency in town ten years ago.
00:11:32.191,00:11:34.568,Now we're struggling to be third.
00:11:34.652,00:11:40.699,"If we don't evolve and think beyond our natural ability, we're gonna go down."
00:11:40.783,00:11:45.204,"Think beyond our natural, I'm not quite clear what you mean here, Dan."
00:11:45.287,00:11:46.831,What do you know about Darcy McGuire?
00:11:46.914,00:11:50.042,"Oh, hey, I heard on the whisper, she just left BBD&amp;O."
00:11:50.626,00:11:53.254,"I never met the woman, but I hear she's a real man-eater."
00:11:53.337,00:11:54.672,She won that Cleo last year.
00:11:54.755,00:11:58.926,"We should have won for the add about-- Oh, yeah, right. That was her? I forgot about that."
00:11:59.009,00:12:00.344,"Yeah, I wish I had."
00:12:00.428,00:12:04.390,"Oh, boy, I hear she is a bitch on wheels."
00:12:07.184,00:12:08.018,"Yeah, why?"
00:12:09.979,00:12:11.313,'Cause I just hired her.
00:12:12.648,00:12:14.024,To do what?
00:12:16.777,00:12:20.239,"You know I love you, Nick, but it's a woman's world out there."
00:12:20.322,00:12:23.367,Getting into a women's psyche is not exactly your strong suit.
00:12:23.868,00:12:28.205,"You can get into their pants better than anybody on Earth, but their psyche is a whole other ball game."
00:12:28.289,00:12:32.001,You hired Darcy McGuire to do what?
00:12:32.084,00:12:35.379,"I know she hasn't done it totally on her own yet, but somebody was gonna grab her."
00:12:35.463,00:12:36.964,"-And she's smart, Nick. -Oh!"
00:12:37.047,00:12:38.716,She's very smart.
00:12:39.467,00:12:43.137,"You made her creative director, didn't you?"
00:12:43.220,00:12:45.347,"I'm sorry, buddy. This isn't easy for me."
00:12:45.431,00:12:47.183,But I got the board breathing down my neck.
00:12:47.266,00:12:49.393,She's coming in this afternoon. You'll meet her.
00:12:52.271,00:12:56.192,"Work with her, because she's got what I need to keep this place afloat."
00:12:56.275,00:12:59.153,"She's got what you need, meaning she's a woman."
00:12:59.236,00:13:00.863,You know how we can compete with that?
00:13:05.659,00:13:07.620,He's coming. He's coming. He's coming.
00:13:10.623,00:13:13.501,"Not so fast, girls. Put it on ice."
00:13:15.377,00:13:16.754,We'll break it out soon.
00:13:18.923,00:13:20.883,We're not moving to the 44th floor?
00:13:22.051,00:13:23.219,Not today.
00:13:24.929,00:13:25.888,Oh.
00:13:26.472,00:13:27.723,"Okay, Gigi, one more."
00:13:38.150,00:13:41.695,"Honey, you look like $48 million."
00:13:41.779,00:13:42.863,Thank you.
00:13:44.448,00:13:46.283,-May I kiss the bride? -Sure.
00:13:48.327,00:13:50.204,-Nick. -Nick!
00:13:50.287,00:13:51.247,Ted.
00:13:51.330,00:13:53.999,"Congratulations, Ted. You're a lucky man."
00:13:54.083,00:13:56.460,"Well, thanks. I happen to agree."
00:13:56.544,00:13:58.921,"So, you're going on a cruise. Two weeks, huh?"
00:13:59.004,00:14:01.507,"Well, actually, the cruise is just the last week."
00:14:01.590,00:14:06.262,"Alexandra has an itinerary, and I faxed one to your office yesterday, to your apartment last week."
00:14:06.345,00:14:08.681,"Ted's office has one, as does the school."
00:14:08.764,00:14:12.226,-In case I've fallen off the planet? -You never know.
00:14:14.853,00:14:18.983,"Hey, here she is. Pretty in pink. So, two whole weeks together, huh?"
00:14:19.066,00:14:21.986,"-Yeah, how you gonna handle it? -I'm gonna love it."
00:14:22.069,00:14:23.904,You can take care of your old man for a change.
00:14:23.988,00:14:25.322,Cook for me. Get my slippers.
00:14:25.406,00:14:28.492,"-Yeah, that'll be happening. -Alexandra has a boyfriend now."
00:14:28.576,00:14:29.493,Mom!
00:14:29.577,00:14:32.288,"I'm just telling him, so he won't be surprised when he comes by."
00:14:32.371,00:14:34.540,You have a boyfriend? You're only 13 years old.
00:14:34.623,00:14:37.042,Am I? I thought I was 15.
00:14:40.421,00:14:41.922,"Look, I wanna meet Cameron."
00:14:42.006,00:14:44.091,Is it okay if I meet Dad at his place?
00:14:44.174,00:14:45.301,Can she? Is it all right with you?
00:14:45.885,00:14:47.303,"-Yeah, well, I… -What time?"
00:14:47.386,00:14:49.471,"Eight, nine maybe?"
00:14:51.682,00:14:54.602,"-Bye, Mom. -Oh, honey. I'm gonna miss you."
00:14:54.685,00:14:57.771,"Oh, I'm gonna miss you, too. Ted, have a good time."
00:15:01.525,00:15:03.152,-Nick. -Honey.
00:15:03.235,00:15:04.361,Later.
00:15:07.239,00:15:10.492,"Yeah, 7:30's fine. Thanks for asking."
00:15:11.076,00:15:12.494,And the name's Dad.
00:15:21.962,00:15:23.797,-Here you go. -Thanks.
00:15:26.383,00:15:29.261,"-Hey, I heard. I can't believe this. -My next headache."
00:15:29.345,00:15:30.804,Don't worry. We'll get through it.
00:15:31.722,00:15:32.806,Yeah.
00:15:35.309,00:15:38.103,"Everyone, everyone, meet Darcy McGuire."
00:15:56.372,00:15:58.082,Hello. I'm Darcy.
00:15:58.582,00:16:00.960,Hi. I'm Nick Marshall.
00:16:01.043,00:16:02.336,"Oh, I've heard a lot about you, Nick."
00:16:02.419,00:16:04.880,"Oh, I've heard a lot about you, too, Darcy."
00:16:07.800,00:16:09.009,Let's hope not.
00:16:09.551,00:16:10.552,Hey.
00:16:11.220,00:16:14.264,"Hey, standing room only. It's a first."
00:16:15.641,00:16:18.727,"I'm very, very excited for you all to meet Darcy McGuire."
00:16:21.563,00:16:23.315,as a leader in the field precedes her.
00:16:23.399,00:16:29.780,"At BBBD&amp;O, Darcy led a creative team that snagged $500 million in new business wins."
00:16:29.863,00:16:31.490,And that was just last year alone.
00:16:31.991,00:16:35.995,"Here at Sloane-Curtis, we've always prided ourselves on our strategic thinking."
00:16:36.078,00:16:41.417,"Now it's time for us to step up, and once again, prove ourselves creatively in the marketplace."
00:16:41.500,00:16:48.215,"And I'm thrilled that Darcy has consented to move across town, join our team, and lead us into the 21st century."
00:16:51.010,00:16:52.052,"Thank you, Dan."
00:16:52.136,00:16:55.055,And thank you all for that warm welcome.
00:16:55.139,00:16:57.141,Let me start off by saying the feeling is mutual.
00:16:57.224,00:16:59.768,I am absolutely thrilled to be here.
00:16:59.852,00:17:03.439,"When I first started in this business, it was my dream to work at Sloane-Curtis."
00:17:03.522,00:17:06.567,"In fact, I even believe I applied for a job here twice."
00:17:11.071,00:17:13.907,But it was BBD&amp;O that offered me a home.
00:17:13.991,00:17:19.621,And what I learned there was that any success I had was a direct result of the team of people that I work with.
00:17:19.705,00:17:22.291,I know that two heads are better than one.
00:17:22.374,00:17:25.085,I know that five heads are better than two.
00:17:26.962,00:17:30.299,"and our hearts into this company, we will deliver, I know that."
00:17:30.382,00:17:33.677,"Now, I love challenges. I love hard work."
00:17:33.761,00:17:40.100,I look forward to sitting at this very table tossing ideas around until what I fear will be the wee hours of the morning.
00:17:40.184,00:17:44.938,"But most importantly, I want the work we do to say something about who we are."
00:17:45.022,00:17:47.983,"-How we think, what we feel. -I'm sorry."
00:17:51.570,00:17:55.824,"So, as our friends in Hollywood say, Let's cut to the chase."
00:17:55.908,00:17:58.327,How are we gonna turn this company around?
00:18:00.621,00:18:08.253,"When Sears decided to go after women in their advertising, and said, Come see the softer side of Sears, their revenues went up 30%."
00:18:08.337,00:18:11.131,Thirty percent. That's huge.
00:18:11.215,00:18:15.427,Female-driven advertising totaled $40 billion last year.
00:18:15.511,00:18:21.725,And Sloane-Curtis' share of that was… Zero.
00:18:22.226,00:18:29.233,"If you want to sell an anti-wrinkle cream or a Ford Mustang to a woman, forgive me, but this is the last place you bring your business."
00:18:29.316,00:18:33.654,And we can't afford to not have a piece of a $40 billion pie.
00:18:33.737,00:18:37.407,"So, I have put together a little kit for everybody."
00:18:37.491,00:18:40.327,Nobody panic. This is supposed to be fun.
00:18:41.245,00:18:47.126,"Every product in this box is looking for new representation, right now, and they're all made for women."
00:18:47.209,00:18:53.132,"I'm pretty sure all the women here are familiar with most of these products, so for the men, let's just briefly run through them."
00:18:55.384,00:18:56.718,"Here you go, Nick."
00:19:01.557,00:19:02.516,Thank you.
00:19:02.599,00:19:19.575,"Each kit contains anti-wrinkle cream, mascara, moisturizing lipstick, bath beads, quick-dry nail polish, an at-home waxing kit, a more wonderful Wonderbra, -a pregnancy test, hair volumizer… -Oh, sorry."
00:19:19.658,00:19:24.913,"…pore cleansing strips, Advil, control-top pantyhose, and a Visa card."
00:19:25.414,00:19:32.171,"Now I want everybody to come up with something for one product, for two, the whole box, whatever moves you."
00:19:34.631,00:19:35.757,and see where we are.
00:19:38.302,00:19:40.929,Great. See you at 8:30 tomorrow morning.
00:19:45.017,00:19:46.268,A nightmare.
00:19:46.894,00:19:51.773,Read my lips… Nightmare.
00:19:56.445,00:19:57.613,That's another 500 bucks.
00:20:01.783,00:20:05.537,"A game of chess, against our old adversary."
00:20:06.580,00:20:08.081,Adversary?
00:20:08.165,00:20:10.417,"Surely, you mean adversary, old boy?"
00:20:11.418,00:20:25.224,"Vinaigrette for arugula salad… You know, women's political caucus… I'd steal her buns if I could."
00:20:30.187,00:20:32.522,Now let's check in on the women's finals.
00:20:34.733,00:20:37.778,There's way too much estrogen on television these days.
00:20:41.198,00:20:47.746,"And as we all know, the perfect antidote for estrogen… is Frank."
00:20:48.330,00:20:49.831,"Oh, I need some Frank."
00:20:54.294,00:20:56.797,"Help me, buddy. Help me now."
00:22:17.502,00:22:19.421,Don't panic.
00:22:19.504,00:22:21.423,This is supposed to be fun.
00:22:23.008,00:22:24.843,"Okay. Okay, I can do this."
00:22:24.926,00:22:26.386,I'm a professional.
00:22:28.805,00:22:30.724,Lipstick. All right.
00:22:30.807,00:22:34.227,"Lipstick on a guy's collar? No, no, women will hate that."
00:22:34.311,00:22:37.147,Lipstick on a guy's collar that won't rub off.
00:22:37.230,00:22:38.732,"No, that's even worse."
00:22:38.815,00:22:41.526,"Okay, okay, okay, I gotta think like a broad."
00:22:41.610,00:22:44.321,"All right, I'm a broad."
00:22:48.366,00:22:54.790,"Mm… On a dark-haired Tahitian beauty, standing under a waterfall, wearing nothing but a thong."
00:22:54.873,00:22:57.626,Water cascading down her back.
00:22:58.293,00:22:59.544,I'm a lesbian.
00:23:00.962,00:23:02.923,"Ah, I gotta change the music."
00:23:06.760,00:23:08.804,"Oh, Alex, thank you."
00:23:11.807,00:23:13.058,"Ah, jackpot!"
00:23:15.685,00:23:18.021,"Oh, she's hot."
00:23:38.667,00:23:39.960,"You go, girl."
00:23:51.304,00:23:52.889,Looks like big dandruff.
00:23:52.973,00:23:55.517,"Smooth, yeah, smooth. Oh, cool."
00:23:55.600,00:23:58.478,"Wow, mascara. Here we go."
00:24:02.274,00:24:04.985,"Mm… Nice, thick lashes."
00:24:05.068,00:24:12.701,"Ow! Ow! Shit, that stings! What the fuck… Okay, fine. Well, I need some anesthetic here."
00:24:23.587,00:24:30.135,"for the piece de resistance, we have… We have the right leg. Yes, excellent."
00:24:30.218,00:24:34.472,"And the hot, hot wax. Very hot wax."
00:24:34.556,00:24:35.807,Here we go.
00:24:35.891,00:24:40.187,"Oh! Jeez! Ooh, that's hot."
00:24:45.025,00:24:52.407,"And next, we immediately apply disposable cloth over the waxed… area."
00:24:52.490,00:24:53.700,Straight ahead.
00:24:54.618,00:24:55.702,Yes.
00:24:56.286,00:25:00.248,"Yeah. It feels kinda nice, yeah."
00:25:00.332,00:25:02.459,I don't know why women complain about waxing their legs.
00:25:03.001,00:25:07.297,"In one smooth motion, yank the strip quickly in the opposite direction of the hair growth."
00:25:07.380,00:25:09.341,"No, no, that would be north."
00:25:09.424,00:25:11.509,"And… one, two, three."
00:25:24.856,00:25:26.566,Women are insane.
00:25:26.650,00:25:28.568,Who would do that more than once?
00:25:29.736,00:25:30.695,I don't know.
00:25:31.321,00:25:33.198,Why would anybody even do the other leg?
00:25:38.870,00:25:40.789,"Ah, yes, that's right, girls."
00:25:40.872,00:25:43.124,Wax it off and cover it up.
00:25:43.208,00:25:48.004,"Yeah. Ally-oop! Ooh, wait."
00:25:49.339,00:25:52.300,"Oh, shit! I guess this takes a little finesse."
00:26:00.725,00:26:02.644,Oh! Ha-ha!
00:26:04.229,00:26:05.563,Okay. Okay.
00:26:11.736,00:26:12.737,Okay.
00:26:18.285,00:26:19.661,Oh.
00:26:21.246,00:26:24.207,"Honey, you just lost yourself five pounds."
00:26:26.668,00:26:28.628,"All right, where's my Wonderbra?"
00:26:28.712,00:26:30.297,Oh.
00:26:34.009,00:26:36.011,-Hi! -What are you doing?
00:26:36.720,00:26:38.013,Exfoliating?
00:26:38.096,00:26:43.184,"-Yo. -You must be, um… Cameron, my boyfriend. This is Nick."
00:26:43.268,00:26:46.896,-Her father. -That's nice nail polish you got there.
