start,end,script
01:22:52.217,01:22:53.802,"Um, I meant to say it."
01:22:53.885,01:22:56.763,"He didn't love it, that I spoke my mind."
01:22:58.848,01:23:02.852,"If you wanna know the truth, I'm not sure he did really love me."
01:23:02.936,01:23:05.730,-Ooh. -Yes. There's a conversation starter.
01:23:05.814,01:23:09.651,God. A smart person would just get so very drunk now.
01:23:10.944,01:23:12.904,How long were you married?
01:23:12.988,01:23:14.864,A little less than a year.
01:23:14.948,01:23:17.450,I've been divorced about nine months now. We worked together.
01:23:17.534,01:23:19.452,"-You know that, right? -Oh, yeah. I knew that."
01:23:19.536,01:23:20.996,-I heard it. -Hmm.
01:23:22.539,01:23:26.668,-What was that like? -It was great in the beginning.
01:23:26.751,01:23:30.046,But it changed. It became competitive.
01:23:30.797,01:23:33.925,"Suddenly, the better I did, the worse we did."
01:23:35.343,01:23:37.345,The price I pay for being me.
01:23:37.429,01:23:39.055,"I know that now. No, truly."
01:23:39.139,01:23:41.516,"-Oh. -No, no, it's true."
01:23:44.144,01:23:46.062,Do you wanna know all this about me?
01:23:46.146,01:23:47.188,Keep going.
01:23:50.316,01:23:54.654,"Well, that's why I needed to get out there on my own, as scary as it was."
01:23:55.780,01:24:02.078,"I mean, not scary, but, um… Well, yeah, I was kind of scared."
01:24:02.787,01:24:05.248,-Why? -I don't know.
01:24:05.331,01:24:08.126,I guess I wasn't sure I could do the job.
01:24:08.209,01:24:13.840,"I mean, I thought I could do it, but I'm finding Sloane-Curtis a much tougher place to navigate than I thought."
01:24:15.550,01:24:16.593,I'm sorry.
01:24:17.844,01:24:19.220,This is insensitive of me.
01:24:19.304,01:24:20.930,-I know you were up for my job. -No.
01:24:21.014,01:24:24.684,-I'm sorry I'm the one that got it. -I'm… I'm not. I'm not.
01:24:24.768,01:24:28.313,-I've learned a lot from you. -Like what?
01:24:28.396,01:24:30.940,"Like what? For starters, you really love what you do."
01:24:31.024,01:24:33.443,-You really love what you do. -Not as much as you do.
01:24:33.526,01:24:35.445,How can you say that? You're so great at it.
01:24:35.528,01:24:37.739,You're so great at it.
01:24:37.822,01:24:41.951,I think Dan's even wondering why he hired me. Really.
01:24:42.035,01:24:44.829,I think the bloom is definitely off the rose.
01:24:47.582,01:24:49.626,You wanna hear something really great?
01:24:49.709,01:24:50.710,Yeah.
01:24:51.628,01:24:54.714,I just closed escrow on my first apartment ever.
01:24:54.798,01:24:56.966,"Finally, I own my own place."
01:24:59.886,01:25:03.223,-What? I wish I was a mind reader. -No.
01:25:04.557,01:25:11.773,I was just thinking… how men like me can get so screwed up.
01:25:14.150,01:25:16.027,I don't think there are men like you.
01:25:17.654,01:25:20.031,"If we kissed, would it ruin everything?"
01:25:22.367,01:25:23.618,Listen to me.
01:25:25.245,01:25:30.250,I think… you are one of the great women.
01:25:30.333,01:25:31.668,I really do.
01:25:40.051,01:25:41.511,I'm sorry.
01:25:43.346,01:25:45.598,But I just meant to say thank you.
01:25:47.725,01:25:49.102,I'm so sorry.
01:26:21.426,01:26:35.565,"Well, I, uh, guess I'll see you… Nick, may I just say… you are an exceptionally great kisser."
01:26:37.901,01:26:39.777,"No, I mean really, really great."
01:26:41.029,01:26:49.746,"Well, I haven't had this much fun making out since… I've never had this much fun making out."
01:26:49.829,01:26:50.955,Me either.
01:26:52.832,01:26:54.667,What do you say we don't let this get weird at work?
01:26:54.751,01:26:55.627,No.
01:26:55.710,01:26:57.503,We have nothing to be embarrassed about.
01:26:57.587,01:27:01.966,We made out. You and I made out.
01:27:03.426,01:27:06.554,"-And if I may, it was… -Sexy as hell."
01:27:07.847,01:27:09.933,God. That's just what I was about to say.
01:27:10.767,01:27:13.561,"Oh, but I think I said it first, I think."
01:27:13.645,01:27:15.563,"-Oh, no, you did. -Oh."
01:27:17.565,01:27:18.942,"Um, well, all right, then."
01:27:30.745,01:27:33.206,Do you want to come back to my place? Say it!
01:27:34.332,01:27:36.626,"Do you want to come-- Good night, Darcy."
01:27:38.253,01:27:39.504,Good night.
01:27:57.563,01:27:58.815,Good night.
01:28:11.953,01:28:13.329,What am I doing?
01:28:26.342,01:28:27.677,Lola.
01:28:30.305,01:28:33.266,It's okay. Okay. Here he comes. Okay.
01:28:34.809,01:28:35.768,Lola?
01:28:37.395,01:28:39.230,I know I haven't heard from you.
01:28:39.314,01:28:41.149,"Lola, how long have you been out here?"
01:28:41.733,01:28:43.609,"Just a few… um, hours."
01:28:43.693,01:28:46.946,"Nick, you said that you wouldn't hurt me."
01:28:47.030,01:28:49.782,"And then you slept with me, and then you didn't call me for six days."
01:28:49.866,01:28:52.702,"So that, in the world of me, that's torture."
01:28:53.745,01:28:58.791,"I mean, we have this totally unbelievable, life-altering sex, and then you just disappear."
01:28:58.875,01:29:01.336,"I mean, you… you stopped drinking coffee!"
01:29:01.419,01:29:04.339,"Lola, I'm so sorry."
01:29:04.422,01:29:05.840,It's okay.
01:29:06.632,01:29:09.093,"It's okay, because I figured out your little secret."
01:29:09.177,01:29:11.637,"-You did? -It's so obvious, when you think about it."
01:29:11.721,01:29:13.806,How else would you know the things that you know?
01:29:13.890,01:29:17.518,"-It wasn't obvious to anybody else. -Nick, come on."
01:29:17.602,01:29:20.980,You're so sensitive. You're so aware of my feelings.
01:29:21.064,01:29:22.523,You're so tuned in.
01:29:23.858,01:29:26.361,"You talk to me like a woman, you think like a woman."
01:29:26.444,01:29:30.448,Nick! Come on! Admit it. You're totally and completely gay.
01:29:32.075,01:29:33.951,-I am? -You're not?
01:29:34.035,01:29:37.205,"Oh! I mean, if you're not, you gotta tell me. You gotta tell me."
01:29:37.288,01:29:40.166,"Because, I mean, based on the other night… Just… Just put me out of my misery."
01:29:40.249,01:29:42.293,Are you or aren't you?
01:29:42.376,01:29:44.962,Say you're gay. Then I'm not nuts. I'm not undesirable.
01:29:45.046,01:29:48.758,Not rejected by another guy! Say it! Say you're gay! Admit it!
01:29:48.841,01:29:49.967,Okay.
01:29:59.143,01:30:00.603,I'm gay.
01:30:02.647,01:30:03.648,How gay?
01:30:05.149,01:30:08.111,Oh! I'm as gay as it gets.
01:30:11.948,01:30:13.783,You're gonna make some guy very happy someday.
01:30:13.866,01:30:15.910,"Oh, from your lips."
01:30:17.578,01:30:20.790,"God, I hate that I'm crying."
01:30:22.041,01:30:24.293,"Well, look it."
01:30:25.336,01:30:30.007,If things should ever change in that department… -You'll be the first to know. -You promise?
01:30:30.091,01:30:33.344,"Oh, yeah, I promise. Come here."
01:30:48.943,01:30:50.194,"Oh, boy."
01:30:55.449,01:30:57.577,"-It was very nice meeting you, Nick. -And you."
01:30:57.660,01:30:59.745,"Thanks for pep talk, yes?"
01:30:59.829,01:31:01.747,You two just take care of each other.
01:31:01.831,01:31:03.749,"-And thanks for the yarmulke. -Oh, no problem."
01:31:03.833,01:31:06.377,"-You wear it well, yes? -Happy trails, kids."
01:31:08.963,01:31:10.298,Darcy!
01:31:12.466,01:31:14.177,I need to talk to you.
01:31:19.265,01:31:22.560,This is not about last night. It's about the Nike meeting.
01:31:22.643,01:31:26.272,And I honestly believe in my gut that you should make the pitch to 'em.
01:31:26.355,01:31:27.273,"Oh, god."
01:31:27.356,01:31:29.317,"-I guilted you into this last night. -No, no."
01:31:29.400,01:31:31.652,"I just think it'd be better all around if you did it, okay?"
01:31:31.736,01:31:33.654,"No, no, no. This is your baby. You've gotta do it."
01:31:33.738,01:31:35.990,I gotta go meet and greet these folks. I'll see you in there.
01:31:37.241,01:31:40.286,"-It's not my baby. -Yes, it is."
01:31:50.129,01:31:51.839,It could be days.
01:31:53.341,01:31:57.511,"And then someone will finally ask, Where's the geek in the glasses who carries all the files?"
01:32:03.476,01:32:06.687,Do either of you two know what the story is on this Erin girl?
01:32:06.771,01:32:08.981,-Miss Lonely Hearts? Who knows? -Yeah.
01:32:09.065,01:32:11.609,"Ooh, I know. She's been here two years."
01:32:11.692,01:32:14.111,"She tried to be a copywriter, but got turned down."
01:32:14.195,01:32:17.198,-So she got stuck as a messenger. -What fool turned her down?
01:32:17.281,01:32:18.908,"You did, sire."
01:32:20.076,01:32:22.578,"Well, did I ever meet with her at least?"
01:32:22.662,01:32:23.496,I don't think so.
01:32:23.579,01:32:26.332,"As I recall, you told me to blow her off."
01:32:26.415,01:32:28.376,"Well, I wanna meet with her now."
01:32:28.459,01:32:30.586,The kid's got something. She's kind of funny.
01:32:30.670,01:32:32.046,"This is your lucky day, pal."
01:32:32.129,01:32:33.965,I just saw the Nike group get off the elevator.
01:32:34.048,01:32:36.759,All women. Your specialty. Come on. I'll walk you up.
01:32:36.842,01:32:38.719,I hate what I'm doing to Darcy. I hate it!
01:32:38.803,01:32:40.846,"I'm gonna write her a long letter, confess everything."
01:32:40.930,01:32:42.598,-You're doing Darcy? Since when? -No!
01:32:42.682,01:32:44.183,I said I hate what I'm doing to Darcy.
01:32:44.267,01:32:46.936,"-Oh, boy. Men are stupider. It's true. -Will you stop it?"
01:32:47.019,01:32:48.562,"-They are. -What do you mean, they?"
01:32:48.646,01:32:50.231,"What, are you officially a woman now?"
01:32:50.314,01:32:52.984,"Oh, I wish. A woman wouldn't have screwed over the woman she loved."
01:32:53.067,01:32:55.278,"No, they don't think that way. And another thing."
01:32:55.361,01:32:57.029,You know this whole thing about penis envy.
01:32:57.113,01:32:57.989,-Yeah. -Not true.
01:32:58.072,01:32:59.573,No. They don't envy it.
01:32:59.657,01:33:00.908,Half of 'em don't even like it.
01:33:00.992,01:33:02.743,You know who has penis envy? We do.
01:33:02.827,01:33:07.581,"That's why we cheat and screw up and lie, because we're all obsessed with our own equipment, that's why."
01:33:07.665,01:33:08.791,-You ready? Okay. -Yeah.
01:33:09.750,01:33:10.710,Thanks.
01:33:16.382,01:33:19.969,and wonder what the road will think of your outfit.
01:33:20.052,01:33:24.265,"You don't have to listen to its jokes, and pretend they're funny in order to run on it."
01:33:25.224,01:33:28.686,It would not be easier to run if you dressed sexier.
01:33:28.769,01:33:31.772,The road doesn't notice if you're not wearing lipstick.
01:33:31.856,01:33:33.566,It does not care how old you are.
01:33:34.275,01:33:38.195,"You do not feel uncomfortable, because you make more money than the road."
01:33:39.155,01:33:46.996,"And you can call on the road whenever you feel like it, whether it's been a day, or even a couple of hours since your last date."
01:33:49.165,01:33:53.878,The only thing the road cares about… is that you pay it a visit once in a while.
01:33:54.962,01:33:57.757,Nike. No games.
01:33:57.840,01:33:59.091,Just sports.
01:34:56.065,01:34:58.692,Why are you not the happiest guy in Chicago right now?
01:34:58.776,01:35:00.694,You just did so great.
01:35:00.778,01:35:06.575,"No, no, I didn't do so great. We did so… No, actually, you did so great."
01:35:06.659,01:35:08.494,"-You. -You, me."
01:35:08.577,01:35:10.996,We did great!
01:35:11.080,01:35:14.166,Will you come with me someplace? I wanna show you something.
01:35:14.250,01:35:16.085,"No, I have something I really need to finish."
01:35:16.168,01:35:17.169,Please?
01:35:18.838,01:35:20.131,Please.
01:35:32.059,01:35:34.061,Okay. Here you go.
01:35:36.772,01:35:38.691,-Come with me. -All right.
01:35:38.774,01:35:41.902,-Should I close my eyes or anything? -No.
01:35:41.986,01:35:45.990,"So, you see those top two floors right there?"
01:35:46.073,01:35:47.116,I do.
01:35:48.784,01:35:51.287,-All mine. -Wow.
01:35:53.372,01:35:54.457,Come here.
01:35:58.961,01:36:16.103,So this is my… living room.
01:36:17.480,01:36:18.981,It's beautiful.
01:36:46.592,01:36:48.093,What are you thinking?
01:36:50.804,01:36:53.182,You've got that look you have sometimes.
01:36:54.141,01:36:57.811,Yeah? No. I was just wondering when you get to move in.
01:37:00.397,01:37:03.859,Okay. This is the dining room.
01:37:05.903,01:37:09.073,-The fireplace works. Come here. -Wow.
01:37:10.491,01:37:11.825,I can see elegant parties in here.
01:37:11.909,01:37:14.828,"Waiters with caviar, you in a beautiful gown."
01:37:14.912,01:37:16.288,You can see all that?
01:37:16.372,01:37:20.084,"Maybe you're naked and I'm the only guest, but it'd still be elegant."
01:37:20.167,01:37:22.294,Okay. So this is upstairs.
01:37:22.378,01:37:25.881,There's a second bedroom or a future office or whatever.
01:37:27.675,01:37:30.719,And this is my boudoir.
01:37:34.890,01:37:37.017,Your boudoir comes with pretty decent music.
01:37:37.101,01:37:38.894,It does.
01:37:38.978,01:37:41.021,Where is that coming from?
01:37:49.697,01:37:51.574,Let's turn up the volume.
01:37:58.163,01:37:59.456,"So, where's your bed going?"
01:38:00.374,01:38:04.003,"Uh, right… here."
01:38:23.689,01:38:28.068,"So, if you had a bed, we'd be dancing on it."
01:38:40.289,01:38:41.373,I like it here.
01:38:43.584,01:38:44.960,"Oh, I like it here, too."
01:38:46.170,01:38:49.173,"No. I mean, I like it here."
01:38:51.467,01:38:52.593,Oh.
01:39:29.004,01:39:30.881,-Dan? I gotta talk to you. -Yeah?
01:39:30.964,01:39:32.174,He'll be there. Bye.
01:39:32.257,01:39:34.343,"I gotta talk to you, too. That was Nike."
01:39:34.426,01:39:36.804,They're gonna announce to the trades that we won the account.
01:39:36.887,01:39:39.682,"I gotta hand it to you. I mean, you… You saved my ass."
01:39:39.765,01:39:40.933,You saved the company's ass.
01:39:41.016,01:39:43.686,"Actually, Dan, I had very little to do with saving anybody's ass."
01:39:43.769,01:39:46.647,"It's Darcy you should be thanking, that's what I want to talk about. Darcy."
01:39:46.730,01:39:49.900,Darcy? Please. I was there yesterday. The girl didn't open her mouth.
01:39:49.983,01:39:52.820,"Look, I'm a big enough man to admit when I screw up."
01:39:52.903,01:39:55.322,I looked at the marketplace and I panicked.
01:39:55.406,01:39:58.659,"Nick, forgive me. I want you to step in here."
01:39:58.742,01:40:01.203,"No, no, no. Dan, you did the right thing when you hired her."
01:40:01.286,01:40:05.249,"I mean, she is the best creative director I have ever seen, bar none."
01:40:05.332,01:40:08.585,"-This isn't about… She's adorable. -Oh, yeah, she is."
01:40:08.669,01:40:11.422,"-But this isn't about that? -No, no. Not like that. No, no."
01:40:11.505,01:40:12.673,Please. Look.
01:40:13.674,01:40:15.884,I've been doing a lot of listening lately.
01:40:17.010,01:40:19.847,"And I've decided, I need to take a leave of absence."
01:40:19.930,01:40:22.391,I need to get away from here and get some perspective on things.
01:40:22.474,01:40:25.519,"What are you, nuts? What is this? What do you mean?"
01:40:25.602,01:40:27.896,This is the biggest account this company has ever landed.
01:40:27.980,01:40:29.982,Do you want me to have nobody running the shop?
01:40:30.065,01:40:31.608,What are you talking about? Darcy's here.
01:40:31.692,01:40:35.320,"You know, for somebody who listens a lot, you don't hear so well."
01:40:35.404,01:40:37.656,I had a meeting with her today. I sat her down.
01:40:37.740,01:40:39.908,"-We had a talk. -Oh, Dan! You didn't."
01:40:39.992,01:40:43.036,-Tell me you didn't fire her. -She didn't even put up a fight.
01:40:43.120,01:40:45.122,"-Oh, Dan, no! -Hey, she's gone, pal."
01:40:45.205,01:40:47.374,"No, no. It's not too late. Look, call her. Call her back."
01:40:47.458,01:40:49.501,"Tell her you need her back, you made a mistake. Hire her back."
01:40:50.085,01:40:52.004,"-Hey, calm down. I can't do that. -Why?"
01:40:52.087,01:40:55.257,Because I talked to the board and I told them I don't need her anymore.
01:40:55.340,01:40:56.842,-Oh! -They offered her a settlement.
01:40:56.925,01:40:57.801,She took it.
01:40:57.885,01:41:00.387,"Besides, Nike says they want you. You're what they bought."
01:41:00.471,01:41:04.558,I got a delivery… Can I… Can I… Would you come out for one second? Let me tell you something.
01:41:04.641,01:41:06.602,My job is to deliver you.
01:41:06.685,01:41:09.813,"Dan, Nike bought an idea. It wasn't even mine."
01:41:09.897,01:41:12.775,Every good idea that they loved yesterday came from her.
01:41:12.858,01:41:17.613,"And if you don't get Darcy McGuire back in here, and I mean pronto, the board is gonna be paying you your settlement."
01:41:17.696,01:41:19.782,"I mean, this is all about saving your ass, right?"
01:41:19.865,01:41:20.741,Save it.
01:41:29.374,01:41:32.711,"Annie, get a hold of Darcy's address and number as quick as possible."
01:41:32.795,01:41:35.798,"-Yeah, sure. -Where's the girl in glasses?"
01:41:35.881,01:41:38.217,Erin? I don't think she's in today.
01:41:44.264,01:41:47.893,-Did she call in sick? -I don't think so. Didn't show up.
01:41:47.976,01:41:49.269,"Oh, where does she live?"
01:41:54.233,01:41:56.819,Where's the geek in the glasses who carries all the files?
01:42:09.373,01:42:12.209,Hey. Yeah. Did you get a hold of Darcy?
01:42:12.292,01:42:16.630,"No? Keep trying. And when you get a hold of her, tell her to stay put."
01:42:16.713,01:42:17.673,I'm coming right over.
01:42:17.756,01:42:19.758,I just have to make a little stop on the way.
01:42:43.532,01:42:45.033,Do you know where this is?
01:42:57.087,01:42:58.171,Down the alley.
01:43:01.216,01:43:03.176,Just down the alley.
01:43:06.096,01:43:07.306,Thanks.
01:43:16.523,01:43:17.816,Whoa.
01:44:18.210,01:44:36.228,"Come on, Erin. Be there. Please… Hello?"
01:45:12.806,01:45:14.349,"No, no."
01:45:19.187,01:45:20.313,Oh!
01:45:27.821,01:45:30.824,Mr. Marshall! Mr. Marshall?
01:45:30.907,01:45:33.076,"Yes, Erin. Yes, it's me."
01:45:33.869,01:45:34.995,I'm sorry.
01:45:35.078,01:45:37.497,I really did not mean to scare you. Okay?
01:45:37.581,01:45:40.125,I just wanted to come and see how you are.
01:45:41.126,01:45:42.252,How are you?
01:45:42.335,01:45:45.464,"Mr. Marshall, if you're here, because I didn't show up today, I'm sorry."
01:45:45.547,01:45:49.342,"I was just about to call. I swear-- No, no, I'm not here, because you didn't show up for work."
01:45:49.426,01:45:54.514,"But I'm here… Well, I… I bet you're wondering why I am here, huh?"
01:45:56.224,01:45:58.101,"As a matter of fact, I was just thinking that."
01:45:58.185,01:46:02.481,"I was thinking, Why is Mr. Marshall here in my bedroom?"
01:46:02.564,01:46:05.984,You were… thinking that just now?
01:46:06.902,01:46:08.945,"Yeah, in my head."
01:46:09.029,01:46:12.032,I must have water in my ears or something.
01:46:12.115,01:46:16.328,"But you're, you know, not thinking anything now, are you?"
01:46:17.412,01:46:19.998,I'm thinking a million things.
01:46:20.082,01:46:21.083,Really?
01:46:21.625,01:46:31.593,"Because, you know, usually I can, uh… I can, uh… You are thinking something right this minute?"
01:46:31.676,01:46:35.597,"Mr. Marshall, I am thinking that you are crazier than I am."
01:46:41.770,01:46:49.778,I think… I think I lost… It's gone.
01:46:53.323,01:46:54.282,I'm back.
01:46:59.454,01:47:00.622,Mr. Marshall?
01:47:00.705,01:47:02.040,Yeah?
01:47:02.916,01:47:06.670,I'm sorry. Is there something I can maybe do for you?
01:47:08.797,01:47:09.923,No.
01:47:11.800,01:47:17.639,"No, Erin, uh… Actually, I came here to see if I could do something for you."
01:47:19.516,01:47:21.643,-For me? -Yeah.
01:47:23.019,01:47:37.242,"See, the truth is… The truth… Erin, the truth is, I'm glad I got here before you did anything to hurt yourself."
01:47:41.913,01:47:46.126,"What makes you think that I would, uh, do something to hurt myself?"
01:47:49.129,01:47:50.380,I just sensed it.
01:47:52.299,01:47:53.425,Really?
01:47:56.011,01:47:57.512,You could sense that?
01:48:03.101,01:48:05.604,"Well, that's not… That's not good."
01:48:09.774,01:48:20.619,"Yeah. But the real reason I'm here is because… Well, here's the thing. The real reason I'm here is because… As you know we have the Nike account, and we have a job opening in our team."
01:48:20.702,01:48:26.917,"And Darcy McGuire and I, we were just discussing, really spit balling on who could be great enough to fill that void."
01:48:27.000,01:48:31.796,"Suddenly, your name popped into my head, and I remembered that you once applied for a job as a copywriter."
01:48:31.880,01:48:34.424,I thought I'd come down here and see if you were still interested.
01:48:35.508,01:48:37.844,Didn't you try and meet with me a while back?
01:48:37.928,01:48:44.226,"Yeah, I tried, but you were unavailable, and then out of town… Well, now I'm available."
01:48:44.309,01:48:51.566,"And as you can plainly see I'm in town, so I'm here to take that meeting if you're available."
01:48:54.819,01:48:56.196,I'm available.
01:48:57.113,01:48:59.824,I'm unbelievably available.
01:49:30.605,01:49:32.732,"I'm not home right now, so please leave a message."
01:49:32.816,01:49:34.859,I'll get back as soon as I can.
01:49:37.195,01:49:39.531,"Darcy? Hi, Darcy, it's Nick."
01:49:39.614,01:49:41.825,"Uh, I'm standing right outside your place here."
01:49:41.908,01:49:44.327,"I sure wish I could find you, get a hold of you."
01:49:44.411,01:49:46.788,Are you all right? I hope so.
01:49:46.871,01:49:49.040,"Anyway, so call me when you get this."
01:49:49.124,01:49:52.419,"On my cell, 5-5-5-1-2-2-6."
01:49:52.502,01:49:54.004,I really need to talk to you.
01:49:54.713,01:49:59.342,Uh… Just making sure you're not there.
01:49:59.426,01:50:02.220,"You're not, right? No, I didn't think so."
01:50:02.304,01:50:05.390,"All right, so call me, please. Please."
01:50:05.473,01:50:06.308,Bye.
01:50:35.211,01:50:38.256,Gigi? Uh… Is everything all right?
01:50:38.340,01:50:41.092,"-Are you back in town already? -No, not until tomorrow."
01:50:41.176,01:50:44.429,Alex called me three times from a pay phone really upset.
01:50:44.512,01:50:46.931,Then we got disconnected. What's the matter?
01:50:47.015,01:50:48.558,Isn't she at the prom?
01:50:48.641,01:50:50.477,Oh! The prom.
01:51:13.833,01:51:16.336,Excuse me. Do you know where Alex Marshall is?
01:51:16.419,01:51:18.546,Little tenth grader? Brown hair? About this high?
01:51:18.630,01:51:21.549,"Yeah, I saw her in the ladies' room. She's been there for, like, an hour."
01:51:27.097,01:51:29.516,"Alex, are you in here?"
01:51:33.728,01:51:35.647,"Alex, it's me."
01:51:37.732,01:51:42.028,"Oh, honey, I just… You know, I can't believe that I screwed up."
01:51:42.112,01:51:44.030,I wasn't there when you left for the prom.
01:51:44.114,01:51:47.951,"Yeah, well, that's not why I'm in here, so you can just go, okay?"
01:51:48.034,01:51:53.498,"Oh, boy, I feel awful. Are you okay? I mean, I… I just… Come on out. Let me see how you look, at least."
01:51:53.581,01:51:56.543,-Come on. -I look like crap!
01:51:56.626,01:51:59.921,I already took my hair out and everything.
01:52:05.009,01:52:07.011,"So, you know, what happened?"
01:52:08.805,01:52:15.228,"Well, if I told you, you'd just freak out, so… What have you got to lose? Try me."
01:52:16.938,01:52:18.064,Okay.
01:52:19.524,01:52:23.987,"Cameron and his friends, they had this big plan."
01:52:24.070,01:52:31.035,They rented this hotel room and… and… It was like a suite.
01:52:32.620,01:52:40.378,"Basically, I promised him that I was gonna… I can't believe I'm gonna say this to you."
01:52:41.421,01:52:46.509,I promised him that I was gonna… sleep with him after the prom.
01:52:50.096,01:52:57.562,"And, like, an hour ago, we were on the dance floor, and I said, I'm sorry, Cameron. You know, I'm just not ready."
01:52:58.146,01:52:59.689,Good. Good girl.
01:52:59.772,01:53:02.233,"-Dad, come on! -I'm sorry, I'm sorry. Go on."
01:53:02.317,01:53:06.988,"Then he goes, Well, the limo, the room, and the tux, it all cost me 400 bucks."
01:53:07.489,01:53:17.832,"And I said, I'm sorry. I'm just not… And he cuts me off and he says, I never should've asked a stupid sophomore to the prom."
01:53:18.625,01:53:20.251,What a waste.
01:53:22.045,01:53:29.135,"Then two seconds later, he goes and meets up with his old girlfriend, and starts making out with her."
01:53:29.219,01:53:32.180,"I mean, this disgusting slut with a tongue ring."
01:53:32.680,01:53:38.061,And then they were laughing and… I just can't go out there ever.
01:53:38.144,01:53:40.188,"-Oh, honey, I'm so proud of you. -Dad!"
01:53:40.688,01:53:43.066,-What are you doing? -I'm sorry. I'm sorry.
01:53:43.149,01:53:44.108,But I am.
01:53:45.193,01:53:48.780,"And believe it or not, I know what it's like to be a woman."
01:53:49.948,01:53:52.033,"I mean, it's not as easy as it looks."
01:53:53.576,01:53:55.203,But you stood up for yourself.
01:53:55.286,01:53:57.413,You know how ahead of the game you are?
01:53:57.497,01:54:02.752,"Anyway, a guy that treats you like that and talks to you like that, -he's not… -Worth my time. Yes, I know."
01:54:03.586,01:54:04.754,It's true. He's not.
01:54:10.718,01:54:12.554,You are so much smarter than me.
01:54:20.812,01:54:22.063,And look at you.
01:54:23.648,01:54:27.151,That clown made out with a girl with a tongue ring over you?
01:54:30.280,01:54:34.242,Honey… you look beautiful.
01:54:38.037,01:54:39.247,Thanks.
01:54:46.254,01:54:47.589,"Take me home, Dad."
01:55:42.852,01:55:45.647,What am I doing? She's not in the refrigerator.
01:56:02.121,01:56:04.666,I wonder if it's too late to go over there.
01:56:04.749,01:56:06.042,"No, it's not too late."
01:56:06.125,01:56:07.919,It's never too late to do the right thing.
01:56:08.002,01:56:09.045,That's what I'll do.
01:56:09.128,01:56:12.173,I'll go over there and I'll do the right thing.
01:56:23.559,01:56:24.560,Hello?
