start,end,script
00:55:53.933,00:55:58.146,I want you to look at these boards for US Air before they come by.this afternoon.
00:55:58.229,00:56:00.190,-Right. -It feels like something's missing to me.
00:56:03.151,00:56:05.361,Feels a bit parochial.
00:56:05.445,00:56:07.447,Maybe it should be in black and white.
00:56:07.530,00:56:16.164,"-What do you think, Nick? -I don't know who you've had, Dan, but, I don't know, it seems kind of… What's the word? Parochial to me."
00:56:16.247,00:56:18.541,"Um, what do you think, Darcy?"
00:56:18.625,00:56:21.377,"I totally agree, especially about the graphics."
00:56:21.461,00:56:24.297,They're parochial. It's so funny you just said that.
00:56:24.380,00:56:25.340,Yeah?
00:56:26.216,00:56:29.260,"And, you know, why don't you get them to try it in black and white?"
00:56:29.344,00:56:30.553,Might punch it up a little.
00:56:32.430,00:56:34.682,What? Did you say something?
00:56:35.767,00:56:39.854,No. I just swear I was thinking the exact same thing.
00:56:44.067,00:56:46.820,"Black and white could really help. Good idea, Nick."
00:56:46.903,00:56:48.947,"Good idea, Nick? Speak up. Quick."
00:56:49.030,00:56:50.740,"-Say something before he leaves. -Uh, Dan?"
00:56:50.824,00:56:51.908,Yeah?
00:56:51.991,00:56:53.618,Want me to take another look at the boards?
00:56:53.701,00:56:55.703,"Once they have another stab at it, give me a buzz."
00:56:55.787,00:56:57.455,"-I will. Thanks, buddy. -Dan?"
00:56:57.956,00:57:08.466,"In case they find Nick's idea too retro, which they might… -Oh, yeah. -…they may think it's old-fashioned… I'd be ready with some… maybe a dot com kind of thing?"
00:57:08.550,00:57:12.637,Maybe there's something about getting online and being online at the airport.
00:57:12.720,00:57:14.764,"No, I think we're fine, really. Really, we're good."
00:57:14.848,00:57:17.016,-I like Nick's fix on this. -Great.
00:57:17.100,00:57:18.393,"Hey, you wanna come by later?"
00:57:18.476,00:57:19.978,"I got a box of new Cubans, just came in."
00:57:20.061,00:57:22.355,-Great. -Cool.
00:57:22.439,00:57:23.898,You smoke cigars?
00:57:25.442,00:57:27.026,No.
00:57:27.110,00:57:29.070,"You know, your office is looking really snazzy."
00:57:29.154,00:57:31.656,-I love the red. -Thanks.
00:57:31.739,00:57:33.950,"Mr. Marshall, your daughter's on line one."
00:57:34.033,00:57:37.745,-Oh. I'm sorry. Would you mind… -Oh. Here you go.
00:57:37.829,00:57:41.332,He has a daughter? Didn't picture that. How old?
00:57:41.416,00:57:43.877,She's 15. She's staying with me while her mom's away.
00:57:43.960,00:57:46.963,-He's married? -Away on her honeymoon.
00:57:47.046,00:57:48.882,"-Oh. -Alex, hi."
00:57:48.965,00:57:50.967,"Uh-huh. Oh, sure, honey. No, that's great."
00:57:51.050,00:57:52.969,Honey? Who are you trying to impress?
00:57:53.052,00:57:55.555,"Okay, look, I'm gonna go out with my friends after school."
00:57:55.638,00:57:58.600,"Then can I bring them back to your place, or will you freak out again?"
00:57:58.683,00:58:00.727,"No, no, no, no. No problem. Whatever you want."
00:58:00.810,00:58:02.520,-What time are you gonna be home? -Wait for me!
00:58:02.604,00:58:03.938,I don't know. I gotta go.
00:58:10.445,00:58:12.697,Total shocker. He's like a nice guy.
00:58:12.780,00:58:16.242,"-Sorry, duty calls. -Oh, of course."
00:58:16.326,00:58:20.079,"-She's 15? -Yeah. Yeah, got a boyfriend that's 18."
00:58:20.163,00:58:22.332,"-And you hate that, right? -Oh! Hate it."
00:58:22.415,00:58:25.460,"Yeah. But she digs him, and he's invited her to the prom."
00:58:25.543,00:58:26.711,"That's a big deal, I guess."
00:58:26.794,00:58:29.506,Going to the prom is mostly about the dress.
00:58:29.589,00:58:31.257,"-You know that, right? -Is it?"
00:58:31.758,00:58:34.469,"Oh, yeah. Once you got the dress handled, it's all downhill from there."
00:58:35.053,00:58:36.471,This feels like a date.
00:58:36.554,00:58:38.765,Why did I go into all that? He needs to go.
00:58:38.848,00:58:40.767,"Well, I'm out of here."
00:58:40.850,00:58:43.394,"Do some research downtown, get inside women's heads."
00:58:43.478,00:58:46.189,"-Well, if you need any help… -I'll be picking your brain."
00:58:46.272,00:58:48.441,-You got it. -I'll take it.
00:58:49.567,00:58:52.362,"Oh, god. Candy."
00:58:52.445,00:58:53.863,She won't last a month.
00:58:57.951,00:59:01.496,-That one's cute. -It's low-cut. I can't wear low-cut.
00:59:02.997,00:59:03.957,It's open.
00:59:10.004,00:59:13.216,"Uh, hi. I'm Alex's dad, Nick."
00:59:13.299,00:59:15.301,-Hi. -Hi.
00:59:15.385,00:59:18.346,-Deadbeat. -Mr. No-Food-in-the-House.
00:59:18.429,00:59:20.598,Forgot her birthday.
00:59:20.682,00:59:22.850,Why is he just standing there?
00:59:22.934,00:59:29.274,"Oh, I just wanted to let you know that I was home, and that I got sort of a date later on tonight, so I'm going out."
00:59:29.357,00:59:30.400,But I'll be home early.
00:59:30.483,00:59:31.859,"Hey, why don't you guys order a pizza?"
00:59:31.943,00:59:33.861,There's not a scrap of food in the joint.
00:59:33.945,00:59:37.574,I also wanted to know if maybe you and I could go out on a date soon?
00:59:37.657,00:59:40.201,I'd like to take you shopping for a prom dress.
00:59:40.285,00:59:42.161,"Oh, that is so sweet."
00:59:42.245,00:59:44.872,I wish my dad would do something like that.
00:59:47.875,00:59:49.127,"First, you throw Cameron out."
00:59:49.210,00:59:51.379,"Now you wanna take me shopping, so I can go to the prom with him?"
00:59:51.963,00:59:53.298,"Well, I overreacted."
00:59:53.381,00:59:56.718,And I just wanna make up for it by taking you shopping.
00:59:57.385,00:59:59.429,"I mean, it's a pretty important thing, you know?"
00:59:59.512,01:00:01.347,They say it's all downhill after the dress.
01:00:04.350,01:00:08.104,"I'll get the most expensive dress, shoes, makeup. He can afford it."
01:00:08.187,01:00:10.565,And what the hell. Let's go crazy.
01:00:10.648,01:00:13.484,"While we're at it, we'll get you new makeup, shoes, the works."
01:00:13.568,01:00:16.988,"-What do you say? -Fine, whatever."
01:00:17.071,01:00:19.657,Whatever meaning yes. Yes?
01:00:21.826,01:00:25.288,Great. Nice to have met you two. I hope to see you again soon.
01:00:25.371,01:00:27.624,"-Definitely. -Bye, Mr. Marshall."
01:00:27.707,01:00:29.125,-Love the apartment. -Great view.
01:00:29.709,01:00:32.003,"Thank you. Oh, okay."
01:00:44.349,01:00:47.894,"I gotta tell ya, I'm not usually like this on a first date."
01:00:47.977,01:00:50.688,It's just… you've been so amazing all night.
01:00:50.772,01:00:56.069,"-You've been so sensitive. -Oh, well… And so understanding and… Hey."
01:00:59.656,01:01:02.116,"-You wanna come up? -Oh, yeah."
01:01:04.911,01:01:07.497,"If I sleep with him, he'll think I'm a slut and never call me again."
01:01:07.580,01:01:11.292,"Or he'll call me all the time, 'cause he'll think he can get it whenever he wants."
01:01:11.376,01:01:14.379,"Oh, what's the difference? He's so incredible!"
01:01:14.462,01:01:16.631,He reminds me of my sister.
01:01:17.382,01:01:22.470,"-So, what do you think? -Well, I… I'll only come up if you really want me to."
01:01:22.553,01:01:25.264,I don't want you to do anything that you're not ready for.
01:01:33.022,01:01:33.940,Whoa!
01:01:34.023,01:01:35.149,What's with the tongue?
01:01:35.233,01:01:36.984,I'm gonna need the Heimlich maneuver.
01:01:38.194,01:01:39.070,Thank you.
01:01:40.196,01:01:41.698,Ooh.
01:01:41.781,01:01:45.118,"-Ouch! That's right, they're attached. -I'm sorry."
01:01:46.244,01:01:48.788,Oh! Now we're talking.
01:01:48.871,01:01:52.834,Uh-huh. Oh.
01:01:52.917,01:01:55.461,Okay. Lied about the grande.
01:01:56.879,01:01:59.799,"Would you mind if we had the lights on, maybe?"
01:01:59.882,01:02:02.593,"-No, you want the light on? -Yeah, it might help."
01:02:02.677,01:02:04.262,"Okay, if it'll help."
01:02:04.971,01:02:07.348,"God, I hope he's better with the light on."
01:02:09.517,01:02:11.018,He's so all over the place.
01:02:11.102,01:02:13.730,"Just do it already, so I can start faking it."
01:02:16.649,01:02:18.735,Is Britney Spears on Leno tonight?
01:02:20.111,01:02:25.032,"-You okay? -Well… Yeah, I'm just fine."
01:02:29.245,01:02:32.290,What… What happened?
01:02:33.082,01:02:40.798,Shaking… Okay. All right.
01:02:40.882,01:02:43.968,"Now, let's pull this together, buddy."
01:02:44.051,01:02:46.763,"I mean, this is what we do."
01:02:48.347,01:02:50.266,-You okay? -Yeah.
01:02:51.017,01:02:52.101,Just regrouping.
01:02:54.812,01:02:57.774,-I can do this better. -Wanna bet?
01:03:00.651,01:03:01.903,Yeah.
01:03:09.952,01:03:13.080,Amazing! Amazing.
01:03:13.164,01:03:18.961,Oh! It was like… you were more inside of me than anybody ever!
01:03:19.962,01:03:21.464,"Well, thanks, doll."
01:03:21.547,01:03:24.967,"-I tried. -No, no."
01:03:25.051,01:03:27.595,"-I mean, more inside my head. -Oh."
01:03:27.678,01:03:31.349,"Like, you knew what I wanted and how I wanted it."
01:03:33.059,01:03:42.401,"We connected in a way that was beyond… beyond… Oh, my heart!"
01:03:42.485,01:03:45.488,My heart is beating so hard.
01:03:47.031,01:03:50.576,"Slow starter, then turns out to be a genius in bed."
01:03:50.660,01:03:55.373,"Ladies and gentlemen, Nick Marshall is a sex god!"
01:03:56.040,01:03:57.750,"Oh, yeah."
01:05:07.987,01:05:09.822,Life. Living it.
01:05:25.004,01:05:36.849,"I just wanted to marry him. I'll be 34, and I want to have kids… Ha! I love it."
01:05:46.901,01:05:48.235,Wait a minute.
01:06:00.873,01:06:02.541,"No, it's great."
01:06:08.756,01:06:11.258,"Okay, that was a… One more. Time for one more."
01:06:11.342,01:06:13.886,"Okay, you know why guys like doing it in front of the mirror?"
01:06:13.970,01:06:16.764,-Why? -Because objects may appear larger.
01:06:18.557,01:06:21.978,"-That's a good one. Anyway. -Oh, that's a good one."
01:06:22.061,01:06:24.397,I heard that in the beauty shop this morning.
01:06:24.480,01:06:26.899,-But seriously. Dee? -Huh?
01:06:26.983,01:06:28.818,That other thing we were talking about before.
01:06:30.277,01:06:37.410,"Come on. I mean, he can't just ignore you all night, stay glued to the TV like some zombie, and then expect you to turn it on like a lightbulb."
01:06:37.493,01:06:39.704,"I mean, I wouldn't put up with that."
01:06:39.787,01:06:42.707,"I mean, you're either interesting or you're not."
01:06:42.790,01:06:44.709,Ask him to decide.
01:06:44.792,01:06:46.711,-Can I write that down? -All right.
01:06:46.794,01:06:50.589,I'm either interesting or I'm not. He'll shit a brick.
01:06:55.886,01:06:58.639,He won't say that you're not.
01:06:59.682,01:07:00.641,Trust me.
01:07:01.642,01:07:03.978,"Okay, I did it."
01:07:04.061,01:07:06.605,I told Chaim I wasn't moving to Israel.
01:07:07.481,01:07:09.900,"Yeah, good. And?"
01:07:09.984,01:07:11.902,I said what you said. He can be a writer anywhere.
01:07:11.986,01:07:14.655,"If I'm going to be in advertising, I need to be here and not there."
01:07:16.782,01:07:18.701,-I don't know. It was in Hebrew. -Ooh.
01:07:18.784,01:07:21.287,"But I don't think it was, You got it. See you next Tuesday."
01:07:21.370,01:07:24.415,I don't know. I'd wait it out. He'll call you.
01:07:27.501,01:07:30.087,Be strong. He will call you.
01:07:31.464,01:07:35.301,"Well, girls, been nice chatting. I gotta get back to work."
01:07:37.928,01:07:40.264,"-Can I make you a sandwich? -No, I'm cool."
01:07:40.347,01:07:41.265,Really.
01:07:42.391,01:07:46.729,"Uh, but thank you, anyway. This was fun."
01:07:53.069,01:07:55.071,More insightful than I would've thought.
01:07:56.447,01:07:59.033,This line doesn't feel exactly right.
01:07:59.533,01:08:02.119,"If you're thinking that line isn't perfect, I agree. It needs work."
01:08:02.620,01:08:04.789,"There's something not exactly right about it, isn't there?"
01:08:04.872,01:08:12.004,"I mean, it's not bad. It's insightful, actually. It's just… Well, what do you think this woman's thinking?"
01:08:12.088,01:08:16.926,"Uh, well, I… Let's see."
01:08:17.802,01:08:20.888,"Uh, she's thinking about what she wants out of life."
01:08:20.971,01:08:23.224,What's she gonna accomplish? How's she gonna do all that?
01:08:24.100,01:08:26.811,"Women, you know, they think about that a lot."
01:08:26.894,01:08:28.604,"I mean, surprisingly a lot."
01:08:28.687,01:08:30.523,They worry all the time about everything.
01:08:31.565,01:08:33.484,You're so right. How do you know that?
01:08:34.568,01:08:36.737,"Well, you know, even I had a mother."
01:08:39.782,01:08:42.618,So maybe running gives her time off from all of that.
01:08:42.701,01:08:46.497,"Maybe, it gives her something she can't get anyplace else. Look at her."
01:08:46.580,01:08:47.706,God. I want to be her.
01:08:48.582,01:08:50.835,"She looks so free, doesn't she?"
01:08:51.335,01:08:56.423,"No one's judging her, no boss to worry about, no guys to worry about, no games to figure her way through."
01:08:56.507,01:08:59.093,I like that. No games. That's good.
01:08:59.176,01:09:00.845,"That'd be nice in life, wouldn't it?"
01:09:02.179,01:09:04.390,"Okay, can I just think for one second?"
01:09:04.473,01:09:06.600,-Take your time. -Okay.
01:09:07.184,01:09:08.310,Okay.
01:09:11.772,01:09:14.692,"She's running. It's early, it's quiet."
01:09:14.775,01:09:17.027,Just the sound of her feet on the asphalt.
01:09:17.528,01:09:20.239,"She likes to run alone. No pressure, no stress."
01:09:20.823,01:09:23.492,This is the one place she can be herself.
01:09:24.785,01:09:27.746,"Look any way she wants, dress any way she wants, think any way she wants."
01:09:28.998,01:09:31.458,"No game playing, no rules. Games, sports, rules."
01:09:31.542,01:09:34.587,"Games, sports, rules. Playing by the rules."
01:09:34.670,01:09:44.138,Playing games versus playing… Playing by the rules. Playing games versus playing… -Why are you nodding? -Because I think you're onto something.
01:09:44.638,01:09:46.307,-Am I? -Aren't you?
01:09:46.390,01:09:49.185,"Well, I was thinking about a play on words."
01:09:49.268,01:09:54.732,Something about games versus… I feel like I was onto something good.
01:09:55.232,01:09:56.442,-Playing games versus playing… -Sports?
01:09:56.942,01:09:59.361,Yes! Thank you. Do you like any of this?
01:09:59.445,01:10:02.865,A lot. I like the idea that you can be yourself on the road.
01:10:02.948,01:10:05.618,"I do, too. Did I say that out loud?"
01:10:06.202,01:10:12.374,"No, I was just… 'Cause I was circling around the exact same thing, -which is great, we're on the same… -Yeah."
01:10:12.458,01:10:14.001,"Sorry, I'm not thinking straight."
01:10:16.086,01:10:19.381,Maybe they should be more swollen. You're doing great. Nike. No games.
01:10:19.465,01:10:20.549,Just sports.
01:10:21.634,01:10:24.011,-Oh. -All right. You should write that down.
01:10:24.094,01:10:25.137,All right.
01:10:26.472,01:10:28.599,"Did he come up with that, or did I?"
01:10:32.186,01:10:37.149,"Boy, can I be… What?"
01:10:38.108,01:10:40.694,"Uh, well, can I be honest with you?"
01:10:41.904,01:10:43.030,Please do.
01:10:43.614,01:10:46.909,"Before I came here, I heard you were a tough, chauvinistic prick."
01:10:46.992,01:10:49.078,I didn't know you were gonna be that honest.
01:10:49.161,01:10:51.121,"-Sorry. I'm… Sorry. -No, that's all right."
01:10:51.622,01:10:54.625,"No, that's okay. You must have looked so forward to meeting me."
01:10:54.708,01:10:58.712,I was dreading it. I had this whole other person built up in my mind.
01:10:58.796,01:11:02.007,"Well, since we're sharing, I heard a few things about you, too."
01:11:02.716,01:11:03.968,"Oh, yes, I'm sure."
01:11:04.051,01:11:06.637,I'm the man-eating bitch Darth Vader of the ad world.
01:11:06.720,01:11:07.638,Verbatim.
01:11:08.681,01:11:11.558,"Really? All right. Well, nice to meet you."
01:11:12.476,01:11:14.812,That's not who I am at all.
01:11:16.105,01:11:19.191,"Just for the record, I don't think that's who you are."
01:11:19.275,01:11:21.193,I don't.
01:11:21.277,01:11:23.362,Thank you. I appreciate that.
01:11:27.992,01:11:31.120,"See, no games equals embarrassing moment."
01:11:31.203,01:11:33.789,Don't fall for a guy at work. Don't fall for a guy at work.
01:11:33.872,01:11:35.624,-Don't fall for a guy at work. -Why?
01:11:37.418,01:11:38.377,Why what?
01:11:38.460,01:11:44.300,"Why won't… Why don't I just work on these story boards, and then bring them back around to you tomorrow if you're free."
01:11:44.383,01:11:46.135,I'm free. Just call me anytime.
01:11:46.635,01:11:48.220,I'm flirting. What's wrong with me?
01:11:49.096,01:11:51.849,"Oh, god! I just looked at his penis. I hope he didn't see me."
01:11:53.434,01:11:55.477,"Oh, shit! I just looked at it again! Stop it!"
01:11:56.895,01:12:00.274,-Are you all right? -Fine. I got something in my eye.
01:12:00.858,01:12:02.693,"All right, um… So, great."
01:12:02.776,01:12:06.405,So tomorrow will be… That'll be great. I'll see you then.
01:12:06.488,01:12:09.575,"-Uh, good work by the way. -You, too."
01:12:09.658,01:12:12.578,"-You sure you're all right? -Yeah, I'm fine."
01:13:24.733,01:13:25.984,You laughing at me?
01:13:26.693,01:13:28.654,-Yeah. -Good.
01:13:28.737,01:13:30.739,I didn't think anyone else was still here.
01:13:30.823,01:13:34.076,-I didn't know anyone was still here. -What time is it?
01:13:34.159,01:13:35.577,It's after ten.
01:13:35.661,01:13:36.912,I didn't realize it was so late.
01:13:38.414,01:13:41.458,Um… I didn't catch that. Sorry?
01:13:41.542,01:13:43.043,I didn't realize how late it was.
01:13:43.127,01:13:47.214,And I'm glad you're here. I'm stuck. I feel so alone.
01:13:47.297,01:13:49.049,You want me to give you a hand with some of this?
01:13:49.133,01:13:50.759,"No, thanks. I'm okay."
01:13:50.843,01:13:53.053,"Yeah, I'm not buying it. What's going on?"
01:13:53.137,01:13:59.309,"Well, I have an early meeting tomorrow with Dan, and I wanted to make it later in the week, so that I could be more prepared."
01:13:59.393,01:14:05.607,"But then I've heard that you slipped in there and took the only time he had left, which left me with 8:15 tomorrow morning."
01:14:05.691,01:14:07.651,It's fine. I'm just not as ready as I wish I was.
01:14:07.734,01:14:09.111,Sorry.
01:14:09.194,01:14:10.737,"Oh, listen. You didn't do it on purpose."
01:14:12.823,01:14:15.159,I just don't want him to be disappointed.
01:14:15.242,01:14:17.494,"Hey, why don't we go through some of these together?"
01:14:17.578,01:14:19.329,-Really? -I insist.
01:14:20.122,01:14:22.624,"-Unless you're too tired or something. -Oh, no."
01:14:22.708,01:14:25.752,"-Mm, I'm not tired. -Yeah, I can see that."
01:14:28.297,01:14:30.424,It's just so far beyond tired at this point.
01:14:30.507,01:14:33.927,I've basically stopped sleeping ever since I took this job.
01:14:34.011,01:14:38.223,"-You have? -Yeah, it's weird. I, um… How do I say this?"
01:14:39.391,01:14:41.393,"You don't feel quite like yourself here, do you?"
01:14:41.477,01:14:45.189,"No, I don't. Not yet, anyway."
01:14:48.817,01:14:50.819,"Plus, I'm mad that I'm getting sick."
01:14:50.903,01:14:52.070,"I never, ever get sick."
01:14:52.154,01:14:54.907,"In fact, you don't have to sit so close to me if you don't want to."
01:14:54.990,01:14:56.950,"No, come here. I'll brave it."
01:14:57.034,01:14:58.911,"So, where do we kick off?"
01:14:58.994,01:15:01.622,-Control-top panty hose? -Okay.
01:15:01.705,01:15:03.957,"Personally, I think they do the trick."
01:15:04.041,01:15:05.792,You've worn control-top panty hose?
01:15:08.420,01:15:11.048,-Did you put a pair in the pink box? -Seriously?
01:15:13.509,01:15:16.386,-You are full of surprises. -Yeah.
01:15:16.470,01:15:17.846,"No, no, no. I mean that as a compliment."
01:15:17.930,01:15:18.931,I love that.
01:15:19.640,01:15:23.060,-And how did you look in them? -Ooh. Hot.
01:15:25.020,01:15:32.152,"My daughter and her boyfriend walked in, and I got 'em on with… And they said what when they saw you in your panty hose?"
01:15:32.236,01:15:34.321,It was the turquoise Wonderbra they noticed.
01:15:34.404,01:15:35.864,"Then, the nail polish."
01:16:03.684,01:16:05.978,-I'm not coming out. -It can't be that bad. Come on out.
01:16:07.020,01:16:08.981,"I look like a nun, an ugly nun."
01:16:09.064,01:16:11.858,Why? Because it's gray? Gray is the new black.
01:16:18.282,01:16:19.491,"Okay, next."
01:16:20.742,01:16:22.035,"This, I love."
01:16:24.663,01:16:26.290,Thank you. Next.
01:17:52.125,01:17:53.335,I think this is the one.
01:17:54.419,01:17:56.421,"I like that. No, I love that."
01:17:58.632,01:18:00.550,Let me take a look.
01:18:00.634,01:18:02.719,Yes! I look older.
01:18:02.803,01:18:06.473,"This is great. Oh, god, I need boobs."
01:18:06.556,01:18:09.142,"Oh, I'll buy a padded bra when he's not around."
01:18:09.226,01:18:12.396,"Oh, I can't believe this is what I'll be wearing the last night I'm a virgin."
01:18:12.979,01:18:14.773,"Or should I say, what I'll be taking off."
01:18:19.611,01:18:22.406,I wanna talk to you about something that's pretty important.
01:18:23.907,01:18:25.534,I've never talked to you about this before.
01:18:25.617,01:18:28.203,"Oh, god. He's actually gonna try to be a dad."
01:18:28.286,01:18:29.579,This should be hilarious.
01:18:30.914,01:18:32.874,I realize I haven't been the perfect dad.
01:18:32.958,01:18:34.668,Understatement of the century.
01:18:34.751,01:18:36.837,"-Can you pass the bread? -Yeah, sure, sure."
01:18:36.920,01:18:53.979,"But that does not mean I don't have the right to talk to you about… about… All right. You're a young woman now, and you may be flirting with the idea of… of… Having sex?"
01:18:54.604,01:18:57.315,"Um, can I get a lemonade, please?"
01:18:57.399,01:19:00.819,"Well, you know, boys and girls think very differently about sex."
01:19:00.902,01:19:05.490,And my hunch is girls just want guys to like 'em and hang out with 'em.
01:19:05.574,01:19:08.326,"Whereas guys… And not all guys, all right?"
01:19:08.410,01:19:12.497,"But most guys, they pretty much just wanna have sex."
01:19:13.540,01:19:22.340,"Okay, I'm… What I'm trying to say here is, I don't want you to feel pressured, -because your boyfriend's older. -Please. Save it."
01:19:22.424,01:19:25.343,"Mom had this talk with me when I was, like, 11."
01:19:25.427,01:19:28.513,I know you're supposed to have sex when you're in love and when it's special.
01:19:28.597,01:19:29.681,I know everything.
01:19:29.765,01:19:36.354,"And Mom knows me for real and knows my friends and knows Cameron, so let's leave the parental talks up to her, okay?"
01:19:36.438,01:19:38.565,Plus I promised Cameron I'd do it prom night.
01:19:38.648,01:19:39.649,"Oh, jeez."
01:19:39.733,01:19:44.613,"And also, let's not make me part of this Nick makeover, or whatever this new thing you're into is, okay?"
01:19:45.447,01:19:47.449,-What new thing? -What new thing?
01:19:47.532,01:19:49.868,This ridiculous new guy you're trying to be.
01:19:49.951,01:19:53.663,Clowning around with me all the sudden? Asking if we can make a salad together?
01:19:53.747,01:19:56.041,Watch Friends together?
01:19:56.124,01:19:58.585,"I mean, it's nuts after 15 years of no relating."
01:19:58.668,01:20:00.921,"I mean, come on."
01:20:01.004,01:20:03.089,Who are you to talk about relationships anyway?
01:20:03.173,01:20:07.636,You never had a real relationship with anyone in your entire life.
01:20:07.719,01:20:10.430,"Look, I'm supposed to meet my friends."
01:20:10.514,01:20:12.891,"-So I'm gonna go, okay? -Sure."
01:20:14.434,01:20:15.894,Thanks for the dress.
01:20:32.786,01:20:35.080,Now you've seen how the cake is assembled.
01:20:35.163,01:20:41.294,"The next time you admire a wedding cake, you'll be able to appreciate… Wow. It looks so gorgeous."
01:20:48.468,01:20:53.431,I always hated being overweight. I always wanted to be thin and pretty and wear cute little clothes.
01:20:56.226,01:21:01.857,And I couldn't walk and I couldn't stand to even stand up at the park for ten minutes while my kids played.
01:21:01.940,01:21:05.443,"I tried sitting on the swings, and the chains cut my hips and it hurt."
01:21:05.527,01:21:08.071,And I couldn't. I couldn't run and I couldn't move.
01:21:08.154,01:21:10.782,And I was tired and I wanted to be a good mom.
01:21:13.201,01:21:15.829,What the hell's wrong with me?
01:21:22.752,01:21:23.628,Darcy?
01:21:23.712,01:21:25.714,How did you know it was me? I didn't say anything.
01:21:27.132,01:21:29.259,"I, uh, just sensed it."
01:21:29.342,01:21:31.678,Shit. I'm such an idiot. I didn't think he'd be there.
01:21:31.761,01:21:34.931,-Excuse me? -I didn't mean to really call you.
01:21:35.807,01:21:39.352,"I had your number here, and I was thinking of you."
01:21:39.436,01:21:41.271,Thinking of calling you.
01:21:44.900,01:21:49.696,"Oh, no, that's all right. I, uh… I was thinking about you, too."
01:22:10.425,01:22:12.636,"Well, here's to another great idea."
01:22:12.719,01:22:14.930,"-What, Let's meet for a drink? -Yes."
01:22:15.013,01:22:18.141,-Yeah? -That's exactly what I wanted to say.
01:22:18.224,01:22:20.393,Sometimes I think you're a bit of a mind reader.
01:22:21.436,01:22:23.647,But I don't have to be a mind reader with you.
01:22:23.730,01:22:25.649,-Hmm. -You always say what you think.
01:22:25.732,01:22:30.654,"-I know. It's a curse. -What… Are you kidding? It's a relief, an enormous relief."
01:22:30.737,01:22:33.490,"Do you know how rare that is, to actually say what you think?"
01:22:33.573,01:22:37.619,Do you have any idea how rare it is for someone to actually like that about me?
01:22:38.620,01:22:41.206,"Trust me, this has not been a great thing in my life."
01:22:42.123,01:22:44.125,My ex-husband didn't love me. Let's just put it that way.
01:22:46.127,01:22:47.212,He didn't love you?
01:22:47.837,01:22:49.130,Did I just say that?
01:22:49.714,01:22:51.007,"Oh, god!"
