start,end,script
00:56:03.193,00:56:04.611,"Evil, dangerous vermin."
00:56:05.696,00:56:07.447,They're the reason we lost the Great War.
00:56:08.490,00:56:11.869,Haven't you been listening to anything Herr Liszt has been telling us?
00:56:12.578,00:56:13.745,No. Not really.
00:56:16.957,00:56:20.043,"Dad's not horrible, is he? He's a good man."
00:56:20.210,00:56:21.378,"Of course, he is."
00:56:22.379,00:56:24.339,But he's in charge of a horrible place.
00:56:25.173,00:56:26.758,"It's only horrible for them, Bruno."
00:56:27.342,00:56:29.887,"We should be proud of Dad, now more than ever before."
00:56:30.095,00:56:31.930,He's making the country great again.
00:57:31.490,00:57:32.866,"Evil, dangerous vermin."
00:58:02.980,00:58:07.150,They wanted someone with tiny fingers to clean all these.
00:58:19.913,00:58:22.124,"We're not supposed to be friends, you and me."
00:58:23.125,00:58:25.836,We're meant to be enemies. Did you know that?
00:58:33.176,00:58:34.302,Do you want some?
00:58:45.313,00:58:47.649,-What's your dad like? -What's he like?
00:58:48.400,00:58:49.568,Is he a good man?
00:58:53.071,00:58:54.531,You've never thought he wasn't?
00:58:57.993,00:58:59.202,And you're proud of him?
00:59:01.329,00:59:02.873,Aren't you proud of yours?
00:59:11.006,00:59:12.841,How dare you talk to people in the house?
00:59:13.216,00:59:15.135,How dare you?
00:59:21.850,00:59:23.894,Have you been stealing food?
00:59:30.734,00:59:31.693,He gave it to me.
00:59:32.986,00:59:33.904,He's my friend.
00:59:36.698,00:59:37.616,What?
00:59:40.619,00:59:44.790,Little man… do you know this Jew?
00:59:46.249,00:59:47.501,Do you know this Jew?
00:59:47.876,00:59:50.670,"No, I just walked in and he was helping himself."
00:59:51.088,00:59:53.131,I've never seen him before in my life.
01:00:02.766,01:00:05.393,"You, finish cleaning the glasses."
01:00:06.728,01:00:10.524,"When I come back, we'll have a little chat about what happens to rats who steal."
01:00:11.483,01:00:12.442,Come away.
01:01:57.797,01:02:00.717,And that there's ample opportunity for leisure also.
01:02:01.176,01:02:09.059,"At the end of their day at the ironmongery, or the build or boot factory, the workers can enjoy the many forms of pastime that the camp has to offer."
01:02:10.560,01:02:12.520,Organized sport is very popular.
01:02:13.146,01:02:15.982,Those that don't play certainly enjoy watching.
01:02:18.401,01:02:26.243,"At the end of the working day, the centrally-located café is the ideal place for friends and families to join together for a hearty and nutritious meal."
01:02:27.744,01:02:31.248,The children in particular enjoy the pastries and cakes on offer.
01:02:39.881,01:02:46.012,"either by visiting orchestras or indeed, by talented musicians from within the camp itself, are always well-attended."
01:02:48.181,01:02:56.106,"Other recreations include reading in the library, pottery, cookery, art, and horticulture for adult and child alike."
01:02:56.731,01:03:00.568,Almost any activity one could wish for is available within the camp.
01:03:22.757,01:03:25.552,-Congratulations. -Thank you.
01:04:07.010,01:04:08.136,"Goodbye, little man."
01:04:55.642,01:04:57.310,Shmuel! Shmuel!
01:05:14.536,01:05:19.082,I don't understand. I saw a film about the camp.
01:05:20.625,01:05:22.293,And it looked so nice.
01:05:29.926,01:05:31.428,I don't know why I did it.
01:05:32.303,01:05:36.891,"Gretel and everyone were saying all these things, and that soldier's so scary."
01:05:42.522,01:05:46.025,"Been coming here for days, but you were never here."
01:05:46.276,01:05:51.197,I thought maybe… we weren't friends anymore.
01:05:59.581,01:06:03.668,"Shmuel, I'm really sorry for what I did. We are still friends, aren't we?"
01:06:37.535,01:06:38.953,I haven't seen him for ages.
01:06:40.580,01:06:41.748,Who's Kurt?
01:06:42.790,01:06:44.042,Lieutenant Kotler.
01:06:45.919,01:06:47.462,He's been moved to the front.
01:06:48.296,01:06:51.883,It was felt that his youth and enthusiasm would be put to better use there.
01:06:52.008,01:06:53.843,"Herr Kommandant, telephone."
01:06:55.178,01:07:01.851,"In actual facts, Gretel, he was sent there because he failed to inform the authorities of his father's lack of loyalty to the party."
01:07:02.060,01:07:04.062,"Which was his duty, I might add."
01:07:04.145,01:07:06.189,-Which was his bad luck. -Bad luck?
01:07:06.314,01:07:10.235,"Well, bad luck that it was his father who was disloyal, and not his mother."
01:07:10.318,01:07:13.112,One presumably doesn't have to report one's mother.
01:07:23.790,01:07:24.666,Mum?
01:07:25.208,01:07:26.417,"Never, stupid."
01:07:31.214,01:07:32.966,It's Father. They've been bombed.
01:07:38.972,01:07:39.889,Grandmother's dead.
01:08:26.227,01:08:48.583,"…The victory which you have obtained for us, and for all who sleep in him, who are still in the body in everlasting fellowship with all that wait for thee on earth, and with all that are around thee in heaven, in union with Him who is the resurrection and the life, who liveth and reigneth with thee and the Holy Ghost, ever one God, world without end. Amen."
01:08:48.708,01:08:51.544,He can't have that on there. She wouldn't have wanted it.
01:08:53.880,01:08:55.089,He does.
01:09:28.081,01:09:33.211,"My grandma and grandpa both died just after we got here, but there weren't any funerals."
01:09:36.214,01:09:38.633,That one there to there.
01:09:41.678,01:09:43.388,They both died at the same time?
01:09:44.514,01:09:45.515,What of?
01:09:47.100,01:09:48.267,I don't know.
01:09:48.351,01:09:50.853,Papa said they must have caught something on the way here.
01:09:52.230,01:09:54.691,They had to go to a hospital as soon as we arrived.
01:09:55.566,01:09:56.734,We didn't see them again.
01:10:03.574,01:10:06.911,"Hmm. Wish we could do something a bit more exciting, though."
01:10:14.585,01:10:15.795,This one?
01:10:17.296,01:10:18.923,"-This one? -No, that one."
01:10:19.549,01:10:22.719,"-This one to here? -No, there!"
01:10:34.564,01:10:36.107,I don't want you to go away again.
01:10:37.817,01:10:39.986,No. Neither do I.
01:11:24.197,01:11:28.785,about my ability to carry out my work if I cannot control my own family?
01:11:37.794,01:11:39.754,Even your own mother couldn't love you.
01:11:50.181,01:11:51.057,Are you happy here?
01:11:53.476,01:11:55.144,Yes. Very.
01:11:58.356,01:11:59.357,"And you, Gretel?"
01:12:01.776,01:12:05.404,"Well, I was, but I do miss home."
01:12:06.030,01:12:09.075,"-I miss my friends. -Yes, I'm sure."
01:12:09.742,01:12:13.329,"And you too, Bruno. You must miss those friends of yours, hmm?"
01:12:13.996,01:12:16.541,"No. Not anymore, really."
01:12:28.511,01:12:37.061,"I suppose the real question is if the opportunity arose, would you prefer to live somewhere else?"
01:12:39.772,01:12:47.321,"No. Not Berlin. Not yet. Somewhere safe. Say, uh, Aunt Lottie's in Heidelberg, for example."
01:12:48.406,01:12:50.533,All of us? You as well?
01:12:51.701,01:12:54.245,"No. That won't be possible just yet, I'm afraid."
01:12:55.037,01:12:56.956,I must stay and complete my work here.
01:13:06.132,01:13:11.220,"She just feels, right now, you need to spend some time elsewhere. Would you like that?"
01:13:22.231,01:13:27.778,"I'm afraid, Bruno, in life, we often have to do things we don't want to do."
01:13:27.862,01:13:33.284,The important thing is your mother does not feel that this is an appropriate place for you to be spending your childhood.
01:13:33.367,01:13:36.829,"And the more I think about it, the more I realize she's very probably right."
01:13:36.954,01:13:38.456,"-But, Dad-- -No!"
01:13:45.546,01:13:47.048,It's time for you to move away.
01:14:13.240,01:14:14.575,Is everything all right?
01:14:18.079,01:14:19.538,We can't find Papa.
01:14:20.122,01:14:24.168,"He went on a different work duty with some of the men, and they haven't come back."
01:14:34.053,01:14:35.638,"I've got some bad news, too."
01:14:36.806,01:14:37.723,I'm going away.
01:14:39.558,01:14:40.810,How long for this time?
01:14:46.607,01:14:50.903,"Mom says this is no place for children, which is just stupid."
01:14:55.741,01:15:00.413,"So, I… I won't ever see you again?"
01:15:03.833,01:15:08.713,"You can come on holiday to Berlin, if you like, when everybody's getting on with each other again."
01:15:14.552,01:15:16.595,I wish I could've helped you find your dad.
01:15:18.055,01:15:20.558,I really want to make up for letting you down like I did.
01:15:21.600,01:15:24.145,"That would have done it, wouldn't it? Helping you find your dad?"
01:15:24.645,01:15:26.564,Would've been great. Like a secret mission.
01:15:32.361,01:15:33.696,I could dig under.
01:15:35.906,01:15:39.410,"-No, but I could bring something. -You don't want to come over here."
01:15:51.255,01:15:52.882,I could come through to your side.
01:15:53.132,01:15:54.216,What's the point in that?
01:15:54.508,01:15:56.469,"Your dad's not going to be over here, is he?"
01:15:58.137,01:16:00.973,"But I'd stick out, though, wouldn't I, if I came through?"
01:16:09.940,01:16:12.109,"If you dressed like me, and shaved your hair off."
01:16:12.276,01:16:14.153,I'm not shaving my hair off.
01:16:14.737,01:16:17.073,You could cover it with a cap.
01:16:17.323,01:16:20.076,-My pajamas are a different color. -I could bring some.
01:16:20.534,01:16:22.578,There's a hut full of them.
01:16:22.912,01:16:25.414,"Thousands of them. Would you do it, though?"
01:16:25.581,01:16:27.917,"-I want to do it. -Would you dare do it, though?"
01:16:28.084,01:16:30.377,-I want to help you find your dad. -I've got to go.
01:16:30.461,01:16:33.672,"Tomorrow, then? I'll bring an extra-big sandwich."
01:16:33.798,01:16:35.633,And don't forget the pajamas!
01:17:41.157,01:17:44.952,"Mum, can I go and play on the swing?"
01:18:24.450,01:18:25.659,I thought you weren't coming.
01:18:26.076,01:18:30.039,I'm sorry. It wasn't easy to get away. I'm not meant to be out here today.
01:18:30.664,01:18:32.082,You forgot the pajamas!
01:18:34.210,01:18:36.879,-Did you bring the sandwich? -Would I let you down?
01:18:39.506,01:18:40.424,Oh.
01:19:12.373,01:19:13.249,Here.
01:19:29.348,01:19:30.266,How do I look?
01:19:38.023,01:19:39.400,Right. Let's get going.
01:19:56.417,01:19:57.293,Bruno?
01:20:30.784,01:20:31.994,Let's go and find your dad.
01:20:38.167,01:20:39.043,Come on!
01:20:39.960,01:20:41.170,Master Bruno?
01:21:34.807,01:21:37.976,-Maybe I should go home. -But what about Papa?
01:21:47.653,01:21:48.612,Yeah.
01:21:52.116,01:21:53.826,We'll check our hut first.
01:21:58.372,01:21:59.248,Bruno?
01:22:06.964,01:22:08.132,Come on.
01:22:21.728,01:22:22.604,Papa?
01:22:47.963,01:22:49.214,Bruno!
01:22:50.591,01:22:52.509,"He must still be outside somewhere, ma'am."
01:23:07.733,01:23:08.775,Bruno!
01:23:11.945,01:23:12.821,Bruno?
01:23:24.791,01:23:26.668,Move! Get up! Quickly!
01:23:36.720,01:23:38.472,-Move them out! -Move!
01:23:52.110,01:23:53.403,would be almost trebled.
01:23:53.612,01:23:59.117,"So, therefore, by the end of the summer-- -Ralf. -Elsa, I'm in a meeting."
01:23:59.910,01:24:00.869,Bruno's missing.
01:24:07.000,01:24:08.001,Come on!
01:24:15.175,01:24:16.176,Wait here.
01:24:40.993,01:24:42.160,Join the queue!
01:24:44.997,01:24:45.998,Move!
01:25:01.555,01:25:03.265,Bruno!
01:25:04.057,01:25:04.933,Move it!
01:25:11.315,01:25:12.274,Bruno!
01:25:22.242,01:25:23.327,It's all right.
01:25:23.452,01:25:26.496,I think we're just waiting in here until the rain stops.
01:25:43.305,01:25:45.140,"No, it's just a shower."
01:26:42.030,01:26:44.282,Move!
01:27:27.033,01:27:27.993,Stop!
01:28:03.069,01:28:04.654,Bruno!
