start,end,script
00:23:32.619,00:23:36.581,The rapper lending his creative mind to an elite credit card for millenials.
00:23:36.706,00:23:39.668,What we're doing with Magnises is growing very fast.
00:23:43.713,00:23:46.425,We were taking in close to $2 million in membership fees.
00:23:48.427,00:23:52.973,"As we kept moving with Magnises, he wanted to penetrate the New York upper class."
00:23:53.181,00:24:04.317,He thought that the Maserati and flying to meetings in private jets were necessary in his pursuit of changing his external image and he thought that image would also be a serious driver for the company.
00:24:07.988,00:24:10.949,and a lot of the members enjoyed being a part of that community.
00:24:12.159,00:24:17.456,"That audience, I think, was the audience that Billy was focused on as far as Fyre was concerned as well..."
00:24:17.664,00:24:20.709,but it was a vision that was so big...
00:24:21.376,00:24:24.087,that it was not something that was going to be easy to pull off.
00:24:29.926,00:24:35.432,"Could you imagine trying to host a music festival, even on Miami Beach or in Boston or LA?"
00:24:35.515,00:24:39.144,Almost impossible without an incredibly big infrastructure.
00:24:39.227,00:24:43.064,"So, dial it up to a small island in the Bahamas."
00:24:43.565,00:24:46.651,It would probably be the most difficult place you could do it.
00:24:47.777,00:24:53.366,"Billy called me and he said, Listen, I need your help and I need you to get to the Bahamas as soon as possible."
00:24:53.783,00:25:01.208,"And I flew in, not in any role, except sort of subtly being the new leader and being kind of..."
00:25:01.875,00:25:03.084,Billy's whisperer.
00:25:05.170,00:25:09.341,"To do a proper music festival, I would say you should try to start the..."
00:25:09.716,00:25:13.470,"the design and the fundraising, everything at least 12 months out."
00:25:13.553,00:25:19.976,The true core team that came in literally had six to eight weeks to build this thing and put it together.
00:25:29.402,00:25:30.654,It's like you couldn't...
00:25:31.112,00:25:34.950,differentiate what was true and what wasn't true.
00:25:36.451,00:25:37.911,I think we chose the right island.
00:25:39.538,00:25:40.747,We got ours for ten million.
00:25:40.956,00:25:43.124,"Freehold land, no lease. We own the land forever."
00:25:43.416,00:25:48.922,"I think it was like, he had to put a million down and then pay the rest by a certain amount of time."
00:25:49.589,00:25:52.008,I don't know if that million was ever paid.
00:25:53.009,00:25:55.637,This was Pablo Escobar's island twenty-five years ago.
00:25:55.762,00:26:02.310,"So we're taking the dream for your average person in America or wherever they are and saying, For three days, you can become Pablo Escobar."
00:26:05.981,00:26:08.483,he was dealing with family members.
00:26:12.612,00:26:15.907,with cocaine drug lords running their drugs through the Bahamas.
00:26:16.783,00:26:20.662,"The owner of the Cay, he wanted a new reputation for his Cay."
00:26:21.121,00:26:26.293,They were told not to use the word Pablo Escobar and then they used that in the first social media tweets.
00:26:26.835,00:26:31.881,The new owner saw the first video promotion and he kicked us off in one shot.
00:26:32.424,00:26:34.259,"Like, no questions asked."
00:26:34.884,00:26:35.927,They were kicked off.
00:26:36.720,00:26:40.724,"Six or eight weeks out, he had to find a new location on a neighboring Island..."
00:26:41.224,00:26:43.268,and then start the whole process all over again.
00:26:44.603,00:26:49.774,"We were constantly trying to move, like, trying to find a new location and trying to find what fits."
00:26:50.400,00:26:52.694,"Man, it just started to get hectic."
00:26:53.111,00:27:01.995,"Then I went to another island, until you finally got to Great Exuma, where it was at least the biggest island in the Exumas so it had, you know..."
00:27:02.787,00:27:03.747,plumbing.
00:27:11.254,00:27:21.473,"American rapper, singer and actor Ja Rule, also known as Jeffrey Atkins, is in the Bahamas with his business partners to discuss the details of a concert next month."
00:27:22.557,00:27:29.773,"Fyre was like the thing of the island. Renting so much, rent-a-cars, big jets are flying in."
00:27:30.482,00:27:33.735,"Everybody was saying, Hey, that's Fyre, they have lots of money."
00:27:33.818,00:27:35.612,They could do anything.
00:27:36.404,00:27:42.786,We hope this is the first of many steps to bring entertainment and bring value back to the Bahamas.
00:27:43.203,00:27:46.706,"I was waiting for some shit like this to happen in the Bahamas, to be real."
00:27:46.873,00:27:51.753,"You know, we never had that many American artists, you know, on one stage."
00:27:52.170,00:27:55.382,"This was supposed to go on for five years, every year."
00:27:56.132,00:28:00.011,"So, if you do good, you were asked for five years."
00:28:00.095,00:28:03.682,"You got the contract, so you wanted to live up to the expectations."
00:28:08.395,00:28:10.063,They let us onto the property...
00:28:10.438,00:28:11.940,and we looked at it.
00:28:12.023,00:28:14.234,And that's when some of the questions started to rise.
00:28:14.734,00:28:15.610,The site...
00:28:16.152,00:28:17.946,was on a hill...
00:28:18.238,00:28:24.994,"and at the base, what I saw was, pretty much, a housing development construction site..."
00:28:25.453,00:28:30.291,that was hazardous in many ways and that needed a lot of work.
00:28:30.667,00:28:34.212,"You know there's going to be hiccups, there's gonna be things to be addressed."
00:28:34.295,00:28:38.216,It's a first-year festival on an island and you find solutions.
00:28:38.299,00:28:43.972,"We said, Here's what you should think about, you know, here's what your tenting is, you know, the geodesic domes..."
00:28:44.055,00:28:45.682,Here's what it's going to cost to set up.
00:28:45.765,00:28:46.766,And...
00:28:46.850,00:28:47.767,away we went.
00:28:51.104,00:28:57.944,What's crazy is they booked the festival during the busiest weekend of the year on Great Exuma.
00:28:58.027,00:28:59.195,It's like the Superbowl there.
00:28:59.279,00:29:08.288,"It's called the National Regatta, and the island basically doubles in population size and all of the hotels get booked months, maybe a year in advance."
00:29:09.372,00:29:18.798,"Billy had sold a villa package, and these people were essentially staying in an Airbnb, so we had to find houses all across the island for 500 guests."
00:29:19.924,00:29:26.097,"To make it worse, they had oversold their Lodge packages, which were these tents on the main site."
00:29:27.182,00:29:31.644,And then the word comes down from the top that all influencers will get housing for free.
00:29:32.979,00:29:34.272,So I start calling influencers.
00:29:34.355,00:29:38.318,I was the first voice that they had heard since they posted.
00:29:38.401,00:29:45.867,"Each influencer, and there were about 250 influencers, were promised, for a post, for one post..."
00:29:46.367,00:29:49.537,"a one-bedroom, three-person villa on the beach..."
00:29:51.372,00:29:52.582,that didn't exist.
00:29:53.958,00:29:55.460,I started talking to Billy...
00:29:55.543,00:30:00.131,"and from the get-go, it was, you know, we were all running around, scrambling, every day to find new houses."
00:30:00.215,00:30:02.634,"We need help from you guys, start to cut people."
00:30:03.009,00:30:05.220,These people aren't paying for the experience.
00:30:06.137,00:30:07.388,Tell them not to come.
00:30:07.597,00:30:12.644,And it was a constant battle because what they cared most about was the influencers.
00:30:13.353,00:30:16.314,So I'm imploring them to cancel paying guests at this point.
00:30:16.397,00:30:23.071,"They're not gonna have a place to stay. And the response from Billy was, We're not a problems focus group. We're a solutions-oriented group."
00:30:23.154,00:30:26.241,We need to have a positive attitude about this. We need a good attitude.
00:30:26.324,00:30:30.453,And he was unflappable but he was also entirely delusional.
00:30:30.912,00:30:38.086,"So it was this constant battle in my mind between, Is this guy a genius or is he a madman?"
00:30:38.253,00:30:42.131,Because he just would not take no for an answer and he wouldn't take advice.
00:30:44.551,00:30:45.510,He's a liar.
00:30:56.563,00:30:58.523,He was running a company called Magnises.
00:30:58.857,00:31:09.492,I had a number of friends then that did get the Magnises card when they started offering access to elite tickets at a cost well below the market rate.
00:31:10.243,00:31:12.078,The whole thing didn't make sense to me.
00:31:13.788,00:31:28.595,"People that I've spoken to that were cardholders recount having their reservations canceled at the last minute, so it seemed very hard for people to actually access any of the benefits that they were promised And so, this guy was always out there, just running hustles..."
00:31:28.928,00:31:35.184,"that were sort of slick, but then not necessarily, in my mind, something that was by the book."
00:31:37.645,00:31:40.940,I vividly remember the Fyre festival video.
00:31:41.608,00:31:50.450,This video was everywhere on Facebook and I see a few of the bands that I actually work with listed as headliners for this festival.
00:31:51.075,00:31:58.458,"So I immediately called the agents and I say, Hey, look, this thing doesn't make sense to me, and they start saying, It doesn't make sense to us either."
00:31:58.541,00:32:02.629,These guys are promising to pay two X what our market value is.
00:32:02.837,00:32:07.592,"I say, Have they sent the money? and they say, Funny that you ask, No, they haven't sent the money for it yet."
00:32:07.675,00:32:09.761,"I say, Okay. This is interesting."
00:32:10.637,00:32:17.393,I take a more active role in investigating everything that was going on with Fyre Festival.
00:32:18.353,00:32:30.615,What I realized was that they had rented an area north of Sandals Resort and then effectively photoshopped out the bottom portion of the map to make it look like they were on a deserted island.
00:32:30.698,00:32:33.493,"I thought, The world's gotta know what's going on."
00:32:33.576,00:32:38.122,"So I create the now-infamous Twitter account, FyreFraud."
00:32:41.417,00:32:49.133,"I thought, Okay, I'm going to put this out there and people are going to see this and everyone's going to know it's bogus, and nothing happened."
00:32:49.217,00:32:53.346,I got maybe two or three clicks on Twitter and that was it.
00:32:53.429,00:32:56.140,"So I said, All right, we gotta hit 'em a little harder."
00:32:57.850,00:33:04.273,What we ended up doing was taking a plane down there and photographing the development and what they were working on.
00:33:05.233,00:33:15.743,One of the things that really struck me was that they were erecting these dome tents that were pitched as luxury villas that I realized were leftover hurricane tents from Hurricane Matthew.
00:33:17.328,00:33:21.749,That is a far stretch from a luxury villa on a deserted island.
00:33:22.333,00:33:28.006,I realized very quickly that there was no way that these guys were going to be able to pull this off.
00:33:37.181,00:33:41.602,"in terms of waste disposal, in terms of restrooms, water."
00:33:42.186,00:33:46.899,"It was a fucking shit show, but we were doing everything that we could possibly do."
00:33:47.191,00:33:50.361,They're frantically building the site.
00:33:51.279,00:33:55.324,"You know, 100 day laborers working around the clock, no sleep."
00:33:55.533,00:33:59.203,"It was just this mass, big crew of local workers."
00:33:59.579,00:34:03.291,"Billy paid them off and then he was like, You know, we need more guys."
00:34:03.624,00:34:04.959,We need more workers.
00:34:05.043,00:34:07.545,Billy paid them for the next three days and then...
00:34:07.628,00:34:10.548,"Billy's like, Bring more workers. We need more workers."
00:34:10.631,00:34:13.301,And then it was starting to get too much for me to handle.
00:34:13.384,00:34:21.309,"They had every living soul on the island of Exuma who could lift a towel, working."
00:34:21.976,00:34:26.147,"My gosh, there had to have been, probably at some point, 200 people."
00:34:26.564,00:34:28.649,I had to feed all the staff.
00:34:28.733,00:34:33.821,"Basically, that was taking on the whole Fyre operation under my wings."
00:34:34.864,00:34:46.501,I'd gone down to the Bahamas with some friends and just coincidentally we actually ran into Ja Rule and Billy down there and then they offered to take us on a little tour of the site.
00:34:47.919,00:34:54.842,"It was beautiful, you know, but it's just like a big giant bluff overlooking the ocean. There are no buildings, there's no..."
00:34:55.426,00:34:59.347,access to electricity or running water or any of that type of stuff.
00:35:00.223,00:35:11.317,"We were just kind of like, concerned, really, there was no infrastructure in place, you know, but at the same time, they sounded fairly confident about their ability to get this thing done."
00:35:16.489,00:35:22.703,"When you guys are not the headlining act at a bigger festival, you guys don't get top of billing. I mean, in our contract..."
00:35:24.747,00:35:27.834,"I understand. I mean, it's a font size."
00:35:29.252,00:35:31.963,You had people working 24 hours a day.
00:35:32.171,00:35:37.635,I had to work basically two days in one because of Fyre Media and then Fyre Festival.
00:35:37.927,00:35:44.058,"I noticed the people that were involved in going back and forth to the Bahamas, in the planning, they were becoming growingly frustrated."
00:35:44.142,00:35:47.436,"They would come to me and like, What are you working on with the booking platform?"
00:35:47.520,00:35:53.151,I can't wait to get back on this side of the business because the festival stuff is just becoming chaotic.
00:35:53.317,00:35:59.907,"We just knew very little about what was happening on the festival side, except, you know, the persistent feeling of growing dread."
00:36:00.074,00:36:02.952,"Every single day, it got endlessly more tense."
00:36:03.161,00:36:12.795,"We would be at standstill sometimes for weeks not being able to get that final sign off or move through on things because he was completely, you know, succumbed to the festival needs."
00:36:13.296,00:36:16.465,Spending money at an outrageous cost and speed.
00:36:16.674,00:36:24.640,"I wasn't sure if it was startup woes, just like unorganization, or if it was actually financial trouble, but sometimes payments would be late."
00:36:25.766,00:36:31.147,"Friday afternoon, our favorite topic is, Did you get paid and was it for the right amount?"
00:36:31.772,00:36:36.777,"and Michael once was like, Yeah, I got paid, but it was in a bag of cash."
00:36:40.698,00:36:43.034,but Billy handled all the finances.
00:36:43.784,00:36:47.872,"At that point, Billy had said, Listen, we're into this for 25 million bucks."
00:36:47.955,00:36:50.333,"I'm like, Oh, my gosh, Billy, jeepers."
00:36:51.500,00:36:57.048,"The word from people that knew Billy was that he was a magician fundraiser and he just kept pulling money in, somehow."
00:37:01.135,00:37:07.183,and somehow have another three million bucks in his pocket to pull off the next level of needs.
00:37:11.520,00:37:13.189,She was a big believer in Billy.
00:37:13.439,00:37:17.735,"She was there from his earliest venture, Magnesis, and then Fyre."
00:37:18.152,00:37:24.617,"She had always been around, always supporting this kid and always believing in his ability to become the next big entrepreneur."
00:37:24.951,00:37:28.120,"We can figure out how to make an extra three, four, five million dollars."
00:37:28.663,00:37:37.296,"Whether it's higher-tier artist passes, food and alcohol passes, VIP party passes, the Kendall Jenner yacht party for $10,000 a head for 100 people."
00:37:37.380,00:37:46.973,"Billy had a vision, you know, and he was definitely thinking of every little twist that he could come up with to raise the money to make it happen."
00:37:47.056,00:37:52.645,"There's two things going for us: one, an audience who has cash, and us, we have the celebrity, we have the island."
00:37:52.728,00:37:55.231,"There's ways we can monetize both, we're gonna make that happen."
00:37:55.314,00:38:00.987,"I overheard a conversation, Let's put up a cabaña for $50,000 and see if anyone buys it."
00:38:01.821,00:38:03.990,"And I remember thinking, Do you have a cabaña to sell?"
00:38:04.073,00:38:10.454,Because I'm feeling concerned that you're not thinking about that before you are putting it live on the site for someone to buy.
00:38:22.008,00:38:25.386,And the site's sole purpose was to destroy this festival.
00:38:25.803,00:38:30.808,It was getting fed direct information and photos of the site that was totally unfinished.
00:38:31.267,00:38:36.522,News that was happening by the day that only pretty senior people in the festival knew what was happening.
00:38:39.984,00:38:45.364,"We were having these confidential meetings and then things from that meeting were actually getting out, word for word."
00:38:46.824,00:38:49.410,So we knew someone actually in the meeting had been wired up.
00:38:49.702,00:38:54.874,So we were all called to the war room to have a meeting and it was basically a witch hunt meeting.
00:38:55.166,00:39:06.927,"It was, If you are the person or people that are sending this information to this website, we will pursue legal action, you will leave this island, you will not get paid and we'll come after you."
00:39:07.345,00:39:10.639,The guy that put together Fyrecay was extorting Billy.
00:39:11.057,00:39:12.892,Billy wanted him to take the website down.
00:39:12.975,00:39:19.315,He said he would only do it if the Fyre Festival started releasing actual photos of the campsites.
00:39:19.398,00:39:26.947,"And I just kept saying to Billy, We need to get the messaging out now that this is not a luxury music festival."
00:39:27.031,00:39:34.705,"People aren't staying on yachts, at least, most aren't, many are not staying in villas and if you can get that messaging out now, we will be able to manage expectations."
00:39:36.999,00:39:39.335,and people will make their own decisions on it.
00:39:39.418,00:39:40.961,But you have got to be honest.
00:39:41.045,00:39:43.506,"Here's what it is. Here's the tents, you know?"
00:39:43.589,00:39:47.676,"People are going to find out sooner or later, so, like, why are you walking around..."
00:39:48.719,00:39:50.304,trying to dodge the inevitable?
00:39:57.144,00:40:00.064,"We're, like, going to the gym, having this grand old time."
00:40:00.815,00:40:04.318,We would go on these jogs every morning to get ready for Fyre Festival.
00:40:04.402,00:40:07.822,"Like, powering around town. We're going on this great vacation."
00:40:07.905,00:40:09.323,We're going to have such a blast.
00:40:09.407,00:40:11.534,We're going to meet all these people and have this...
00:40:11.617,00:40:13.786,just truly fantastic experience.
00:40:13.869,00:40:15.538,"I mean, it was so exciting."
00:40:21.836,00:40:24.672,I noticed you hadn't created your Fyreband account yet.
00:40:24.755,00:40:27.716,"It is your wallet for the weekend, so load it appropriately."
00:40:27.800,00:40:31.470,"The majority of our guests have added $3,000 for the weekend."
00:40:31.929,00:40:38.519,"But if you want to reserve tables or take part in the add-on experiences, you will want to put on much more."
00:40:38.602,00:40:44.150,Billy wanted the engineers to set up payment through this RFID bracelet.
00:40:48.737,00:40:50.739,"I mean, this was never tested out."
00:40:54.076,00:40:55.911,for our festival attendees.
00:40:55.995,00:40:58.998,"It was, We can't put on the Fyre Festival because we don't have any money."
00:41:00.291,00:41:09.592,"I received a call from a woman asking me, I would say, very aggressively to put money on my wristband."
00:41:09.675,00:41:13.554,"They wanted you to buy jet ski things, a private plane."
00:41:16.223,00:41:18.100,The first batch of kids had loaded...
00:41:19.852,00:41:23.189,"$800,000 on these wristbands."
00:41:23.272,00:41:28.194,"You know, you've spent all this money on a ticket, and now the same amount of money on the wristband, it seemed..."
00:41:28.277,00:41:29.278,sort of peculiar.
00:41:36.202,00:41:43.959,"They didn't have enough tents and 350 people would have nowhere to stay and by the way, houses that we sourced weren't getting paid."
00:41:46.212,00:41:49.298,So this was now becoming clear that there wasn't any money.
00:41:49.590,00:41:52.635,"Because homeowners were like, You sent me a wire..."
00:41:53.010,00:41:55.387,five days ago and I haven't received any funds.
00:41:55.596,00:42:03.562,"I had an explicit phone call from one of the management team to stop telling Carola about the housing situation, because they were trying to get more money from her..."
00:42:04.104,00:42:06.106,and that my emails were alarming her...
00:42:06.482,00:42:09.151,and they outright told me to be dishonest.
00:42:10.569,00:42:19.119,"And you have to realize I got paid 30% of my fee, so they're hanging-- My fee's not due until the day of the event, so they're hanging 70% of my fee over my head like a carrot."
00:42:22.706,00:42:24.792,"Every hour, something else would happen."
00:42:25.376,00:42:27.127,"Every minute, there'd be another obstacle."
00:42:27.836,00:42:34.301,We had a $6 million contract with Star Catering to handle all the food service and we only had $1 million allocated.
00:42:34.385,00:42:36.178,And Billy fired them over the phone.
00:42:36.262,00:42:39.306,And then he hung up the phone. I stood there and he said...
00:42:40.266,00:42:41.559,Can you salvage this?
00:42:41.642,00:42:44.395,"And I said, Oh, my gosh, I have two weeks to come up..."
00:42:44.728,00:42:48.566,"with food service for 6,000 kids? This is going to be fascinating."
00:42:50.025,00:43:03.247,"Grant, who was on the call, pulled out the proposal from Star and said, I told them I wanted sushi chefs coming in, and, I needed to see Indian cuisine, and I thought, Gosh, Grant, you've missed the boat here."
00:43:03.497,00:43:08.669,"We are not spending $6 million, we can only spend $1 million and I'm eliminating all of that."
00:43:11.880,00:43:16.051,"At this point in time, there had been no progress pictures, no updated videos."
00:43:16.760,00:43:25.102,They were using the same footage and photographs from that first promotional video in all of the subsequent promotional content.
00:43:25.269,00:43:31.275,"The media and marketing companies in New York, we didn't have any visibility into what was happening on the production side."
00:43:31.859,00:43:36.822,We're building out this vision that was based around this kind of visual facade.
00:43:41.660,00:43:44.079,that we had signed up for got taken off the page.
00:43:44.413,00:43:51.420,"That was sort of when we started trying to dig a little bit more and see, Oh, can you send us pictures of the accommodations?"
00:43:51.712,00:43:55.758,You had people asking very legitimate questions on Instagram.
00:43:56.342,00:43:59.762,"They were trying to book flights, trying to understand logistics."
00:44:04.558,00:44:09.355,"Grant was trying to use our employees for customer service, but that wasn't what we were hired to do."
00:44:09.980,00:44:16.654,"The only thing we could do was to just keep telling people, Email concierge@fyre.com."
00:44:16.862,00:44:20.908,"And then we would get another request saying, concierge@fyre.com didn't respond."
00:44:22.368,00:44:25.204,The unanswered questions turned to people criticizing...
00:44:27.498,00:44:29.375,"I was like, This is terrible customer service."
00:44:29.458,00:44:33.045,They need to know better. They're throwing this luxury festival...
00:44:36.173,00:44:37.675,These comments are killing us.
00:44:37.758,00:44:40.260,What do we do about all the people that are talking shit?
00:44:41.220,00:44:51.980,The decision was to screenshot all of the legitimate questions and forward that over to the Fyre team and then delete all of the negative comments that were degrading the brand.
00:44:52.690,00:45:04.034,"I saw them actively deleting comments and then turning comments off entirely so that you wouldn't have 3,000 people saying, Hey, I don't have my flight information. Where do I need to go?"
00:45:12.751,00:45:15.754,So as me and Billy was riding back towards the site...
00:45:17.297,00:45:21.051,"You know, he was like.... Kinda like panicky look, you know?"
00:45:21.552,00:45:26.140,"So he's like, What do you think? You think we can get this done?"
00:45:26.348,00:45:27.725,"I said, What do you mean?"
00:45:27.808,00:45:30.644,You think we can get everything done before Thursday?
00:45:31.395,00:45:32.229,So...
00:45:32.354,00:45:37.776,"Me saying to myself right there, I say, You want to lie to him or you just want to speak the truth?"
00:45:37.860,00:45:43.282,"'Cause sometimes the truth can come pretty, and then sometimes the truth can just come ugly."
00:45:43.449,00:45:48.412,"So, I was like, Billy, being honest, I think we could do it."
00:45:48.495,00:45:55.169,But we need some more time. We need to do some overtime and we need to just push... We need to do more hours.
00:45:59.673,00:46:02.426,"Okay, should we pull the plug or should we keep this thing going?"
00:46:02.509,00:46:07.055,"And every day, Billy would say, We can't pull the plug. We've got to keep this thing going."
00:46:07.139,00:46:10.934,"You can't have people come, this is not going to work."
00:46:11.018,00:46:13.145,Verbatim. It was like...
00:46:13.228,00:46:15.105,"If you want to leave, you can leave."
00:46:15.272,00:46:18.358,"If you're not going to leave, we're here to find solutions."
00:46:18.442,00:46:25.365,"And I would step outside, right after each meeting, literally go out on the porch and burst into tears."
