start,end,script
00:46:25.741,00:46:30.996,"Never in my career did I ever do this, but there I would be, thinking, Holy shit."
00:46:33.665,00:46:35.334,"Guys, we're running out of time."
00:46:35.417,00:46:39.129,"I've tried to warn you multiple times, but my words have fallen on deaf ears."
00:46:39.713,00:46:45.219,"We are one day out without enough beds to safely house our staff, our VIP guests and our paid customers."
00:46:45.594,00:46:48.388,"You need to cancel more guests, immediately."
00:46:48.472,00:47:08.784,"I was basically like, I know that you're worried about press blowback, but imagine a scenario where 350 people arrive onto a remote island, are herded onto yellow school buses, brought to a festival site that's unfinished and realize they've no place to sleep and to make it worse, they have no way to get home, because we don't have any charter flights booked back for them."
00:47:08.867,00:47:13.247,"I know you're worried about the press, but there's no worse situation than that."
00:47:13.914,00:47:15.040,And the response?
00:47:15.541,00:47:19.586,"The response was, At least they'll see your smiling face and yoga skills."
00:47:21.338,00:47:23.882,'Cause I was supposed to be the yoga instructor for the event.
00:47:25.259,00:47:26.260,Okay.
00:47:26.385,00:47:28.720,"Like, what am I supposed to do? You know? Like, I'm..."
00:47:30.472,00:47:31.431,"All right, sure."
00:47:37.312,00:47:48.907,Billy was under such immense financial pressure that he effectively had to put this festival on because otherwise he wasn't going to be able to repay any of the factor receivables that he had raised money from.
00:47:49.575,00:47:52.953,It's the same thing as an individual going to a loan shark.
00:47:53.537,00:47:56.498,"No matter what happened, this money was going to be owed."
00:47:57.541,00:48:04.548,"They had told investors who had already given money that, in the event of a cancellation, that they would be covered when in fact they weren't."
00:48:04.631,00:48:08.552,"And they didn't have festival insurance, so canceling really wasn't an option."
00:48:12.306,00:48:14.099,And events always feel like a disaster.
00:48:14.182,00:48:17.352,They always feel like everything's going wrong and you're putting out fires.
00:48:18.061,00:48:23.525,"The draw, the appeal was to be part of creating something that was special."
00:48:23.609,00:48:29.114,"And that desire overcame my inner wisdom, which was like, This is a mess."
00:48:29.823,00:48:32.701,The atmosphere that was cultivated there was that...
00:48:33.076,00:48:38.290,"nobody, no matter what, was able to cross them and tell them, No."
00:48:38.916,00:48:47.341,"Had we not pulled off these kind of crazy things like Andy finding this caterer with no time left, then there would've been no festival."
00:48:47.841,00:48:55.015,"It's possible that by solving problems, we were just enabling them to continue to create this monster."
00:49:03.690,00:49:04.608,"Oh, yeah."
00:49:05.609,00:49:07.778,Did Andy tell you how they had to get the water out?
00:49:08.320,00:49:09.154,Yeah.
00:49:09.821,00:49:12.783,"It was, like, fucking crazy."
00:49:15.786,00:49:17.621,Let me tell you something. We had...
00:49:17.704,00:49:19.998,four containers filled...
00:49:20.082,00:49:28.423,"Four 18-wheeler trucks filled with Evian water, but I had left the week before for two days to go to meetings in Bermuda for the America's Cup."
00:49:28.507,00:49:40.477,"And when I came back, I'd missed the big meeting with Customs, and of course Customs had said to Billy and the gang, You need to pay us $175,000 in cash today for us to release the water."
00:49:41.728,00:49:42.729,I went down.
00:49:42.980,00:49:44.106,"Well, Billy called me."
00:49:44.272,00:49:46.483,"I'm gonna speak completely, you know..."
00:49:46.817,00:49:49.069,"This won't go that far, I'm sure, but..."
00:49:49.277,00:49:52.614,"Billy called and said, Andy, we need you to take one big thing for the team."
00:49:52.739,00:49:53.740,And I said...
00:49:54.449,00:49:56.868,"My gosh, I've been taking something for the team every day."
00:49:56.952,00:50:03.709,"He said, Well, you're our wonderful gay leader, and we need you to go down. Will you..."
00:50:04.251,00:50:05.085,suck...
00:50:05.544,00:50:06.503,dick...
00:50:07.170,00:50:08.922,to fix this water problem?
00:50:09.006,00:50:22.269,"And I said, Billy, what? And he said, Andy, if you will go down and suck Cunningham's dick, who's the head of Customs, and get him to clear all of the containers with water, you will save this festival."
00:50:22.352,00:50:28.775,"And I literally drove home, took a shower, I drank some mouthwash."
00:50:28.859,00:50:34.948,"I'm like, Oh my gosh, I'm really... And I got into my car to drive across the island to take one for the team..."
00:50:35.323,00:50:39.202,"and I got to his office, fully prepared to suck his dick."
00:50:39.953,00:50:52.549,"He couldn't have been nicer. He's like, Andy, listen, I will release all the water, I will let you serve it, but I want to be want to be one of the first people to be paid this import fee for what you're doing, and I said, Okay, great."
00:50:52.632,00:50:55.969,And I got back and I had all the water that we needed.
00:50:58.013,00:51:03.351,"Can you imagine, in my 30 years of a career, that this is what I was going to do?"
00:51:03.435,00:51:06.688,"I was going to do that, honestly, to save the festival."
00:51:08.398,00:51:16.031,"Major news in the vlog today. Tomorrow morning, 5:30, half of the Jerry Media crew is going to Fyre Festival in Bahamas on a remote island."
00:51:16.114,00:51:19.701,"We've been doing their marketing for the last couple of months, so excited to see this thing take off."
00:51:19.785,00:51:21.203,I think it's going to be f... epic.
00:51:22.621,00:51:27.000,We went down with about four of the teammates the day before the festival.
00:51:27.292,00:51:30.295,"Mick, the good news about this plane? If we want to leave, just..."
00:51:30.670,00:51:32.798,take the window off and just head out.
00:51:32.881,00:51:34.925,This is great. This is a great flight.
00:51:35.008,00:51:38.386,"I remember the feeling, getting off the plane, we were so excited."
00:51:38.470,00:51:40.180,"Finally here, this is happening."
00:51:41.765,00:51:43.892,There's literally no cars on the island.
00:51:43.975,00:51:47.270,"We couldn't rent one. They didn't hook us up with one, so..."
00:51:47.521,00:51:50.732,this is us. We're hitch-hiking for the next couple of days.
00:51:50.941,00:51:56.279,"I was down there yesterday and I said, Man, this ain't gonna be finished for no Friday."
00:51:56.613,00:51:58.907,"So much work, so much things!"
00:51:59.658,00:52:00.992,And so little time.
00:52:01.493,00:52:03.620,"So, none of this was here. All this sand is new."
00:52:05.956,00:52:07.457,...a few days ago. Can you?
00:52:12.629,00:52:17.551,"We all know now that this is an inevitability, that this event is going to happen, no matter what."
00:52:18.009,00:52:21.471,I'm working with this Navy SEAL who's telling me this is like a clusterfuck.
00:52:21.596,00:52:24.224,That's what he called it. An elephant of a clusterfuck.
00:52:24.307,00:52:31.148,"He's laughing and not even laughing, just disturbed at how fucked up this is and..."
00:52:31.731,00:52:34.359,"and he's a Navy SEAL, like, come on!"
00:52:34.442,00:52:37.237,The last 24 hours were unbelievable.
00:52:37.320,00:52:39.990,All I kept thinking about was Woodstock.
00:52:40.407,00:52:42.200,Think of that music festival.
00:52:42.284,00:52:47.706,Does anybody talk about the hundreds and hundreds of cars that were stuck on the thruway for days?
00:52:47.956,00:52:50.041,Does anybody talk about the mudslides?
00:52:50.625,00:52:54.713,How many people died of drug overdoses? Does anybody talk about the lack of food?
00:52:54.796,00:52:55.797,Almost no water.
00:52:55.881,00:52:58.383,"Absolutely not. And I thought, You know what?"
00:52:58.466,00:53:06.641,"If Woodstock could get through that and, from a publicity perspective, land where it did, FyreFestival can make it."
00:53:07.642,00:53:09.811,"Well, actually we didn't sleep that night."
00:53:09.895,00:53:13.064,"'cause I remember exactly what happened, so..."
00:53:13.148,00:53:21.364,"we're standing outside on the porch of this mansion, looking out at the ocean and it's a full moon or something and it starts..."
00:53:21.448,00:53:23.158,pouring rain.
00:53:24.451,00:53:25.535,Pouring rain.
00:53:26.411,00:53:27.537,Thunder and lightning.
00:53:28.705,00:53:30.290,And we just start laughing.
00:53:31.166,00:53:33.210,"Like, belly laughs..."
00:53:34.753,00:53:37.005,and look at each other and...
00:53:37.589,00:53:47.307,"To this point, I'm so delirious that I still am not sure that this is 100% entirely true, but I remember one of our group saying, At least they won't get away with it now."
00:53:47.766,00:53:52.103,I honestly remember that and I don't know that that's-- But that's what I remember.
00:53:53.146,00:53:55.565,So you have to realize the site's unfinished.
00:53:55.815,00:53:59.361,There's mattresses all over the place getting soaked.
00:53:59.903,00:54:02.781,Any tent that was done is now unlivable.
00:54:03.156,00:54:04.783,And the guests are still coming.
00:54:05.200,00:54:06.826,And we have nowhere to put them.
00:54:09.829,00:54:13.083,Because I know the work we had done that morning and...
00:54:14.084,00:54:15.252,I could have cried.
00:54:18.421,00:54:23.718,"The other funny thing that happened was we were laughing and we were like, Well at least nothing is on time in the Bahamas."
00:54:23.802,00:54:25.679,At least this rain... The guests will be late.
00:54:25.762,00:54:29.140,"They were supposed to come at 6:50, the first flight got there at 6:20."
00:54:29.224,00:54:30.433,It was like a sick joke.
00:54:31.893,00:54:32.894,So...
00:54:39.901,00:54:41.486,"Fyre Festival, baby. Here we go."
00:54:42.988,00:54:44.781,About to go to...
00:54:45.573,00:54:46.533,Miami.
00:54:46.616,00:54:49.828,"Miami for, like, four hours. And then where are we going?"
00:54:50.120,00:54:52.163,-Bahamas. -Bahamas.
00:54:52.247,00:54:53.540,"Check out my ice, baby."
00:54:54.124,00:54:56.835,"Bahamas. We're coming for you, baby."
00:54:57.502,00:55:00.714,We are here in the... private jet.
00:55:01.089,00:55:07.095,"We thought we were going to get on one of those propeller planes, like a tiny little propeller plane that was in all of the video footage."
00:55:07.178,00:55:11.433,I didn't realize what plane we were going to be on until we were boarded.
00:55:11.516,00:55:13.101,"And, I mean, it was like a 737."
00:55:13.184,00:55:19.024,"My understanding, it was supposed to be this branded jet experience, which I think was a..."
00:55:22.193,00:55:25.322,"Oh, let's slap a logo on it and call it a day type of thing."
00:55:25.822,00:55:28.408,"It's actually worse than, like, really..."
00:55:28.491,00:55:31.661,Like being low economy class.
00:55:34.164,00:55:38.752,"and that's when my friend looked at his phone and said, Blink-182 just pulled out."
00:55:38.835,00:55:41.129,Do you still want to get on the plane?
00:55:41.212,00:55:45.258,"And their reasoning wasn't anything like, Don't go, it's a disaster."
00:55:45.342,00:55:49.512,"It was just like, We don't think we can put on the show that our fans would deserve."
00:55:49.596,00:55:52.640,I've never been to a Blink-182 concert so I don't even know what that means.
00:55:52.724,00:55:55.268,"So we were like, It will be fine."
00:56:03.735,00:56:05.236,"Still, nothing seemed amiss."
00:56:05.320,00:56:07.280,I do remember being presented a choice.
00:56:07.364,00:56:11.993,"Do you want to go to the campsite or do you want to go to this restaurant, this beachside restaurant?"
00:56:12.077,00:56:21.961,"An executive decision was made, I don't know by who, but it was to essentially close down the campsite and to reroute all of the new attendees to a separate bar."
00:56:22.420,00:56:29.094,"It was never planned. I knew of it, like, maybe 25 minutes to them coming down to the restaurant."
00:56:29.469,00:56:32.889,"Tons of buses, bussing in hundreds of their guests."
00:56:32.972,00:56:35.683,"And they were asking, Is this the Fyre Festival?"
00:56:35.934,00:56:40.980,They all thought that they were at the first step of what was going to be a very exciting experience.
00:56:41.272,00:56:44.109,"It's on this, like, beautiful beach."
00:56:44.192,00:56:47.987,"A dock goes all the way out, people are just dangling their legs, having tequila."
00:56:48.071,00:56:51.491,"I'm looking around and I'm like, This is the greatest decoy of all time."
00:56:51.574,00:56:54.327,"The music playing, and the guests was just cheering on."
00:56:54.411,00:56:56.621,They were dancing and having a good time.
00:57:00.208,00:57:03.503,"Quite frankly, it was probably the best part of the entire experience."
00:57:03.586,00:57:06.297,What was happening on the campgrounds was the exact opposite.
00:57:10.343,00:57:12.262,They're soaking wet!
00:57:16.224,00:57:25.817,"What was already this kind of very loosely put together festival, which was over-advertised, has now devolved into something much worse."
00:57:28.570,00:57:32.407,"we didn't have enough beds, we didn't have enough site, we didn't have enough staff."
00:57:32.490,00:57:35.034,It was just... We were overwhelmed.
00:57:35.118,00:57:40.165,"So I'm getting phone calls. I'm trying to charge my phone, and the calls are to get me to the blue production house."
00:57:40.248,00:57:43.918,So I get there and it's mayhem. People are scrambling everywhere.
00:57:44.002,00:57:45.712,They're still outside trying to build stuff.
00:57:47.797,00:57:50.592,Because he's like hyperventilating in the bedroom.
00:57:50.800,00:57:53.011,People are crying and it's all these emotions.
00:57:53.094,00:57:54.929,"I was like, Okay, get your shit done."
00:57:55.013,00:57:58.558,I'm literally getting now physically pulled in different directions by the assistants.
00:57:58.641,00:58:00.685,"Marc, this person arrived, that person arrived."
00:58:00.768,00:58:02.103,We need to find them houses.
00:58:02.187,00:58:06.941,I thought something was wrong after they held us on the beach for six hours.
00:58:07.025,00:58:08.860,Kinda funneling tequila down our throats.
00:58:12.155,00:58:15.992,"They started asking, Where can I go? Where do we go?"
00:58:16.075,00:58:18.578,How are we getting to the campsite? Where is the campsite?
00:58:18.661,00:58:19.662,Where's my luggage?
00:58:19.746,00:58:23.124,"And I was like, What do I tell them?"
00:58:23.208,00:58:27.879,"You know, Billy would be in the room and he'd be kind of the CEO, calling the shots."
00:58:27.962,00:58:33.801,"Every now and then, he would walk out, go get on his four-wheeler, and just ride really fast in, like, one direction."
00:58:33.885,00:58:35.220,Just take off.
00:58:35.303,00:58:42.560,"And then he would come right back and walk back in without, you know, a lot to talk about, but you could see he just had like bottled up energy."
00:58:42.810,00:58:46.606,It's time to let people in and kind of see how it unfolds.
00:58:56.741,00:59:03.998,"The bus driver just knew where to go, and he's telling us, Oh, yeah, they didn't start construction on any of this until maybe a month ago."
00:59:04.082,00:59:08.169,"Or, Oh, yeah, you're really in for something."
00:59:08.253,00:59:11.798,Just wait until you see what you're getting yourselves into.
00:59:11.881,00:59:22.559,Which is a very concerning thing to hear when you're on a bus to you have no idea where after taking a plane to God knows what island with who knows what people.
00:59:26.312,00:59:27.730,Turn around!
00:59:27.814,00:59:30.900,Turn this bus right around!
00:59:31.234,00:59:36.322,We see this sea of white little tents.
00:59:40.201,00:59:43.496,"A lot of people thought, Maybe we're passing through this area."
00:59:43.580,00:59:45.331,Our villas are just on the other side.
00:59:45.415,00:59:49.961,"And it was the bus driver who said, Oh, no. That's where you're staying."
00:59:50.044,00:59:52.880,"It was like, Oh, my God!"
00:59:56.509,00:59:59.387,"This festival is never happening again, I hope they know that."
01:00:01.639,01:00:07.145,"and we get to that blue house that I guess was their headquarters, and there was just a line of hundreds of people."
01:00:12.191,01:00:16.279,"but we kept standing there, and some people just had bottles of liquor."
01:00:17.739,01:00:21.117,Billy came up to me and told me to just blast the music.
01:00:22.410,01:00:24.579,As loud as I possibly could.
01:00:24.662,01:00:29.000,That's one of the most annoying parts. You could just hear this pulsating noise.
01:00:31.836,01:00:38.426,"Like, one of the hostesses or one of the staff that would come, Please, we cannot hear anything as we're trying to check in these people."
01:00:38.509,01:00:40.136,And so we would lower the music.
01:00:40.219,01:00:42.597,"After five minutes, Billy would come back."
01:00:42.680,01:00:44.891,Raise the music.
01:00:45.433,01:00:48.186,"Everyone was, like, arguing, you know?"
01:00:48.269,01:00:51.105,"Everyone was making noise or like, Where I'm gonna stay?"
01:00:51.189,01:00:53.316,What am I gonna do? What am I gonna eat?
01:00:53.733,01:00:58.071,"The attendees were looking towards anything, anyone for direction."
01:00:59.405,01:01:00.865,"Guys, stay here."
01:01:04.118,01:01:07.830,"So I just kind of walked up and I said, Where do you go if you have a villa?"
01:01:07.914,01:01:10.792,"And he said, Everybody that has a villa, just go grab a tent."
01:01:10.875,01:01:12.585,And so this whole mass of people...
01:01:12.710,01:01:14.420,"I was like, It's a free-for-all."
01:01:19.425,01:01:21.386,"we heard this rush, then we heard the screaming."
01:01:21.469,01:01:25.390,We walked out and there was just this mass of people going to tents.
01:01:28.017,01:01:30.561,I'm not getting off this ship until I know what's going on there.
01:01:35.358,01:01:37.568,These are the lockers that are just being set up.
01:01:37.652,01:01:41.489,They're taking off the plastic that are supposed to hold our valuables.
01:01:45.076,01:01:47.412,They brought out the luggage in two big containers.
01:01:47.495,01:01:50.373,Like truck containers. Eighteen-wheeler containers.
01:01:50.456,01:01:53.835,"They just said, Everyone, grab your bag. And it was just a frenzy."
01:01:56.337,01:01:58.715,their black bag amongst a sea of black bags.
01:01:58.798,01:02:03.177,"And if they had to climb over you and stomp over you to get their piece of luggage, so be it."
01:02:03.553,01:02:07.306,This is an absolute disaster.
01:02:07.932,01:02:09.809,Where do you-- Yo!
01:02:14.063,01:02:16.691,"We do not want to be on the perimeter, I promise you."
01:02:18.443,01:02:22.238,Our strategy from there was to kind of ransack all the tents around us.
01:02:22.321,01:02:24.615,Just started poking holes and flipping mattresses.
01:02:24.699,01:02:26.659,My buddy pissed on a few of the beds.
01:02:28.578,01:02:31.497,People was just walking with mattresses on top of their head.
01:02:31.914,01:02:34.250,Walking from this one around to that one.
01:02:36.586,01:02:40.298,One woman had a whole pallet of toilet paper.
01:02:40.381,01:02:46.512,Somebody else had this whole giant box of pillows that she was lugging back to her tent.
01:02:46.596,01:02:49.682,"It became very barbaric, in a sense."
01:03:09.285,01:03:10.578,There was no lights.
01:03:13.247,01:03:16.375,People were scattered throughout that area and spent one night.
01:03:16.459,01:03:18.669,My guess is most of them never went to sleep.
01:03:21.547,01:03:24.884,in a panic at one point in the dead of night.
01:03:24.967,01:03:26.803,She couldn't find her friend.
01:03:26.886,01:03:30.181,"She was lost, she seemed like she was drunk. I mean..."
01:03:31.849,01:03:34.185,But there's nothing you can do to help a person like that.
01:03:34.268,01:03:36.354,"You know, I don't know where I am either."
01:03:36.938,01:03:43.903,"And there was a definite turning point, I would say, when the sun went down, when the camaraderie was over."
01:03:46.906,01:03:48.324,all of the tents were full.
01:03:48.407,01:03:51.160,And this is with one-third of the guests we were supposed to have.
01:03:53.871,01:04:00.795,and looking at this image of the campground for the first time feeling what an epic failure really is.
01:04:09.262,01:04:11.389,"just to be like, This is what's going on."
01:04:11.472,01:04:14.517,"I mean, Here's the lockers, here's the concierge stand."
01:04:14.600,01:04:16.477,This is what Fyre Festival is.
01:04:17.311,01:04:19.772,The tweets just started going viral.
01:04:21.649,01:04:25.194,It was just kind of the perfect thing to consume in real-time.
01:04:27.905,01:04:30.741,Then I saw the Twitter post.
01:04:31.617,01:04:32.827,The cheese sandwich.
01:04:34.996,01:04:37.623,That was when I knew this was done.
01:04:40.126,01:04:44.088,I remember The New York Times came out with an article that talked about this entire Fyre Festival.
01:04:45.882,01:04:47.174,from an operational perspective.
01:04:47.675,01:05:06.235,"What they didn't talk about, which I think was something that was missed, was a couple of powerful models posting an orange tile is what essentially built this entire festival, and then one kid with probably 400 followers posted a picture of cheese on toast that trended and essentially ripped down the festival."
01:05:06.527,01:05:10.031,All I know is that people were stoked to watch this thing go down.
01:05:19.123,01:05:23.085,almost a gleeful response on social media from people that weren't there.
01:05:23.169,01:05:25.588,"The way that it seemed like it happened is funny, you know?"
01:05:25.671,01:05:30.134,"A Lord of the Flies situation with, you know, Instagram's top influencers."
01:05:35.765,01:05:38.768,"I said, No, Grant, we're not posting any more promises."
01:05:38.851,01:05:41.479,We're not trying to propel this vision any further.
01:05:41.562,01:05:43.856,"You know, This thing is dead."
01:05:44.315,01:05:51.113,"Then I think, like, three minutes later, I get a text from Grant introducing me to their new social media team."
01:05:51.197,01:05:53.407,Can you please send him over the credentials?
01:05:55.159,01:06:01.082,"I just remember calling Ja - he wasn't even there yet - and saying, like, There's, like, no way this is happening."
01:06:01.165,01:06:04.460,I'm sending out the email. I really don't care at this point.
01:06:04.543,01:06:10.675,"And then I told Billy I cancelled the acts and at that point, he knew everything had fallen apart already."
01:06:11.676,01:06:15.221,And he was pacing back and forth out on the terrace.
01:06:15.304,01:06:20.935,"I could see that there were tears in his eyes, but that was the first time that any of us had seen that."
01:06:21.018,01:06:25.564,"Through thick and thin, he stayed so positive and it wasn't until that day..."
01:06:26.357,01:06:30.444,"that things started to crumble, that he really started to get it."
01:06:34.156,01:06:41.288,thinking he was the entrepreneur of our decade to essentially being a massive viral disgrace and joke.
01:06:44.625,01:06:48.671,and Carola just looks like she's been like hit by a truck.
01:06:49.213,01:07:01.809,"Grant stayed and he was talking about drafting up their official response to what had happened, and it was like, Due to circumstances out of our control, and I remember Jorge looks at him and he's like, Do not lie again."
01:07:02.018,01:07:04.437,This is your chance to tell the truth.
01:07:05.354,01:07:08.774,Don't say 'out of our control.' This was perfectly in our control.
01:07:11.736,01:07:14.572,Fyre Festival is officially cancelled.
01:07:21.245,01:07:24.206,"Apparently, there's no food on the island. They're not letting people in."
01:07:27.376,01:07:29.837,They were just trying to get out at that point.
01:07:30.004,01:07:44.643,Part of the problem was that there weren't planes to take them out and the airport was totally overwhelmed with all these people and they eventually locked them in Okay. How long until water comes?
01:07:45.686,01:07:46.687,And food.
01:07:49.356,01:07:54.153,It was just this sort of real-time saga that started at six o'clock in the afternoon.
01:07:55.112,01:07:57.907,"And in the morning, the media started picking it up."
01:08:01.702,01:08:02.787,are feeling the heat.
01:08:02.870,01:08:07.374,"We took a big jump here, a big risk, and V1 has failed."
01:08:07.458,01:08:10.169,"People were making fun of it, making fun of us."
01:08:15.216,01:08:20.846,If you had thousands of dollars to go on a trip to see Blink-182...
01:08:22.515,01:08:25.559,that's on you. That is Darwinism at its finest.
01:08:32.233,01:08:40.991,"so the car rental companies came and took the keys, the house owners came and demanded that their properties were returned."
01:08:44.245,01:08:47.998,"I need $26,000 in cash, and I want it right now."
01:08:48.082,01:08:50.960,He was a big guy and he followed me.
01:08:51.252,01:08:53.838,And then I went back to the tent and he followed me.
01:08:53.921,01:09:05.558,"I had the head of the Bahamian Tourism Board, the Minister of Finance and the head of the University of the Bahamas waiting for $1 million that they wanted to be paid."
01:09:10.229,01:09:14.191,"for, you know, a month, a month-and-a-half without being paid..."
01:09:14.275,01:09:25.703,"that as soon as realized that, you know, all of this was collapsing, started, rightfully so, demanding their payment, so there was a sort of a strike."
01:09:26.328,01:09:31.584,And we get word that there's an angry mob of locals coming down through the gates.
01:09:31.917,01:09:34.128,They're pissed off and they want their money.
01:09:35.713,01:09:42.469,"And it's now, like, five of us in the production house There was about, I don't know, I want to say 30 people coming down."
