start,end,script
00:28:28.160,00:28:30.800,"Custody sergeants don't really like to be hurried, do they?"
00:28:30.840,00:28:34.160,Just formalities.
00:28:30.840,00:28:36.040,"Fingerprints, charge sheet, and I've got to be in magistrates' court on Tuesday."
00:28:36.080,00:28:37.600,What?
00:28:37.640,00:28:41.400,"Me, Sherlock!"
00:28:41.440,00:28:43.160,"Good, fine."
00:28:43.200,00:28:45.760,You wanna tell your little pal he's welcome to go and own up anytime.
00:28:45.800,00:28:48.320,"This symbol, I still can't place it."
00:28:48.360,00:28:53.320,"No, I need you to go to the police station ask about the journalist, his personal effects would've been impounded."
00:28:53.360,00:28:57.000,Get hold of his diary or something that will tell us his movements.
00:28:57.040,00:28:58.960,Go and see Van Coon's PA.
00:28:59.000,00:29:01.800,"If you retrace their steps, somewhere they'll coincide."
00:29:10.440,00:29:11.960,Scotland Yard.
00:29:22.120,00:29:26.880,Flew back from Dalian Friday.
00:29:26.920,00:29:29.600,-Can you print me up a copy?
00:29:29.640,00:29:31.880,What about the day he died?
00:29:31.920,00:29:33.760,"AMANDA: Sorry, I've got a gap."
00:29:35.160,00:29:36.840,I have all his receipts.
00:29:36.880,00:29:41.440,-Your friend...
00:29:41.480,00:29:43.880,He's an arrogant sod.
00:29:48.960,00:29:51.560,"This is what you wanted, isn't it?"
00:29:57.720,00:30:00.600,"What kind of a boss was he, Amanda?"
00:30:00.640,00:30:04.280,"Um, no."
00:30:04.320,00:30:08.000,The only things Eddie appreciated had a big price tag.
00:30:08.040,00:30:10.840,Like that hand cream.
00:30:17.080,00:30:18.920,Look at this one.
00:30:18.960,00:30:21.560,"Got a taxi from home on the day he died, 18.50."
00:30:21.600,00:30:23.560,That would get him to the office.
00:30:23.600,00:30:26.400,Not rush hour. Check the time.
00:30:26.440,00:30:28.480,The West End.
00:30:30.280,00:30:32.800,"Underground, printed at one in Piccadilly."
00:30:32.840,00:30:35.320,So he got a Tube back to the office.
00:30:35.360,00:30:37.840,Why would he get a taxi into town and then the Tube back?
00:30:37.880,00:30:40.000,Because he was delivering something heavy.
00:30:40.040,00:30:42.400,You wouldn't lug a package up the escalator.
00:30:42.440,00:30:45.720,-Delivering?
00:30:45.760,00:30:47.840,"Dropped the package, delivered it, and then..."
00:30:50.280,00:30:52.640,Stopped on his way.
00:30:56.000,00:31:00.840,"So you bought your lunch from here en route to the station, but where were you headed from?"
00:31:00.880,00:31:03.280,Where did the taxi drop you?
00:31:05.240,00:31:07.320,Eddie Van Coon brought a package here the day he died.
00:31:07.360,00:31:09.080,Whatever was hidden inside that case...
00:31:09.120,00:31:11.400,I've managed to piece together a picture using scraps of information.
00:31:11.440,00:31:14.480,"Credit card bills, receipts."
00:31:14.520,00:31:16.720,-Sherlock.
00:31:16.760,00:31:19.200,"-I don't know where, but..."
00:31:20.360,00:31:21.760,How could you tell?
00:31:21.800,00:31:24.200,Lukis' diary. He was here too.
00:31:25.080,00:31:26.160,Oh.
00:31:50.960,00:31:52.440,WATSON: Hello.
00:31:58.600,00:32:00.600,You want lucky cat?
00:32:01.720,00:32:03.240,"WATSON: No, thanks, no."
00:32:04.120,00:32:06.360,10! 10!
00:32:06.400,00:32:07.800,Ooh!
00:32:07.840,00:32:10.240,"I think your wife, she will like."
00:32:11.040,00:32:12.520,"Um, thank you."
00:32:21.240,00:32:22.600,Sherlock.
00:32:24.360,00:32:26.240,The label there.
00:32:26.280,00:32:28.880,-It's exactly the same as the cipher.
00:32:34.840,00:32:38.360,"It's an ancient number system, Hangzhou."
00:32:38.400,00:32:40.760,These days only street traders use it.
00:32:40.800,00:32:44.000,Those were numbers written on the wall at the bank and at the library.
00:32:44.040,00:32:46.280,Numbers written in an ancient Chinese dialect.
00:32:47.080,00:32:48.800,WATSON: It's a 15.
00:32:48.840,00:32:51.320,"What we thought was the artist's tag, it's a number 15."
00:32:51.360,00:32:54.760,"And the blindfold, the horizontal line."
00:32:54.800,00:32:57.080,"-The Chinese number one, John."
00:33:02.680,00:33:10.200,"WATSON: Two men, travel back from China, both head straight for the Lucky Cat emporium."
00:33:10.840,00:33:13.000,What did they see?
00:33:13.040,00:33:15.280,It's not what they saw.
00:33:15.320,00:33:18.280,It's what they both brought back in those suitcases.
00:33:18.320,00:33:20.200,And you don't mean duty free.
00:33:21.800,00:33:23.160,Thank you.
00:33:27.760,00:33:29.240,Think about what Sebastian told us.
00:33:29.280,00:33:31.960,"About Van Coon, about how he stayed afloat in the market."
00:33:32.000,00:33:34.920,-Lost five million.
00:33:34.960,00:33:37.120,That's how he made such easy money.
00:33:37.160,00:33:39.600,He was a smuggler. Mmm.
00:33:39.640,00:33:40.960,I reckon he would have been perfect.
00:33:42.760,00:33:45.240,"Businessman, making frequent trips to Asia."
00:33:45.280,00:33:48.840,"Lukis was the same, a journalist writing about China."
00:33:48.880,00:33:51.120,Both of them smuggled stuff about.
00:33:51.160,00:33:53.480,The Lucky Cat was their drop-off.
00:33:54.200,00:33:56.080,But why did they die?
00:33:56.120,00:34:04.760,"It doesn't make sense, if the both turn up at the shop and deliver the goods why would someone threaten them and kill them after the event, after they'd finished the job?"
00:34:08.760,00:34:10.360,What if one of them was light-fingered?
00:34:10.400,00:34:12.480,-How do you mean?
00:34:12.520,00:34:14.520,Something from the hoard.
00:34:14.560,00:34:16.600,And the killer doesn't know which of them took it so he threatens them both.
00:34:16.640,00:34:17.640,Right.
00:34:20.280,00:34:22.240,Remind me.
00:34:22.280,00:34:24.320,When was the last time that it rained?
00:34:33.680,00:34:36.000,It's been here since Monday.
00:34:46.920,00:34:50.080,SHERLOCK: No one's been in that flat for at least three days.
00:34:50.120,00:34:52.960,WATSON: Could have gone on holiday.
00:34:53.000,00:34:55.000,Do you leave your windows open when you go on holiday?
00:35:05.280,00:35:06.680,Sherlock!
00:35:14.360,00:35:17.000,Someone else has been here.
00:35:17.040,00:35:20.600,"Somebody else broke into the flat and knocked over the vase, just like I did."
00:35:31.600,00:35:33.600,WATSON: Do you think maybe you could let me in this time?
00:35:38.840,00:35:40.680,"Can you not keep doing this, please?"
00:35:47.560,00:35:48.760,I'm not the first!
00:35:50.960,00:35:52.040,What?
00:35:52.080,00:35:55.040,Somebody's been in here before me!
00:35:55.080,00:35:56.560,WATSON: What are you saying?
00:35:59.280,00:36:00.880,Size eight feet.
00:36:02.400,00:36:06.400,"Small, but athletic."
00:36:07.520,00:36:09.160,I'm wasting my breath.
00:36:13.280,00:36:15.680,"Small, strong hands."
00:36:18.400,00:36:19.800,Our acrobat.
00:36:21.160,00:36:23.600,Why didn't he close the window when he left...
00:36:23.640,00:36:26.000,"Oh, stupid, stupid!"
00:36:26.600,00:36:27.840,Obvious.
00:36:28.520,00:36:30.000,He's still here.
00:36:53.400,00:36:55.480,Any time you want to include me...
00:36:55.520,00:36:56.800,John...
00:36:57.680,00:36:58.880,John!
00:37:01.080,00:37:05.880,"Oh, I'm Sherlock Holmes and I always work alone because no-one else can compete with my massive intellect!"
00:37:48.440,00:37:51.000,The milk's gone off and the washing started to smell.
00:37:51.040,00:37:53.080,Somebody left here in a hurry three days ago.
00:37:53.120,00:37:54.800,Somebody?
00:37:54.840,00:37:57.480,We have to find her.
00:37:57.520,00:37:58.960,"How, exactly?"
00:38:03.880,00:38:06.120,We could start with this.
00:38:06.160,00:38:07.640,You've gone all croaky.
00:38:11.480,00:38:13.840,When was the last time that you saw her?
00:38:13.880,00:38:17.160,ANDY: Three days ago.
00:38:17.200,00:38:19.560,This morning they told me she'd resigned.
00:38:19.600,00:38:22.360,Just like that.
00:38:23.880,00:38:27.360,What was the last thing that she did on her final afternoon?
00:38:31.280,00:38:37.000,"She does this demonstration for the tourists, a tea ceremony."
00:38:37.040,00:38:41.280,So she would have packed up her things and just put them in here.
00:39:00.280,00:39:02.840,-We have to get to Soo Lin Yao.
00:39:02.880,00:39:04.080,Sherlock!
00:39:04.120,00:39:05.920,"WATSON: Oh, look who it is."
00:39:06.760,00:39:08.080,Found something you'll like.
00:39:15.080,00:39:18.120,"Tuesday morning, all you've got to do is turn up and say the bag was yours."
00:39:18.160,00:39:20.360,Forget about your court date.
00:39:25.360,00:39:27.520,"GIRL: Dude, that was rad!"
00:39:29.560,00:39:33.960,"You want to hide a tree, then a forest is the best place to do it, wouldn't you say?"
00:39:34.000,00:39:38.680,"People would just walk straight past, not knowing, unable to decipher the message."
00:39:40.440,00:39:43.560,There. I spotted it earlier.
00:39:43.600,00:39:46.280,They've been here.
00:39:46.320,00:39:47.680,RAZ: Yeah.
00:39:47.720,00:39:51.040,"SHERLOCK: John, if we're going to decipher this code, we're gonna need to look for more evidence."
00:40:53.040,00:40:55.360,Answer your phone.
00:41:12.200,00:41:14.120,WATSON: It's been painted over.
00:41:17.080,00:41:20.120,I don't understand.
00:41:22.680,00:41:26.120,Ten minutes ago. I saw it.
00:41:26.160,00:41:29.840,Somebody doesn't want me to see it.
00:41:29.880,00:41:32.080,"-Sherlock, what are you..."
00:41:32.120,00:41:33.760,I need you to concentrate.
00:41:33.800,00:41:37.360,What? Why? Why?
00:41:37.400,00:41:39.680,I need you to maximise your visual memory.
00:41:39.720,00:41:43.600,-Try to picture what you saw.
00:41:43.640,00:41:45.280,-Can you remember it?
00:41:45.320,00:41:46.640,-Can you remember the pattern?
00:41:46.680,00:41:48.520,-How much can you remember it?
00:41:48.560,00:41:52.560,Because the average human memory on visual matters is only 62% accurate.
00:41:52.600,00:41:54.680,"-Yeah, well, don't worry, I remember all of it."
00:41:54.720,00:41:59.000,"Yeah. Well, at least I would, if I could get to my pockets."
00:42:20.000,00:42:21.640,"Always in pairs, John, look."
00:42:21.680,00:42:22.720,Mmm?
00:42:23.680,00:42:25.600,Numbers.
00:42:25.640,00:42:26.840,Come with partners.
00:42:26.880,00:42:28.480,"God, I need to sleep."
00:42:28.520,00:42:31.520,-Why did he paint it so near the tracks?
00:42:31.560,00:42:33.560,Thousands of people pass by there every day.
00:42:33.600,00:42:35.280,Just 20 minutes.
00:42:36.640,00:42:38.560,Of course.
00:42:38.600,00:42:40.160,"Of course, he wants information."
00:42:40.200,00:42:42.320,He's trying to communicate with his people in the underworld.
00:42:42.360,00:42:45.240,Whatever was stolen he wants it back.
00:42:45.280,00:42:47.560,"It's somewhere here, in a code."
00:42:49.160,00:42:52.120,We can't crack this without Soo Lin Yao.
00:42:52.160,00:42:54.080,"Oh, good."
00:42:54.120,00:42:56.720,Two men who travelled back from China were murdered.
00:42:56.760,00:42:59.680,And their killer left them messages in Hangzhou numerals.
00:42:59.720,00:43:01.920,Soo Lin Yao is in danger.
00:43:01.960,00:43:04.560,"That cipher, it was just the same pattern as the others."
00:43:04.600,00:43:06.520,He means to kill her as well.
00:43:06.560,00:43:10.840,"Look, I've tried everywhere, friends, colleagues."
00:43:10.880,00:43:15.000,"I mean, she could be a thousand miles away."
00:43:15.040,00:43:18.280,-What are you looking at?
00:43:18.320,00:43:22.600,The pots were her obsession.
00:43:22.640,00:43:25.440,"If they dry out, then the clay can start to crumble."
00:43:25.480,00:43:28.640,"Apparently, you have to just keep making tea in them."
00:43:28.680,00:43:31.720,"Yesterday, only one of those pots were shining."
00:43:32.480,00:43:34.200,"Now, there are two."
00:44:24.480,00:44:26.520,-Fancy a biscuit with that?
00:44:28.680,00:44:31.800,Centuries old.
00:44:38.840,00:44:40.000,Hello.
00:44:41.000,00:44:43.560,You saw the cipher.
00:44:43.600,00:44:46.200,Then you know he is coming for me.
00:44:46.240,00:44:48.520,You've been clever to avoid him so far.
00:44:49.760,00:44:51.360,I had to finish.
00:44:52.160,00:44:53.480,To finish this work.
00:44:55.800,00:44:58.040,It's only a matter of time.
00:44:58.080,00:45:00.600,I know he will find me.
00:45:00.640,00:45:02.400,Who is he?
00:45:04.960,00:45:08.080,"When I was a girl, we met in China."
00:45:10.280,00:45:12.000,I recognised his...
00:45:13.000,00:45:15.080,-signature.
00:45:17.120,00:45:18.960,Only he would do this.
00:45:20.160,00:45:21.400,Zhi Zhu.
00:45:22.280,00:45:24.320,-Zhi Zhu?
00:45:30.280,00:45:31.680,SOO LIN: You know this mark?
00:45:31.720,00:45:35.880,-Yes. It's the mark of a Tong.
00:45:35.920,00:45:38.600,"Ancient crime syndicate, based in China."
00:45:41.480,00:45:43.920,Every foot soldier bears the mark.
00:45:45.680,00:45:47.840,Everyone who hauls for them.
00:45:48.760,00:45:49.960,Hauls?
00:45:52.000,00:45:53.800,You... You mean you were a smuggler?
00:45:58.080,00:45:59.800,I was 15.
00:46:01.840,00:46:03.440,My parents were dead.
00:46:04.680,00:46:06.480,I had no livelihood.
00:46:07.960,00:46:13.800,"No way of surviving, day-to-day, except to work for the bosses."
00:46:13.840,00:46:14.960,Who are they?
00:46:16.120,00:46:18.920,They are called the Black Lotus.
00:46:22.600,00:46:31.640,"By the time I was 16, I was taking thousands of pounds worth of drugs across the border into Hong Kong."
00:46:35.800,00:46:38.440,I managed to leave that life behind me.
00:46:40.240,00:46:41.920,I came to England.
00:46:44.120,00:46:46.120,"They gave me a job, here."
00:46:49.320,00:46:51.200,Everything was good.
00:46:52.160,00:46:53.560,New life.
00:46:53.600,00:46:55.760,And he came looking for you.
00:46:56.360,00:46:57.520,Yes.
00:47:00.040,00:47:05.640,"I hoped, after five years maybe they would have forgotten me."
00:47:07.120,00:47:09.560,But they never really let you leave.
00:47:11.880,00:47:18.200,"A small community like ours, they are never very far away."
00:47:23.760,00:47:25.920,He came to my flat.
00:47:25.960,00:47:30.400,He asked me to help him to track down something that was stolen.
00:47:30.440,00:47:32.120,And you've no idea what it was?
00:47:32.960,00:47:35.320,I refused to help.
00:47:35.360,00:47:38.720,"So, you knew him well when you were living back in China?"
00:47:40.960,00:47:42.280,"Oh, yes."
00:47:45.200,00:47:46.240,He's my brother.
00:48:00.680,00:48:02.200,Two orphans.
00:48:04.600,00:48:06.560,We had no choice.
00:48:08.280,00:48:13.280,We could work for the Black Lotus or starve on the streets like beggars.
00:48:18.680,00:48:22.120,My brother has become their puppet.
00:48:22.160,00:48:25.400,In the power of the one they call Shan.
00:48:26.800,00:48:28.200,The Black Lotus general.
00:48:32.120,00:48:34.120,I turned my brother away.
00:48:36.480,00:48:38.560,He said I had betrayed him.
00:48:41.160,00:48:45.920,"Next day, I came to work and the cipher was waiting."
00:48:52.760,00:48:55.600,SHERLOCK: Can you decipher these?
00:48:55.640,00:48:59.000,-These are numbers.
00:48:59.040,00:49:03.640,"Here, the line across the man's eyes, it's the Chinese number one."
00:49:03.680,00:49:06.680,And this one is 15.
00:49:08.080,00:49:10.520,All the smugglers know it.
00:49:10.560,00:49:11.760,It's based upon a book...
00:49:17.160,00:49:18.720,He's here.
00:49:19.280,00:49:23.880,Zhi Zhu has found me.
00:49:23.920,00:49:27.160,"WATSON: No, no, Sherlock."
00:49:27.200,00:49:29.720,Come here. Get in. Get in!
00:49:45.880,00:49:48.160,I have to go and help him.
00:50:20.320,00:50:22.520,-Careful!
00:50:22.560,00:50:26.840,"Some of those skulls are over 200,000 years old, have a bit of respect!"
00:51:46.560,00:51:47.920,"Oh, my God."
00:52:20.680,00:52:24.680,How many murders is it going to take before you start believing that this maniac's out there?
00:52:26.960,00:52:29.080,A young girl was gunned down tonight.
00:52:29.120,00:52:31.560,That's three victims in three days.
00:52:31.600,00:52:33.600,You're supposed to be finding him.
00:52:33.640,00:52:36.720,Brian Lukis and Eddie Van Coon were working for a gang of international smugglers.
00:52:36.760,00:52:41.680,A gang called the Black Lotus operating here in London right under your nose.
00:52:43.000,00:52:44.600,Can you prove that?
00:52:51.520,00:52:55.440,-What are you thinking?
00:52:55.480,00:52:58.720,"I suppose it's never going to trouble Egon Ronay, is it?"
00:52:58.760,00:53:00.600,I'd stick with the pasta.
00:53:00.640,00:53:04.680,"Don't want to be doing roast pork, not if you're slicing up cadavers."
00:53:05.560,00:53:07.000,What are you having?
00:53:07.040,00:53:09.720,I don't eat when I'm working.
00:53:09.760,00:53:11.680,So you're working here tonight?
00:53:11.720,00:53:14.040,-Need to examine some bodies.
00:53:14.080,00:53:16.880,Eddie Van Coon and Brian Lukis.
00:53:16.920,00:53:18.640,They're on my list.
00:53:20.000,00:53:22.480,Could you wheel them out again for me?
00:53:22.520,00:53:26.040,Well...their paperwork's already gone through.
00:53:30.360,00:53:33.240,-You changed your hair.
00:53:33.280,00:53:36.000,The style.
00:53:36.040,00:53:38.560,"-Yes, well..."
00:53:39.720,00:53:40.960,Suits you better this way.
00:53:51.680,00:53:53.880,We're just interested in the feet.
00:53:53.920,00:53:55.280,-The feet?
00:53:55.320,00:53:58.000,Do you mind if we have a look at them?
00:54:05.240,00:54:06.720,"Now, Van Coon."
00:54:13.200,00:54:14.240,Oh!
00:54:14.880,00:54:16.920,So...
00:54:16.960,00:54:21.280,So either these two men just happened to visit the same Chinese tattoo parlour or I'm telling the truth.
00:54:21.320,00:54:22.720,What do you want?
00:54:22.760,00:54:25.440,I want every book from Lukis' apartment and Van Coon's.
00:54:25.480,00:54:26.880,Their books?
00:54:30.720,00:54:33.280,Not just a criminal organisation.
00:54:33.320,00:54:34.400,It's a cult.
00:54:36.720,00:54:39.200,Her brother was corrupted by one of its leaders.
00:54:39.240,00:54:40.600,Soo Lin said the name.
00:54:40.640,00:54:42.280,"Yes, Shan."
00:54:42.320,00:54:43.400,General Shan.
00:54:43.440,00:54:44.720,We're still no closer to finding him.
00:54:44.760,00:54:48.040,Wrong! We've got almost all we need to know.
00:54:48.080,00:54:51.400,She gave us most of the missing pieces.
00:54:51.440,00:54:54.360,Why did he need to visit his sister? Why did he need her expertise?
00:54:54.400,00:54:55.680,-She worked at the museum.
00:54:55.720,00:54:57.680,An expert in antiquities.
00:54:58.480,00:55:00.440,"Mmm. Of course, I see."
00:55:00.480,00:55:04.080,"Valuable antiquities, John."
00:55:04.120,00:55:07.240,China's home to a thousand treasures hidden after Mao's revolution.
00:55:07.280,00:55:08.520,The Black Lotus is selling them.
00:55:14.160,00:55:16.960,-Check for the dates...
00:55:17.000,00:55:18.600,Arrived from China four days ago.
00:55:19.760,00:55:21.760,Anonymous.
00:55:21.800,00:55:23.960,The vendor doesn't give his name.
00:55:24.000,00:55:26.440,Two undiscovered treasures from the East.
00:55:26.480,00:55:29.840,One in Lukis' suitcase and one in Van Coon's.
00:55:30.720,00:55:34.720,SHERLOCK: Antiquities sold at auction.
00:55:36.200,00:55:38.080,"Look, here's another one."
00:55:38.120,00:55:43.720,"Arrived from China a month ago, Chinese ceramic statue sold, 400,000."
00:55:43.760,00:55:46.960,"Look, a month before that, Chinese painting, half a million."
00:55:47.000,00:55:49.680,All of them from an anonymous source.
00:55:49.720,00:55:52.480,They're stealing them back in China and one by one they're feeding them into Britain.
00:55:52.520,00:55:53.560,Ah!
00:55:56.240,00:56:00.880,"WATSON: Well, every single auction coincides with Lukis or Van Coon travelling to China."
00:56:00.920,00:56:02.760,"So, what if one of them got greedy when they were in China?"
00:56:02.800,00:56:04.440,What if one of them stole something?
00:56:04.480,00:56:05.880,That's why Zhi Zhu's come.
00:56:07.120,00:56:09.840,"Sorry, are we collecting for charity, Sherlock?"
00:56:09.880,00:56:13.440,-What?
00:56:19.800,00:56:21.760,So the numbers are references.
00:56:21.800,00:56:23.160,To books.
00:56:23.200,00:56:26.400,To specific pages and specific words on those pages.
00:56:26.960,00:56:28.880,Right. So...
00:56:28.920,00:56:30.600,"15 and 1, that means?"
00:56:30.640,00:56:32.640,Turn to page 15 and it's the first word you read.
00:56:32.680,00:56:35.640,"-Okay, so what's the message?"
00:56:35.680,00:56:38.440,That's the cunning of the book code.
00:56:38.480,00:56:41.000,It has to be one that they both own.
00:56:43.440,00:56:46.800,"Okay, fine."
00:57:00.840,00:57:05.200,We found these at the museum.
00:57:05.240,00:57:08.520,"Er, we hoped Soo Lin could decipher it for us."
00:57:08.560,00:57:09.840,Tough.
00:57:10.880,00:57:12.800,Anything else I can do?
00:57:13.520,00:57:15.000,"To assist you, I mean."
00:57:15.040,00:57:17.360,Some silence right now would be marvelous.
00:57:32.200,00:57:33.600,Cigarette.
00:57:35.680,00:57:36.800,Uh...
00:58:02.200,00:58:03.560,Imagine.
00:58:18.000,00:58:19.080,Oh.
00:58:25.120,00:58:29.760,"I'm sorry to keep you waiting, but we haven't got anything now until next Thursday."
00:58:29.800,00:58:31.960,WOMAN 1: This is taking ages.
00:58:32.000,00:58:34.080,"RECEPTIONIST: Ah, sorry."
00:58:34.120,00:58:37.280,WOMAN 2: What's the point of taking appointment if they can't even speak to me?
00:58:37.320,00:58:39.800,"Um, what's going on?"
00:58:39.840,00:58:44.800,"That new doctor you hired, he hasn't buzzed the intercom for ages."
00:58:44.840,00:58:46.760,-Let me go and have a word.
00:58:46.800,00:58:48.720,-Excuse me.
00:58:49.600,00:58:51.440,-John?
00:58:54.880,00:58:56.200,John?
00:59:06.920,00:59:11.000,Looks like I'm done.
00:59:11.040,00:59:14.360,"-Oh, I did one or two of yours."
00:59:14.400,00:59:16.640,"Well, maybe five or six."
00:59:18.000,00:59:19.600,"I'm sorry, that's not very professional."
00:59:19.640,00:59:21.600,"No. No, not really."
00:59:22.440,00:59:24.600,I had...a bit of a late one.
00:59:26.080,00:59:27.400,"Oh, right."
00:59:29.800,00:59:31.240,"Anyway, see you."
00:59:31.280,00:59:35.520,So...what were you doing to keep you up so late?
00:59:35.560,00:59:38.880,I was attending a sort of book event.
00:59:38.920,00:59:42.720,"Oh. Oh, she likes books, does she, your girlfriend?"
00:59:43.520,00:59:44.880,"No, it wasn't a date."
00:59:44.920,00:59:48.440,"-Good. I mean, I'm..."
00:59:51.760,00:59:54.040,A book that everybody would own.
01:00:03.800,01:00:05.960,"Fifteen, entry one."
01:00:20.120,01:00:21.680,I need to get some air.
01:00:21.720,01:00:24.680,"-Actually, I've got a date."
01:00:24.720,01:00:27.720,Where two people who like each other go out and have fun?
01:00:27.760,01:00:30.960,-That's what I was suggesting.
01:00:31.000,01:00:32.480,"At least, I hope not."
01:00:32.520,01:00:34.240,-Where are you taking her?
01:00:34.280,01:00:36.600,"Er, dull, boring, predictable."
01:00:37.720,01:00:39.400,Why don't you try this?
01:00:39.440,01:00:41.400,In London for one night only.
01:00:43.280,01:00:45.920,"Thanks, but I don't come to you for dating advice."
01:00:45.960,01:00:48.360,SARAH: It's years since anyone took me to the circus.
01:00:48.400,01:00:50.600,"WATSON: Right, yes."
01:00:50.640,01:00:54.880,"Well, a friend recommended it to me I phoned up."
01:00:54.920,01:00:57.120,"Oh! What are they, a touring company or something?"
01:00:57.160,01:00:59.480,I don't know much about it.
01:00:59.520,01:01:01.360,SARAH: I think they're probably from China.
01:01:01.400,01:01:05.600,"I think so, yes."
01:01:05.640,01:01:09.040,"That's wonderful, thank you very much."
01:01:09.080,01:01:11.120,"Hi, I have two tickets reserved for tonight."
01:01:11.160,01:01:13.440,-And what's the name?
01:01:16.600,01:01:19.920,"Actually, I have three in that name."
01:01:19.960,01:01:22.080,"No, I don't think so, we only booked two."
01:01:22.120,01:01:25.280,Then I phoned back and got one for myself as well.
01:01:26.000,01:01:27.440,I'm Sherlock.
01:01:29.920,01:01:31.800,-Hi.
01:01:35.760,01:01:38.000,You couldn't let me have just one night off.
01:01:38.040,01:01:41.560,"Yellow Dragon Circus, in London for one day."
01:01:41.600,01:01:43.240,The Tong sent an assassin to England...
01:01:43.280,01:01:45.360,Dressed as a tightrope walker?
01:01:45.400,01:01:47.560,"We're looking for a killer who can climb, who can shin up a rope."
01:01:47.600,01:01:50.520,Where else would you find that level of dexterity?
01:01:50.560,01:01:52.360,Exit visas are scarce in China.
01:01:52.400,01:01:54.240,They need a pretty good reason to get out of that country.
01:01:54.280,01:01:56.000,"Now, all I need to do is have a quick look around the place."
01:01:56.040,01:01:57.520,Fine. You do that.
01:01:57.560,01:01:59.320,I need your help.
01:01:59.360,01:02:01.240,I do have a couple of other things on my mind this evening.
01:02:01.280,01:02:02.720,Like what?
01:02:03.360,01:02:05.400,You are kidding?
01:02:05.440,01:02:07.840,-What's so important?
01:02:07.880,01:02:10.400,You're going to chase some killer while I'm trying to...
01:02:10.440,01:02:11.800,What?
01:02:11.840,01:02:14.400,to get off with Sarah.
01:02:14.440,01:02:16.720,Hey... Ready?
01:02:16.760,01:02:17.880,Yeah.
01:02:28.040,01:02:30.280,This is not a circus.
01:02:30.320,01:02:32.120,Look at the size of this crowd.
01:02:32.160,01:02:35.800,"Sherlock, this is...art."
01:02:35.840,01:02:37.880,-This is not their day job.
01:02:37.920,01:02:40.160,"They're not a circus, they're a gang of international smugglers."
01:04:14.680,01:04:16.760,Classic Chinese escapology act.
01:04:16.800,01:04:20.400,-Hmm?
01:04:20.440,01:04:23.440,The warrior has to escape his bonds before it fires.
01:04:43.880,01:04:45.160,-Oh!
01:04:45.200,01:04:46.440,Oh.
01:04:58.200,01:05:01.600,"She splits the sandbag, the sand pours out."
01:05:01.640,01:05:04.000,"Gradually, the weight lowers into the bowl."
01:05:43.720,01:05:45.880,-Thank God.
