title,title_kr,title_en,genre,age_rating,director,release_year,running_time,story,subs_path,img_path,type
Better.Call.Saul,베터 콜 사울,Better Call Saul,"코미디, 드라마, 범죄",18,Vince Gilligan,2015,48min,브레이킹 배드의 스핀오프. 베터 콜 사울 (Better call Saul) 이라는 제목은 브레이킹 배드에서 등장하는 사울 굿맨의 변호사 광고 슬로건에서 따왔다. 2002년을 배경으로 삼류 변호사 지미 맥길이 악덕 변호사 사울 굿맨으로 변하게 되는 과정을 그린다. ,https://netflixschool-script-csv.s3.amazonaws.com/Better.Call.Saul_2015.csv,https://netflixschool-posters.s3.amazonaws.com/Better.Call.Saul_2015.jpg,2
Black.Mirror,블랙 미러,Black Mirror,"SF, 드라마, 스릴러, Made in Europe",18,Charlie Brooker,2011,59min,"2011년 12월 Channel 4에서 방영을 시작한 SF 옴니버스 드라마. 만약 기술이 마약이나 마찬가지이고 사용되기도 마약 같이 사용되고 있다면 그에 따른 부작용은 무엇인가? 불안함과 즐거움 사이의 모호한 존재가 바로 블랙 미러다. 검은 거울은 모든 벽과 책상에 있고 모든 사람의 손바닥에 있다: 차갑고 번쩍거리는 텔레비전 화면, 모니터, 스마트폰이 바로 검은 거울이다. 가까운 미래의 첨단 기술이 인간의 욕망을 실현해 주면서 벌어지는 특별한 상황들을 어두운 상상력으로 풀어낸다. ",https://netflixschool-script-csv.s3.amazonaws.com/Black.Mirror_2011.csv,https://netflixschool-posters.s3.amazonaws.com/Black.Mirror_2011.jpg,2
Breaking.Bad,브레이킹 배드,Breaking Bad,"드라마, 범죄, 스릴러",18,Vince Gilligan,2008,48min,2008년 1월 AMC에서 방영을 시작한 범죄 스릴러. Breaking Bad는 막가기를 뜻하는 미국 남부 지방의 속어이다. 한때 노벨화학상까지 바라 볼 정도로 뛰어난 과학자였던 고등학교 화학 교사 월터 화이트는 자신의 50세 생일 날에 폐암 3기 진단을 받는다. 어느 날 동서와 함께 마약 단속 현장을 참관한 그는 현장에서 달아나는 옛 제자 제시를 발견한다. 뇌성마비에 걸린 고등학생 아들과 임신한 아내를 위해 제시에게 동업을 제의한 월터는 자신의 화학지식을 이용해 전례없는 고순도 고품질의 메스암페타민을 제조한다. ,https://netflixschool-script-csv.s3.amazonaws.com/Breaking.Bad_2008.csv,https://netflixschool-posters.s3.amazonaws.com/Breaking.Bad_2008.jpg,2
Disenchantment,디스인챈트,Disenchantment,"SF, 애니메이션, 코미디, 액션, 판타지",15,Matt Groening,2018,28min,"무너져 가는 중세 왕국 드림랜드. 스스로 운명을 개척하고 싶은 술고래 공주 빈은 거침없는 성격의 엘포, 말썽쟁이 악마 루시를 친구 삼아 모험을 떠난다. 억세게 운 나쁜 삼총사는 이 여정에서 거인, 장난꾸러기 요정, 하르피아이, 작은 도깨비, 트롤, 바다코끼리, 수많은 얼간이 인간들을 마주치는데... ",https://netflixschool-script-csv.s3.amazonaws.com/Disenchantment_2018.csv,https://netflixschool-posters.s3.amazonaws.com/Disenchantment_2018.jpg,2
Friends,프렌즈,Friends,"코미디, 드라마, 로맨스",15,David Crane,1994,25min,"1994년 5월 NBC에서 방영을 시작한 시트콤. 미국 뉴욕 시 맨해튼의 그리니치 빌리지의 아파트와 까페 센트럴 퍼크를 중심으로 2-30대의 세 명의 남자와 세 명의 여자의 우정과 사랑, 삶을 그렸다. 부잣집 맏딸이자 응석받이로 자라 온 레이첼은 결혼식을 앞두고 결혼 선물들을 쳐다보던 중 자신이 남편보다 결혼선물을 더 사랑한다는 사실을 깨닫고 회의감을 느끼게 된다. 이를 계기로 불현듯 결혼식에서 도망쳐 나오게 되고, 뉴욕에 아버지의 그늘을 피할 곳을 찾다가 결혼식 전 우연히 만난 고등학교 동창 모니카와 재회하게 된다. ",https://netflixschool-script-csv.s3.amazonaws.com/Friends_1994.csv,https://netflixschool-posters.s3.amazonaws.com/Friends_1994.jpg,2
How.to.Get.Away.With.Murder,범죄의 재구성,How to Get Away with Murder,"드라마, 스릴러, 범죄",18,Peter Nowalk,2014,43min,유능한 형사소송 변호사이자 법학과 교수인 애널리스 키팅과 제자 5명은 복잡하게 얽힌 살인 사건에 점점 깊이 빠져든다. ,https://netflixschool-script-csv.s3.amazonaws.com/How.to.Get.Away.With.Murder_2014.csv,https://netflixschool-posters.s3.amazonaws.com/How.to.Get.Away.With.Murder_2014.jpg,2
MINDHUNTER,마인드헌터,Mindhunter,"드라마, 범죄, 스릴러",18,Joe Penhall,2017,53min,단지 미치광이의 소행인가. 무차별 잔혹 범죄가 급증한 1970년대 말. FBI 행동과학부 요원들은 잇달아 발생한 강력 사건 해결을 위해 살인마들과 위험한 대화를 시작한다. FBI 엘리트 요원이 프로파일링 기법을 이용하여 악명 높은 범죄자들을 추적하는 모습을 그린 스릴러 시리즈. ,https://netflixschool-script-csv.s3.amazonaws.com/MINDHUNTER_2017.csv,https://netflixschool-posters.s3.amazonaws.com/MINDHUNTER_2017.jpg,2
Narcos,나르코스,Narcos,"드라마, 범죄, 스릴러",18,Carlo Bernard,2015,52min,"콜롬비아의 에스코바르와 로스 페페스는 세계 최대의 마약 제국을 건설하고 미국의 공공의 적이 된다. 카르텔과 양국 정부의 피비린내 나는 전쟁, 이것은 실화다. ",https://netflixschool-script-csv.s3.amazonaws.com/Narcos_2015.csv,https://netflixschool-posters.s3.amazonaws.com/Narcos_2015.jpg,2
Peaky.Blinders,피키 블라인더스,Peaky Blinders,"드라마, 범죄, Made in Europe",18,Steven Knight,2013,58min,"제1차 세계대전 직후인 1919년 영국 버밍엄. 토마스 셸비를 주축으로 한 셸비 가문은 악명 높은 범죄 조직 ""피키 블라인더스""를 이끌고 암흑가의 정상을 차지하기 위해 수단과 방법을 가리지 않는다. ",https://netflixschool-script-csv.s3.amazonaws.com/Peaky.Blinders_2013.csv,https://netflixschool-posters.s3.amazonaws.com/Peaky.Blinders_2013.jpg,2
Rick.and.Morty,릭 앤 모티,Rick and Morty,"SF, 액션, 애니메이션, 코미디",18,Dan Harmon,2013,22min,술에 절어 사는 천재 과학자 릭은 투정이 심한 10대 손자 모티를 데리고 외계와 대체 현실로 아슬아슬한 모험을 떠난다. ,https://netflixschool-script-csv.s3.amazonaws.com/Rick.and.Morty_2013.csv,https://netflixschool-posters.s3.amazonaws.com/Rick.and.Morty_2013.jpg,2
Sherlock,셜록,Sherlock,"드라마, 스릴러, 범죄, Made in Europe",15,Mark Gatiss,2010,1시간 28분,"2010년 7월 BBC One에서 방영을 시작한 추리물. 아서 코난 도일의 셜록 홈즈 시리즈를 원작으로 현대적으로 재구성하였다. 아프가니스탄에서 군의관으로 복무 중이었으나, 전투 중 부상을 입고 의병 제대한 후 존 왓슨은 우연히 만난 옛 친구 마이크 스탬포드를 통해 셜록 홈즈를 소개받고 허드슨 부인이 세를 놓는 방에 함께 사는 룸메이트가 된다. 과거 허드슨 부인에게 도움을 준 인연으로 그녀의 건물에 세들어 있는 셜록은 자신을 고기능 소시오패스라고 당당하게 공인하는 괴짜 탐정. 왓슨은 얼떨결에 셜록의 조수 역할로 미스테리한 살인 사건 수사에 동참하는데... ",https://netflixschool-script-csv.s3.amazonaws.com/Sherlock_2010.csv,https://netflixschool-posters.s3.amazonaws.com/Sherlock_2010.jpg,2
Stranger.Things,기묘한 이야기,Stranger Things,"SF, 공포, 스릴러, 드라마, 판타지",15,Matt Duffer,2016,52min,"인디애나주의 작은 마을에서 행방불명된 소년. 이와 함께 미스터리한 힘을 가진 소녀가 나타나고, 마을에는 기묘한 현상들이 일어나기 시작한다. 아들을 찾으려는 엄마와 마을 사람들은 이제 정부의 일급비밀 실험의 실체와 무시무시한 기묘한 현상들에 맞서야 한다. ",https://netflixschool-script-csv.s3.amazonaws.com/Stranger.Things_2016.csv,https://netflixschool-posters.s3.amazonaws.com/Stranger.Things_2016.jpg,2
