start,end,script
00:25:31.720,00:25:38.760,"The thing is, Miss Hardbroom, I don't have that much spare cash, so I wasn't actually offering."
00:25:40.560,00:25:46.920,"Though this may not all delight, you lot, forget about tonight."
00:25:59.040,00:26:01.920,Why are you all still here?
00:26:02.000,00:26:04.800,Oh. Did I offer you tea?
00:26:09.920,00:26:13.920,I always carry some with me. You never know when you're going to need it.
00:26:14.000,00:26:16.480,"Dad, you fixed everything."
00:26:30.880,00:26:32.360,"Sorry, Mum."
00:26:32.760,00:26:36.200,"I would never hide anything from you. Well, maybe your birthday presents."
00:26:36.280,00:26:38.400,"You still don't know where they're kept, do you?"
00:26:39.680,00:26:44.560,"Mum, if my magic doesn't come from you, where does it come from?"
00:26:45.880,00:26:49.320,"Well, I'm sure you'll work that out for yourself someday."
00:26:50.000,00:26:54.720,"Till then, you've just got to believe that you are good enough to be here."
00:26:55.000,00:26:56.440,"And so do you, Mum."
00:26:57.120,00:26:58.200,The best mum.
00:26:59.640,00:27:04.040,I know you've seen a different side of me this evening.
00:27:08.720,00:27:12.120,And we are more proud of you than ever.
00:27:12.200,00:27:15.400,Standing up in front of everyone to admit what you'd done?
00:27:15.800,00:27:18.520,"That takes real guts, Maud."
00:27:19.280,00:27:22.080,But aren't you massively disappointed in me?
00:27:22.160,00:27:25.200,What about all the stupid mistakes I've made since I've come here?
00:27:25.280,00:27:28.960,"Maud, why do you think I carry that powder?"
00:27:32.080,00:27:36.240,Mistakes are how you learn. Mistakes are a sign that you tried.
00:27:36.320,00:27:41.640,And you never stop trying. That's what makes you you.
00:27:43.520,00:27:47.280,"Hey, you know what this calls for, don't you?"
00:27:47.360,00:27:49.920,-A family shot for the wall! -Shot for the wall!
00:00:06.000,00:00:08.680,It's your birth scroll. There's something you need to know.
00:00:08.760,00:00:11.880,This knowledge could endanger the entire school.
00:00:11.960,00:00:16.520,"Somehow, Agatha managed to escape the enchantments that bound her to Darkwood Cottage."
00:00:17.040,00:00:18.920,They lied to her all her life.
00:00:19.800,00:00:24.160,"-Esmerelda, what have you done? -I think you might want to see this."
00:01:29.800,00:01:31.760,"Please pick up, Millie."
00:01:32.240,00:01:33.600,Please.
00:01:34.960,00:01:36.480,Please?
00:01:44.280,00:01:46.120,Why don't you just talk to her?
00:01:46.520,00:01:47.840,She got me expelled.
00:01:47.920,00:01:49.800,"Well, perhaps she wants to say sorry."
00:01:51.840,00:01:53.200,It's a bit late for that.
00:02:05.320,00:02:06.160,Flappy!
00:02:16.760,00:02:19.280,Oh! Detector spell?
00:02:19.360,00:02:23.520,"Yes, it will alert us to any unauthorized magic."
00:02:24.760,00:02:29.720,The spell has been applied to everyone on the premises.
00:02:30.640,00:02:36.080,"It's an important health and safety measure, isn't it, Flappy?"
00:02:39.320,00:02:41.560,what about Miss Drill?
00:02:41.640,00:02:44.640,"Oh, that was just one of my little jokes."
00:02:46.640,00:02:49.480,Dimity! Are you all right?
00:02:51.680,00:02:52.880,I think so.
00:02:59.120,00:03:00.840,But where's Miss Cackle?
00:03:00.920,00:03:02.960,When the truth came out...
00:03:03.560,00:03:09.080,she ran away rather than face the consequences of her crimes.
00:03:09.440,00:03:10.560,What truth?
00:03:11.520,00:03:15.560,"As the elder daughter, Agatha is the legitimate headmistress."
00:03:15.640,00:03:17.560,We must accept that.
00:03:17.640,00:03:22.800,"After all, only the Great Wizard can rewrite the Witches' Code."
00:03:22.880,00:03:25.800,"So he can, jammy old toad."
00:03:38.080,00:03:42.840,"So, I'd better get on with running my school."
00:03:43.520,00:03:47.760,This place will never be yours. A school isn't bricks and mortar.
00:03:47.840,00:03:51.720,"A school is its students, and the girls will never accept you."
00:03:53.200,00:03:57.280,"Oh, I'm sure they'll like me, once they get to know me."
00:04:01.200,00:04:09.000,"And so, in conclusion, today we hail a glorious new dawn for this academy. Wait for applause."
00:04:12.880,00:04:17.040,"Get some life into it, Gullett, you're about as inspiring as a dead frog."
00:04:20.040,00:04:25.680,Please give a warm Cackle's welcome for our new headmistress!
00:04:30.880,00:04:32.160,"Girls, girls, girls."
00:04:33.560,00:04:37.880,I am so sorry about everything that you've been through.
00:04:38.760,00:04:44.480,"How you have suffered under the regime of that impostor, my sister."
00:04:44.560,00:04:52.280,"Horrible food, constant tests, endless boring chanting lessons."
00:04:53.240,00:04:57.600,"Well, that's all going to change."
00:04:57.680,00:05:01.440,Check your maglets for your new timetables.
00:05:03.880,00:05:07.560,"As you'll see, I've added three extra break times per week."
00:05:13.600,00:05:17.080,I'll be issuing remembering powder to all of you.
00:05:18.800,00:05:21.680,But they'll forget everything as soon as the spell wears off.
00:05:22.280,00:05:26.040,Why do you care? You're not even a witch anymore.
00:05:28.120,00:05:30.160,Listen to your new...
00:05:31.880,00:05:33.720,head girl.
00:05:50.520,00:05:52.200,You've been practicing.
00:05:56.480,00:05:59.000,"Oh, sorry, Mrs. Roberts!"
00:05:59.080,00:06:00.440,You'll have to stop.
00:06:07.640,00:06:10.920,You've beaten the computer! I didn't even know you could do that!
00:06:11.000,00:06:12.080,Me neither.
00:06:14.520,00:06:19.160,"Was that, you know, M-A-G-I-C?"
00:06:20.360,00:06:21.520,I don't know.
00:06:24.120,00:06:28.680,"Tell us where she is, or I'll turn you into a dung beetle."
00:06:31.080,00:06:32.680,Or a head louse.
00:06:33.480,00:06:34.760,Or...
00:06:45.800,00:06:46.960,What was that?
00:06:47.040,00:06:50.560,"Naughty, naughty, you used unauthorized spells."
00:06:50.640,00:06:52.920,"Discovery and transference, to be precise."
00:06:53.000,00:06:54.440,"Sorry, force of habit."
00:06:54.520,00:06:56.200,I was looking for Maud.
00:06:56.680,00:06:59.400,They were going to turn me into a toilet brush!
00:06:59.760,00:07:02.000,I'm sure that won't be necessary.
00:07:02.080,00:07:05.720,Maud is a good girl who respects authority.
00:07:18.560,00:07:22.000,"You will set an example to the others, won't you?"
00:07:23.480,00:07:24.640,Yes.
00:07:29.640,00:07:31.520,"That's all right, dear. Run along now."
00:07:41.880,00:07:44.280,And you should return to your duties.
00:07:45.000,00:07:47.600,I didn't authorize a transference spell.
00:07:48.600,00:07:49.760,Indeed not.
00:08:03.040,00:08:05.920,"She can see, hear, think and feel."
00:08:19.880,00:08:23.200,So Miss Cackle didn't run away.
00:08:23.280,00:08:26.000,No. Agatha trapped her in the picture.
00:08:26.480,00:08:27.640,And it's all my fault.
00:08:27.720,00:08:30.200,-You didn't know. -But I let Agatha in.
00:08:30.280,00:08:32.280,I have to do something to save Miss Cackle.
00:08:34.039,00:08:36.400,"Miss Cackle summoned the Great Wizard, remember?"
00:08:37.000,00:08:38.920,"When he gets here, he'll sort everything out."
00:08:40.120,00:08:42.440,Yes. He will.
00:08:50.000,00:08:53.360,Miss Cackle's trapped in a painting. We are in big trouble.
00:08:53.960,00:08:56.360,You're right. What are we gonna do?
00:08:56.440,00:08:59.760,There's only one thing we can. Tell the truth and say sorry.
00:09:03.760,00:09:05.360,I summon Miss Gullett.
00:09:08.960,00:09:12.640,It's an emergency! The Great Wizard's on his way!
00:09:13.800,00:09:16.680,So you better let Miss Cackle go and put this school back to normal.
00:09:16.760,00:09:20.520,"Are you telling me what to do, mistress bossy drawers?"
00:09:21.080,00:09:23.720,I'm just saying you don't have a choice.
00:09:23.800,00:09:27.200,"Esmerelda Hallow, your sort make me sick!"
00:09:27.880,00:09:33.720,You're all jolly broomsticks and team spirit and shiny trophies!
00:09:38.000,00:09:39.040,Esme?
00:09:42.400,00:09:44.480,Better put it somewhere safe.
00:09:50.880,00:09:55.560,"If the Great Wizard tries to take my school, every atom of it will be destroyed."
00:09:56.720,00:10:00.880,"If I can't have this place, no one can."
00:10:03.880,00:10:05.840,You shouldn't have interfered.
00:10:06.360,00:10:10.680,"Agatha's the rightful headmistress, because she's the older sister."
00:10:14.520,00:10:15.760,All right.
00:10:19.800,00:10:20.720,You win.
00:10:21.840,00:10:22.720,I'm sorry.
00:10:31.520,00:10:32.520,How did you get here?
00:10:37.600,00:10:38.680,What's this?
00:10:42.840,00:10:43.920,From Ethel.
00:10:44.960,00:10:46.720,"Ooh, look, he's here!"
00:10:56.640,00:10:58.400,"Oh, hurry, my love."
00:11:05.160,00:11:07.920,"It's OK, the Great Wizard will sort everything out."
00:11:09.640,00:11:11.920,"Wait, Your Greatness, we must warn you!"
00:11:12.000,00:11:15.800,Agatha's taken over! She thinks she's headmistress now.
00:11:15.880,00:11:17.000,Headmistress?
00:11:17.080,00:11:21.520,"I think I can deal with one power-crazed middle-aged witch, thank you, Algernon."
00:11:24.200,00:11:28.400,A little bat told me you were telling tales.
00:11:29.640,00:11:31.280,Oh! Oh!
00:11:31.360,00:11:33.320,"Oh, don't worry, my dear."
00:11:41.560,00:11:42.440,Ha!
00:11:48.840,00:11:49.800,We've got you.
00:11:51.040,00:11:52.520,Agatha's taken over.
00:11:54.080,00:11:55.480,I need to go back and help.
00:12:08.080,00:12:11.000,"So you see, I am the elder daughter."
00:12:17.960,00:12:20.200,-The code! -I am the code.
00:12:20.280,00:12:22.520,"I can rewrite it, every line."
00:12:23.080,00:12:28.640,"Now, before I decide what your punishment will be, where is your sister?"
00:12:28.720,00:12:31.520,I was afraid you might ask me that.
00:12:36.440,00:12:41.600,"You have the second-hand powers of a teenage girl, and I am twice as strong as any mere witch."
00:12:43.440,00:12:45.200,But not as strong as three.
00:12:48.960,00:12:52.000,"Hecate Hardbroom, why?"
00:12:52.680,00:12:55.000,She was going to destroy the school.
00:12:56.000,00:12:59.160,I've got the perfect punishment for you.
00:13:11.760,00:13:14.360,I'll just pop you over there.
00:13:17.720,00:13:20.560,"Sorry, bad choice of words."
00:13:25.200,00:13:27.480,Do what? He's been here for hours and nothing's happened.
00:13:32.800,00:13:34.920,"Agatha's got him, too, hasn't she?"
00:13:41.120,00:13:45.560,You are invited to an end-of-term feast in the Great Hall.
00:13:45.640,00:13:49.600,We need to get that picture... and save Miss Cackle.
00:14:02.720,00:14:04.400,Let's hope Ethel's telling the truth.
00:14:31.320,00:14:33.920,"You need to be invited in, remember?"
00:14:36.360,00:14:38.880,"Never thought I'd say this, but..."
00:14:39.640,00:14:43.160,"well met and welcome, Mildred Hubble."
00:14:49.920,00:14:52.360,It's... gone.
00:14:56.560,00:14:58.360,No. I promise.
00:15:01.760,00:15:02.640,Is that you?
00:15:06.200,00:15:07.320,Where are you?
00:15:10.160,00:15:11.480,I can see that.
00:15:11.920,00:15:13.960,Well... I can't.
00:15:14.040,00:15:15.040,I mean...
00:15:15.120,00:15:17.080,"Oh, just come here, you silly slug."
00:15:23.520,00:15:26.600,I'm sorry I got you expelled.
00:15:27.160,00:15:29.120,I was just trying to keep you safe.
00:15:29.720,00:15:33.120,"More importantly, what are you two doing in here?"
00:15:34.080,00:15:36.160,"Well, we thought..."
00:15:39.560,00:15:43.200,that if we could get the painting out of the school...
00:15:43.640,00:15:45.400,then maybe someone...
00:15:49.560,00:15:51.640,It isn't what it looks like.
00:15:52.200,00:15:55.200,"Trying to steal school property, eh?"
00:15:55.280,00:15:57.680,We didn't... It wasn't me.
00:16:01.080,00:16:06.240,Because I think you've all seen a little bit too much.
00:16:09.840,00:16:11.640,Of course not.
00:16:12.400,00:16:16.360,I'd hate you to miss the end-of-term celebrations!
00:16:33.240,00:16:34.520,The spell's wearing off.
00:16:36.080,00:16:37.120,Mildred Hubble!
00:16:37.200,00:16:39.800,-I thought you were-- -I... I came back.
00:16:39.880,00:16:42.840,"Ethel, Maud and Enid, Miss Gullett turned them into cakes."
00:16:42.920,00:16:44.280,-Cakes? Stop that. -Yes.
00:16:46.560,00:16:48.000,Only Miss Cackle...
00:16:51.280,00:16:53.160,can help them now.
00:16:53.680,00:16:55.160,And unfortunately...
00:16:56.120,00:17:00.760,only you can help Miss Cackle.
00:17:14.560,00:17:16.840,"Enjoy, girls."
00:17:17.640,00:17:20.920,"More cakes? Miss Gullett, you are spoiling us."
00:17:22.000,00:17:24.440,They do look delicious.
00:17:25.960,00:17:31.080,"By all we see and all we are, I summon you from realms afar."
00:17:36.360,00:17:38.480,Did... did I say it wrong?
00:17:40.080,00:17:41.480,It's not your fault.
00:17:42.560,00:17:43.800,You're too young.
00:17:43.880,00:17:46.640,A witch's power increases every year.
00:17:46.720,00:17:48.360,I just hoped...
00:17:48.440,00:17:49.880,So what do we do now?
00:17:49.960,00:17:54.080,"You need to go home. Be safe, Mildred Hubble."
00:17:54.160,00:17:56.040,-But what are you-- -I said go.
00:18:00.000,00:18:00.880,Go.
00:18:10.880,00:18:12.000,Thank you.
00:18:14.800,00:18:15.880,Stop!
00:18:17.000,00:18:18.800,Mildred Hubble!
00:18:18.880,00:18:25.040,By all that I see and all that we are...
00:18:26.080,00:18:32.280,"I summon you, Ada, from realms afar."
00:18:40.840,00:18:42.640,We'll deal with you later.
00:18:49.600,00:18:50.760,No!
00:18:51.400,00:18:53.720,"Mildred, I was going to eat that."
00:18:53.800,00:18:55.040,"Well, don't."
00:18:56.120,00:18:57.560,Those aren't cakes.
00:18:58.720,00:18:59.720,They're your friends.
00:18:59.800,00:19:02.560,"Oh, they're such good friends."
00:19:02.640,00:19:04.840,I think they should be together...
00:19:22.600,00:19:26.840,"-How do we get them back? -Don't tell me, I know this one."
00:19:26.920,00:19:29.480,So do I. I've heard it.
00:19:32.960,00:19:35.800,"Each to her own, let the truth be shown."
00:19:46.120,00:19:48.680,I nearly ate you. Who did this?
00:19:56.280,00:19:59.560,And she trapped Miss Cackle in the painting.
00:20:00.120,00:20:03.840,"And turned the Great Wizard into a balloon, don't forget that."
00:20:04.800,00:20:09.000,My methods are a tad unorthodox...
00:20:14.200,00:20:16.840,And there's nothing any of you can do about it.
00:20:16.920,00:20:18.000,"Yes, there is."
00:20:20.760,00:20:23.840,Hands up who wants Agatha in charge.
00:20:32.640,00:20:35.680,"If you don't leave, we all will."
00:20:38.760,00:20:40.000,You can't.
00:20:40.520,00:20:45.120,"Without us, you have nothing to be headmistress of."
00:20:47.440,00:20:48.440,All right.
00:20:56.600,00:20:58.680,You're... You're actually going?
00:20:58.760,00:21:01.200,I always dreamed of running this place.
00:21:01.280,00:21:05.720,"But a school consists of people, not bricks and mortar."
00:21:06.680,00:21:13.000,"So, it doesn't really matter if I do this."
00:21:15.440,00:21:25.440,"Bricks and stone, beams and slate, all must fall, annihilate!"
00:21:52.720,00:21:55.240,"Make it last, hold it fast!"
00:21:56.960,00:21:58.240,You stopped Agatha's spell?
00:21:58.320,00:22:00.320,"No, just containing it!"
00:22:00.400,00:22:03.160,"When my strength runs out, the whole place falls!"
00:22:16.240,00:22:20.520,"Till we meet again, Mildred Hubble."
00:22:35.280,00:22:36.280,Esmerelda!
00:22:41.680,00:22:42.800,Keep moving!
00:23:04.840,00:23:05.960,We aren't many...
00:23:08.120,00:23:09.120,we are one.
00:23:18.880,00:23:21.560,"We aren't many, we are one!"
00:23:22.520,00:23:25.120,"We aren't many, we are one!"
00:23:28.160,00:23:30.400,"We aren't many, we are one!"
00:23:30.480,00:23:32.960,"We aren't many, we are one!"
00:23:35.840,00:23:38.040,"We aren't many, we are one!"
00:23:38.120,00:23:40.600,"We aren't many, we are one!"
00:23:40.680,00:23:43.200,"We aren't many, we are one!"
00:23:43.280,00:23:45.840,"We aren't many, we are one!"
00:23:45.920,00:23:48.280,Agatha's spell shall be undone!
00:23:48.360,00:23:51.000,Agatha's spell shall be undone!
00:24:48.400,00:24:49.320,Miss Hardbroom.
00:25:00.640,00:25:03.080,"I am truly sorry, Your Greatness."
00:25:05.360,00:25:07.640,I suppose there's no real harm done.
00:25:08.840,00:25:10.320,Thanks to Mildred.
00:25:20.800,00:25:26.160,"We just... well, I don't really know. But I don't think we could do it again."
00:25:27.640,00:25:29.160,You won't have to.
00:25:46.800,00:25:49.400,I promise I'll leave your school alone.
00:25:49.480,00:25:51.360,"Yes, you will."
00:25:51.960,00:25:53.680,"Ada, please."
00:25:53.760,00:25:55.520,I'm your sister.
00:25:56.360,00:25:57.320,"Yes, you are."
00:25:57.960,00:26:00.080,But my girls come first.
00:26:04.400,00:26:05.880,"I'm sorry, Agatha."
00:26:17.600,00:26:19.040,You did the right thing.
00:26:19.320,00:26:20.320,Yes.
00:26:21.000,00:26:23.560,"For all her faults, she loved this place."
00:26:24.280,00:26:25.120,Hm.
00:26:26.440,00:26:28.120,Now she will never leave it.
00:26:34.680,00:26:35.840,Now...
00:26:36.640,00:26:39.120,how are the First Years doing in their exams?
00:26:42.280,00:26:44.640,I can't believe they're still making her do this.
00:26:44.720,00:26:46.840,I can't believe they gave her a new broom.
00:26:47.520,00:26:51.960,"Look at the way she sits on it, like a sack of rotten pumpkins."
00:26:52.040,00:26:54.680,"Keep going, Millie, you crafty crow!"
00:26:59.480,00:27:00.560,Millie!
00:27:09.760,00:27:15.520,You slammed into a tree and ruined a very expensive new broomstick.
00:27:15.600,00:27:18.480,Most examiners would fail you for this.
00:27:19.160,00:27:23.360,"I, however, am not most examiners."
00:27:23.440,00:27:33.040,"So, averaging this mark with your written papers gives you a final mark of 51 percent, which means you have passed."
00:27:49.240,00:27:51.240,See you next year!
00:00:41.520,00:00:43.040,"Come on, we'll be late."
00:00:47.800,00:00:50.320,Hurry! I want to talk to my mum!
00:00:56.880,00:00:58.320,Look at the queue!
00:01:08.240,00:01:09.800,"You won't be long, will you, Ethel?"
00:01:09.880,00:01:12.040,"I mean, um, we're really busy."
00:01:12.120,00:01:15.040,We're revising for Miss Bat's witchery test tomorrow.
00:01:15.120,00:01:17.000,We kind of lost track of time.
00:01:17.080,00:01:20.600,"And unless this queue gets moving, we're not going to have time to ring home."
00:01:20.680,00:01:24.280,"This will be a call of considerable length, actually."
00:01:24.360,00:01:27.360,Mother's going to want to hear everything I've achieved today.
00:01:27.440,00:01:33.440,"And whilst it might not take you two long to detail your achievements, it can take a Hallow forever."
00:01:34.960,00:01:37.280,S-Sorry about that. I didn't...
00:01:41.160,00:01:44.840,"Apologies, darling, can't chat now. Magic Council."
00:01:49.080,00:01:50.400,Must fly!
00:02:07.200,00:02:13.280,Um... is Drusilla OK to go in now or...?
00:02:14.240,00:02:22.960,"Drusilla is, but I'm not sure you are, We've done plenty."
00:02:25.200,00:02:32.680,I imagine it's practically impossible to get your head around the entirety of witch history when you're not one.
00:02:35.080,00:02:39.520,"Yes, she is. Even the Great Wizard said so."
00:02:39.600,00:02:41.880,"Not from a witching family, though, is she?"
00:02:44.520,00:02:47.480,Some of us come top whether we work for it or not...
00:02:48.040,00:02:52.320,"whilst others always come bottom, no matter what."
00:02:52.400,00:02:53.400,"Well, not this time!"
00:02:54.320,00:02:56.400,"This time, I'm going to surprise a few people."
00:03:07.400,00:03:10.240,Who am I kidding? I'm not going to surprise anyone.
00:03:16.280,00:03:18.280,Haven't you ever heard of a wisdom spell?
00:03:18.360,00:03:21.880,"If you found out how to do one of those, you'd be the cleverest girl in school."
00:03:23.040,00:03:26.440,"Enid, Mildred would never do a spell for selfish gain."
00:03:26.520,00:03:28.080,It's against the code.
00:03:30.080,00:03:33.280,And she's wise enough to know not to break it.
00:03:38.480,00:03:40.320,Cleverest girl in the school?
00:03:46.120,00:03:55.040,"Here's one. To understand in 40,000 ways, find the stocking of one who's lived for 40,000 days."
00:03:56.080,00:04:03.760,"Add a beetle's blood and a frog's tears, and lo, you shall see the world far beyond your years."
00:04:06.600,00:04:09.080,Where are we going to find a century-old sock?
00:05:32.640,00:05:36.760,"Lights out, Miss Hallow. Study time is over."
00:06:03.600,00:06:06.200,"Miss Hardbroom, come quickly!"
00:06:18.360,00:06:20.680,I think she's going to be needing some time off.
00:06:20.760,00:06:23.720,"We'll have to get someone in to replace her, then."
00:06:23.800,00:06:27.760,Her witchery class has a rather important test tomorrow afternoon.
00:06:27.840,00:06:31.400,-And children can't teach themselves. -Let me see what I can do.
00:06:32.400,00:06:39.880,Give me a mind greater than my own and turn me into the cleverest of crones.
00:06:57.680,00:06:59.280,"Um, I'm not sure."
00:07:00.960,00:07:03.600,Ask me about any moment in the whole history of witchcraft.
00:07:04.320,00:07:09.640,"Which king of England banned all witches from his kingdom, forcing us underground for eternity?"
00:07:09.720,00:07:11.080,Um...
00:07:12.760,00:07:15.240,Uh... Something else.
00:07:15.320,00:07:18.680,I'll give you a clue. He had a big belly and a bushy beard.
00:07:18.760,00:07:21.520,"-Oh, Father Christmas! -No!"
00:07:24.000,00:07:28.920,"Oh, Mildred, it definitely hasn't worked. What are you going to do?"
00:07:29.000,00:07:30.720,There's only one thing I can do.
00:07:31.880,00:07:33.240,Revise.
00:07:44.320,00:07:46.240,Want to put an extra hour in now?
00:07:52.200,00:07:53.280,What?
00:07:55.680,00:07:57.520,What have you done with Mildred?
00:08:00.600,00:08:03.320,"Are you feeling OK, Maud?"
00:08:07.120,00:08:11.960,"Mildred, is that... really you?"
00:08:12.040,00:08:13.400,Who else would it be?
00:08:14.640,00:08:16.840,You look terrible.
00:08:16.920,00:08:21.160,Excuse me. No one looks their best first thing.
00:08:21.240,00:08:23.560,Anyone can have a bad hair day.
00:08:23.640,00:08:25.760,It's a lot worse than that.
00:08:39.880,00:08:42.679,"No, Mildred, you didn't."
00:08:45.480,00:08:50.360,Just look at your skin. It's so stretchy.
00:08:50.440,00:08:52.600,I need to go and see Miss Cackle straight away!
00:08:52.680,00:08:55.760,"No, you don't. Think about how much trouble we'd get into."
00:08:55.840,00:08:57.160,Maud!
00:08:58.560,00:08:59.800,Where you going?
00:09:00.360,00:09:06.720,"Well, if it's possible to magic you into a doddery old body, it must be possible to magic you out."
00:09:14.600,00:09:20.000,"Uh, Esmerelda, do you know anything about... wisdom spells?"
00:09:20.640,00:09:22.440,"A little bit, yes."
00:09:22.520,00:09:25.360,We're doing a... project on them.
00:09:26.040,00:09:31.240,"And this book tells me how to do one, but not how to undo it."
00:09:31.320,00:09:33.680,"Well, that's because you can't."
00:09:34.680,00:09:36.800,These are time spells.
00:09:37.440,00:09:40.240,"Only time can undo them, not you."
00:09:40.320,00:09:45.200,"It might be a week, a month, even a year. You just have to wait and see."
00:09:49.040,00:09:57.400,"-Uh, you, girl. Come here. -Sorry, I'm in a bit of a-- When a witch asks you to do something, it is not optional."
00:10:07.040,00:10:08.200,Thank you.
00:10:08.840,00:10:12.920,"I am Miss Darkside, the supply witch."
00:10:13.000,00:10:22.360,"Apparently, someone called Miss Bat has lost all her marbles and one of her socks, and I am here to replace her."
00:10:22.920,00:10:27.080,Do you have any idea where your headteacher might be?
00:10:28.080,00:10:31.400,"Yes. Yes, I think I might."
00:10:33.320,00:10:36.720,"Miss Darkside, this is Miss Cackle."
00:10:36.800,00:10:48.080,"Um, there seems to be a bit of a mix-up, though, as Miss Cackle was just telling us that Miss Bat is now absolutely fine and there is no need for a supply witch."
00:10:48.920,00:10:49.920,Is this true?
00:10:51.000,00:10:52.040,Mmm.
00:10:52.520,00:10:56.560,This place is even more chaotic than I'd heard.
00:10:58.920,00:11:01.360,I thought you were going to make things better.
00:11:05.440,00:11:08.560,Do you know the punishment for impersonating a teacher?
00:11:08.640,00:11:11.440,A whole term of cat confiscation.
00:11:11.520,00:11:14.440,"Ah! Miss Darkside, I presume."
00:11:14.520,00:11:16.840,"Oh! Yes, that's me."
00:11:27.520,00:11:30.800,Miss Darkside's been through a bit of a crisis.
00:11:30.880,00:11:32.440,Mildred's mum's been taken ill...
00:11:33.120,00:11:35.800,and Mildred had to go home to look after her.
00:11:36.240,00:11:39.080,"Oh, dear. What's the matter?"
00:11:39.760,00:11:40.760,Uh...
00:11:44.920,00:11:47.440,Is that really serious enough to miss school?
00:11:48.320,00:11:51.560,This one is. It's particularly invasive.
00:11:51.640,00:11:55.960,"Oh. Well, how long will Mildred be?"
00:11:56.280,00:11:59.680,A week. Maybe a month.
00:12:00.400,00:12:03.520,Even a year. We'll just have to wait and see.
00:12:03.960,00:12:05.120,Well...
00:12:06.480,00:12:09.680,"Show Miss Darkside to your classroom, please, will you, Maud?"
00:12:10.080,00:12:13.000,-She's in with you. -Just this way.
00:12:48.840,00:12:51.480,"Um... Morning, everyone."
00:12:52.760,00:12:56.080,I am... Mil...
00:12:56.760,00:12:58.960,Millicent Darkside...
00:12:59.040,00:13:00.160,and I'm...
00:13:00.920,00:13:03.480,I-I'm c-covering for Miss Bat.
00:13:14.640,00:13:16.400,"Or post them, either's good."
00:13:20.320,00:13:23.040,-that isn't even hers? -That's right.
00:13:23.480,00:13:26.400,"No, it isn't. She made that up to get out of the test."
00:13:27.160,00:13:33.440,The only way possible for her not to come bottom was for her not to sit it in the first place.
00:13:39.960,00:13:47.600,"Right, I think it's time I started teaching, with me being the teacher."
00:13:50.280,00:13:51.280,So...
